Hosth2
#######################

22:40:09.674077 IP 10.0.0.1 > 10.0.0.2: ICMP echo request, id 4007, seq 1, length 64
22:40:09.675301 IP 10.0.0.2 > 10.0.0.1: ICMP echo reply, id 4007, seq 1, length 64
22:40:10.042218 ARP, Request who-has 10.0.0.3 tell 10.0.0.1, length 28
22:40:10.405916 ARP, Request who-has 10.0.0.4 tell 10.0.0.1, length 28
22:40:11.305268 IP 0.0.0.0.68 > 255.255.255.255.67: BOOTP/DHCP, Request from 56:40:46:6b:4e:fd, length 300
22:40:11.404951 ARP, Request who-has 10.0.0.4 tell 10.0.0.1, length 28
22:40:12.408483 ARP, Request who-has 10.0.0.4 tell 10.0.0.1, length 28
22:40:13.739504 IP 0.0.0.0.68 > 255.255.255.255.67: BOOTP/DHCP, Request from 96:23:61:d6:2e:ac, length 300
22:40:13.739928 ARP, Request who-has 10.0.0.5 tell 10.0.0.1, length 28
22:40:13.762886 IP6 fe80::9423:61ff:fed6:2eac.5353 > ff02::fb.5353: 0 [2q] PTR (QM)? _ipps._tcp.local. PTR (QM)? _ipp._tcp.local. (45)
22:40:13.908299 IP6 fe80::a83b:d5ff:feee:2788.5353 > ff02::fb.5353: 0 [2q] PTR (QM)? _ipps._tcp.local. PTR (QM)? _ipp._tcp.local. (45)
22:40:14.034574 IP6 fe80::4cf:aff:fee5:cf9d.5353 > ff02::fb.5353: 0 [2q] PTR (QM)? _ipps._tcp.local. PTR (QM)? _ipp._tcp.local. (45)
22:40:14.178259 IP6 fe80::5440:46ff:fe6b:4efd.5353 > ff02::fb.5353: 0 [2q] PTR (QM)? _ipps._tcp.local. PTR (QM)? _ipp._tcp.local. (45)
22:40:14.379013 IP6 fe80::6ca3:42ff:febd:4b61.5353 > ff02::fb.5353: 0 [2q] PTR (QM)? _ipps._tcp.local. PTR (QM)? _ipp._tcp.local. (45)
22:40:14.728134 ARP, Request who-has 10.0.0.5 tell 10.0.0.1, length 28
22:40:15.722933 ARP, Request who-has 10.0.0.5 tell 10.0.0.1, length 28
22:40:17.041882 ARP, Request who-has 10.0.0.6 tell 10.0.0.1, length 28
22:40:17.426273 IP 0.0.0.0.68 > 255.255.255.255.67: BOOTP/DHCP, Request from 6e:a3:42:bd:4b:61, length 300
22:40:18.024934 ARP, Request who-has 10.0.0.6 tell 10.0.0.1, length 28
22:40:18.410011 IP 0.0.0.0.68 > 255.255.255.255.67: BOOTP/DHCP, Request from aa:3b:d5:ee:27:88, length 300
22:40:19.029329 ARP, Request who-has 10.0.0.6 tell 10.0.0.1, length 28
22:40:19.728418 IP 0.0.0.0.68 > 255.255.255.255.67: BOOTP/DHCP, Request from 06:cf:0a:e5:cf:9d, length 300
22:40:20.333875 ARP, Request who-has 10.0.0.7 tell 10.0.0.1, length 28
22:40:21.331945 ARP, Request who-has 10.0.0.7 tell 10.0.0.1, length 28
22:40:21.470815 LLDP, length 47
22:40:21.745084 56:40:46:6b:4e:fd > ff:ff:ff:ff:ff:ff, ethertype Unknown (0x8942), length 69: 
	0x0000:  2000 0604 0002 0000 0207 0400 0000 0000  ................
	0x0010:  0604 0302 0002 0602 0078 fe0c 0026 e100  .........x...&..
	0x0020:  0000 0000 0000 0006 1808 0031 3791 7786  ...........17.w.
	0x0030:  1ff2 e601 0100 00                        .......
22:40:22.326286 ARP, Request who-has 10.0.0.7 tell 10.0.0.1, length 28
22:40:22.753483 ARP, Request who-has 10.0.0.8 tell 10.0.0.1, length 28
22:40:25.797857 IP 0.0.0.0.68 > 255.255.255.255.67: BOOTP/DHCP, Request from a6:0a:e8:c2:51:4f, length 300
22:40:27.039020 IP 0.0.0.0.68 > 255.255.255.255.67: BOOTP/DHCP, Request from aa:3b:d5:ee:27:88, length 300
22:40:27.073581 IP 0.0.0.0.68 > 255.255.255.255.67: BOOTP/DHCP, Request from 06:cf:0a:e5:cf:9d, length 300
22:40:28.524703 IP 0.0.0.0.68 > 255.255.255.255.67: BOOTP/DHCP, Request from 96:23:61:d6:2e:ac, length 300
22:40:28.819659 IP 0.0.0.0.68 > 255.255.255.255.67: BOOTP/DHCP, Request from 6e:a3:42:bd:4b:61, length 300
22:40:29.772093 IP6 fe80::9423:61ff:fed6:2eac.5353 > ff02::fb.5353: 0 [2q] PTR (QM)? _ipps._tcp.local. PTR (QM)? _ipp._tcp.local. (45)
22:40:29.911727 IP6 fe80::a83b:d5ff:feee:2788.5353 > ff02::fb.5353: 0 [2q] PTR (QM)? _ipps._tcp.local. PTR (QM)? _ipp._tcp.local. (45)
22:40:30.035018 IP6 fe80::4cf:aff:fee5:cf9d.5353 > ff02::fb.5353: 0 [2q] PTR (QM)? _ipps._tcp.local. PTR (QM)? _ipp._tcp.local. (45)
22:40:30.178011 IP6 fe80::5440:46ff:fe6b:4efd.5353 > ff02::fb.5353: 0 [2q] PTR (QM)? _ipps._tcp.local. PTR (QM)? _ipp._tcp.local. (45)
22:40:30.383300 IP6 fe80::6ca3:42ff:febd:4b61.5353 > ff02::fb.5353: 0 [2q] PTR (QM)? _ipps._tcp.local. PTR (QM)? _ipp._tcp.local. (45)
22:40:30.893719 IP 0.0.0.0.68 > 255.255.255.255.67: BOOTP/DHCP, Request from 56:40:46:6b:4e:fd, length 300
22:40:31.684432 IP6 fe80::a40a:e8ff:fec2:514f.5353 > ff02::fb.5353: 0 [2q] PTR (QM)? _ipps._tcp.local. PTR (QM)? _ipp._tcp.local. (45)
22:40:31.756498 IP 0.0.0.0.68 > 255.255.255.255.67: BOOTP/DHCP, Request from d2:1a:a8:b4:a0:aa, length 300
22:40:32.134070 IP6 fe80::d01a:a8ff:feb4:a0aa.5353 > ff02::fb.5353: 0 [2q] PTR (QM)? _ipps._tcp.local. PTR (QM)? _ipp._tcp.local. (45)
22:40:33.013607 IP 10.0.0.2 > 10.0.0.1: ICMP echo request, id 4024, seq 1, length 64
22:40:33.055599 IP 10.0.0.1 > 10.0.0.2: ICMP echo reply, id 4024, seq 1, length 64
22:40:33.361468 ARP, Request who-has 10.0.0.3 tell 10.0.0.2, length 28
22:40:33.417775 ARP, Reply 10.0.0.3 is-at 62:52:cd:31:e2:b5, length 28
22:40:33.419107 IP 10.0.0.2 > 10.0.0.3: ICMP echo request, id 4025, seq 1, length 64
22:40:33.477169 IP 10.0.0.3 > 10.0.0.2: ICMP echo reply, id 4025, seq 1, length 64
22:40:33.784117 ARP, Request who-has 10.0.0.4 tell 10.0.0.2, length 28
22:40:33.875798 ARP, Reply 10.0.0.4 is-at 0e:86:76:35:e9:b7, length 28
22:40:33.877095 IP 10.0.0.2 > 10.0.0.4: ICMP echo request, id 4026, seq 1, length 64
22:40:33.940365 IP 10.0.0.4 > 10.0.0.2: ICMP echo reply, id 4026, seq 1, length 64
22:40:34.253629 ARP, Request who-has 10.0.0.5 tell 10.0.0.2, length 28
22:40:34.319314 ARP, Reply 10.0.0.5 is-at 9e:70:ab:3e:15:eb, length 28
22:40:34.320533 IP 10.0.0.2 > 10.0.0.5: ICMP echo request, id 4027, seq 1, length 64
22:40:34.381192 IP 10.0.0.5 > 10.0.0.2: ICMP echo reply, id 4027, seq 1, length 64
22:40:34.686191 ARP, Request who-has 10.0.0.6 tell 10.0.0.2, length 28
22:40:34.744588 ARP, Reply 10.0.0.6 is-at 42:b7:f3:57:e5:80, length 28
22:40:34.745812 IP 10.0.0.2 > 10.0.0.6: ICMP echo request, id 4028, seq 1, length 64
22:40:34.806601 IP 10.0.0.6 > 10.0.0.2: ICMP echo reply, id 4028, seq 1, length 64
22:40:35.114214 ARP, Request who-has 10.0.0.7 tell 10.0.0.2, length 28
22:40:35.192488 ARP, Reply 10.0.0.7 is-at 2a:23:2b:66:dd:b8, length 28
22:40:35.194739 IP 10.0.0.2 > 10.0.0.7: ICMP echo request, id 4029, seq 1, length 64
22:40:35.248028 IP 10.0.0.7 > 10.0.0.2: ICMP echo reply, id 4029, seq 1, length 64
22:40:35.554706 ARP, Request who-has 10.0.0.8 tell 10.0.0.2, length 28
22:40:35.756817 IP 0.0.0.0.68 > 255.255.255.255.67: BOOTP/DHCP, Request from 96:23:61:d6:2e:ac, length 300
22:40:35.811918 IP 0.0.0.0.68 > 255.255.255.255.67: BOOTP/DHCP, Request from 6e:a3:42:bd:4b:61, length 300
22:40:36.513346 LLDP, length 47
22:40:36.552953 ARP, Request who-has 10.0.0.8 tell 10.0.0.2, length 28
22:40:36.631961 ARP, Reply 10.0.0.8 is-at 3a:f0:57:3e:0e:67, length 28
22:40:36.633216 IP 10.0.0.2 > 10.0.0.8: ICMP echo request, id 4030, seq 1, length 64
22:40:36.693045 IP 10.0.0.8 > 10.0.0.2: ICMP echo reply, id 4030, seq 1, length 64
22:40:36.795619 56:40:46:6b:4e:fd > ff:ff:ff:ff:ff:ff, ethertype Unknown (0x8942), length 69: 
	0x0000:  2000 0604 0002 0000 0207 0400 0000 0000  ................
	0x0010:  0604 0302 0002 0602 0078 fe0c 0026 e100  .........x...&..
	0x0020:  0000 0000 0000 0006 1808 0031 3791 7786  ...........17.w.
	0x0030:  1ff2 e601 0100 00                        .......
22:40:37.367040 IP 10.0.0.3 > 10.0.0.2: ICMP echo request, id 4032, seq 1, length 64
22:40:37.369009 IP 10.0.0.2 > 10.0.0.3: ICMP echo reply, id 4032, seq 1, length 64
22:40:37.743916 ARP, Request who-has 10.0.0.4 tell 10.0.0.3, length 28
22:40:38.020456 ARP, Request who-has 10.0.0.1 tell 10.0.0.2, length 28
22:40:38.074963 ARP, Reply 10.0.0.1 is-at c2:72:34:72:f2:5b, length 28
22:40:38.189814 ARP, Request who-has 10.0.0.5 tell 10.0.0.3, length 28
22:40:38.415298 IP 0.0.0.0.68 > 255.255.255.255.67: BOOTP/DHCP, Request from a6:0a:e8:c2:51:4f, length 300
22:40:38.587963 ARP, Request who-has 10.0.0.6 tell 10.0.0.3, length 28
22:40:39.002523 ARP, Request who-has 10.0.0.7 tell 10.0.0.3, length 28
22:40:39.266782 IP 0.0.0.0.68 > 255.255.255.255.67: BOOTP/DHCP, Request from d2:1a:a8:b4:a0:aa, length 300
22:40:39.393613 ARP, Request who-has 10.0.0.8 tell 10.0.0.3, length 28
22:40:39.840204 ARP, Request who-has 10.0.0.1 tell 10.0.0.4, length 28
22:40:41.679992 ARP, Request who-has 10.0.0.2 tell 10.0.0.8, length 28
22:40:41.681321 ARP, Reply 10.0.0.2 is-at 22:ae:0f:90:01:17, length 28
22:40:42.390242 ARP, Request who-has 10.0.0.2 tell 10.0.0.3, length 28
22:40:42.391481 ARP, Reply 10.0.0.2 is-at 22:ae:0f:90:01:17, length 28
22:40:42.399598 IP 0.0.0.0.68 > 255.255.255.255.67: BOOTP/DHCP, Request from 56:40:46:6b:4e:fd, length 300
22:40:49.259525 IP6 :: > ff02::16: HBH ICMP6, multicast listener report v2, 2 group record(s), length 48
22:40:49.269059 IP6 :: > ff02::16: HBH ICMP6, multicast listener report v2, 2 group record(s), length 48
22:40:49.331538 IP6 :: > ff02::1:ff6b:4efd: ICMP6, neighbor solicitation, who has fe80::5440:46ff:fe6b:4efd, length 24
22:40:49.416749 IP6 :: > ff02::16: HBH ICMP6, multicast listener report v2, 2 group record(s), length 48
22:40:49.445095 IP6 :: > ff02::16: HBH ICMP6, multicast listener report v2, 2 group record(s), length 48
22:40:49.525399 IP6 :: > ff02::16: HBH ICMP6, multicast listener report v2, 2 group record(s), length 48
22:40:49.525426 IP6 :: > ff02::16: HBH ICMP6, multicast listener report v2, 2 group record(s), length 48
22:40:49.565204 IP6 :: > ff02::1:ffd6:2eac: ICMP6, neighbor solicitation, who has fe80::9423:61ff:fed6:2eac, length 24
22:40:49.612021 IP6 :: > ff02::16: HBH ICMP6, multicast listener report v2, 2 group record(s), length 48
22:40:49.667816 IP6 :: > ff02::16: HBH ICMP6, multicast listener report v2, 2 group record(s), length 48
22:40:49.667845 IP6 :: > ff02::16: HBH ICMP6, multicast listener report v2, 2 group record(s), length 48
22:40:49.667903 IP6 :: > ff02::1:ffbd:4b61: ICMP6, neighbor solicitation, who has fe80::6ca3:42ff:febd:4b61, length 24
22:40:49.699651 IP6 :: > ff02::16: HBH ICMP6, multicast listener report v2, 2 group record(s), length 48
22:40:49.755291 IP6 :: > ff02::16: HBH ICMP6, multicast listener report v2, 2 group record(s), length 48
22:40:49.792969 IP6 :: > ff02::1:ffee:2788: ICMP6, neighbor solicitation, who has fe80::a83b:d5ff:feee:2788, length 24
22:40:49.819739 IP6 :: > ff02::16: HBH ICMP6, multicast listener report v2, 2 group record(s), length 48
22:40:49.862057 IP6 :: > ff02::1:ffe5:cf9d: ICMP6, neighbor solicitation, who has fe80::4cf:aff:fee5:cf9d, length 24
22:40:49.963299 IP6 :: > ff02::16: HBH ICMP6, multicast listener report v2, 2 group record(s), length 48
22:40:50.044269 IP6 :: > ff02::16: HBH ICMP6, multicast listener report v2, 2 group record(s), length 48
22:40:50.062833 IP6 :: > ff02::16: HBH ICMP6, multicast listener report v2, 1 group record(s), length 28
22:40:50.133095 IP 10.0.0.4 > 10.0.0.2: ICMP echo request, id 4042, seq 1, length 64
22:40:50.134454 IP 10.0.0.2 > 10.0.0.4: ICMP echo reply, id 4042, seq 1, length 64
22:40:50.202357 IP6 :: > ff02::1:ffc2:514f: ICMP6, neighbor solicitation, who has fe80::a40a:e8ff:fec2:514f, length 24
22:40:50.237754 IP6 :: > ff02::1:ffb4:a0aa: ICMP6, neighbor solicitation, who has fe80::d01a:a8ff:feb4:a0aa, length 24
22:40:50.331570 IP6 fe80::5440:46ff:fe6b:4efd > ff02::16: HBH ICMP6, multicast listener report v2, 1 group record(s), length 28
22:40:50.342836 IP6 fe80::5440:46ff:fe6b:4efd > ff02::16: HBH ICMP6, multicast listener report v2, 1 group record(s), length 28
22:40:50.394507 IP6 fe80::5440:46ff:fe6b:4efd.5353 > ff02::fb.5353: 0*- [0q] 2/0/0 PTR _workstation._tcp.local., PTR floodlight [56:40:46:6b:4e:fd]._workstation._tcp.local. (117)
22:40:50.404094 IP6 fe80::9423:61ff:fed6:2eac > ff02::16: HBH ICMP6, multicast listener report v2, 1 group record(s), length 28
22:40:50.404120 IP6 fe80::9423:61ff:fed6:2eac > ff02::16: HBH ICMP6, multicast listener report v2, 1 group record(s), length 28
22:40:50.412337 IP6 fe80::5440:46ff:fe6b:4efd.5353 > ff02::fb.5353: 0 [3q] [5n] ANY (QM)? floodlight [56:40:46:6b:4e:fd]._workstation._tcp.local. ANY (QM)? floodlight.local. ANY (QM)? d.f.e.4.b.6.e.f.f.f.6.4.0.4.4.5.0.0.0.0.0.0.0.0.0.0.0.0.0.8.e.f.ip6.arpa. (267)
22:40:50.433239 IP6 fe80::5440:46ff:fe6b:4efd.5353 > ff02::fb.5353: 0 [2q] PTR (QM)? _ipps._tcp.local. PTR (QM)? _ipp._tcp.local. (45)
22:40:50.436919 IP6 fe80::9423:61ff:fed6:2eac.5353 > ff02::fb.5353: 0*- [0q] 2/0/0 PTR _workstation._tcp.local., PTR floodlight [96:23:61:d6:2e:ac]._workstation._tcp.local. (117)
22:40:50.471539 IP6 fe80::5440:46ff:fe6b:4efd > ff02::16: HBH ICMP6, multicast listener report v2, 1 group record(s), length 28
22:40:50.515812 IP6 fe80::5440:46ff:fe6b:4efd > ff02::16: HBH ICMP6, multicast listener report v2, 2 group record(s), length 48
22:40:50.532157 IP6 fe80::9423:61ff:fed6:2eac.5353 > ff02::fb.5353: 0 [3q] [5n] ANY (QM)? floodlight [96:23:61:d6:2e:ac]._workstation._tcp.local. ANY (QM)? floodlight.local. ANY (QM)? c.a.e.2.6.d.e.f.f.f.1.6.3.2.4.9.0.0.0.0.0.0.0.0.0.0.0.0.0.8.e.f.ip6.arpa. (267)
22:40:50.610453 IP6 fe80::9423:61ff:fed6:2eac.5353 > ff02::fb.5353: 0 [2q] PTR (QM)? _ipps._tcp.local. PTR (QM)? _ipp._tcp.local. (45)
22:40:50.664685 IP6 fe80::5440:46ff:fe6b:4efd.5353 > ff02::fb.5353: 0 [3q] [5n] ANY (QM)? floodlight [56:40:46:6b:4e:fd]._workstation._tcp.local. ANY (QM)? floodlight.local. ANY (QM)? d.f.e.4.b.6.e.f.f.f.6.4.0.4.4.5.0.0.0.0.0.0.0.0.0.0.0.0.0.8.e.f.ip6.arpa. (267)
22:40:50.676055 IP6 fe80::6ca3:42ff:febd:4b61 > ff02::16: HBH ICMP6, multicast listener report v2, 1 group record(s), length 28
22:40:50.676087 IP6 fe80::6ca3:42ff:febd:4b61 > ff02::16: HBH ICMP6, multicast listener report v2, 1 group record(s), length 28
22:40:50.726850 IP6 fe80::6ca3:42ff:febd:4b61.5353 > ff02::fb.5353: 0*- [0q] 2/0/0 PTR _workstation._tcp.local., PTR floodlight [6e:a3:42:bd:4b:61]._workstation._tcp.local. (117)
22:40:50.772187 IP6 fe80::6ca3:42ff:febd:4b61.5353 > ff02::fb.5353: 0 [3q] [5n] ANY (QM)? floodlight [6e:a3:42:bd:4b:61]._workstation._tcp.local. ANY (QM)? floodlight.local. ANY (QM)? 1.6.b.4.d.b.e.f.f.f.2.4.3.a.c.6.0.0.0.0.0.0.0.0.0.0.0.0.0.8.e.f.ip6.arpa. (267)
22:40:50.832343 IP6 fe80::a83b:d5ff:feee:2788 > ff02::16: HBH ICMP6, multicast listener report v2, 1 group record(s), length 28
22:40:50.885218 IP6 fe80::a83b:d5ff:feee:2788 > ff02::16: HBH ICMP6, multicast listener report v2, 1 group record(s), length 28
22:40:50.885262 IP6 fe80::6ca3:42ff:febd:4b61.5353 > ff02::fb.5353: 0 [2q] PTR (QM)? _ipps._tcp.local. PTR (QM)? _ipp._tcp.local. (45)
22:40:50.885319 IP6 fe80::9423:61ff:fed6:2eac.5353 > ff02::fb.5353: 0 [3q] [5n] ANY (QM)? floodlight [96:23:61:d6:2e:ac]._workstation._tcp.local. ANY (QM)? floodlight.local. ANY (QM)? c.a.e.2.6.d.e.f.f.f.1.6.3.2.4.9.0.0.0.0.0.0.0.0.0.0.0.0.0.8.e.f.ip6.arpa. (267)
22:40:50.885355 IP6 fe80::a83b:d5ff:feee:2788 > ff02::16: HBH ICMP6, multicast listener report v2, 2 group record(s), length 48
22:40:50.920818 IP6 fe80::5440:46ff:fe6b:4efd.5353 > ff02::fb.5353: 0 [3q] [5n] ANY (QM)? floodlight [56:40:46:6b:4e:fd]._workstation._tcp.local. ANY (QM)? floodlight.local. ANY (QM)? d.f.e.4.b.6.e.f.f.f.6.4.0.4.4.5.0.0.0.0.0.0.0.0.0.0.0.0.0.8.e.f.ip6.arpa. (267)
22:40:50.978866 IP6 fe80::a83b:d5ff:feee:2788.5353 > ff02::fb.5353: 0*- [0q] 2/0/0 PTR _workstation._tcp.local., PTR floodlight [aa:3b:d5:ee:27:88]._workstation._tcp.local. (117)
22:40:50.984131 IP6 fe80::a83b:d5ff:feee:2788.5353 > ff02::fb.5353: 0 [3q] [5n] ANY (QM)? floodlight [aa:3b:d5:ee:27:88]._workstation._tcp.local. ANY (QM)? floodlight.local. ANY (QM)? 8.8.7.2.e.e.e.f.f.f.5.d.b.3.8.a.0.0.0.0.0.0.0.0.0.0.0.0.0.8.e.f.ip6.arpa. (267)
22:40:50.984157 IP6 fe80::a83b:d5ff:feee:2788.5353 > ff02::fb.5353: 0 [2q] PTR (QM)? _ipps._tcp.local. PTR (QM)? _ipp._tcp.local. (45)
22:40:51.116095 IP6 fe80::4cf:aff:fee5:cf9d > ff02::16: HBH ICMP6, multicast listener report v2, 1 group record(s), length 28
22:40:51.121163 IP6 fe80::5440:46ff:fe6b:4efd.5353 > ff02::fb.5353: 0*- [0q] 5/0/0 (Cache flush) TXT "", (Cache flush) AAAA fe80::5440:46ff:fe6b:4efd, (Cache flush) PTR floodlight.local., (Cache flush) HINFO, (Cache flush) SRV floodlight.local.:9 0 0 (249)
22:40:51.431818 IP6 fe80::5440:46ff:fe6b:4efd.5353 > ff02::fb.5353: 0*- [0q] 2/0/0 PTR _workstation._tcp.local., PTR floodlight [56:40:46:6b:4e:fd]._workstation._tcp.local. (117)
22:40:51.440434 IP6 fe80::a83b:d5ff:feee:2788.5353 > ff02::fb.5353: 0 [3q] [5n] ANY (QM)? floodlight [aa:3b:d5:ee:27:88]._workstation._tcp.local. ANY (QM)? floodlight.local. ANY (QM)? 8.8.7.2.e.e.e.f.f.f.5.d.b.3.8.a.0.0.0.0.0.0.0.0.0.0.0.0.0.8.e.f.ip6.arpa. (267)
22:40:51.440461 IP6 fe80::4cf:aff:fee5:cf9d > ff02::16: HBH ICMP6, multicast listener report v2, 1 group record(s), length 28
22:40:51.440486 IP6 fe80::9423:61ff:fed6:2eac > ff02::16: HBH ICMP6, multicast listener report v2, 1 group record(s), length 28
22:40:51.440692 IP6 fe80::6ca3:42ff:febd:4b61.5353 > ff02::fb.5353: 0 [3q] [5n] ANY (QM)? floodlight [6e:a3:42:bd:4b:61]._workstation._tcp.local. ANY (QM)? floodlight.local. ANY (QM)? 1.6.b.4.d.b.e.f.f.f.2.4.3.a.c.6.0.0.0.0.0.0.0.0.0.0.0.0.0.8.e.f.ip6.arpa. (267)
22:40:51.445042 IP6 fe80::5440:46ff:fe6b:4efd.5353 > ff02::fb.5353: 0 [2q] PTR (QM)? _ipps._tcp.local. PTR (QM)? _ipp._tcp.local. (45)
22:40:51.460064 IP6 fe80::4cf:aff:fee5:cf9d.5353 > ff02::fb.5353: 0*- [0q] 2/0/0 PTR _workstation._tcp.local., PTR floodlight [06:cf:0a:e5:cf:9d]._workstation._tcp.local. (117)
22:40:51.461438 IP6 fe80::4cf:aff:fee5:cf9d.5353 > ff02::fb.5353: 0 [3q] [5n] ANY (QM)? floodlight [06:cf:0a:e5:cf:9d]._workstation._tcp.local. ANY (QM)? floodlight.local. ANY (QM)? d.9.f.c.5.e.e.f.f.f.a.0.f.c.4.0.0.0.0.0.0.0.0.0.0.0.0.0.0.8.e.f.ip6.arpa. (267)
22:40:51.464125 IP6 fe80::4cf:aff:fee5:cf9d.5353 > ff02::fb.5353: 0 [2q] PTR (QM)? _ipps._tcp.local. PTR (QM)? _ipp._tcp.local. (45)
22:40:51.611184 LLDP, length 47
22:40:51.687867 IP6 fe80::9423:61ff:fed6:2eac.5353 > ff02::fb.5353: 0 [3q] [5n] ANY (QM)? floodlight [96:23:61:d6:2e:ac]._workstation._tcp.local. ANY (QM)? floodlight.local. ANY (QM)? c.a.e.2.6.d.e.f.f.f.1.6.3.2.4.9.0.0.0.0.0.0.0.0.0.0.0.0.0.8.e.f.ip6.arpa. (267)
22:40:51.687893 IP6 fe80::4cf:aff:fee5:cf9d > ff02::16: HBH ICMP6, multicast listener report v2, 1 group record(s), length 28
22:40:51.687919 IP6 fe80::a83b:d5ff:feee:2788.5353 > ff02::fb.5353: 0 [3q] [5n] ANY (QM)? floodlight [aa:3b:d5:ee:27:88]._workstation._tcp.local. ANY (QM)? floodlight.local. ANY (QM)? 8.8.7.2.e.e.e.f.f.f.5.d.b.3.8.a.0.0.0.0.0.0.0.0.0.0.0.0.0.8.e.f.ip6.arpa. (267)
22:40:51.687945 IP6 fe80::6ca3:42ff:febd:4b61 > ff02::16: HBH ICMP6, multicast listener report v2, 1 group record(s), length 28
22:40:51.688308 IP6 fe80::4cf:aff:fee5:cf9d.5353 > ff02::fb.5353: 0 [3q] [5n] ANY (QM)? floodlight [06:cf:0a:e5:cf:9d]._workstation._tcp.local. ANY (QM)? floodlight.local. ANY (QM)? d.9.f.c.5.e.e.f.f.f.a.0.f.c.4.0.0.0.0.0.0.0.0.0.0.0.0.0.0.8.e.f.ip6.arpa. (267)
22:40:51.699590 IP6 fe80::a83b:d5ff:feee:2788.5353 > ff02::fb.5353: 0*- [0q] 5/0/0 (Cache flush) TXT "", (Cache flush) AAAA fe80::a83b:d5ff:feee:2788, (Cache flush) PTR floodlight.local., (Cache flush) HINFO, (Cache flush) SRV floodlight.local.:9 0 0 (249)
22:40:51.699616 IP6 fe80::9423:61ff:fed6:2eac.5353 > ff02::fb.5353: 0*- [0q] 5/0/0 (Cache flush) TXT "", (Cache flush) AAAA fe80::9423:61ff:fed6:2eac, (Cache flush) PTR floodlight.local., (Cache flush) HINFO, (Cache flush) SRV floodlight.local.:9 0 0 (249)
22:40:51.893598 56:40:46:6b:4e:fd > ff:ff:ff:ff:ff:ff, ethertype Unknown (0x8942), length 69: 
	0x0000:  2000 0604 0002 0000 0207 0400 0000 0000  ................
	0x0010:  0604 0302 0002 0602 0078 fe0c 0026 e100  .........x...&..
	0x0020:  0000 0000 0000 0006 1808 0031 3791 7786  ...........17.w.
	0x0030:  1ff2 e601 0100 00                        .......
22:40:51.893625 IP6 fe80::6ca3:42ff:febd:4b61.5353 > ff02::fb.5353: 0 [3q] [5n] ANY (QM)? floodlight [6e:a3:42:bd:4b:61]._workstation._tcp.local. ANY (QM)? floodlight.local. ANY (QM)? 1.6.b.4.d.b.e.f.f.f.2.4.3.a.c.6.0.0.0.0.0.0.0.0.0.0.0.0.0.8.e.f.ip6.arpa. (267)
22:40:51.893650 IP6 fe80::a40a:e8ff:fec2:514f > ff02::16: HBH ICMP6, multicast listener report v2, 1 group record(s), length 28
22:40:51.893854 IP6 fe80::a40a:e8ff:fec2:514f > ff02::16: HBH ICMP6, multicast listener report v2, 1 group record(s), length 28
22:40:51.893880 IP6 fe80::9423:61ff:fed6:2eac > ff02::16: HBH ICMP6, multicast listener report v2, 2 group record(s), length 48
22:40:51.893906 IP6 fe80::a83b:d5ff:feee:2788 > ff02::16: HBH ICMP6, multicast listener report v2, 1 group record(s), length 28
22:40:51.893932 ARP, Request who-has 10.0.0.5 tell 10.0.0.4, length 28
22:40:51.894211 IP6 fe80::a40a:e8ff:fec2:514f.5353 > ff02::fb.5353: 0*- [0q] 2/0/0 PTR _workstation._tcp.local., PTR floodlight [a6:0a:e8:c2:51:4f]._workstation._tcp.local. (117)
22:40:51.894250 IP6 fe80::a40a:e8ff:fec2:514f.5353 > ff02::fb.5353: 0 [3q] [5n] ANY (QM)? floodlight [a6:0a:e8:c2:51:4f]._workstation._tcp.local. ANY (QM)? floodlight.local. ANY (QM)? f.4.1.5.2.c.e.f.f.f.8.e.a.0.4.a.0.0.0.0.0.0.0.0.0.0.0.0.0.8.e.f.ip6.arpa. (267)
22:40:51.894284 IP6 fe80::a40a:e8ff:fec2:514f.5353 > ff02::fb.5353: 0 [2q] PTR (QM)? _ipps._tcp.local. PTR (QM)? _ipp._tcp.local. (45)
22:40:51.894315 IP6 fe80::6ca3:42ff:febd:4b61.5353 > ff02::fb.5353: 0*- [0q] 5/0/0 (Cache flush) TXT "", (Cache flush) AAAA fe80::6ca3:42ff:febd:4b61, (Cache flush) PTR floodlight.local., (Cache flush) HINFO, (Cache flush) SRV floodlight.local.:9 0 0 (249)
22:40:51.894421 IP6 fe80::4cf:aff:fee5:cf9d.5353 > ff02::fb.5353: 0 [3q] [5n] ANY (QM)? floodlight [06:cf:0a:e5:cf:9d]._workstation._tcp.local. ANY (QM)? floodlight.local. ANY (QM)? d.9.f.c.5.e.e.f.f.f.a.0.f.c.4.0.0.0.0.0.0.0.0.0.0.0.0.0.0.8.e.f.ip6.arpa. (267)
22:40:51.987722 IP6 fe80::a83b:d5ff:feee:2788.5353 > ff02::fb.5353: 0*- [0q] 2/0/0 PTR _workstation._tcp.local., PTR floodlight [aa:3b:d5:ee:27:88]._workstation._tcp.local. (117)
22:40:51.987749 IP6 fe80::a83b:d5ff:feee:2788.5353 > ff02::fb.5353: 0 [2q] PTR (QM)? _ipps._tcp.local. PTR (QM)? _ipp._tcp.local. (45)
22:40:52.151023 IP6 fe80::5440:46ff:fe6b:4efd.5353 > ff02::fb.5353: 0*- [0q] 5/0/0 (Cache flush) TXT "", (Cache flush) AAAA fe80::5440:46ff:fe6b:4efd, (Cache flush) PTR floodlight.local., (Cache flush) HINFO, (Cache flush) SRV floodlight.local.:9 0 0 (249)
22:40:52.562907 IP6 fe80::4cf:aff:fee5:cf9d > ff02::16: HBH ICMP6, multicast listener report v2, 2 group record(s), length 48
22:40:52.568328 IP6 fe80::9423:61ff:fed6:2eac.5353 > ff02::fb.5353: 0*- [0q] 2/0/0 PTR _workstation._tcp.local., PTR floodlight [96:23:61:d6:2e:ac]._workstation._tcp.local. (117)
22:40:52.568355 IP6 fe80::9423:61ff:fed6:2eac.5353 > ff02::fb.5353: 0 [2q] PTR (QM)? _ipps._tcp.local. PTR (QM)? _ipp._tcp.local. (45)
22:40:52.568380 IP6 fe80::a40a:e8ff:fec2:514f.5353 > ff02::fb.5353: 0 [3q] [5n] ANY (QM)? floodlight [a6:0a:e8:c2:51:4f]._workstation._tcp.local. ANY (QM)? floodlight.local. ANY (QM)? f.4.1.5.2.c.e.f.f.f.8.e.a.0.4.a.0.0.0.0.0.0.0.0.0.0.0.0.0.8.e.f.ip6.arpa. (267)
22:40:52.568490 IP6 fe80::6ca3:42ff:febd:4b61.5353 > ff02::fb.5353: 0*- [0q] 2/0/0 PTR _workstation._tcp.local., PTR floodlight [6e:a3:42:bd:4b:61]._workstation._tcp.local. (117)
22:40:52.568516 IP6 fe80::4cf:aff:fee5:cf9d.5353 > ff02::fb.5353: 0*- [0q] 5/0/0 (Cache flush) TXT "", (Cache flush) AAAA fe80::4cf:aff:fee5:cf9d, (Cache flush) PTR floodlight.local., (Cache flush) HINFO, (Cache flush) SRV floodlight.local.:9 0 0 (249)
22:40:52.568758 IP6 fe80::6ca3:42ff:febd:4b61.5353 > ff02::fb.5353: 0 [2q] PTR (QM)? _ipps._tcp.local. PTR (QM)? _ipp._tcp.local. (45)
22:40:52.568784 IP6 fe80::d01a:a8ff:feb4:a0aa > ff02::16: HBH ICMP6, multicast listener report v2, 1 group record(s), length 28
22:40:52.585154 IP6 fe80::d01a:a8ff:feb4:a0aa > ff02::16: HBH ICMP6, multicast listener report v2, 1 group record(s), length 28
22:40:52.599499 IP6 :: > ff02::16: HBH ICMP6, multicast listener report v2, 1 group record(s), length 28
22:40:52.663732 IP6 fe80::d01a:a8ff:feb4:a0aa.5353 > ff02::fb.5353: 0*- [0q] 2/0/0 PTR _workstation._tcp.local., PTR floodlight [d2:1a:a8:b4:a0:aa]._workstation._tcp.local. (117)
22:40:52.668029 IP6 fe80::a40a:e8ff:fec2:514f.5353 > ff02::fb.5353: 0 [3q] [5n] ANY (QM)? floodlight [a6:0a:e8:c2:51:4f]._workstation._tcp.local. ANY (QM)? floodlight.local. ANY (QM)? f.4.1.5.2.c.e.f.f.f.8.e.a.0.4.a.0.0.0.0.0.0.0.0.0.0.0.0.0.8.e.f.ip6.arpa. (267)
22:40:52.668428 IP6 fe80::4cf:aff:fee5:cf9d.5353 > ff02::fb.5353: 0*- [0q] 2/0/0 PTR _workstation._tcp.local., PTR floodlight [06:cf:0a:e5:cf:9d]._workstation._tcp.local. (117)
22:40:52.706883 IP 0.0.0.0.68 > 255.255.255.255.67: BOOTP/DHCP, Request from 56:40:46:6b:4e:fd, length 300
22:40:53.551491 IP6 :: > ff02::1:ff6b:4efd: ICMP6, neighbor solicitation, who has fe80::5440:46ff:fe6b:4efd, length 24
22:40:53.551527 IP6 :: > ff02::16: HBH ICMP6, multicast listener report v2, 1 group record(s), length 28
22:40:53.690894 IP6 :: > ff02::16: HBH ICMP6, multicast listener report v2, 1 group record(s), length 28
22:40:53.704078 IP6 fe80::4cf:aff:fee5:cf9d.5353 > ff02::fb.5353: 0 [2q] PTR (QM)? _ipps._tcp.local. PTR (QM)? _ipp._tcp.local. (45)
22:40:53.706207 IP6 fe80::a40a:e8ff:fec2:514f > ff02::16: HBH ICMP6, multicast listener report v2, 1 group record(s), length 28
22:40:53.711779 IP 0.0.0.0.68 > 255.255.255.255.67: BOOTP/DHCP, Request from aa:3b:d5:ee:27:88, length 300
22:40:53.713254 IP6 :: > ff02::16: HBH ICMP6, multicast listener report v2, 1 group record(s), length 28
22:40:53.714577 IP6 fe80::d01a:a8ff:feb4:a0aa.5353 > ff02::fb.5353: 0 [3q] [5n] ANY (QM)? floodlight [d2:1a:a8:b4:a0:aa]._workstation._tcp.local. ANY (QM)? floodlight.local. ANY (QM)? a.a.0.a.4.b.e.f.f.f.8.a.a.1.0.d.0.0.0.0.0.0.0.0.0.0.0.0.0.8.e.f.ip6.arpa. (267)
22:40:53.716363 IP6 :: > ff02::1:ffee:2788: ICMP6, neighbor solicitation, who has fe80::a83b:d5ff:feee:2788, length 24
22:40:53.718447 IP6 fe80::a40a:e8ff:fec2:514f.5353 > ff02::fb.5353: 0*- [0q] 2/0/0 (Cache flush) TXT "", (Cache flush) SRV floodlight.local.:9 0 0 (110)
22:40:53.723994 IP6 fe80::a40a:e8ff:fec2:514f.5353 > ff02::fb.5353: 0*- [0q] 3/0/0 (Cache flush) HINFO, (Cache flush) AAAA fe80::a40a:e8ff:fec2:514f, (Cache flush) PTR floodlight.local. (167)
22:40:53.724029 IP6 fe80::d01a:a8ff:feb4:a0aa.5353 > ff02::fb.5353: 0 [2q] PTR (QM)? _ipps._tcp.local. PTR (QM)? _ipp._tcp.local. (45)
22:40:53.724065 IP6 fe80::d01a:a8ff:feb4:a0aa > ff02::16: HBH ICMP6, multicast listener report v2, 2 group record(s), length 48
22:40:53.724099 IP6 fe80::d01a:a8ff:feb4:a0aa.5353 > ff02::fb.5353: 0 [3q] [5n] ANY (QM)? floodlight [d2:1a:a8:b4:a0:aa]._workstation._tcp.local. ANY (QM)? floodlight.local. ANY (QM)? a.a.0.a.4.b.e.f.f.f.8.a.a.1.0.d.0.0.0.0.0.0.0.0.0.0.0.0.0.8.e.f.ip6.arpa. (267)
22:40:53.724134 IP6 fe80::9423:61ff:fed6:2eac.5353 > ff02::fb.5353: 0*- [0q] 5/0/0 (Cache flush) TXT "", (Cache flush) AAAA fe80::9423:61ff:fed6:2eac, (Cache flush) PTR floodlight.local., (Cache flush) HINFO, (Cache flush) SRV floodlight.local.:9 0 0 (249)
22:40:54.551664 IP6 fe80::5440:46ff:fe6b:4efd > ff02::16: HBH ICMP6, multicast listener report v2, 1 group record(s), length 28
22:40:54.551700 IP6 fe80::5440:46ff:fe6b:4efd > ff02::2: ICMP6, router solicitation, length 16
22:40:54.559769 IP6 fe80::5440:46ff:fe6b:4efd > ff02::16: HBH ICMP6, multicast listener report v2, 1 group record(s), length 28
22:40:54.614309 IP6 fe80::5440:46ff:fe6b:4efd.5353 > ff02::fb.5353: 0*- [0q] 2/0/0 PTR _workstation._tcp.local., PTR floodlight [56:40:46:6b:4e:fd]._workstation._tcp.local. (117)
22:40:54.633194 IP6 fe80::5440:46ff:fe6b:4efd.5353 > ff02::fb.5353: 0 [3q] [5n] ANY (QM)? floodlight [56:40:46:6b:4e:fd]._workstation._tcp.local. ANY (QM)? floodlight.local. ANY (QM)? d.f.e.4.b.6.e.f.f.f.6.4.0.4.4.5.0.0.0.0.0.0.0.0.0.0.0.0.0.8.e.f.ip6.arpa. (267)
22:40:54.656004 IP6 fe80::5440:46ff:fe6b:4efd.5353 > ff02::fb.5353: 0 [2q] PTR (QM)? _ipps._tcp.local. PTR (QM)? _ipp._tcp.local. (45)
22:40:54.883893 IP6 fe80::5440:46ff:fe6b:4efd.5353 > ff02::fb.5353: 0 [3q] [5n] ANY (QM)? floodlight [56:40:46:6b:4e:fd]._workstation._tcp.local. ANY (QM)? floodlight.local. ANY (QM)? d.f.e.4.b.6.e.f.f.f.6.4.0.4.4.5.0.0.0.0.0.0.0.0.0.0.0.0.0.8.e.f.ip6.arpa. (267)
22:40:54.941892 IP6 :: > ff02::16: HBH ICMP6, multicast listener report v2, 2 group record(s), length 48
22:40:54.988347 IP6 :: > ff02::16: HBH ICMP6, multicast listener report v2, 2 group record(s), length 48
22:40:54.988382 IP6 fe80::4cf:aff:fee5:cf9d.5353 > ff02::fb.5353: 0*- [0q] 5/0/0 (Cache flush) TXT "", (Cache flush) AAAA fe80::4cf:aff:fee5:cf9d, (Cache flush) PTR floodlight.local., (Cache flush) HINFO, (Cache flush) SRV floodlight.local.:9 0 0 (249)
22:40:54.988417 IP 0.0.0.0.68 > 255.255.255.255.67: BOOTP/DHCP, Request from 96:23:61:d6:2e:ac, length 300
22:40:54.988452 IP6 fe80::d01a:a8ff:feb4:a0aa.5353 > ff02::fb.5353: 0 [3q] [5n] ANY (QM)? floodlight [d2:1a:a8:b4:a0:aa]._workstation._tcp.local. ANY (QM)? floodlight.local. ANY (QM)? a.a.0.a.4.b.e.f.f.f.8.a.a.1.0.d.0.0.0.0.0.0.0.0.0.0.0.0.0.8.e.f.ip6.arpa. (267)
22:40:54.988660 IP6 fe80::a40a:e8ff:fec2:514f > ff02::16: HBH ICMP6, multicast listener report v2, 2 group record(s), length 48
22:40:54.988696 IP6 fe80::a40a:e8ff:fec2:514f.5353 > ff02::fb.5353: 0*- [0q] 2/0/0 PTR _workstation._tcp.local., PTR floodlight [a6:0a:e8:c2:51:4f]._workstation._tcp.local. (117)
22:40:54.988731 IP6 fe80::a40a:e8ff:fec2:514f.5353 > ff02::fb.5353: 0 [2q] PTR (QM)? _ipps._tcp.local. PTR (QM)? _ipp._tcp.local. (45)
22:40:54.988996 IP6 fe80::6ca3:42ff:febd:4b61.5353 > ff02::fb.5353: 0*- [0q] 5/0/0 (Cache flush) TXT "", (Cache flush) AAAA fe80::6ca3:42ff:febd:4b61, (Cache flush) PTR floodlight.local., (Cache flush) HINFO, (Cache flush) SRV floodlight.local.:9 0 0 (249)
22:40:54.989070 IP6 :: > ff02::16: HBH ICMP6, multicast listener report v2, 1 group record(s), length 28
22:40:54.989116 IP6 :: > ff02::16: HBH ICMP6, multicast listener report v2, 1 group record(s), length 28
22:40:55.018986 IP6 :: > ff02::1:ffd6:2eac: ICMP6, neighbor solicitation, who has fe80::9423:61ff:fed6:2eac, length 24
22:40:55.024446 IP6 :: > ff02::1:ffe5:cf9d: ICMP6, neighbor solicitation, who has fe80::4cf:aff:fee5:cf9d, length 24
22:40:55.024488 IP 0.0.0.0.68 > 255.255.255.255.67: BOOTP/DHCP, Request from 06:cf:0a:e5:cf:9d, length 300
22:40:55.024531 IP6 :: > ff02::16: HBH ICMP6, multicast listener report v2, 1 group record(s), length 28
22:40:55.024573 IP 0.0.0.0.68 > 255.255.255.255.67: BOOTP/DHCP, Request from a6:0a:e8:c2:51:4f, length 300
22:40:55.024615 IP6 :: > ff02::16: HBH ICMP6, multicast listener report v2, 1 group record(s), length 28
22:40:55.024657 IP6 :: > ff02::16: HBH ICMP6, multicast listener report v2, 2 group record(s), length 48
22:40:55.024925 IP6 fe80::a83b:d5ff:feee:2788 > ff02::16: HBH ICMP6, multicast listener report v2, 1 group record(s), length 28
22:40:55.025000 IP6 fe80::a83b:d5ff:feee:2788 > ff02::2: ICMP6, router solicitation, length 16
22:40:55.025059 IP6 fe80::a83b:d5ff:feee:2788 > ff02::16: HBH ICMP6, multicast listener report v2, 1 group record(s), length 28
22:40:55.036912 IP6 fe80::a83b:d5ff:feee:2788.5353 > ff02::fb.5353: 0*- [0q] 2/0/0 PTR _workstation._tcp.local., PTR floodlight [aa:3b:d5:ee:27:88]._workstation._tcp.local. (117)
22:40:55.036947 IP6 fe80::a83b:d5ff:feee:2788.5353 > ff02::fb.5353: 0 [3q] [5n] ANY (QM)? floodlight [aa:3b:d5:ee:27:88]._workstation._tcp.local. ANY (QM)? floodlight.local. ANY (QM)? 8.8.7.2.e.e.e.f.f.f.5.d.b.3.8.a.0.0.0.0.0.0.0.0.0.0.0.0.0.8.e.f.ip6.arpa. (267)
22:40:55.036982 IP6 fe80::a83b:d5ff:feee:2788.5353 > ff02::fb.5353: 0 [2q] PTR (QM)? _ipps._tcp.local. PTR (QM)? _ipp._tcp.local. (45)
22:40:55.037017 IP6 fe80::a83b:d5ff:feee:2788 > ff02::16: HBH ICMP6, multicast listener report v2, 2 group record(s), length 48
22:40:55.037244 IP6 :: > ff02::16: HBH ICMP6, multicast listener report v2, 2 group record(s), length 48
22:40:55.037279 IP6 :: > ff02::16: HBH ICMP6, multicast listener report v2, 1 group record(s), length 28
22:40:55.037952 IP6 fe80::d01a:a8ff:feb4:a0aa.5353 > ff02::fb.5353: 0*- [0q] 5/0/0 (Cache flush) TXT "", (Cache flush) AAAA fe80::d01a:a8ff:feb4:a0aa, (Cache flush) PTR floodlight.local., (Cache flush) HINFO, (Cache flush) SRV floodlight.local.:9 0 0 (249)
22:40:55.039506 IP6 fe80::5440:46ff:fe6b:4efd > ff02::16: HBH ICMP6, multicast listener report v2, 1 group record(s), length 28
22:40:55.051444 IP6 fe80::5440:46ff:fe6b:4efd > ff02::16: HBH ICMP6, multicast listener report v2, 2 group record(s), length 48
22:40:55.056576 IP6 fe80::d01a:a8ff:feb4:a0aa.5353 > ff02::fb.5353: 0 [2q] PTR (QM)? _ipps._tcp.local. PTR (QM)? _ipp._tcp.local. (45)
22:40:55.057888 IP6 fe80::d01a:a8ff:feb4:a0aa.5353 > ff02::fb.5353: 0*- [0q] 2/0/0 PTR _workstation._tcp.local., PTR floodlight [d2:1a:a8:b4:a0:aa]._workstation._tcp.local. (117)
22:40:55.059905 IP6 fe80::a83b:d5ff:feee:2788.5353 > ff02::fb.5353: 0 [3q] [5n] ANY (QM)? floodlight [aa:3b:d5:ee:27:88]._workstation._tcp.local. ANY (QM)? floodlight.local. ANY (QM)? 8.8.7.2.e.e.e.f.f.f.5.d.b.3.8.a.0.0.0.0.0.0.0.0.0.0.0.0.0.8.e.f.ip6.arpa. (267)
22:40:55.061326 IP6 :: > ff02::1:ffc2:514f: ICMP6, neighbor solicitation, who has fe80::a40a:e8ff:fec2:514f, length 24
22:40:55.062708 IP6 :: > ff02::1:ffbd:4b61: ICMP6, neighbor solicitation, who has fe80::6ca3:42ff:febd:4b61, length 24
22:40:55.070943 IP6 fe80::9423:61ff:fed6:2eac > ff02::16: HBH ICMP6, multicast listener report v2, 1 group record(s), length 28
22:40:55.071132 IP6 fe80::9423:61ff:fed6:2eac > ff02::2: ICMP6, router solicitation, length 16
22:40:55.144977 IP6 fe80::5440:46ff:fe6b:4efd.5353 > ff02::fb.5353: 0 [3q] [5n] ANY (QM)? floodlight [56:40:46:6b:4e:fd]._workstation._tcp.local. ANY (QM)? floodlight.local. ANY (QM)? d.f.e.4.b.6.e.f.f.f.6.4.0.4.4.5.0.0.0.0.0.0.0.0.0.0.0.0.0.8.e.f.ip6.arpa. (267)
22:40:55.349408 IP6 fe80::5440:46ff:fe6b:4efd.5353 > ff02::fb.5353: 0*- [0q] 5/0/0 (Cache flush) TXT "", (Cache flush) AAAA fe80::5440:46ff:fe6b:4efd, (Cache flush) PTR floodlight.local., (Cache flush) HINFO, (Cache flush) SRV floodlight.local.:9 0 0 (249)
22:40:55.643738 IP6 fe80::5440:46ff:fe6b:4efd.5353 > ff02::fb.5353: 0*- [0q] 2/0/0 PTR _workstation._tcp.local., PTR floodlight [56:40:46:6b:4e:fd]._workstation._tcp.local. (117)
22:40:55.650185 ARP, Request who-has 10.0.0.2 tell 10.0.0.4, length 28
22:40:55.651439 ARP, Reply 10.0.0.2 is-at 22:ae:0f:90:01:17, length 28
22:40:55.652950 IP6 fe80::5440:46ff:fe6b:4efd.5353 > ff02::fb.5353: 0 [2q] PTR (QM)? _ipps._tcp.local. PTR (QM)? _ipp._tcp.local. (45)
22:40:55.697928 IP6 fe80::9423:61ff:fed6:2eac > ff02::16: HBH ICMP6, multicast listener report v2, 1 group record(s), length 28
22:40:55.697963 IP6 fe80::9423:61ff:fed6:2eac.5353 > ff02::fb.5353: 0*- [0q] 2/0/0 PTR _workstation._tcp.local., PTR floodlight [96:23:61:d6:2e:ac]._workstation._tcp.local. (117)
22:40:55.697999 IP6 fe80::9423:61ff:fed6:2eac.5353 > ff02::fb.5353: 0 [2q] PTR (QM)? _ipps._tcp.local. PTR (QM)? _ipp._tcp.local. (45)
22:40:55.698033 IP6 fe80::4cf:aff:fee5:cf9d > ff02::16: HBH ICMP6, multicast listener report v2, 1 group record(s), length 28
22:40:55.698294 IP6 fe80::4cf:aff:fee5:cf9d > ff02::2: ICMP6, router solicitation, length 16
22:40:55.698331 IP6 fe80::4cf:aff:fee5:cf9d > ff02::16: HBH ICMP6, multicast listener report v2, 1 group record(s), length 28
22:40:55.698398 IP6 fe80::9423:61ff:fed6:2eac > ff02::16: HBH ICMP6, multicast listener report v2, 2 group record(s), length 48
22:40:55.698470 IP6 :: > ff02::16: HBH ICMP6, multicast listener report v2, 1 group record(s), length 28
22:40:55.698505 IP6 fe80::4cf:aff:fee5:cf9d.5353 > ff02::fb.5353: 0 [3q] [5n] ANY (QM)? floodlight [06:cf:0a:e5:cf:9d]._workstation._tcp.local. ANY (QM)? floodlight.local. ANY (QM)? d.9.f.c.5.e.e.f.f.f.a.0.f.c.4.0.0.0.0.0.0.0.0.0.0.0.0.0.0.8.e.f.ip6.arpa. (267)
22:40:55.698540 IP6 :: > ff02::16: HBH ICMP6, multicast listener report v2, 1 group record(s), length 28
22:40:55.698803 IP 0.0.0.0.68 > 255.255.255.255.67: BOOTP/DHCP, Request from d2:1a:a8:b4:a0:aa, length 300
22:40:55.698838 IP6 :: > ff02::16: HBH ICMP6, multicast listener report v2, 1 group record(s), length 28
22:40:55.699511 ARP, Request who-has 10.0.0.6 tell 10.0.0.4, length 28
22:40:55.704908 IP6 fe80::4cf:aff:fee5:cf9d.5353 > ff02::fb.5353: 0 [2q] PTR (QM)? _ipps._tcp.local. PTR (QM)? _ipp._tcp.local. (45)
22:40:55.705066 IP6 fe80::4cf:aff:fee5:cf9d > ff02::16: HBH ICMP6, multicast listener report v2, 1 group record(s), length 28
22:40:55.705101 IP6 fe80::9423:61ff:fed6:2eac > ff02::16: HBH ICMP6, multicast listener report v2, 1 group record(s), length 28
22:40:55.705136 IP6 fe80::a83b:d5ff:feee:2788.5353 > ff02::fb.5353: 0 [3q] [5n] ANY (QM)? floodlight [aa:3b:d5:ee:27:88]._workstation._tcp.local. ANY (QM)? floodlight.local. ANY (QM)? 8.8.7.2.e.e.e.f.f.f.5.d.b.3.8.a.0.0.0.0.0.0.0.0.0.0.0.0.0.8.e.f.ip6.arpa. (267)
22:40:55.705171 IP6 fe80::a83b:d5ff:feee:2788.5353 > ff02::fb.5353: 0*- [0q] 5/0/0 (Cache flush) TXT "", (Cache flush) AAAA fe80::a83b:d5ff:feee:2788, (Cache flush) PTR floodlight.local., (Cache flush) HINFO, (Cache flush) SRV floodlight.local.:9 0 0 (249)
22:40:55.705206 IP6 fe80::a83b:d5ff:feee:2788 > ff02::16: HBH ICMP6, multicast listener report v2, 1 group record(s), length 28
22:40:55.705241 IP6 fe80::a83b:d5ff:feee:2788.5353 > ff02::fb.5353: 0*- [0q] 2/0/0 PTR _workstation._tcp.local., PTR floodlight [aa:3b:d5:ee:27:88]._workstation._tcp.local. (117)
22:40:55.705276 IP6 fe80::a83b:d5ff:feee:2788.5353 > ff02::fb.5353: 0 [2q] PTR (QM)? _ipps._tcp.local. PTR (QM)? _ipp._tcp.local. (45)
22:40:55.705310 IP6 fe80::9423:61ff:fed6:2eac.5353 > ff02::fb.5353: 0 [3q] [5n] ANY (QM)? floodlight [96:23:61:d6:2e:ac]._workstation._tcp.local. ANY (QM)? floodlight.local. ANY (QM)? c.a.e.2.6.d.e.f.f.f.1.6.3.2.4.9.0.0.0.0.0.0.0.0.0.0.0.0.0.8.e.f.ip6.arpa. (267)
22:40:55.705565 IP6 fe80::4cf:aff:fee5:cf9d.5353 > ff02::fb.5353: 0 [3q] [5n] ANY (QM)? floodlight [06:cf:0a:e5:cf:9d]._workstation._tcp.local. ANY (QM)? floodlight.local. ANY (QM)? d.9.f.c.5.e.e.f.f.f.a.0.f.c.4.0.0.0.0.0.0.0.0.0.0.0.0.0.0.8.e.f.ip6.arpa. (267)
22:40:55.705600 IP6 fe80::4cf:aff:fee5:cf9d.5353 > ff02::fb.5353: 0 [3q] [5n] ANY (QM)? floodlight [06:cf:0a:e5:cf:9d]._workstation._tcp.local. ANY (QM)? floodlight.local. ANY (QM)? d.9.f.c.5.e.e.f.f.f.a.0.f.c.4.0.0.0.0.0.0.0.0.0.0.0.0.0.0.8.e.f.ip6.arpa. (267)
22:40:55.705635 IP6 fe80::4cf:aff:fee5:cf9d > ff02::16: HBH ICMP6, multicast listener report v2, 2 group record(s), length 48
22:40:55.925524 IP 0.0.0.0.68 > 255.255.255.255.67: BOOTP/DHCP, Request from 56:40:46:6b:4e:fd, length 300
22:40:56.091855 IP6 fe80::9423:61ff:fed6:2eac.5353 > ff02::fb.5353: 0 [3q] [5n] ANY (QM)? floodlight [96:23:61:d6:2e:ac]._workstation._tcp.local. ANY (QM)? floodlight.local. ANY (QM)? c.a.e.2.6.d.e.f.f.f.1.6.3.2.4.9.0.0.0.0.0.0.0.0.0.0.0.0.0.8.e.f.ip6.arpa. (267)
22:40:56.091891 IP6 fe80::9423:61ff:fed6:2eac.5353 > ff02::fb.5353: 0*- [0q] 5/0/0 (Cache flush) TXT "", (Cache flush) AAAA fe80::9423:61ff:fed6:2eac, (Cache flush) PTR floodlight.local., (Cache flush) HINFO, (Cache flush) SRV floodlight.local.:9 0 0 (249)
22:40:56.091926 IP6 fe80::4cf:aff:fee5:cf9d.5353 > ff02::fb.5353: 0*- [0q] 1/0/0 (Cache flush) TXT "" (79)
22:40:56.091961 IP6 fe80::4cf:aff:fee5:cf9d.5353 > ff02::fb.5353: 0*- [0q] 2/0/0 (Cache flush) SRV floodlight.local.:9 0 0, (Cache flush) HINFO (122)
22:40:56.092085 IP6 fe80::4cf:aff:fee5:cf9d.5353 > ff02::fb.5353: 0*- [0q] 2/0/0 (Cache flush) PTR floodlight.local., (Cache flush) AAAA fe80::4cf:aff:fee5:cf9d (142)
22:40:56.092120 ARP, Request who-has 10.0.0.6 tell 10.0.0.4, length 28
22:40:56.092155 IP6 :: > ff02::1:ffb4:a0aa: ICMP6, neighbor solicitation, who has fe80::d01a:a8ff:feb4:a0aa, length 24
22:40:56.092460 IP6 fe80::a40a:e8ff:fec2:514f > ff02::16: HBH ICMP6, multicast listener report v2, 1 group record(s), length 28
22:40:56.103564 ARP, Request who-has 10.0.0.2 tell 10.0.0.4, length 28
22:40:56.104812 ARP, Reply 10.0.0.2 is-at 22:ae:0f:90:01:17, length 28
22:40:56.108281 IP6 fe80::a40a:e8ff:fec2:514f > ff02::2: ICMP6, router solicitation, length 16
22:40:56.108316 IP6 fe80::a40a:e8ff:fec2:514f > ff02::16: HBH ICMP6, multicast listener report v2, 1 group record(s), length 28
