Hosth8
#######################

22:40:09.620782 IP6 fe80::2823:2bff:fe66:ddb8 > ff02::2: ICMP6, router solicitation, length 16
22:40:09.679338 IP6 fe80::c86:76ff:fe35:e9b7 > ff02::2: ICMP6, router solicitation, length 16
22:40:09.852262 IP6 fe80::589d:7bff:fe83:4eef > ff02::2: ICMP6, router solicitation, length 16
22:40:10.311681 IP6 fe80::40b7:f3ff:fe57:e580 > ff02::2: ICMP6, router solicitation, length 16
22:40:10.413884 IP6 fe80::38f0:57ff:fe3e:e67 > ff02::2: ICMP6, router solicitation, length 16
22:40:11.460117 IP 0.0.0.0.68 > 255.255.255.255.67: BOOTP/DHCP, Request from 5a:9d:7b:83:4e:ef, length 300
22:40:16.120702 IP6 fe80::d01a:a8ff:feb4:a0aa.5353 > ff02::fb.5353: 0 [2q] PTR (QM)? _ipps._tcp.local. PTR (QM)? _ipp._tcp.local. (45)
22:40:16.946442 IP6 fe80::589d:7bff:fe83:4eef.5353 > ff02::fb.5353: 0 [2q] PTR (QM)? _ipps._tcp.local. PTR (QM)? _ipp._tcp.local. (45)
22:40:20.905012 IP 0.0.0.0.68 > 255.255.255.255.67: BOOTP/DHCP, Request from 5a:9d:7b:83:4e:ef, length 300
22:40:20.991222 IP 0.0.0.0.68 > 255.255.255.255.67: BOOTP/DHCP, Request from d2:1a:a8:b4:a0:aa, length 300
22:40:21.475061 LLDP, length 47
22:40:21.634803 5a:9d:7b:83:4e:ef > ff:ff:ff:ff:ff:ff, ethertype Unknown (0x8942), length 69: 
	0x0000:  2000 0604 0002 0000 0207 0400 0000 0000  ................
	0x0010:  0e04 0302 0003 0602 0078 fe0c 0026 e100  .........x...&..
	0x0020:  0000 0000 0000 000e 1808 0031 3791 7786  ...........17.w.
	0x0030:  1ff2 e601 0100 00                        .......
22:40:22.337260 ARP, Request who-has 10.0.0.7 tell 10.0.0.1, length 28
22:40:22.763916 ARP, Request who-has 10.0.0.8 tell 10.0.0.1, length 28
22:40:22.765209 ARP, Reply 10.0.0.8 is-at 3a:f0:57:3e:0e:67, length 28
22:40:28.529573 IP 0.0.0.0.68 > 255.255.255.255.67: BOOTP/DHCP, Request from 96:23:61:d6:2e:ac, length 300
22:40:28.812215 IP 0.0.0.0.68 > 255.255.255.255.67: BOOTP/DHCP, Request from 6e:a3:42:bd:4b:61, length 300
22:40:29.778252 IP6 fe80::9423:61ff:fed6:2eac.5353 > ff02::fb.5353: 0 [2q] PTR (QM)? _ipps._tcp.local. PTR (QM)? _ipp._tcp.local. (45)
22:40:29.966355 IP6 fe80::4ca6:54ff:fed1:d4f0.5353 > ff02::fb.5353: 0 [2q] PTR (QM)? _ipps._tcp.local. PTR (QM)? _ipp._tcp.local. (45)
22:40:30.022274 IP 0.0.0.0.68 > 255.255.255.255.67: BOOTP/DHCP, Request from 5a:9d:7b:83:4e:ef, length 300
22:40:30.376140 IP6 fe80::6ca3:42ff:febd:4b61.5353 > ff02::fb.5353: 0 [2q] PTR (QM)? _ipps._tcp.local. PTR (QM)? _ipp._tcp.local. (45)
22:40:31.745886 IP 0.0.0.0.68 > 255.255.255.255.67: BOOTP/DHCP, Request from d2:1a:a8:b4:a0:aa, length 300
22:40:32.118757 IP6 fe80::d01a:a8ff:feb4:a0aa.5353 > ff02::fb.5353: 0 [2q] PTR (QM)? _ipps._tcp.local. PTR (QM)? _ipp._tcp.local. (45)
22:40:32.946382 IP6 fe80::589d:7bff:fe83:4eef.5353 > ff02::fb.5353: 0 [2q] PTR (QM)? _ipps._tcp.local. PTR (QM)? _ipp._tcp.local. (45)
22:40:33.419198 ARP, Request who-has 10.0.0.3 tell 10.0.0.2, length 28
22:40:33.831412 ARP, Request who-has 10.0.0.4 tell 10.0.0.2, length 28
22:40:34.292650 ARP, Request who-has 10.0.0.5 tell 10.0.0.2, length 28
22:40:35.150714 ARP, Request who-has 10.0.0.7 tell 10.0.0.2, length 28
22:40:35.369933 IP 0.0.0.0.68 > 255.255.255.255.67: BOOTP/DHCP, Request from 4e:a6:54:d1:d4:f0, length 300
22:40:35.764555 IP 0.0.0.0.68 > 255.255.255.255.67: BOOTP/DHCP, Request from 96:23:61:d6:2e:ac, length 300
22:40:35.813374 IP 0.0.0.0.68 > 255.255.255.255.67: BOOTP/DHCP, Request from 6e:a3:42:bd:4b:61, length 300
22:40:36.531780 LLDP, length 47
22:40:36.598988 ARP, Request who-has 10.0.0.8 tell 10.0.0.2, length 28
22:40:36.600254 ARP, Reply 10.0.0.8 is-at 3a:f0:57:3e:0e:67, length 28
22:40:36.662688 IP 10.0.0.2 > 10.0.0.8: ICMP echo request, id 4030, seq 1, length 64
22:40:36.663918 IP 10.0.0.8 > 10.0.0.2: ICMP echo reply, id 4030, seq 1, length 64
22:40:36.702486 5a:9d:7b:83:4e:ef > ff:ff:ff:ff:ff:ff, ethertype Unknown (0x8942), length 69: 
	0x0000:  2000 0604 0002 0000 0207 0400 0000 0000  ................
	0x0010:  0e04 0302 0003 0602 0078 fe0c 0026 e100  .........x...&..
	0x0020:  0000 0000 0000 000e 1808 0031 3791 7786  ...........17.w.
	0x0030:  1ff2 e601 0100 00                        .......
22:40:37.766336 ARP, Request who-has 10.0.0.4 tell 10.0.0.3, length 28
22:40:38.174889 ARP, Request who-has 10.0.0.5 tell 10.0.0.3, length 28
22:40:38.588162 ARP, Request who-has 10.0.0.6 tell 10.0.0.3, length 28
22:40:38.987975 ARP, Request who-has 10.0.0.7 tell 10.0.0.3, length 28
22:40:39.254353 IP 0.0.0.0.68 > 255.255.255.255.67: BOOTP/DHCP, Request from d2:1a:a8:b4:a0:aa, length 300
22:40:39.394604 ARP, Request who-has 10.0.0.8 tell 10.0.0.3, length 28
22:40:39.395843 ARP, Reply 10.0.0.8 is-at 3a:f0:57:3e:0e:67, length 28
22:40:39.446365 IP 10.0.0.3 > 10.0.0.8: ICMP echo request, id 4037, seq 1, length 64
22:40:39.447610 IP 10.0.0.8 > 10.0.0.3: ICMP echo reply, id 4037, seq 1, length 64
22:40:39.799060 ARP, Request who-has 10.0.0.1 tell 10.0.0.4, length 28
22:40:41.667880 ARP, Request who-has 10.0.0.2 tell 10.0.0.8, length 28
22:40:41.707889 ARP, Reply 10.0.0.2 is-at 22:ae:0f:90:01:17, length 28
22:40:44.452673 ARP, Request who-has 10.0.0.3 tell 10.0.0.8, length 28
22:40:44.479083 ARP, Reply 10.0.0.3 is-at 62:52:cd:31:e2:b5, length 28
22:40:44.871641 IP 0.0.0.0.68 > 255.255.255.255.67: BOOTP/DHCP, Request from 5a:9d:7b:83:4e:ef, length 300
22:40:49.371837 IP6 :: > ff02::16: HBH ICMP6, multicast listener report v2, 2 group record(s), length 48
22:40:49.584526 IP6 :: > ff02::16: HBH ICMP6, multicast listener report v2, 2 group record(s), length 48
22:40:49.585441 IP6 :: > ff02::16: HBH ICMP6, multicast listener report v2, 2 group record(s), length 48
22:40:49.585467 IP6 :: > ff02::16: HBH ICMP6, multicast listener report v2, 2 group record(s), length 48
22:40:49.585493 IP6 :: > ff02::16: HBH ICMP6, multicast listener report v2, 2 group record(s), length 48
22:40:49.585519 IP6 :: > ff02::16: HBH ICMP6, multicast listener report v2, 2 group record(s), length 48
22:40:49.647594 IP6 :: > ff02::16: HBH ICMP6, multicast listener report v2, 2 group record(s), length 48
22:40:49.660449 IP6 :: > ff02::16: HBH ICMP6, multicast listener report v2, 2 group record(s), length 48
22:40:49.660475 IP6 :: > ff02::1:ffd6:2eac: ICMP6, neighbor solicitation, who has fe80::9423:61ff:fed6:2eac, length 24
22:40:49.660501 IP6 :: > ff02::1:ffbd:4b61: ICMP6, neighbor solicitation, who has fe80::6ca3:42ff:febd:4b61, length 24
22:40:49.720426 IP6 :: > ff02::16: HBH ICMP6, multicast listener report v2, 2 group record(s), length 48
22:40:49.931853 IP6 :: > ff02::1:ff83:4eef: ICMP6, neighbor solicitation, who has fe80::589d:7bff:fe83:4eef, length 24
22:40:49.952307 IP6 :: > ff02::16: HBH ICMP6, multicast listener report v2, 2 group record(s), length 48
22:40:49.976457 IP6 :: > ff02::1:ffd1:d4f0: ICMP6, neighbor solicitation, who has fe80::4ca6:54ff:fed1:d4f0, length 24
22:40:50.070288 IP6 :: > ff02::16: HBH ICMP6, multicast listener report v2, 1 group record(s), length 28
22:40:50.227052 IP6 :: > ff02::1:ffb4:a0aa: ICMP6, neighbor solicitation, who has fe80::d01a:a8ff:feb4:a0aa, length 24
22:40:50.404172 IP6 fe80::9423:61ff:fed6:2eac > ff02::16: HBH ICMP6, multicast listener report v2, 1 group record(s), length 28
22:40:50.414064 IP6 fe80::9423:61ff:fed6:2eac > ff02::16: HBH ICMP6, multicast listener report v2, 1 group record(s), length 28
22:40:50.441985 IP6 fe80::9423:61ff:fed6:2eac.5353 > ff02::fb.5353: 0*- [0q] 2/0/0 PTR _workstation._tcp.local., PTR floodlight [96:23:61:d6:2e:ac]._workstation._tcp.local. (117)
22:40:50.536123 IP6 fe80::9423:61ff:fed6:2eac.5353 > ff02::fb.5353: 0 [3q] [5n] ANY (QM)? floodlight [96:23:61:d6:2e:ac]._workstation._tcp.local. ANY (QM)? floodlight.local. ANY (QM)? c.a.e.2.6.d.e.f.f.f.1.6.3.2.4.9.0.0.0.0.0.0.0.0.0.0.0.0.0.8.e.f.ip6.arpa. (267)
22:40:50.642506 IP6 fe80::9423:61ff:fed6:2eac.5353 > ff02::fb.5353: 0 [2q] PTR (QM)? _ipps._tcp.local. PTR (QM)? _ipp._tcp.local. (45)
22:40:50.666329 IP6 fe80::6ca3:42ff:febd:4b61 > ff02::16: HBH ICMP6, multicast listener report v2, 1 group record(s), length 28
22:40:50.666856 IP6 fe80::6ca3:42ff:febd:4b61 > ff02::16: HBH ICMP6, multicast listener report v2, 1 group record(s), length 28
22:40:50.666892 IP6 fe80::6ca3:42ff:febd:4b61.5353 > ff02::fb.5353: 0*- [0q] 2/0/0 PTR _workstation._tcp.local., PTR floodlight [6e:a3:42:bd:4b:61]._workstation._tcp.local. (117)
22:40:50.742248 IP6 fe80::6ca3:42ff:febd:4b61.5353 > ff02::fb.5353: 0 [3q] [5n] ANY (QM)? floodlight [6e:a3:42:bd:4b:61]._workstation._tcp.local. ANY (QM)? floodlight.local. ANY (QM)? 1.6.b.4.d.b.e.f.f.f.2.4.3.a.c.6.0.0.0.0.0.0.0.0.0.0.0.0.0.8.e.f.ip6.arpa. (267)
22:40:50.785683 IP6 fe80::6ca3:42ff:febd:4b61.5353 > ff02::fb.5353: 0 [2q] PTR (QM)? _ipps._tcp.local. PTR (QM)? _ipp._tcp.local. (45)
22:40:50.931539 IP6 fe80::589d:7bff:fe83:4eef > ff02::16: HBH ICMP6, multicast listener report v2, 1 group record(s), length 28
22:40:50.939675 IP6 fe80::589d:7bff:fe83:4eef > ff02::16: HBH ICMP6, multicast listener report v2, 1 group record(s), length 28
22:40:51.000605 IP6 fe80::9423:61ff:fed6:2eac.5353 > ff02::fb.5353: 0 [3q] [5n] ANY (QM)? floodlight [96:23:61:d6:2e:ac]._workstation._tcp.local. ANY (QM)? floodlight.local. ANY (QM)? c.a.e.2.6.d.e.f.f.f.1.6.3.2.4.9.0.0.0.0.0.0.0.0.0.0.0.0.0.8.e.f.ip6.arpa. (267)
22:40:51.004214 IP6 fe80::589d:7bff:fe83:4eef.5353 > ff02::fb.5353: 0*- [0q] 2/0/0 PTR _workstation._tcp.local., PTR floodlight [5a:9d:7b:83:4e:ef]._workstation._tcp.local. (117)
22:40:51.011998 IP6 fe80::589d:7bff:fe83:4eef.5353 > ff02::fb.5353: 0 [3q] [5n] ANY (QM)? floodlight [5a:9d:7b:83:4e:ef]._workstation._tcp.local. ANY (QM)? floodlight.local. ANY (QM)? f.e.e.4.3.8.e.f.f.f.b.7.d.9.8.5.0.0.0.0.0.0.0.0.0.0.0.0.0.8.e.f.ip6.arpa. (267)
22:40:51.032877 IP6 fe80::589d:7bff:fe83:4eef.5353 > ff02::fb.5353: 0 [2q] PTR (QM)? _ipps._tcp.local. PTR (QM)? _ipp._tcp.local. (45)
22:40:51.206754 IP6 fe80::6ca3:42ff:febd:4b61.5353 > ff02::fb.5353: 0 [3q] [5n] ANY (QM)? floodlight [6e:a3:42:bd:4b:61]._workstation._tcp.local. ANY (QM)? floodlight.local. ANY (QM)? 1.6.b.4.d.b.e.f.f.f.2.4.3.a.c.6.0.0.0.0.0.0.0.0.0.0.0.0.0.8.e.f.ip6.arpa. (267)
22:40:51.206847 IP6 fe80::9423:61ff:fed6:2eac > ff02::16: HBH ICMP6, multicast listener report v2, 1 group record(s), length 28
22:40:51.237472 IP6 fe80::4ca6:54ff:fed1:d4f0 > ff02::16: HBH ICMP6, multicast listener report v2, 1 group record(s), length 28
22:40:51.247619 IP6 fe80::589d:7bff:fe83:4eef > ff02::16: HBH ICMP6, multicast listener report v2, 1 group record(s), length 28
22:40:51.269022 IP6 fe80::589d:7bff:fe83:4eef.5353 > ff02::fb.5353: 0 [3q] [5n] ANY (QM)? floodlight [5a:9d:7b:83:4e:ef]._workstation._tcp.local. ANY (QM)? floodlight.local. ANY (QM)? f.e.e.4.3.8.e.f.f.f.b.7.d.9.8.5.0.0.0.0.0.0.0.0.0.0.0.0.0.8.e.f.ip6.arpa. (267)
22:40:51.507473 IP6 fe80::589d:7bff:fe83:4eef > ff02::16: HBH ICMP6, multicast listener report v2, 2 group record(s), length 48
22:40:51.518803 IP6 fe80::589d:7bff:fe83:4eef.5353 > ff02::fb.5353: 0 [3q] [5n] ANY (QM)? floodlight [5a:9d:7b:83:4e:ef]._workstation._tcp.local. ANY (QM)? floodlight.local. ANY (QM)? f.e.e.4.3.8.e.f.f.f.b.7.d.9.8.5.0.0.0.0.0.0.0.0.0.0.0.0.0.8.e.f.ip6.arpa. (267)
22:40:51.560476 LLDP, length 47
22:40:51.560502 IP6 fe80::6ca3:42ff:febd:4b61 > ff02::16: HBH ICMP6, multicast listener report v2, 1 group record(s), length 28
22:40:51.560527 ARP, Request who-has 10.0.0.5 tell 10.0.0.4, length 28
22:40:51.560755 IP6 fe80::4ca6:54ff:fed1:d4f0.5353 > ff02::fb.5353: 0*- [0q] 2/0/0 PTR _workstation._tcp.local., PTR floodlight [4e:a6:54:d1:d4:f0]._workstation._tcp.local. (117)
22:40:51.560781 IP6 fe80::9423:61ff:fed6:2eac.5353 > ff02::fb.5353: 0 [3q] [5n] ANY (QM)? floodlight [96:23:61:d6:2e:ac]._workstation._tcp.local. ANY (QM)? floodlight.local. ANY (QM)? c.a.e.2.6.d.e.f.f.f.1.6.3.2.4.9.0.0.0.0.0.0.0.0.0.0.0.0.0.8.e.f.ip6.arpa. (267)
22:40:51.700093 5a:9d:7b:83:4e:ef > ff:ff:ff:ff:ff:ff, ethertype Unknown (0x8942), length 69: 
	0x0000:  2000 0604 0002 0000 0207 0400 0000 0000  ................
	0x0010:  0e04 0302 0003 0602 0078 fe0c 0026 e100  .........x...&..
	0x0020:  0000 0000 0000 000e 1808 0031 3791 7786  ...........17.w.
	0x0030:  1ff2 e601 0100 00                        .......
22:40:51.718459 IP6 fe80::589d:7bff:fe83:4eef.5353 > ff02::fb.5353: 0*- [0q] 3/0/0 (Cache flush) TXT "", (Cache flush) HINFO, (Cache flush) SRV floodlight.local.:9 0 0 (135)
22:40:51.720464 IP6 fe80::589d:7bff:fe83:4eef.5353 > ff02::fb.5353: 0*- [0q] 2/0/0 (Cache flush) PTR floodlight.local., (Cache flush) AAAA fe80::589d:7bff:fe83:4eef (142)
22:40:51.758852 IP6 fe80::4ca6:54ff:fed1:d4f0.5353 > ff02::fb.5353: 0 [3q] [5n] ANY (QM)? floodlight [4e:a6:54:d1:d4:f0]._workstation._tcp.local. ANY (QM)? floodlight.local. ANY (QM)? 0.f.4.d.1.d.e.f.f.f.4.5.6.a.c.4.0.0.0.0.0.0.0.0.0.0.0.0.0.8.e.f.ip6.arpa. (267)
22:40:51.758878 IP6 fe80::4ca6:54ff:fed1:d4f0.5353 > ff02::fb.5353: 0 [2q] PTR (QM)? _ipps._tcp.local. PTR (QM)? _ipp._tcp.local. (45)
22:40:51.758904 IP6 fe80::6ca3:42ff:febd:4b61.5353 > ff02::fb.5353: 0 [3q] [5n] ANY (QM)? floodlight [6e:a3:42:bd:4b:61]._workstation._tcp.local. ANY (QM)? floodlight.local. ANY (QM)? 1.6.b.4.d.b.e.f.f.f.2.4.3.a.c.6.0.0.0.0.0.0.0.0.0.0.0.0.0.8.e.f.ip6.arpa. (267)
22:40:51.940683 IP6 fe80::6ca3:42ff:febd:4b61 > ff02::16: HBH ICMP6, multicast listener report v2, 2 group record(s), length 48
22:40:51.940709 IP6 fe80::d01a:a8ff:feb4:a0aa > ff02::16: HBH ICMP6, multicast listener report v2, 1 group record(s), length 28
22:40:51.940735 IP6 fe80::d01a:a8ff:feb4:a0aa > ff02::16: HBH ICMP6, multicast listener report v2, 1 group record(s), length 28
22:40:51.940918 IP6 fe80::6ca3:42ff:febd:4b61.5353 > ff02::fb.5353: 0*- [0q] 5/0/0 (Cache flush) TXT "", (Cache flush) AAAA fe80::6ca3:42ff:febd:4b61, (Cache flush) PTR floodlight.local., (Cache flush) HINFO, (Cache flush) SRV floodlight.local.:9 0 0 (249)
22:40:51.940943 IP6 fe80::d01a:a8ff:feb4:a0aa.5353 > ff02::fb.5353: 0*- [0q] 2/0/0 PTR _workstation._tcp.local., PTR floodlight [d2:1a:a8:b4:a0:aa]._workstation._tcp.local. (117)
22:40:52.025355 IP6 fe80::589d:7bff:fe83:4eef.5353 > ff02::fb.5353: 0*- [0q] 2/0/0 PTR _workstation._tcp.local., PTR floodlight [5a:9d:7b:83:4e:ef]._workstation._tcp.local. (117)
22:40:52.033294 IP6 fe80::589d:7bff:fe83:4eef.5353 > ff02::fb.5353: 0 [2q] PTR (QM)? _ipps._tcp.local. PTR (QM)? _ipp._tcp.local. (45)
22:40:52.192757 IP6 fe80::9423:61ff:fed6:2eac.5353 > ff02::fb.5353: 0*- [0q] 5/0/0 (Cache flush) TXT "", (Cache flush) AAAA fe80::9423:61ff:fed6:2eac, (Cache flush) PTR floodlight.local., (Cache flush) HINFO, (Cache flush) SRV floodlight.local.:9 0 0 (249)
22:40:52.250924 IP6 fe80::4ca6:54ff:fed1:d4f0.5353 > ff02::fb.5353: 0 [3q] [5n] ANY (QM)? floodlight [4e:a6:54:d1:d4:f0]._workstation._tcp.local. ANY (QM)? floodlight.local. ANY (QM)? 0.f.4.d.1.d.e.f.f.f.4.5.6.a.c.4.0.0.0.0.0.0.0.0.0.0.0.0.0.8.e.f.ip6.arpa. (267)
22:40:52.256693 IP6 fe80::9423:61ff:fed6:2eac > ff02::16: HBH ICMP6, multicast listener report v2, 2 group record(s), length 48
22:40:52.257052 IP6 fe80::6ca3:42ff:febd:4b61.5353 > ff02::fb.5353: 0*- [0q] 2/0/0 PTR _workstation._tcp.local., PTR floodlight [6e:a3:42:bd:4b:61]._workstation._tcp.local. (117)
22:40:52.257077 IP6 fe80::d01a:a8ff:feb4:a0aa.5353 > ff02::fb.5353: 0 [3q] [5n] ANY (QM)? floodlight [d2:1a:a8:b4:a0:aa]._workstation._tcp.local. ANY (QM)? floodlight.local. ANY (QM)? a.a.0.a.4.b.e.f.f.f.8.a.a.1.0.d.0.0.0.0.0.0.0.0.0.0.0.0.0.8.e.f.ip6.arpa. (267)
22:40:52.257103 IP6 fe80::6ca3:42ff:febd:4b61.5353 > ff02::fb.5353: 0 [2q] PTR (QM)? _ipps._tcp.local. PTR (QM)? _ipp._tcp.local. (45)
22:40:52.753019 IP6 fe80::589d:7bff:fe83:4eef.5353 > ff02::fb.5353: 0*- [0q] 5/0/0 (Cache flush) TXT "", (Cache flush) AAAA fe80::589d:7bff:fe83:4eef, (Cache flush) PTR floodlight.local., (Cache flush) HINFO, (Cache flush) SRV floodlight.local.:9 0 0 (249)
22:40:53.203557 IP6 fe80::d01a:a8ff:feb4:a0aa > ff02::16: HBH ICMP6, multicast listener report v2, 1 group record(s), length 28
22:40:53.217285 IP6 fe80::d01a:a8ff:feb4:a0aa.5353 > ff02::fb.5353: 0 [2q] PTR (QM)? _ipps._tcp.local. PTR (QM)? _ipp._tcp.local. (45)
22:40:53.217311 IP6 fe80::d01a:a8ff:feb4:a0aa > ff02::16: HBH ICMP6, multicast listener report v2, 2 group record(s), length 48
22:40:53.217338 IP6 fe80::4ca6:54ff:fed1:d4f0 > ff02::16: HBH ICMP6, multicast listener report v2, 2 group record(s), length 48
22:40:53.258540 IP6 fe80::4ca6:54ff:fed1:d4f0 > ff02::16: HBH ICMP6, multicast listener report v2, 1 group record(s), length 28
22:40:53.262064 IP6 fe80::d01a:a8ff:feb4:a0aa.5353 > ff02::fb.5353: 0 [3q] [5n] ANY (QM)? floodlight [d2:1a:a8:b4:a0:aa]._workstation._tcp.local. ANY (QM)? floodlight.local. ANY (QM)? a.a.0.a.4.b.e.f.f.f.8.a.a.1.0.d.0.0.0.0.0.0.0.0.0.0.0.0.0.8.e.f.ip6.arpa. (267)
22:40:53.264481 IP6 fe80::d01a:a8ff:feb4:a0aa.5353 > ff02::fb.5353: 0 [3q] [5n] ANY (QM)? floodlight [d2:1a:a8:b4:a0:aa]._workstation._tcp.local. ANY (QM)? floodlight.local. ANY (QM)? a.a.0.a.4.b.e.f.f.f.8.a.a.1.0.d.0.0.0.0.0.0.0.0.0.0.0.0.0.8.e.f.ip6.arpa. (267)
22:40:53.265890 IP6 fe80::9423:61ff:fed6:2eac.5353 > ff02::fb.5353: 0*- [0q] 2/0/0 PTR _workstation._tcp.local., PTR floodlight [96:23:61:d6:2e:ac]._workstation._tcp.local. (117)
22:40:53.267511 IP6 fe80::9423:61ff:fed6:2eac.5353 > ff02::fb.5353: 0 [2q] PTR (QM)? _ipps._tcp.local. PTR (QM)? _ipp._tcp.local. (45)
22:40:53.283947 IP6 fe80::4ca6:54ff:fed1:d4f0.5353 > ff02::fb.5353: 0 [3q] [5n] ANY (QM)? floodlight [4e:a6:54:d1:d4:f0]._workstation._tcp.local. ANY (QM)? floodlight.local. ANY (QM)? 0.f.4.d.1.d.e.f.f.f.4.5.6.a.c.4.0.0.0.0.0.0.0.0.0.0.0.0.0.8.e.f.ip6.arpa. (267)
22:40:53.387702 IP6 :: > ff02::16: HBH ICMP6, multicast listener report v2, 2 group record(s), length 48
22:40:53.399054 IP 0.0.0.0.68 > 255.255.255.255.67: BOOTP/DHCP, Request from 5a:9d:7b:83:4e:ef, length 300
22:40:53.403529 IP6 :: > ff02::1:ff83:4eef: ICMP6, neighbor solicitation, who has fe80::589d:7bff:fe83:4eef, length 24
22:40:53.868053 IP6 fe80::4ca6:54ff:fed1:d4f0.5353 > ff02::fb.5353: 0*- [0q] 2/0/0 (Cache flush) TXT "", (Cache flush) SRV floodlight.local.:9 0 0 (110)
22:40:53.868088 IP6 fe80::4ca6:54ff:fed1:d4f0.5353 > ff02::fb.5353: 0*- [0q] 3/0/0 (Cache flush) HINFO, (Cache flush) AAAA fe80::4ca6:54ff:fed1:d4f0, (Cache flush) PTR floodlight.local. (167)
22:40:53.868123 IP6 fe80::d01a:a8ff:feb4:a0aa.5353 > ff02::fb.5353: 0*- [0q] 5/0/0 (Cache flush) TXT "", (Cache flush) AAAA fe80::d01a:a8ff:feb4:a0aa, (Cache flush) PTR floodlight.local., (Cache flush) HINFO, (Cache flush) SRV floodlight.local.:9 0 0 (249)
22:40:53.868159 IP6 fe80::d01a:a8ff:feb4:a0aa.5353 > ff02::fb.5353: 0 [2q] PTR (QM)? _ipps._tcp.local. PTR (QM)? _ipp._tcp.local. (45)
22:40:53.868633 IP6 fe80::d01a:a8ff:feb4:a0aa.5353 > ff02::fb.5353: 0*- [0q] 2/0/0 PTR _workstation._tcp.local., PTR floodlight [d2:1a:a8:b4:a0:aa]._workstation._tcp.local. (117)
22:40:53.868668 IP6 fe80::6ca3:42ff:febd:4b61.5353 > ff02::fb.5353: 0*- [0q] 5/0/0 (Cache flush) TXT "", (Cache flush) AAAA fe80::6ca3:42ff:febd:4b61, (Cache flush) PTR floodlight.local., (Cache flush) HINFO, (Cache flush) SRV floodlight.local.:9 0 0 (249)
22:40:53.868703 IP6 fe80::4ca6:54ff:fed1:d4f0.5353 > ff02::fb.5353: 0*- [0q] 2/0/0 PTR _workstation._tcp.local., PTR floodlight [4e:a6:54:d1:d4:f0]._workstation._tcp.local. (117)
22:40:53.868738 IP6 fe80::4ca6:54ff:fed1:d4f0.5353 > ff02::fb.5353: 0 [2q] PTR (QM)? _ipps._tcp.local. PTR (QM)? _ipp._tcp.local. (45)
22:40:54.115485 IP6 :: > ff02::16: HBH ICMP6, multicast listener report v2, 2 group record(s), length 48
22:40:54.381462 IP6 :: > ff02::16: HBH ICMP6, multicast listener report v2, 1 group record(s), length 28
22:40:54.381497 IP6 :: > ff02::16: HBH ICMP6, multicast listener report v2, 1 group record(s), length 28
22:40:54.381532 IP 0.0.0.0.68 > 255.255.255.255.67: BOOTP/DHCP, Request from 4e:a6:54:d1:d4:f0, length 300
22:40:54.403745 IP6 fe80::589d:7bff:fe83:4eef > ff02::16: HBH ICMP6, multicast listener report v2, 1 group record(s), length 28
22:40:54.403781 IP6 fe80::589d:7bff:fe83:4eef > ff02::2: ICMP6, router solicitation, length 16
22:40:54.411787 IP6 fe80::589d:7bff:fe83:4eef > ff02::16: HBH ICMP6, multicast listener report v2, 1 group record(s), length 28
22:40:54.469050 IP6 fe80::589d:7bff:fe83:4eef.5353 > ff02::fb.5353: 0*- [0q] 2/0/0 PTR _workstation._tcp.local., PTR floodlight [5a:9d:7b:83:4e:ef]._workstation._tcp.local. (117)
22:40:54.491972 IP6 fe80::589d:7bff:fe83:4eef.5353 > ff02::fb.5353: 0 [3q] [5n] ANY (QM)? floodlight [5a:9d:7b:83:4e:ef]._workstation._tcp.local. ANY (QM)? floodlight.local. ANY (QM)? f.e.e.4.3.8.e.f.f.f.b.7.d.9.8.5.0.0.0.0.0.0.0.0.0.0.0.0.0.8.e.f.ip6.arpa. (267)
22:40:54.505217 IP6 fe80::589d:7bff:fe83:4eef.5353 > ff02::fb.5353: 0 [2q] PTR (QM)? _ipps._tcp.local. PTR (QM)? _ipp._tcp.local. (45)
22:40:54.533640 IP6 fe80::9423:61ff:fed6:2eac.5353 > ff02::fb.5353: 0*- [0q] 5/0/0 (Cache flush) TXT "", (Cache flush) AAAA fe80::9423:61ff:fed6:2eac, (Cache flush) PTR floodlight.local., (Cache flush) HINFO, (Cache flush) SRV floodlight.local.:9 0 0 (249)
22:40:54.533676 IP6 :: > ff02::16: HBH ICMP6, multicast listener report v2, 1 group record(s), length 28
22:40:54.547825 IP 0.0.0.0.68 > 255.255.255.255.67: BOOTP/DHCP, Request from 6e:a3:42:bd:4b:61, length 300
22:40:54.547859 IP6 :: > ff02::16: HBH ICMP6, multicast listener report v2, 1 group record(s), length 28
22:40:54.547894 IP 0.0.0.0.68 > 255.255.255.255.67: BOOTP/DHCP, Request from d2:1a:a8:b4:a0:aa, length 300
22:40:54.569091 IP6 :: > ff02::16: HBH ICMP6, multicast listener report v2, 1 group record(s), length 28
22:40:54.570593 ARP, Request who-has 10.0.0.6 tell 10.0.0.4, length 28
22:40:54.595233 IP6 :: > ff02::1:ffbd:4b61: ICMP6, neighbor solicitation, who has fe80::6ca3:42ff:febd:4b61, length 24
22:40:54.602573 IP6 :: > ff02::16: HBH ICMP6, multicast listener report v2, 2 group record(s), length 48
22:40:54.745004 IP6 fe80::589d:7bff:fe83:4eef.5353 > ff02::fb.5353: 0 [3q] [5n] ANY (QM)? floodlight [5a:9d:7b:83:4e:ef]._workstation._tcp.local. ANY (QM)? floodlight.local. ANY (QM)? f.e.e.4.3.8.e.f.f.f.b.7.d.9.8.5.0.0.0.0.0.0.0.0.0.0.0.0.0.8.e.f.ip6.arpa. (267)
22:40:54.915755 IP6 fe80::589d:7bff:fe83:4eef > ff02::16: HBH ICMP6, multicast listener report v2, 2 group record(s), length 48
22:40:54.996396 IP6 fe80::589d:7bff:fe83:4eef.5353 > ff02::fb.5353: 0 [3q] [5n] ANY (QM)? floodlight [5a:9d:7b:83:4e:ef]._workstation._tcp.local. ANY (QM)? floodlight.local. ANY (QM)? f.e.e.4.3.8.e.f.f.f.b.7.d.9.8.5.0.0.0.0.0.0.0.0.0.0.0.0.0.8.e.f.ip6.arpa. (267)
22:40:55.047969 IP6 fe80::589d:7bff:fe83:4eef > ff02::16: HBH ICMP6, multicast listener report v2, 1 group record(s), length 28
22:40:55.196197 IP6 fe80::589d:7bff:fe83:4eef.5353 > ff02::fb.5353: 0*- [0q] 3/0/0 (Cache flush) TXT "", (Cache flush) HINFO, (Cache flush) SRV floodlight.local.:9 0 0 (135)
22:40:55.208344 IP6 fe80::589d:7bff:fe83:4eef.5353 > ff02::fb.5353: 0*- [0q] 2/0/0 (Cache flush) PTR floodlight.local., (Cache flush) AAAA fe80::589d:7bff:fe83:4eef (142)
22:40:55.392069 IP6 :: > ff02::16: HBH ICMP6, multicast listener report v2, 2 group record(s), length 48
22:40:55.392133 IP 0.0.0.0.68 > 255.255.255.255.67: BOOTP/DHCP, Request from 96:23:61:d6:2e:ac, length 300
22:40:55.392193 IP6 :: > ff02::1:ffd6:2eac: ICMP6, neighbor solicitation, who has fe80::9423:61ff:fed6:2eac, length 24
22:40:55.392261 IP6 :: > ff02::16: HBH ICMP6, multicast listener report v2, 1 group record(s), length 28
22:40:55.392296 IP6 :: > ff02::1:ffd1:d4f0: ICMP6, neighbor solicitation, who has fe80::4ca6:54ff:fed1:d4f0, length 24
22:40:55.392331 IP6 :: > ff02::16: HBH ICMP6, multicast listener report v2, 1 group record(s), length 28
22:40:55.392366 ARP, Request who-has 10.0.0.6 tell 10.0.0.4, length 28
22:40:55.392401 IP6 :: > ff02::1:ffb4:a0aa: ICMP6, neighbor solicitation, who has fe80::d01a:a8ff:feb4:a0aa, length 24
22:40:55.392436 IP6 fe80::9423:61ff:fed6:2eac > ff02::16: HBH ICMP6, multicast listener report v2, 1 group record(s), length 28
22:40:55.393290 IP6 fe80::9423:61ff:fed6:2eac > ff02::2: ICMP6, router solicitation, length 16
22:40:55.424225 IP6 fe80::9423:61ff:fed6:2eac > ff02::16: HBH ICMP6, multicast listener report v2, 1 group record(s), length 28
22:40:55.424260 IP6 fe80::9423:61ff:fed6:2eac.5353 > ff02::fb.5353: 0*- [0q] 2/0/0 PTR _workstation._tcp.local., PTR floodlight [96:23:61:d6:2e:ac]._workstation._tcp.local. (117)
22:40:55.424295 IP6 fe80::9423:61ff:fed6:2eac.5353 > ff02::fb.5353: 0 [2q] PTR (QM)? _ipps._tcp.local. PTR (QM)? _ipp._tcp.local. (45)
22:40:55.424330 IP6 fe80::9423:61ff:fed6:2eac > ff02::16: HBH ICMP6, multicast listener report v2, 2 group record(s), length 48
22:40:55.424391 IP6 fe80::9423:61ff:fed6:2eac > ff02::16: HBH ICMP6, multicast listener report v2, 1 group record(s), length 28
22:40:55.504480 IP6 fe80::589d:7bff:fe83:4eef.5353 > ff02::fb.5353: 0 [2q] PTR (QM)? _ipps._tcp.local. PTR (QM)? _ipp._tcp.local. (45)
22:40:55.508370 IP6 fe80::589d:7bff:fe83:4eef.5353 > ff02::fb.5353: 0*- [0q] 2/0/0 PTR _workstation._tcp.local., PTR floodlight [5a:9d:7b:83:4e:ef]._workstation._tcp.local. (117)
22:40:55.857518 IP6 fe80::9423:61ff:fed6:2eac.5353 > ff02::fb.5353: 0 [3q] [5n] ANY (QM)? floodlight [96:23:61:d6:2e:ac]._workstation._tcp.local. ANY (QM)? floodlight.local. ANY (QM)? c.a.e.2.6.d.e.f.f.f.1.6.3.2.4.9.0.0.0.0.0.0.0.0.0.0.0.0.0.8.e.f.ip6.arpa. (267)
22:40:55.857553 IP6 fe80::6ca3:42ff:febd:4b61 > ff02::16: HBH ICMP6, multicast listener report v2, 1 group record(s), length 28
22:40:55.896003 IP6 fe80::6ca3:42ff:febd:4b61 > ff02::2: ICMP6, router solicitation, length 16
22:40:55.896370 IP6 fe80::6ca3:42ff:febd:4b61 > ff02::16: HBH ICMP6, multicast listener report v2, 1 group record(s), length 28
22:40:55.896405 IP6 fe80::6ca3:42ff:febd:4b61.5353 > ff02::fb.5353: 0*- [0q] 2/0/0 PTR _workstation._tcp.local., PTR floodlight [6e:a3:42:bd:4b:61]._workstation._tcp.local. (117)
22:40:55.896440 IP6 fe80::6ca3:42ff:febd:4b61.5353 > ff02::fb.5353: 0 [3q] [5n] ANY (QM)? floodlight [6e:a3:42:bd:4b:61]._workstation._tcp.local. ANY (QM)? floodlight.local. ANY (QM)? 1.6.b.4.d.b.e.f.f.f.2.4.3.a.c.6.0.0.0.0.0.0.0.0.0.0.0.0.0.8.e.f.ip6.arpa. (267)
22:40:55.896475 IP6 fe80::6ca3:42ff:febd:4b61.5353 > ff02::fb.5353: 0 [2q] PTR (QM)? _ipps._tcp.local. PTR (QM)? _ipp._tcp.local. (45)
22:40:55.896510 IP6 fe80::d01a:a8ff:feb4:a0aa > ff02::16: HBH ICMP6, multicast listener report v2, 1 group record(s), length 28
22:40:55.896545 IP6 fe80::d01a:a8ff:feb4:a0aa > ff02::2: ICMP6, router solicitation, length 16
22:40:55.896975 IP6 fe80::d01a:a8ff:feb4:a0aa > ff02::16: HBH ICMP6, multicast listener report v2, 1 group record(s), length 28
22:40:55.897010 IP6 fe80::d01a:a8ff:feb4:a0aa.5353 > ff02::fb.5353: 0*- [0q] 2/0/0 PTR _workstation._tcp.local., PTR floodlight [d2:1a:a8:b4:a0:aa]._workstation._tcp.local. (117)
22:40:55.897045 IP6 fe80::d01a:a8ff:feb4:a0aa.5353 > ff02::fb.5353: 0 [3q] [5n] ANY (QM)? floodlight [d2:1a:a8:b4:a0:aa]._workstation._tcp.local. ANY (QM)? floodlight.local. ANY (QM)? a.a.0.a.4.b.e.f.f.f.8.a.a.1.0.d.0.0.0.0.0.0.0.0.0.0.0.0.0.8.e.f.ip6.arpa. (267)
22:40:56.214912 IP6 fe80::4ca6:54ff:fed1:d4f0 > ff02::16: HBH ICMP6, multicast listener report v2, 1 group record(s), length 28
22:40:56.214948 IP6 fe80::4ca6:54ff:fed1:d4f0 > ff02::2: ICMP6, router solicitation, length 16
22:40:56.221235 IP6 fe80::4ca6:54ff:fed1:d4f0 > ff02::16: HBH ICMP6, multicast listener report v2, 1 group record(s), length 28
22:40:56.221293 IP6 fe80::4ca6:54ff:fed1:d4f0.5353 > ff02::fb.5353: 0*- [0q] 2/0/0 PTR _workstation._tcp.local., PTR floodlight [4e:a6:54:d1:d4:f0]._workstation._tcp.local. (117)
22:40:56.221488 IP6 fe80::4ca6:54ff:fed1:d4f0.5353 > ff02::fb.5353: 0 [3q] [5n] ANY (QM)? floodlight [4e:a6:54:d1:d4:f0]._workstation._tcp.local. ANY (QM)? floodlight.local. ANY (QM)? 0.f.4.d.1.d.e.f.f.f.4.5.6.a.c.4.0.0.0.0.0.0.0.0.0.0.0.0.0.8.e.f.ip6.arpa. (267)
22:40:56.221523 IP6 fe80::4ca6:54ff:fed1:d4f0.5353 > ff02::fb.5353: 0 [2q] PTR (QM)? _ipps._tcp.local. PTR (QM)? _ipp._tcp.local. (45)
22:40:56.221558 IP6 fe80::4ca6:54ff:fed1:d4f0 > ff02::16: HBH ICMP6, multicast listener report v2, 2 group record(s), length 48
22:40:56.221592 IP6 fe80::4ca6:54ff:fed1:d4f0.5353 > ff02::fb.5353: 0 [3q] [5n] ANY (QM)? floodlight [4e:a6:54:d1:d4:f0]._workstation._tcp.local. ANY (QM)? floodlight.local. ANY (QM)? 0.f.4.d.1.d.e.f.f.f.4.5.6.a.c.4.0.0.0.0.0.0.0.0.0.0.0.0.0.8.e.f.ip6.arpa. (267)
22:40:56.225912 IP6 fe80::589d:7bff:fe83:4eef.5353 > ff02::fb.5353: 0*- [0q] 4/0/0 (Cache flush) TXT "", (Cache flush) HINFO, (Cache flush) SRV floodlight.local.:9 0 0, (Cache flush) AAAA fe80::589d:7bff:fe83:4eef (163)
22:40:56.231988 IP6 fe80::589d:7bff:fe83:4eef.5353 > ff02::fb.5353: 0*- [0q] 1/0/0 (Cache flush) PTR floodlight.local. (114)
22:40:56.252834 IP6 fe80::9423:61ff:fed6:2eac.5353 > ff02::fb.5353: 0 [3q] [5n] ANY (QM)? floodlight [96:23:61:d6:2e:ac]._workstation._tcp.local. ANY (QM)? floodlight.local. ANY (QM)? c.a.e.2.6.d.e.f.f.f.1.6.3.2.4.9.0.0.0.0.0.0.0.0.0.0.0.0.0.8.e.f.ip6.arpa. (267)
22:40:56.252998 IP6 fe80::9423:61ff:fed6:2eac.5353 > ff02::fb.5353: 0*- [0q] 5/0/0 (Cache flush) TXT "", (Cache flush) AAAA fe80::9423:61ff:fed6:2eac, (Cache flush) PTR floodlight.local., (Cache flush) HINFO, (Cache flush) SRV floodlight.local.:9 0 0 (249)
22:40:56.276446 IP6 fe80::4ca6:54ff:fed1:d4f0.5353 > ff02::fb.5353: 0 [3q] [5n] ANY (QM)? floodlight [4e:a6:54:d1:d4:f0]._workstation._tcp.local. ANY (QM)? floodlight.local. ANY (QM)? 0.f.4.d.1.d.e.f.f.f.4.5.6.a.c.4.0.0.0.0.0.0.0.0.0.0.0.0.0.8.e.f.ip6.arpa. (267)
22:40:56.280865 IP6 fe80::6ca3:42ff:febd:4b61.5353 > ff02::fb.5353: 0 [3q] [5n] ANY (QM)? floodlight [6e:a3:42:bd:4b:61]._workstation._tcp.local. ANY (QM)? floodlight.local. ANY (QM)? 1.6.b.4.d.b.e.f.f.f.2.4.3.a.c.6.0.0.0.0.0.0.0.0.0.0.0.0.0.8.e.f.ip6.arpa. (267)
22:40:56.282474 IP6 fe80::6ca3:42ff:febd:4b61 > ff02::16: HBH ICMP6, multicast listener report v2, 2 group record(s), length 48
22:40:56.284814 IP6 fe80::d01a:a8ff:feb4:a0aa.5353 > ff02::fb.5353: 0 [2q] PTR (QM)? _ipps._tcp.local. PTR (QM)? _ipp._tcp.local. (45)
22:40:56.286800 ARP, Request who-has 10.0.0.6 tell 10.0.0.4, length 28
22:40:56.296552 IP6 fe80::d01a:a8ff:feb4:a0aa.5353 > ff02::fb.5353: 0 [3q] [5n] ANY (QM)? floodlight [d2:1a:a8:b4:a0:aa]._workstation._tcp.local. ANY (QM)? floodlight.local. ANY (QM)? a.a.0.a.4.b.e.f.f.f.8.a.a.1.0.d.0.0.0.0.0.0.0.0.0.0.0.0.0.8.e.f.ip6.arpa. (267)
22:40:56.296588 IP6 fe80::d01a:a8ff:feb4:a0aa > ff02::16: HBH ICMP6, multicast listener report v2, 2 group record(s), length 48
22:40:56.296623 IP6 fe80::d01a:a8ff:feb4:a0aa.5353 > ff02::fb.5353: 0 [3q] [5n] ANY (QM)? floodlight [d2:1a:a8:b4:a0:aa]._workstation._tcp.local. ANY (QM)? floodlight.local. ANY (QM)? a.a.0.a.4.b.e.f.f.f.8.a.a.1.0.d.0.0.0.0.0.0.0.0.0.0.0.0.0.8.e.f.ip6.arpa. (267)
22:40:56.296658 IP6 fe80::6ca3:42ff:febd:4b61 > ff02::16: HBH ICMP6, multicast listener report v2, 1 group record(s), length 28
22:40:56.296693 IP6 fe80::9423:61ff:fed6:2eac.5353 > ff02::fb.5353: 0*- [0q] 2/0/0 PTR _workstation._tcp.local., PTR floodlight [96:23:61:d6:2e:ac]._workstation._tcp.local. (117)
22:40:56.308735 IP6 fe80::9423:61ff:fed6:2eac.5353 > ff02::fb.5353: 0 [2q] PTR (QM)? _ipps._tcp.local. PTR (QM)? _ipp._tcp.local. (45)
22:40:56.308770 IP6 fe80::4ca6:54ff:fed1:d4f0.5353 > ff02::fb.5353: 0*- [0q] 5/0/0 (Cache flush) TXT "", (Cache flush) AAAA fe80::4ca6:54ff:fed1:d4f0, (Cache flush) PTR floodlight.local., (Cache flush) HINFO, (Cache flush) SRV floodlight.local.:9 0 0 (249)
22:40:56.308805 IP6 fe80::4ca6:54ff:fed1:d4f0 > ff02::16: HBH ICMP6, multicast listener report v2, 1 group record(s), length 28
22:40:56.308840 IP6 fe80::4ca6:54ff:fed1:d4f0.5353 > ff02::fb.5353: 0*- [0q] 2/0/0 PTR _workstation._tcp.local., PTR floodlight [4e:a6:54:d1:d4:f0]._workstation._tcp.local. (117)
22:40:56.309268 IP6 fe80::4ca6:54ff:fed1:d4f0.5353 > ff02::fb.5353: 0 [2q] PTR (QM)? _ipps._tcp.local. PTR (QM)? _ipp._tcp.local. (45)
22:40:56.309310 IP6 fe80::6ca3:42ff:febd:4b61.5353 > ff02::fb.5353: 0*- [0q] 2/0/0 PTR _workstation._tcp.local., PTR floodlight [6e:a3:42:bd:4b:61]._workstation._tcp.local. (117)
22:40:56.515655 IP 0.0.0.0.68 > 255.255.255.255.67: BOOTP/DHCP, Request from 5a:9d:7b:83:4e:ef, length 300
22:40:56.533358 IP 0.0.0.0.68 > 255.255.255.255.67: BOOTP/DHCP, Request from 4e:a6:54:d1:d4:f0, length 300
22:40:56.557177 IP6 fe80::6ca3:42ff:febd:4b61.5353 > ff02::fb.5353: 0 [2q] PTR (QM)? _ipps._tcp.local. PTR (QM)? _ipp._tcp.local. (45)
22:40:56.564378 IP6 fe80::9423:61ff:fed6:2eac.5353 > ff02::fb.5353: 0*- [0q] 5/0/0 (Cache flush) TXT "", (Cache flush) AAAA fe80::9423:61ff:fed6:2eac, (Cache flush) PTR floodlight.local., (Cache flush) HINFO, (Cache flush) SRV floodlight.local.:9 0 0 (249)
22:40:56.564414 IP6 fe80::d01a:a8ff:feb4:a0aa.5353 > ff02::fb.5353: 0*- [0q] 3/0/0 (Cache flush) TXT "", (Cache flush) HINFO, (Cache flush) SRV floodlight.local.:9 0 0 (135)
22:40:56.564448 IP6 fe80::d01a:a8ff:feb4:a0aa.5353 > ff02::fb.5353: 0*- [0q] 2/0/0 (Cache flush) PTR floodlight.local., (Cache flush) AAAA fe80::d01a:a8ff:feb4:a0aa (142)
22:40:56.564613 IP6 fe80::d01a:a8ff:feb4:a0aa > ff02::16: HBH ICMP6, multicast listener report v2, 1 group record(s), length 28
22:40:56.564648 IP6 fe80::d01a:a8ff:feb4:a0aa.5353 > ff02::fb.5353: 0*- [0q] 2/0/0 PTR _workstation._tcp.local., PTR floodlight [d2:1a:a8:b4:a0:aa]._workstation._tcp.local. (117)
22:40:56.564683 IP6 fe80::d01a:a8ff:feb4:a0aa.5353 > ff02::fb.5353: 0 [2q] PTR (QM)? _ipps._tcp.local. PTR (QM)? _ipp._tcp.local. (45)
22:40:56.565097 IP 0.0.0.0.68 > 255.255.255.255.67: BOOTP/DHCP, Request from 96:23:61:d6:2e:ac, length 300
22:40:56.565132 IP6 fe80::4ca6:54ff:fed1:d4f0.5353 > ff02::fb.5353: 0*- [0q] 5/0/0 (Cache flush) TXT "", (Cache flush) AAAA fe80::4ca6:54ff:fed1:d4f0, (Cache flush) PTR floodlight.local., (Cache flush) HINFO, (Cache flush) SRV floodlight.local.:9 0 0 (249)
22:40:56.657014 IP 0.0.0.0.68 > 255.255.255.255.67: BOOTP/DHCP, Request from d2:1a:a8:b4:a0:aa, length 300
22:40:56.657581 IP6 fe80::6ca3:42ff:febd:4b61.5353 > ff02::fb.5353: 0*- [0q] 5/0/0 (Cache flush) TXT "", (Cache flush) AAAA fe80::6ca3:42ff:febd:4b61, (Cache flush) PTR floodlight.local., (Cache flush) HINFO, (Cache flush) SRV floodlight.local.:9 0 0 (249)
22:40:56.693123 ARP, Request who-has 10.0.0.7 tell 10.0.0.4, length 28
22:40:56.693698 IP6 fe80::d01a:a8ff:feb4:a0aa.5353 > ff02::fb.5353: 0*- [0q] 5/0/0 (Cache flush) TXT "", (Cache flush) AAAA fe80::d01a:a8ff:feb4:a0aa, (Cache flush) PTR floodlight.local., (Cache flush) HINFO, (Cache flush) SRV floodlight.local.:9 0 0 (249)
22:40:56.888435 IP6 fe80::9423:61ff:fed6:2eac.5353 > ff02::fb.5353: 0 [2q] PTR (QM)? _ipps._tcp.local. PTR (QM)? _ipp._tcp.local. (45)
22:40:56.913117 IP6 fe80::9423:61ff:fed6:2eac.5353 > ff02::fb.5353: 0*- [0q] 5/0/0 PTR _workstation._tcp.local., PTR floodlight [96:23:61:d6:2e:ac]._workstation._tcp.local., (Cache flush) TXT "", (Cache flush) SRV floodlight.local.:9 0 0, (Cache flush) AAAA fe80::9423:61ff:fed6:2eac (189)
22:40:56.946415 IP 0.0.0.0.68 > 255.255.255.255.67: BOOTP/DHCP, Request from 6e:a3:42:bd:4b:61, length 300
22:40:57.214063 ARP, Request who-has 10.0.0.8 tell 10.0.0.4, length 28
22:40:57.215503 ARP, Reply 10.0.0.8 is-at 3a:f0:57:3e:0e:67, length 28
22:40:57.292845 IP 10.0.0.4 > 10.0.0.8: ICMP echo request, id 4118, seq 1, length 64
22:40:57.294075 IP 10.0.0.8 > 10.0.0.4: ICMP echo reply, id 4118, seq 1, length 64
22:40:57.347317 IP6 fe80::4ca6:54ff:fed1:d4f0.5353 > ff02::fb.5353: 0 [2q] PTR (QM)? _ipps._tcp.local. PTR (QM)? _ipp._tcp.local. (45)
22:40:57.367140 IP6 fe80::4ca6:54ff:fed1:d4f0.5353 > ff02::fb.5353: 0*- [0q] 5/0/0 PTR _workstation._tcp.local., PTR floodlight [4e:a6:54:d1:d4:f0]._workstation._tcp.local., (Cache flush) TXT "", (Cache flush) SRV floodlight.local.:9 0 0, (Cache flush) AAAA fe80::4ca6:54ff:fed1:d4f0 (189)
22:40:57.506275 IP6 fe80::589d:7bff:fe83:4eef.5353 > ff02::fb.5353: 0 [2q] PTR (QM)? _ipps._tcp.local. PTR (QM)? _ipp._tcp.local. (45)
22:40:57.537358 IP6 fe80::589d:7bff:fe83:4eef.5353 > ff02::fb.5353: 0*- [0q] 5/0/0 PTR _workstation._tcp.local., PTR floodlight [5a:9d:7b:83:4e:ef]._workstation._tcp.local., (Cache flush) TXT "", (Cache flush) SRV floodlight.local.:9 0 0, (Cache flush) AAAA fe80::589d:7bff:fe83:4eef (189)
22:40:57.565802 IP6 fe80::9423:61ff:fed6:2eac.5353 > ff02::fb.5353: 0*- [0q] 5/0/0 (Cache flush) TXT "", (Cache flush) AAAA fe80::9423:61ff:fed6:2eac, (Cache flush) PTR floodlight.local., (Cache flush) HINFO, (Cache flush) SRV floodlight.local.:9 0 0 (249)
22:40:57.642997 ARP, Request who-has 10.0.0.1 tell 10.0.0.5, length 28
22:40:57.779506 IP6 fe80::6ca3:42ff:febd:4b61.5353 > ff02::fb.5353: 0 [2q] PTR (QM)? _ipps._tcp.local. PTR (QM)? _ipp._tcp.local. (45)
22:40:57.817243 IP6 fe80::6ca3:42ff:febd:4b61.5353 > ff02::fb.5353: 0*- [0q] 5/0/0 PTR _workstation._tcp.local., PTR floodlight [6e:a3:42:bd:4b:61]._workstation._tcp.local., (Cache flush) TXT "", (Cache flush) SRV floodlight.local.:9 0 0, (Cache flush) AAAA fe80::6ca3:42ff:febd:4b61 (189)
22:40:57.905581 IP6 fe80::d01a:a8ff:feb4:a0aa.5353 > ff02::fb.5353: 0 [2q] PTR (QM)? _ipps._tcp.local. PTR (QM)? _ipp._tcp.local. (45)
22:40:57.929662 IP6 fe80::d01a:a8ff:feb4:a0aa.5353 > ff02::fb.5353: 0*- [0q] 5/0/0 PTR _workstation._tcp.local., PTR floodlight [d2:1a:a8:b4:a0:aa]._workstation._tcp.local., (Cache flush) TXT "", (Cache flush) SRV floodlight.local.:9 0 0, (Cache flush) AAAA fe80::d01a:a8ff:feb4:a0aa (189)
22:40:58.027012 IP6 fe80::4ca6:54ff:fed1:d4f0.5353 > ff02::fb.5353: 0*- [0q] 5/0/0 (Cache flush) TXT "", (Cache flush) AAAA fe80::4ca6:54ff:fed1:d4f0, (Cache flush) PTR floodlight.local., (Cache flush) HINFO, (Cache flush) SRV floodlight.local.:9 0 0 (249)
22:40:58.182490 IP6 fe80::4ca6:54ff:fed1:d4f0 > ff02::2: ICMP6, router solicitation, length 16
22:40:58.255779 IP6 fe80::589d:7bff:fe83:4eef.5353 > ff02::fb.5353: 0*- [0q] 4/0/0 (Cache flush) TXT "", (Cache flush) HINFO, (Cache flush) SRV floodlight.local.:9 0 0, (Cache flush) AAAA fe80::589d:7bff:fe83:4eef (163)
22:40:58.261943 IP6 fe80::589d:7bff:fe83:4eef.5353 > ff02::fb.5353: 0*- [0q] 1/0/0 (Cache flush) PTR floodlight.local. (114)
22:40:58.411578 IP6 fe80::589d:7bff:fe83:4eef > ff02::2: ICMP6, router solicitation, length 16
22:40:58.539119 IP6 fe80::6ca3:42ff:febd:4b61.5353 > ff02::fb.5353: 0*- [0q] 5/0/0 (Cache flush) TXT "", (Cache flush) AAAA fe80::6ca3:42ff:febd:4b61, (Cache flush) PTR floodlight.local., (Cache flush) HINFO, (Cache flush) SRV floodlight.local.:9 0 0 (249)
22:40:58.648799 ARP, Request who-has 10.0.0.1 tell 10.0.0.5, length 28
22:40:58.660418 IP6 fe80::d01a:a8ff:feb4:a0aa.5353 > ff02::fb.5353: 0*- [0q] 5/0/0 (Cache flush) TXT "", (Cache flush) AAAA fe80::d01a:a8ff:feb4:a0aa, (Cache flush) PTR floodlight.local., (Cache flush) HINFO, (Cache flush) SRV floodlight.local.:9 0 0 (249)
22:40:58.732317 IP6 fe80::6ca3:42ff:febd:4b61 > ff02::2: ICMP6, router solicitation, length 16
22:40:58.806293 IP6 fe80::d01a:a8ff:feb4:a0aa > ff02::2: ICMP6, router solicitation, length 16
22:40:59.486278 IP 0.0.0.0.68 > 255.255.255.255.67: BOOTP/DHCP, Request from 4e:a6:54:d1:d4:f0, length 300
22:41:00.141634 ARP, Request who-has 10.0.0.6 tell 10.0.0.5, length 28
22:41:00.175590 IP 0.0.0.0.68 > 255.255.255.255.67: BOOTP/DHCP, Request from 5a:9d:7b:83:4e:ef, length 300
22:41:00.413694 IP 0.0.0.0.68 > 255.255.255.255.67: BOOTP/DHCP, Request from d2:1a:a8:b4:a0:aa, length 300
22:41:00.532613 ARP, Request who-has 10.0.0.7 tell 10.0.0.5, length 28
22:41:00.814278 IP6 fe80::9423:61ff:fed6:2eac.5353 > ff02::fb.5353: 0 [2q] PTR (QM)? _ipps._tcp.local. PTR (QM)? _ipp._tcp.local. (45)
22:41:01.276253 IP6 fe80::4ca6:54ff:fed1:d4f0.5353 > ff02::fb.5353: 0 [2q] PTR (QM)? _ipps._tcp.local. PTR (QM)? _ipp._tcp.local. (45)
22:41:01.506791 IP6 fe80::589d:7bff:fe83:4eef.5353 > ff02::fb.5353: 0 [2q] PTR (QM)? _ipps._tcp.local. PTR (QM)? _ipp._tcp.local. (45)
22:41:01.745644 IP6 fe80::9423:61ff:fed6:2eac > ff02::2: ICMP6, router solicitation, length 16
22:41:01.781753 IP6 fe80::6ca3:42ff:febd:4b61.5353 > ff02::fb.5353: 0 [2q] PTR (QM)? _ipps._tcp.local. PTR (QM)? _ipp._tcp.local. (45)
