Hosth1
#######################

22:40:09.604363 IP 0.0.0.0.68 > 255.255.255.255.67: BOOTP/DHCP, Request from 4e:a6:54:d1:d4:f0, length 300
22:40:09.606602 ARP, Reply 10.0.0.2 is-at 22:ae:0f:90:01:17, length 28
22:40:09.607826 IP 10.0.0.1 > 10.0.0.2: ICMP echo request, id 4007, seq 1, length 64
22:40:09.706204 IP 10.0.0.2 > 10.0.0.1: ICMP echo reply, id 4007, seq 1, length 64
22:40:10.010297 ARP, Request who-has 10.0.0.3 tell 10.0.0.1, length 28
22:40:10.053200 ARP, Reply 10.0.0.3 is-at 62:52:cd:31:e2:b5, length 28
22:40:10.054360 IP 10.0.0.1 > 10.0.0.3: ICMP echo request, id 4008, seq 1, length 64
22:40:10.079991 IP 10.0.0.3 > 10.0.0.1: ICMP echo reply, id 4008, seq 1, length 64
22:40:10.385743 ARP, Request who-has 10.0.0.4 tell 10.0.0.1, length 28
22:40:11.105635 IP 0.0.0.0.68 > 255.255.255.255.67: BOOTP/DHCP, Request from ce:ca:df:d7:9c:7c, length 300
22:40:11.383919 ARP, Request who-has 10.0.0.4 tell 10.0.0.1, length 28
22:40:12.385248 ARP, Request who-has 10.0.0.4 tell 10.0.0.1, length 28
22:40:12.855982 IP6 fe80::ccca:dfff:fed7:9c7c.5353 > ff02::fb.5353: 0 [2q] PTR (QM)? _ipps._tcp.local. PTR (QM)? _ipp._tcp.local. (45)
22:40:13.159027 IP6 fe80::e41f:e0ff:fe87:3e.5353 > ff02::fb.5353: 0 [2q] PTR (QM)? _ipps._tcp.local. PTR (QM)? _ipp._tcp.local. (45)
22:40:13.690048 IP 0.0.0.0.68 > 255.255.255.255.67: BOOTP/DHCP, Request from 96:23:61:d6:2e:ac, length 300
22:40:13.704667 ARP, Request who-has 10.0.0.5 tell 10.0.0.1, length 28
22:40:13.750048 IP6 fe80::9423:61ff:fed6:2eac.5353 > ff02::fb.5353: 0 [2q] PTR (QM)? _ipps._tcp.local. PTR (QM)? _ipp._tcp.local. (45)
22:40:13.953721 IP6 fe80::4ca6:54ff:fed1:d4f0.5353 > ff02::fb.5353: 0 [2q] PTR (QM)? _ipps._tcp.local. PTR (QM)? _ipp._tcp.local. (45)
22:40:14.246550 IP 0.0.0.0.68 > 255.255.255.255.67: BOOTP/DHCP, Request from e6:1f:e0:87:00:3e, length 300
22:40:14.370045 IP6 fe80::6ca3:42ff:febd:4b61.5353 > ff02::fb.5353: 0 [2q] PTR (QM)? _ipps._tcp.local. PTR (QM)? _ipp._tcp.local. (45)
22:40:14.703469 ARP, Request who-has 10.0.0.5 tell 10.0.0.1, length 28
22:40:14.853045 IP 0.0.0.0.68 > 255.255.255.255.67: BOOTP/DHCP, Request from 4e:a6:54:d1:d4:f0, length 300
22:40:15.703433 ARP, Request who-has 10.0.0.5 tell 10.0.0.1, length 28
22:40:17.009133 ARP, Request who-has 10.0.0.6 tell 10.0.0.1, length 28
22:40:17.418652 IP 0.0.0.0.68 > 255.255.255.255.67: BOOTP/DHCP, Request from 6e:a3:42:bd:4b:61, length 300
22:40:18.007524 ARP, Request who-has 10.0.0.6 tell 10.0.0.1, length 28
22:40:19.007611 ARP, Request who-has 10.0.0.6 tell 10.0.0.1, length 28
22:40:19.402345 IP 0.0.0.0.68 > 255.255.255.255.67: BOOTP/DHCP, Request from ce:ca:df:d7:9c:7c, length 300
22:40:19.721571 IP 0.0.0.0.68 > 255.255.255.255.67: BOOTP/DHCP, Request from 06:cf:0a:e5:cf:9d, length 300
22:40:20.283910 IP 0.0.0.0.68 > 255.255.255.255.67: BOOTP/DHCP, Request from 4e:a6:54:d1:d4:f0, length 300
22:40:20.311286 ARP, Request who-has 10.0.0.7 tell 10.0.0.1, length 28
22:40:21.307656 ARP, Request who-has 10.0.0.7 tell 10.0.0.1, length 28
22:40:21.471938 LLDP, length 47
22:40:21.841695 ce:ca:df:d7:9c:7c > ff:ff:ff:ff:ff:ff, ethertype Unknown (0x8942), length 69: 
	0x0000:  2000 0604 0002 0000 0207 0400 0000 0000  ................
	0x0010:  0104 0302 0001 0602 0078 fe0c 0026 e100  .........x...&..
	0x0020:  0000 0000 0000 0001 1808 0031 3791 7786  ...........17.w.
	0x0030:  1ff2 e601 0100 00                        .......
22:40:22.308402 ARP, Request who-has 10.0.0.7 tell 10.0.0.1, length 28
22:40:22.363749 ARP, Reply 10.0.0.7 is-at 2a:23:2b:66:dd:b8, length 28
22:40:22.364972 IP 10.0.0.1 > 10.0.0.7: ICMP echo request, id 4022, seq 1, length 64
22:40:22.401702 IP 10.0.0.7 > 10.0.0.1: ICMP echo reply, id 4022, seq 1, length 64
22:40:22.709847 ARP, Request who-has 10.0.0.8 tell 10.0.0.1, length 28
22:40:22.782650 ARP, Reply 10.0.0.8 is-at 3a:f0:57:3e:0e:67, length 28
22:40:22.783908 IP 10.0.0.1 > 10.0.0.8: ICMP echo request, id 4023, seq 1, length 64
22:40:25.789478 IP 0.0.0.0.68 > 255.255.255.255.67: BOOTP/DHCP, Request from a6:0a:e8:c2:51:4f, length 300
22:40:27.061069 IP 0.0.0.0.68 > 255.255.255.255.67: BOOTP/DHCP, Request from 06:cf:0a:e5:cf:9d, length 300
22:40:28.405996 IP 0.0.0.0.68 > 255.255.255.255.67: BOOTP/DHCP, Request from ce:ca:df:d7:9c:7c, length 300
22:40:28.509722 IP 0.0.0.0.68 > 255.255.255.255.67: BOOTP/DHCP, Request from 96:23:61:d6:2e:ac, length 300
22:40:28.803279 IP 0.0.0.0.68 > 255.255.255.255.67: BOOTP/DHCP, Request from 6e:a3:42:bd:4b:61, length 300
22:40:28.867950 IP6 fe80::ccca:dfff:fed7:9c7c.5353 > ff02::fb.5353: 0 [2q] PTR (QM)? _ipps._tcp.local. PTR (QM)? _ipp._tcp.local. (45)
22:40:29.160636 IP6 fe80::e41f:e0ff:fe87:3e.5353 > ff02::fb.5353: 0 [2q] PTR (QM)? _ipps._tcp.local. PTR (QM)? _ipp._tcp.local. (45)
22:40:29.286986 IP 0.0.0.0.68 > 255.255.255.255.67: BOOTP/DHCP, Request from e6:1f:e0:87:00:3e, length 300
22:40:29.752858 IP6 fe80::9423:61ff:fed6:2eac.5353 > ff02::fb.5353: 0 [2q] PTR (QM)? _ipps._tcp.local. PTR (QM)? _ipp._tcp.local. (45)
22:40:29.952740 IP6 fe80::4ca6:54ff:fed1:d4f0.5353 > ff02::fb.5353: 0 [2q] PTR (QM)? _ipps._tcp.local. PTR (QM)? _ipp._tcp.local. (45)
22:40:30.028250 IP6 fe80::4cf:aff:fee5:cf9d.5353 > ff02::fb.5353: 0 [2q] PTR (QM)? _ipps._tcp.local. PTR (QM)? _ipp._tcp.local. (45)
22:40:30.370510 IP6 fe80::6ca3:42ff:febd:4b61.5353 > ff02::fb.5353: 0 [2q] PTR (QM)? _ipps._tcp.local. PTR (QM)? _ipp._tcp.local. (45)
22:40:31.677998 IP6 fe80::a40a:e8ff:fec2:514f.5353 > ff02::fb.5353: 0 [2q] PTR (QM)? _ipps._tcp.local. PTR (QM)? _ipp._tcp.local. (45)
22:40:31.748760 IP 0.0.0.0.68 > 255.255.255.255.67: BOOTP/DHCP, Request from d2:1a:a8:b4:a0:aa, length 300
22:40:32.124924 IP6 fe80::d01a:a8ff:feb4:a0aa.5353 > ff02::fb.5353: 0 [2q] PTR (QM)? _ipps._tcp.local. PTR (QM)? _ipp._tcp.local. (45)
22:40:33.026591 IP 10.0.0.2 > 10.0.0.1: ICMP echo request, id 4024, seq 1, length 64
22:40:33.027890 IP 10.0.0.1 > 10.0.0.2: ICMP echo reply, id 4024, seq 1, length 64
22:40:33.381707 ARP, Request who-has 10.0.0.3 tell 10.0.0.2, length 28
22:40:33.801192 ARP, Request who-has 10.0.0.4 tell 10.0.0.2, length 28
22:40:34.269600 ARP, Request who-has 10.0.0.5 tell 10.0.0.2, length 28
22:40:34.703003 ARP, Request who-has 10.0.0.6 tell 10.0.0.2, length 28
22:40:35.135262 ARP, Request who-has 10.0.0.7 tell 10.0.0.2, length 28
22:40:35.347893 IP 0.0.0.0.68 > 255.255.255.255.67: BOOTP/DHCP, Request from 4e:a6:54:d1:d4:f0, length 300
22:40:35.576233 ARP, Request who-has 10.0.0.8 tell 10.0.0.2, length 28
22:40:35.740162 IP 0.0.0.0.68 > 255.255.255.255.67: BOOTP/DHCP, Request from 96:23:61:d6:2e:ac, length 300
22:40:35.803000 IP 0.0.0.0.68 > 255.255.255.255.67: BOOTP/DHCP, Request from 6e:a3:42:bd:4b:61, length 300
22:40:36.527348 LLDP, length 47
22:40:36.566449 ARP, Request who-has 10.0.0.8 tell 10.0.0.2, length 28
22:40:36.896341 ce:ca:df:d7:9c:7c > ff:ff:ff:ff:ff:ff, ethertype Unknown (0x8942), length 69: 
	0x0000:  2000 0604 0002 0000 0207 0400 0000 0000  ................
	0x0010:  0104 0302 0001 0602 0078 fe0c 0026 e100  .........x...&..
	0x0020:  0000 0000 0000 0001 1808 0031 3791 7786  ...........17.w.
	0x0030:  1ff2 e601 0100 00                        .......
22:40:37.002956 IP 0.0.0.0.68 > 255.255.255.255.67: BOOTP/DHCP, Request from e6:1f:e0:87:00:3e, length 300
22:40:37.038970 IP 10.0.0.3 > 10.0.0.1: ICMP echo request, id 4031, seq 1, length 64
22:40:37.040478 IP 10.0.0.1 > 10.0.0.3: ICMP echo reply, id 4031, seq 1, length 64
22:40:37.698459 ARP, Request who-has 10.0.0.4 tell 10.0.0.3, length 28
22:40:38.037505 ARP, Request who-has 10.0.0.1 tell 10.0.0.2, length 28
22:40:38.038706 ARP, Reply 10.0.0.1 is-at c2:72:34:72:f2:5b, length 28
22:40:38.166938 ARP, Request who-has 10.0.0.5 tell 10.0.0.3, length 28
22:40:38.397747 IP 0.0.0.0.68 > 255.255.255.255.67: BOOTP/DHCP, Request from a6:0a:e8:c2:51:4f, length 300
22:40:38.562070 ARP, Request who-has 10.0.0.6 tell 10.0.0.3, length 28
22:40:38.981020 ARP, Request who-has 10.0.0.7 tell 10.0.0.3, length 28
22:40:39.260784 IP 0.0.0.0.68 > 255.255.255.255.67: BOOTP/DHCP, Request from d2:1a:a8:b4:a0:aa, length 300
22:40:39.803767 ARP, Request who-has 10.0.0.1 tell 10.0.0.4, length 28
22:40:39.805034 ARP, Reply 10.0.0.1 is-at c2:72:34:72:f2:5b, length 28
22:40:41.976022 IP 0.0.0.0.68 > 255.255.255.255.67: BOOTP/DHCP, Request from ce:ca:df:d7:9c:7c, length 300
22:40:42.013156 ARP, Request who-has 10.0.0.1 tell 10.0.0.3, length 28
22:40:42.014292 ARP, Reply 10.0.0.1 is-at c2:72:34:72:f2:5b, length 28
22:40:49.203593 IP6 :: > ff02::16: HBH ICMP6, multicast listener report v2, 2 group record(s), length 48
22:40:49.225342 IP6 :: > ff02::1:ff87:3e: ICMP6, neighbor solicitation, who has fe80::e41f:e0ff:fe87:3e, length 24
22:40:49.245888 IP6 :: > ff02::16: HBH ICMP6, multicast listener report v2, 2 group record(s), length 48
22:40:49.245914 IP6 :: > ff02::16: HBH ICMP6, multicast listener report v2, 2 group record(s), length 48
22:40:49.262784 IP6 :: > ff02::16: HBH ICMP6, multicast listener report v2, 2 group record(s), length 48
22:40:49.269397 IP6 :: > ff02::16: HBH ICMP6, multicast listener report v2, 2 group record(s), length 48
22:40:49.395329 IP6 :: > ff02::16: HBH ICMP6, multicast listener report v2, 2 group record(s), length 48
22:40:49.399993 IP6 :: > ff02::16: HBH ICMP6, multicast listener report v2, 2 group record(s), length 48
22:40:49.400019 IP6 :: > ff02::16: HBH ICMP6, multicast listener report v2, 2 group record(s), length 48
22:40:49.400045 IP6 :: > ff02::1:ffd6:2eac: ICMP6, neighbor solicitation, who has fe80::9423:61ff:fed6:2eac, length 24
22:40:49.431625 IP6 :: > ff02::16: HBH ICMP6, multicast listener report v2, 2 group record(s), length 48
22:40:49.483542 IP6 :: > ff02::1:ffd7:9c7c: ICMP6, neighbor solicitation, who has fe80::ccca:dfff:fed7:9c7c, length 24
22:40:49.584132 IP6 :: > ff02::16: HBH ICMP6, multicast listener report v2, 2 group record(s), length 48
22:40:49.660091 IP6 :: > ff02::16: HBH ICMP6, multicast listener report v2, 2 group record(s), length 48
22:40:49.660120 IP6 :: > ff02::1:ffbd:4b61: ICMP6, neighbor solicitation, who has fe80::6ca3:42ff:febd:4b61, length 24
22:40:49.724034 IP6 :: > ff02::16: HBH ICMP6, multicast listener report v2, 2 group record(s), length 48
22:40:49.833519 IP6 :: > ff02::1:ffe5:cf9d: ICMP6, neighbor solicitation, who has fe80::4cf:aff:fee5:cf9d, length 24
22:40:49.931879 IP6 :: > ff02::16: HBH ICMP6, multicast listener report v2, 2 group record(s), length 48
22:40:49.951890 IP6 :: > ff02::1:ffd1:d4f0: ICMP6, neighbor solicitation, who has fe80::4ca6:54ff:fed1:d4f0, length 24
22:40:50.038347 IP6 :: > ff02::16: HBH ICMP6, multicast listener report v2, 1 group record(s), length 28
22:40:50.196691 IP6 :: > ff02::1:ffc2:514f: ICMP6, neighbor solicitation, who has fe80::a40a:e8ff:fec2:514f, length 24
22:40:50.211781 IP6 fe80::e41f:e0ff:fe87:3e > ff02::16: HBH ICMP6, multicast listener report v2, 1 group record(s), length 28
22:40:50.222914 IP6 fe80::e41f:e0ff:fe87:3e > ff02::16: HBH ICMP6, multicast listener report v2, 1 group record(s), length 28
22:40:50.230374 IP6 :: > ff02::1:ffb4:a0aa: ICMP6, neighbor solicitation, who has fe80::d01a:a8ff:feb4:a0aa, length 24
22:40:50.272998 IP6 fe80::e41f:e0ff:fe87:3e.5353 > ff02::fb.5353: 0*- [0q] 2/0/0 PTR _workstation._tcp.local., PTR floodlight [e6:1f:e0:87:00:3e]._workstation._tcp.local. (117)
22:40:50.292369 IP6 fe80::e41f:e0ff:fe87:3e.5353 > ff02::fb.5353: 0 [3q] [5n] ANY (QM)? floodlight [e6:1f:e0:87:00:3e]._workstation._tcp.local. ANY (QM)? floodlight.local. ANY (QM)? e.3.0.0.7.8.e.f.f.f.0.e.f.1.4.e.0.0.0.0.0.0.0.0.0.0.0.0.0.8.e.f.ip6.arpa. (267)
22:40:50.312493 IP6 fe80::e41f:e0ff:fe87:3e.5353 > ff02::fb.5353: 0 [2q] PTR (QM)? _ipps._tcp.local. PTR (QM)? _ipp._tcp.local. (45)
22:40:50.364696 IP6 fe80::9423:61ff:fed6:2eac > ff02::16: HBH ICMP6, multicast listener report v2, 1 group record(s), length 28
22:40:50.372562 IP6 fe80::9423:61ff:fed6:2eac > ff02::16: HBH ICMP6, multicast listener report v2, 1 group record(s), length 28
22:40:50.423248 IP6 fe80::9423:61ff:fed6:2eac.5353 > ff02::fb.5353: 0*- [0q] 2/0/0 PTR _workstation._tcp.local., PTR floodlight [96:23:61:d6:2e:ac]._workstation._tcp.local. (117)
22:40:50.445068 IP6 fe80::9423:61ff:fed6:2eac.5353 > ff02::fb.5353: 0 [3q] [5n] ANY (QM)? floodlight [96:23:61:d6:2e:ac]._workstation._tcp.local. ANY (QM)? floodlight.local. ANY (QM)? c.a.e.2.6.d.e.f.f.f.1.6.3.2.4.9.0.0.0.0.0.0.0.0.0.0.0.0.0.8.e.f.ip6.arpa. (267)
22:40:50.475494 IP6 fe80::9423:61ff:fed6:2eac.5353 > ff02::fb.5353: 0 [2q] PTR (QM)? _ipps._tcp.local. PTR (QM)? _ipp._tcp.local. (45)
22:40:50.491747 IP6 fe80::ccca:dfff:fed7:9c7c > ff02::16: HBH ICMP6, multicast listener report v2, 1 group record(s), length 28
22:40:50.546636 IP6 fe80::ccca:dfff:fed7:9c7c.5353 > ff02::fb.5353: 0*- [0q] 2/0/0 PTR _workstation._tcp.local., PTR floodlight [ce:ca:df:d7:9c:7c]._workstation._tcp.local. (117)
22:40:50.564543 IP6 fe80::ccca:dfff:fed7:9c7c.5353 > ff02::fb.5353: 0 [3q] [5n] ANY (QM)? floodlight [ce:ca:df:d7:9c:7c]._workstation._tcp.local. ANY (QM)? floodlight.local. ANY (QM)? c.7.c.9.7.d.e.f.f.f.f.d.a.c.c.c.0.0.0.0.0.0.0.0.0.0.0.0.0.8.e.f.ip6.arpa. (267)
22:40:50.567162 IP6 fe80::e41f:e0ff:fe87:3e.5353 > ff02::fb.5353: 0 [3q] [5n] ANY (QM)? floodlight [e6:1f:e0:87:00:3e]._workstation._tcp.local. ANY (QM)? floodlight.local. ANY (QM)? e.3.0.0.7.8.e.f.f.f.0.e.f.1.4.e.0.0.0.0.0.0.0.0.0.0.0.0.0.8.e.f.ip6.arpa. (267)
22:40:50.585364 IP6 fe80::ccca:dfff:fed7:9c7c.5353 > ff02::fb.5353: 0 [2q] PTR (QM)? _ipps._tcp.local. PTR (QM)? _ipp._tcp.local. (45)
22:40:50.610495 IP6 fe80::6ca3:42ff:febd:4b61 > ff02::16: HBH ICMP6, multicast listener report v2, 1 group record(s), length 28
22:40:50.641888 IP6 fe80::6ca3:42ff:febd:4b61 > ff02::16: HBH ICMP6, multicast listener report v2, 1 group record(s), length 28
22:40:50.641914 IP6 fe80::6ca3:42ff:febd:4b61.5353 > ff02::fb.5353: 0*- [0q] 2/0/0 PTR _workstation._tcp.local., PTR floodlight [6e:a3:42:bd:4b:61]._workstation._tcp.local. (117)
22:40:50.642413 IP6 fe80::e41f:e0ff:fe87:3e > ff02::16: HBH ICMP6, multicast listener report v2, 2 group record(s), length 48
22:40:50.643579 IP6 fe80::ccca:dfff:fed7:9c7c > ff02::16: HBH ICMP6, multicast listener report v2, 1 group record(s), length 28
22:40:50.666178 IP6 fe80::6ca3:42ff:febd:4b61.5353 > ff02::fb.5353: 0 [3q] [5n] ANY (QM)? floodlight [6e:a3:42:bd:4b:61]._workstation._tcp.local. ANY (QM)? floodlight.local. ANY (QM)? 1.6.b.4.d.b.e.f.f.f.2.4.3.a.c.6.0.0.0.0.0.0.0.0.0.0.0.0.0.8.e.f.ip6.arpa. (267)
22:40:50.695039 IP6 fe80::9423:61ff:fed6:2eac.5353 > ff02::fb.5353: 0 [3q] [5n] ANY (QM)? floodlight [96:23:61:d6:2e:ac]._workstation._tcp.local. ANY (QM)? floodlight.local. ANY (QM)? c.a.e.2.6.d.e.f.f.f.1.6.3.2.4.9.0.0.0.0.0.0.0.0.0.0.0.0.0.8.e.f.ip6.arpa. (267)
22:40:50.715154 IP6 fe80::e41f:e0ff:fe87:3e > ff02::16: HBH ICMP6, multicast listener report v2, 1 group record(s), length 28
22:40:50.735262 IP6 fe80::6ca3:42ff:febd:4b61.5353 > ff02::fb.5353: 0 [2q] PTR (QM)? _ipps._tcp.local. PTR (QM)? _ipp._tcp.local. (45)
22:40:50.816318 IP6 fe80::ccca:dfff:fed7:9c7c.5353 > ff02::fb.5353: 0 [3q] [5n] ANY (QM)? floodlight [ce:ca:df:d7:9c:7c]._workstation._tcp.local. ANY (QM)? floodlight.local. ANY (QM)? c.7.c.9.7.d.e.f.f.f.f.d.a.c.c.c.0.0.0.0.0.0.0.0.0.0.0.0.0.8.e.f.ip6.arpa. (267)
22:40:50.818645 IP6 fe80::e41f:e0ff:fe87:3e.5353 > ff02::fb.5353: 0 [3q] [5n] ANY (QM)? floodlight [e6:1f:e0:87:00:3e]._workstation._tcp.local. ANY (QM)? floodlight.local. ANY (QM)? e.3.0.0.7.8.e.f.f.f.0.e.f.1.4.e.0.0.0.0.0.0.0.0.0.0.0.0.0.8.e.f.ip6.arpa. (267)
22:40:50.852538 IP6 fe80::9423:61ff:fed6:2eac > ff02::16: HBH ICMP6, multicast listener report v2, 1 group record(s), length 28
22:40:50.896460 IP6 fe80::4cf:aff:fee5:cf9d > ff02::16: HBH ICMP6, multicast listener report v2, 1 group record(s), length 28
22:40:50.935718 IP6 fe80::ccca:dfff:fed7:9c7c > ff02::16: HBH ICMP6, multicast listener report v2, 2 group record(s), length 48
22:40:51.000326 IP6 fe80::4cf:aff:fee5:cf9d > ff02::16: HBH ICMP6, multicast listener report v2, 1 group record(s), length 28
22:40:51.000353 IP6 fe80::9423:61ff:fed6:2eac.5353 > ff02::fb.5353: 0 [3q] [5n] ANY (QM)? floodlight [96:23:61:d6:2e:ac]._workstation._tcp.local. ANY (QM)? floodlight.local. ANY (QM)? c.a.e.2.6.d.e.f.f.f.1.6.3.2.4.9.0.0.0.0.0.0.0.0.0.0.0.0.0.8.e.f.ip6.arpa. (267)
22:40:51.015919 IP6 fe80::6ca3:42ff:febd:4b61.5353 > ff02::fb.5353: 0 [3q] [5n] ANY (QM)? floodlight [6e:a3:42:bd:4b:61]._workstation._tcp.local. ANY (QM)? floodlight.local. ANY (QM)? 1.6.b.4.d.b.e.f.f.f.2.4.3.a.c.6.0.0.0.0.0.0.0.0.0.0.0.0.0.8.e.f.ip6.arpa. (267)
22:40:51.015945 IP6 fe80::4cf:aff:fee5:cf9d.5353 > ff02::fb.5353: 0*- [0q] 2/0/0 PTR _workstation._tcp.local., PTR floodlight [06:cf:0a:e5:cf:9d]._workstation._tcp.local. (117)
22:40:51.016255 IP6 fe80::4cf:aff:fee5:cf9d.5353 > ff02::fb.5353: 0 [3q] [5n] ANY (QM)? floodlight [06:cf:0a:e5:cf:9d]._workstation._tcp.local. ANY (QM)? floodlight.local. ANY (QM)? d.9.f.c.5.e.e.f.f.f.a.0.f.c.4.0.0.0.0.0.0.0.0.0.0.0.0.0.0.8.e.f.ip6.arpa. (267)
22:40:51.016281 IP6 fe80::4ca6:54ff:fed1:d4f0 > ff02::16: HBH ICMP6, multicast listener report v2, 1 group record(s), length 28
22:40:51.028493 IP6 fe80::4cf:aff:fee5:cf9d.5353 > ff02::fb.5353: 0 [2q] PTR (QM)? _ipps._tcp.local. PTR (QM)? _ipp._tcp.local. (45)
22:40:51.051066 IP6 fe80::e41f:e0ff:fe87:3e.5353 > ff02::fb.5353: 0*- [0q] 5/0/0 (Cache flush) TXT "", (Cache flush) AAAA fe80::e41f:e0ff:fe87:3e, (Cache flush) PTR floodlight.local., (Cache flush) HINFO, (Cache flush) SRV floodlight.local.:9 0 0 (249)
22:40:51.073069 IP6 fe80::ccca:dfff:fed7:9c7c.5353 > ff02::fb.5353: 0 [3q] [5n] ANY (QM)? floodlight [ce:ca:df:d7:9c:7c]._workstation._tcp.local. ANY (QM)? floodlight.local. ANY (QM)? c.7.c.9.7.d.e.f.f.f.f.d.a.c.c.c.0.0.0.0.0.0.0.0.0.0.0.0.0.8.e.f.ip6.arpa. (267)
22:40:51.149445 IP6 fe80::4ca6:54ff:fed1:d4f0.5353 > ff02::fb.5353: 0*- [0q] 2/0/0 PTR _workstation._tcp.local., PTR floodlight [4e:a6:54:d1:d4:f0]._workstation._tcp.local. (117)
22:40:51.149471 IP6 fe80::4ca6:54ff:fed1:d4f0.5353 > ff02::fb.5353: 0 [3q] [5n] ANY (QM)? floodlight [4e:a6:54:d1:d4:f0]._workstation._tcp.local. ANY (QM)? floodlight.local. ANY (QM)? 0.f.4.d.1.d.e.f.f.f.4.5.6.a.c.4.0.0.0.0.0.0.0.0.0.0.0.0.0.8.e.f.ip6.arpa. (267)
22:40:51.149497 IP6 fe80::4ca6:54ff:fed1:d4f0.5353 > ff02::fb.5353: 0 [2q] PTR (QM)? _ipps._tcp.local. PTR (QM)? _ipp._tcp.local. (45)
22:40:51.206673 IP6 fe80::9423:61ff:fed6:2eac.5353 > ff02::fb.5353: 0*- [0q] 5/0/0 (Cache flush) TXT "", (Cache flush) AAAA fe80::9423:61ff:fed6:2eac, (Cache flush) PTR floodlight.local., (Cache flush) HINFO, (Cache flush) SRV floodlight.local.:9 0 0 (249)
22:40:51.271222 IP6 fe80::ccca:dfff:fed7:9c7c.5353 > ff02::fb.5353: 0*- [0q] 1/0/0 (Cache flush) TXT "" (79)
22:40:51.274611 IP6 fe80::4cf:aff:fee5:cf9d > ff02::16: HBH ICMP6, multicast listener report v2, 1 group record(s), length 28
22:40:51.274637 IP6 fe80::6ca3:42ff:febd:4b61 > ff02::16: HBH ICMP6, multicast listener report v2, 1 group record(s), length 28
22:40:51.286275 IP6 fe80::ccca:dfff:fed7:9c7c.5353 > ff02::fb.5353: 0*- [0q] 2/0/0 (Cache flush) SRV floodlight.local.:9 0 0, (Cache flush) HINFO (122)
22:40:51.291242 IP6 fe80::ccca:dfff:fed7:9c7c.5353 > ff02::fb.5353: 0*- [0q] 2/0/0 (Cache flush) PTR floodlight.local., (Cache flush) AAAA fe80::ccca:dfff:fed7:9c7c (142)
22:40:51.336951 IP6 fe80::4cf:aff:fee5:cf9d.5353 > ff02::fb.5353: 0 [3q] [5n] ANY (QM)? floodlight [06:cf:0a:e5:cf:9d]._workstation._tcp.local. ANY (QM)? floodlight.local. ANY (QM)? d.9.f.c.5.e.e.f.f.f.a.0.f.c.4.0.0.0.0.0.0.0.0.0.0.0.0.0.0.8.e.f.ip6.arpa. (267)
22:40:51.336977 IP6 fe80::9423:61ff:fed6:2eac > ff02::16: HBH ICMP6, multicast listener report v2, 2 group record(s), length 48
22:40:51.428433 IP6 fe80::e41f:e0ff:fe87:3e.5353 > ff02::fb.5353: 0*- [0q] 2/0/0 PTR _workstation._tcp.local., PTR floodlight [e6:1f:e0:87:00:3e]._workstation._tcp.local. (117)
22:40:51.428494 IP6 fe80::e41f:e0ff:fe87:3e.5353 > ff02::fb.5353: 0 [2q] PTR (QM)? _ipps._tcp.local. PTR (QM)? _ipp._tcp.local. (45)
22:40:51.484855 IP6 fe80::9423:61ff:fed6:2eac.5353 > ff02::fb.5353: 0*- [0q] 2/0/0 PTR _workstation._tcp.local., PTR floodlight [96:23:61:d6:2e:ac]._workstation._tcp.local. (117)
22:40:51.492198 IP6 fe80::9423:61ff:fed6:2eac.5353 > ff02::fb.5353: 0 [2q] PTR (QM)? _ipps._tcp.local. PTR (QM)? _ipp._tcp.local. (45)
22:40:51.505575 IP6 fe80::6ca3:42ff:febd:4b61.5353 > ff02::fb.5353: 0 [3q] [5n] ANY (QM)? floodlight [6e:a3:42:bd:4b:61]._workstation._tcp.local. ANY (QM)? floodlight.local. ANY (QM)? 1.6.b.4.d.b.e.f.f.f.2.4.3.a.c.6.0.0.0.0.0.0.0.0.0.0.0.0.0.8.e.f.ip6.arpa. (267)
22:40:51.511769 IP6 fe80::a40a:e8ff:fec2:514f > ff02::16: HBH ICMP6, multicast listener report v2, 1 group record(s), length 28
22:40:51.511842 IP6 fe80::a40a:e8ff:fec2:514f > ff02::16: HBH ICMP6, multicast listener report v2, 1 group record(s), length 28
22:40:51.525259 IP6 fe80::4ca6:54ff:fed1:d4f0.5353 > ff02::fb.5353: 0 [3q] [5n] ANY (QM)? floodlight [4e:a6:54:d1:d4:f0]._workstation._tcp.local. ANY (QM)? floodlight.local. ANY (QM)? 0.f.4.d.1.d.e.f.f.f.4.5.6.a.c.4.0.0.0.0.0.0.0.0.0.0.0.0.0.8.e.f.ip6.arpa. (267)
22:40:51.575236 IP6 fe80::ccca:dfff:fed7:9c7c.5353 > ff02::fb.5353: 0*- [0q] 2/0/0 PTR _workstation._tcp.local., PTR floodlight [ce:ca:df:d7:9c:7c]._workstation._tcp.local. (117)
22:40:51.597222 IP6 fe80::ccca:dfff:fed7:9c7c.5353 > ff02::fb.5353: 0 [2q] PTR (QM)? _ipps._tcp.local. PTR (QM)? _ipp._tcp.local. (45)
22:40:51.728015 ARP, Request who-has 10.0.0.5 tell 10.0.0.4, length 28
22:40:51.728041 IP6 fe80::a40a:e8ff:fec2:514f.5353 > ff02::fb.5353: 0*- [0q] 2/0/0 PTR _workstation._tcp.local., PTR floodlight [a6:0a:e8:c2:51:4f]._workstation._tcp.local. (117)
22:40:51.736903 IP6 fe80::a40a:e8ff:fec2:514f.5353 > ff02::fb.5353: 0 [3q] [5n] ANY (QM)? floodlight [a6:0a:e8:c2:51:4f]._workstation._tcp.local. ANY (QM)? floodlight.local. ANY (QM)? f.4.1.5.2.c.e.f.f.f.8.e.a.0.4.a.0.0.0.0.0.0.0.0.0.0.0.0.0.8.e.f.ip6.arpa. (267)
22:40:51.736928 IP6 fe80::a40a:e8ff:fec2:514f.5353 > ff02::fb.5353: 0 [2q] PTR (QM)? _ipps._tcp.local. PTR (QM)? _ipp._tcp.local. (45)
22:40:51.736954 IP6 fe80::6ca3:42ff:febd:4b61 > ff02::16: HBH ICMP6, multicast listener report v2, 2 group record(s), length 48
22:40:51.737353 IP6 fe80::4ca6:54ff:fed1:d4f0 > ff02::16: HBH ICMP6, multicast listener report v2, 2 group record(s), length 48
22:40:51.737379 IP6 fe80::6ca3:42ff:febd:4b61.5353 > ff02::fb.5353: 0*- [0q] 5/0/0 (Cache flush) TXT "", (Cache flush) AAAA fe80::6ca3:42ff:febd:4b61, (Cache flush) PTR floodlight.local., (Cache flush) HINFO, (Cache flush) SRV floodlight.local.:9 0 0 (249)
22:40:51.737405 IP6 fe80::4ca6:54ff:fed1:d4f0 > ff02::16: HBH ICMP6, multicast listener report v2, 1 group record(s), length 28
22:40:51.758721 IP6 fe80::4cf:aff:fee5:cf9d.5353 > ff02::fb.5353: 0 [3q] [5n] ANY (QM)? floodlight [06:cf:0a:e5:cf:9d]._workstation._tcp.local. ANY (QM)? floodlight.local. ANY (QM)? d.9.f.c.5.e.e.f.f.f.a.0.f.c.4.0.0.0.0.0.0.0.0.0.0.0.0.0.0.8.e.f.ip6.arpa. (267)
22:40:51.904324 IP6 fe80::4cf:aff:fee5:cf9d > ff02::16: HBH ICMP6, multicast listener report v2, 2 group record(s), length 48
22:40:51.904350 IP6 fe80::4ca6:54ff:fed1:d4f0.5353 > ff02::fb.5353: 0 [3q] [5n] ANY (QM)? floodlight [4e:a6:54:d1:d4:f0]._workstation._tcp.local. ANY (QM)? floodlight.local. ANY (QM)? 0.f.4.d.1.d.e.f.f.f.4.5.6.a.c.4.0.0.0.0.0.0.0.0.0.0.0.0.0.8.e.f.ip6.arpa. (267)
22:40:51.904570 IP6 fe80::a40a:e8ff:fec2:514f.5353 > ff02::fb.5353: 0 [3q] [5n] ANY (QM)? floodlight [a6:0a:e8:c2:51:4f]._workstation._tcp.local. ANY (QM)? floodlight.local. ANY (QM)? f.4.1.5.2.c.e.f.f.f.8.e.a.0.4.a.0.0.0.0.0.0.0.0.0.0.0.0.0.8.e.f.ip6.arpa. (267)
22:40:51.904654 IP6 fe80::6ca3:42ff:febd:4b61.5353 > ff02::fb.5353: 0*- [0q] 2/0/0 PTR _workstation._tcp.local., PTR floodlight [6e:a3:42:bd:4b:61]._workstation._tcp.local. (117)
22:40:51.904714 IP6 fe80::4cf:aff:fee5:cf9d.5353 > ff02::fb.5353: 0*- [0q] 5/0/0 (Cache flush) TXT "", (Cache flush) AAAA fe80::4cf:aff:fee5:cf9d, (Cache flush) PTR floodlight.local., (Cache flush) HINFO, (Cache flush) SRV floodlight.local.:9 0 0 (249)
22:40:51.917434 IP6 fe80::6ca3:42ff:febd:4b61.5353 > ff02::fb.5353: 0 [2q] PTR (QM)? _ipps._tcp.local. PTR (QM)? _ipp._tcp.local. (45)
22:40:51.918259 ce:ca:df:d7:9c:7c > ff:ff:ff:ff:ff:ff, ethertype Unknown (0x8942), length 69: 
	0x0000:  2000 0604 0002 0000 0207 0400 0000 0000  ................
	0x0010:  0104 0302 0001 0602 0078 fe0c 0026 e100  .........x...&..
	0x0020:  0000 0000 0000 0001 1808 0031 3791 7786  ...........17.w.
	0x0030:  1ff2 e601 0100 00                        .......
22:40:52.069497 IP6 fe80::4ca6:54ff:fed1:d4f0.5353 > ff02::fb.5353: 0*- [0q] 2/0/0 (Cache flush) TXT "", (Cache flush) SRV floodlight.local.:9 0 0 (110)
22:40:52.089960 IP6 fe80::4ca6:54ff:fed1:d4f0.5353 > ff02::fb.5353: 0*- [0q] 3/0/0 (Cache flush) HINFO, (Cache flush) AAAA fe80::4ca6:54ff:fed1:d4f0, (Cache flush) PTR floodlight.local. (167)
22:40:52.089986 IP6 fe80::d01a:a8ff:feb4:a0aa > ff02::16: HBH ICMP6, multicast listener report v2, 1 group record(s), length 28
22:40:52.090256 IP6 fe80::d01a:a8ff:feb4:a0aa > ff02::16: HBH ICMP6, multicast listener report v2, 1 group record(s), length 28
22:40:52.090283 IP6 fe80::d01a:a8ff:feb4:a0aa.5353 > ff02::fb.5353: 0*- [0q] 2/0/0 PTR _workstation._tcp.local., PTR floodlight [d2:1a:a8:b4:a0:aa]._workstation._tcp.local. (117)
22:40:52.090308 IP6 fe80::a40a:e8ff:fec2:514f.5353 > ff02::fb.5353: 0 [3q] [5n] ANY (QM)? floodlight [a6:0a:e8:c2:51:4f]._workstation._tcp.local. ANY (QM)? floodlight.local. ANY (QM)? f.4.1.5.2.c.e.f.f.f.8.e.a.0.4.a.0.0.0.0.0.0.0.0.0.0.0.0.0.8.e.f.ip6.arpa. (267)
22:40:52.090334 IP6 fe80::4cf:aff:fee5:cf9d.5353 > ff02::fb.5353: 0*- [0q] 2/0/0 PTR _workstation._tcp.local., PTR floodlight [06:cf:0a:e5:cf:9d]._workstation._tcp.local. (117)
22:40:52.090751 IP6 fe80::4cf:aff:fee5:cf9d.5353 > ff02::fb.5353: 0 [2q] PTR (QM)? _ipps._tcp.local. PTR (QM)? _ipp._tcp.local. (45)
22:40:52.167922 IP6 fe80::a40a:e8ff:fec2:514f > ff02::16: HBH ICMP6, multicast listener report v2, 1 group record(s), length 28
22:40:52.219605 IP6 :: > ff02::16: HBH ICMP6, multicast listener report v2, 1 group record(s), length 28
22:40:52.246828 IP 0.0.0.0.68 > 255.255.255.255.67: BOOTP/DHCP, Request from ce:ca:df:d7:9c:7c, length 300
22:40:52.608096 IP6 fe80::e41f:e0ff:fe87:3e.5353 > ff02::fb.5353: 0*- [0q] 5/0/0 (Cache flush) TXT "", (Cache flush) AAAA fe80::e41f:e0ff:fe87:3e, (Cache flush) PTR floodlight.local., (Cache flush) HINFO, (Cache flush) SRV floodlight.local.:9 0 0 (249)
22:40:52.608132 IP6 fe80::9423:61ff:fed6:2eac.5353 > ff02::fb.5353: 0*- [0q] 5/0/0 (Cache flush) TXT "", (Cache flush) AAAA fe80::9423:61ff:fed6:2eac, (Cache flush) PTR floodlight.local., (Cache flush) HINFO, (Cache flush) SRV floodlight.local.:9 0 0 (249)
22:40:52.608167 IP6 :: > ff02::16: HBH ICMP6, multicast listener report v2, 1 group record(s), length 28
22:40:52.608201 IP6 :: > ff02::16: HBH ICMP6, multicast listener report v2, 2 group record(s), length 48
22:40:52.608532 IP6 :: > ff02::16: HBH ICMP6, multicast listener report v2, 2 group record(s), length 48
22:40:52.608567 IP 0.0.0.0.68 > 255.255.255.255.67: BOOTP/DHCP, Request from e6:1f:e0:87:00:3e, length 300
22:40:52.684534 IP 0.0.0.0.68 > 255.255.255.255.67: BOOTP/DHCP, Request from 96:23:61:d6:2e:ac, length 300
22:40:52.772232 IP6 :: > ff02::16: HBH ICMP6, multicast listener report v2, 1 group record(s), length 28
22:40:52.779046 IP6 fe80::d01a:a8ff:feb4:a0aa.5353 > ff02::fb.5353: 0 [3q] [5n] ANY (QM)? floodlight [d2:1a:a8:b4:a0:aa]._workstation._tcp.local. ANY (QM)? floodlight.local. ANY (QM)? a.a.0.a.4.b.e.f.f.f.8.a.a.1.0.d.0.0.0.0.0.0.0.0.0.0.0.0.0.8.e.f.ip6.arpa. (267)
22:40:52.787404 IP6 fe80::4ca6:54ff:fed1:d4f0.5353 > ff02::fb.5353: 0*- [0q] 2/0/0 PTR _workstation._tcp.local., PTR floodlight [4e:a6:54:d1:d4:f0]._workstation._tcp.local. (117)
22:40:52.787439 IP6 fe80::4ca6:54ff:fed1:d4f0.5353 > ff02::fb.5353: 0 [2q] PTR (QM)? _ipps._tcp.local. PTR (QM)? _ipp._tcp.local. (45)
22:40:52.796364 IP6 fe80::a40a:e8ff:fec2:514f.5353 > ff02::fb.5353: 0*- [0q] 2/0/0 (Cache flush) TXT "", (Cache flush) SRV floodlight.local.:9 0 0 (110)
22:40:52.796399 IP6 fe80::a40a:e8ff:fec2:514f.5353 > ff02::fb.5353: 0*- [0q] 3/0/0 (Cache flush) HINFO, (Cache flush) AAAA fe80::a40a:e8ff:fec2:514f, (Cache flush) PTR floodlight.local. (167)
22:40:52.796683 IP6 :: > ff02::1:ffd6:2eac: ICMP6, neighbor solicitation, who has fe80::9423:61ff:fed6:2eac, length 24
22:40:52.926227 IP6 fe80::d01a:a8ff:feb4:a0aa > ff02::16: HBH ICMP6, multicast listener report v2, 1 group record(s), length 28
22:40:52.926347 IP6 fe80::d01a:a8ff:feb4:a0aa.5353 > ff02::fb.5353: 0 [2q] PTR (QM)? _ipps._tcp.local. PTR (QM)? _ipp._tcp.local. (45)
22:40:53.008418 IP6 :: > ff02::1:ffd7:9c7c: ICMP6, neighbor solicitation, who has fe80::ccca:dfff:fed7:9c7c, length 24
22:40:53.050022 IP6 fe80::d01a:a8ff:feb4:a0aa > ff02::16: HBH ICMP6, multicast listener report v2, 2 group record(s), length 48
22:40:53.050057 IP6 fe80::d01a:a8ff:feb4:a0aa.5353 > ff02::fb.5353: 0 [3q] [5n] ANY (QM)? floodlight [d2:1a:a8:b4:a0:aa]._workstation._tcp.local. ANY (QM)? floodlight.local. ANY (QM)? a.a.0.a.4.b.e.f.f.f.8.a.a.1.0.d.0.0.0.0.0.0.0.0.0.0.0.0.0.8.e.f.ip6.arpa. (267)
22:40:53.050255 IP6 :: > ff02::16: HBH ICMP6, multicast listener report v2, 1 group record(s), length 28
22:40:53.050351 IP 0.0.0.0.68 > 255.255.255.255.67: BOOTP/DHCP, Request from 4e:a6:54:d1:d4:f0, length 300
22:40:53.202882 IP6 :: > ff02::1:ff87:3e: ICMP6, neighbor solicitation, who has fe80::e41f:e0ff:fe87:3e, length 24
22:40:53.203047 IP6 :: > ff02::16: HBH ICMP6, multicast listener report v2, 1 group record(s), length 28
22:40:53.203215 IP6 :: > ff02::16: HBH ICMP6, multicast listener report v2, 1 group record(s), length 28
22:40:53.690932 IP6 fe80::9423:61ff:fed6:2eac > ff02::16: HBH ICMP6, multicast listener report v2, 1 group record(s), length 28
22:40:53.690967 IP6 fe80::9423:61ff:fed6:2eac > ff02::2: ICMP6, router solicitation, length 16
22:40:53.699866 IP6 fe80::9423:61ff:fed6:2eac > ff02::16: HBH ICMP6, multicast listener report v2, 1 group record(s), length 28
22:40:53.730599 IP6 fe80::4cf:aff:fee5:cf9d.5353 > ff02::fb.5353: 0*- [0q] 5/0/0 (Cache flush) TXT "", (Cache flush) AAAA fe80::4cf:aff:fee5:cf9d, (Cache flush) PTR floodlight.local., (Cache flush) HINFO, (Cache flush) SRV floodlight.local.:9 0 0 (249)
22:40:53.736849 IP6 fe80::d01a:a8ff:feb4:a0aa.5353 > ff02::fb.5353: 0 [3q] [5n] ANY (QM)? floodlight [d2:1a:a8:b4:a0:aa]._workstation._tcp.local. ANY (QM)? floodlight.local. ANY (QM)? a.a.0.a.4.b.e.f.f.f.8.a.a.1.0.d.0.0.0.0.0.0.0.0.0.0.0.0.0.8.e.f.ip6.arpa. (267)
22:40:53.764034 IP6 fe80::9423:61ff:fed6:2eac.5353 > ff02::fb.5353: 0*- [0q] 2/0/0 PTR _workstation._tcp.local., PTR floodlight [96:23:61:d6:2e:ac]._workstation._tcp.local. (117)
22:40:53.764196 IP6 fe80::a40a:e8ff:fec2:514f > ff02::16: HBH ICMP6, multicast listener report v2, 2 group record(s), length 48
22:40:53.773514 IP6 fe80::a40a:e8ff:fec2:514f.5353 > ff02::fb.5353: 0*- [0q] 2/0/0 PTR _workstation._tcp.local., PTR floodlight [a6:0a:e8:c2:51:4f]._workstation._tcp.local. (117)
22:40:53.773549 IP6 fe80::a40a:e8ff:fec2:514f.5353 > ff02::fb.5353: 0 [2q] PTR (QM)? _ipps._tcp.local. PTR (QM)? _ipp._tcp.local. (45)
22:40:53.773584 IP6 fe80::6ca3:42ff:febd:4b61.5353 > ff02::fb.5353: 0*- [0q] 5/0/0 (Cache flush) TXT "", (Cache flush) AAAA fe80::6ca3:42ff:febd:4b61, (Cache flush) PTR floodlight.local., (Cache flush) HINFO, (Cache flush) SRV floodlight.local.:9 0 0 (249)
22:40:53.773979 IP6 :: > ff02::16: HBH ICMP6, multicast listener report v2, 1 group record(s), length 28
22:40:53.774014 IP6 :: > ff02::16: HBH ICMP6, multicast listener report v2, 1 group record(s), length 28
22:40:53.781820 IP6 :: > ff02::1:ffe5:cf9d: ICMP6, neighbor solicitation, who has fe80::4cf:aff:fee5:cf9d, length 24
22:40:53.788114 IP 0.0.0.0.68 > 255.255.255.255.67: BOOTP/DHCP, Request from 06:cf:0a:e5:cf:9d, length 300
22:40:53.788177 IP6 fe80::9423:61ff:fed6:2eac.5353 > ff02::fb.5353: 0 [2q] PTR (QM)? _ipps._tcp.local. PTR (QM)? _ipp._tcp.local. (45)
22:40:53.827712 IP6 fe80::9423:61ff:fed6:2eac > ff02::16: HBH ICMP6, multicast listener report v2, 2 group record(s), length 48
22:40:53.827748 IP6 :: > ff02::16: HBH ICMP6, multicast listener report v2, 1 group record(s), length 28
22:40:53.828544 IP6 :: > ff02::16: HBH ICMP6, multicast listener report v2, 1 group record(s), length 28
22:40:53.828580 IP 0.0.0.0.68 > 255.255.255.255.67: BOOTP/DHCP, Request from a6:0a:e8:c2:51:4f, length 300
22:40:53.828615 IP6 :: > ff02::1:ffd1:d4f0: ICMP6, neighbor solicitation, who has fe80::4ca6:54ff:fed1:d4f0, length 24
22:40:53.828650 IP6 :: > ff02::16: HBH ICMP6, multicast listener report v2, 1 group record(s), length 28
22:40:53.828685 IP6 :: > ff02::16: HBH ICMP6, multicast listener report v2, 2 group record(s), length 48
22:40:53.828719 IP6 :: > ff02::16: HBH ICMP6, multicast listener report v2, 2 group record(s), length 48
22:40:53.838729 IP6 fe80::d01a:a8ff:feb4:a0aa.5353 > ff02::fb.5353: 0*- [0q] 5/0/0 (Cache flush) TXT "", (Cache flush) AAAA fe80::d01a:a8ff:feb4:a0aa, (Cache flush) PTR floodlight.local., (Cache flush) HINFO, (Cache flush) SRV floodlight.local.:9 0 0 (249)
22:40:53.861963 IP6 fe80::d01a:a8ff:feb4:a0aa.5353 > ff02::fb.5353: 0 [2q] PTR (QM)? _ipps._tcp.local. PTR (QM)? _ipp._tcp.local. (45)
22:40:54.007534 IP6 fe80::ccca:dfff:fed7:9c7c > ff02::16: HBH ICMP6, multicast listener report v2, 1 group record(s), length 28
22:40:54.007569 IP6 fe80::ccca:dfff:fed7:9c7c > ff02::2: ICMP6, router solicitation, length 16
22:40:54.014881 IP6 fe80::e41f:e0ff:fe87:3e > ff02::16: HBH ICMP6, multicast listener report v2, 1 group record(s), length 28
22:40:54.016090 IP6 fe80::ccca:dfff:fed7:9c7c > ff02::16: HBH ICMP6, multicast listener report v2, 1 group record(s), length 28
22:40:54.028218 IP6 fe80::e41f:e0ff:fe87:3e > ff02::2: ICMP6, router solicitation, length 16
22:40:54.030021 IP6 fe80::e41f:e0ff:fe87:3e > ff02::16: HBH ICMP6, multicast listener report v2, 1 group record(s), length 28
22:40:54.060955 IP6 fe80::9423:61ff:fed6:2eac > ff02::16: HBH ICMP6, multicast listener report v2, 1 group record(s), length 28
22:40:54.067915 IP6 fe80::9423:61ff:fed6:2eac.5353 > ff02::fb.5353: 0 [3q] [5n] ANY (QM)? floodlight [96:23:61:d6:2e:ac]._workstation._tcp.local. ANY (QM)? floodlight.local. ANY (QM)? c.a.e.2.6.d.e.f.f.f.1.6.3.2.4.9.0.0.0.0.0.0.0.0.0.0.0.0.0.8.e.f.ip6.arpa. (267)
22:40:54.075796 IP6 fe80::ccca:dfff:fed7:9c7c.5353 > ff02::fb.5353: 0*- [0q] 2/0/0 PTR _workstation._tcp.local., PTR floodlight [ce:ca:df:d7:9c:7c]._workstation._tcp.local. (117)
22:40:54.094650 IP6 fe80::ccca:dfff:fed7:9c7c.5353 > ff02::fb.5353: 0 [3q] [5n] ANY (QM)? floodlight [ce:ca:df:d7:9c:7c]._workstation._tcp.local. ANY (QM)? floodlight.local. ANY (QM)? c.7.c.9.7.d.e.f.f.f.f.d.a.c.c.c.0.0.0.0.0.0.0.0.0.0.0.0.0.8.e.f.ip6.arpa. (267)
22:40:54.110749 IP6 fe80::ccca:dfff:fed7:9c7c.5353 > ff02::fb.5353: 0 [2q] PTR (QM)? _ipps._tcp.local. PTR (QM)? _ipp._tcp.local. (45)
22:40:54.120136 IP6 fe80::e41f:e0ff:fe87:3e.5353 > ff02::fb.5353: 0*- [0q] 2/0/0 PTR _workstation._tcp.local., PTR floodlight [e6:1f:e0:87:00:3e]._workstation._tcp.local. (117)
22:40:54.120350 IP6 fe80::e41f:e0ff:fe87:3e.5353 > ff02::fb.5353: 0 [2q] PTR (QM)? _ipps._tcp.local. PTR (QM)? _ipp._tcp.local. (45)
22:40:54.120385 IP6 fe80::e41f:e0ff:fe87:3e > ff02::16: HBH ICMP6, multicast listener report v2, 1 group record(s), length 28
22:40:54.164698 IP6 fe80::d01a:a8ff:feb4:a0aa.5353 > ff02::fb.5353: 0*- [0q] 2/0/0 PTR _workstation._tcp.local., PTR floodlight [d2:1a:a8:b4:a0:aa]._workstation._tcp.local. (117)
22:40:54.164734 IP 0.0.0.0.68 > 255.255.255.255.67: BOOTP/DHCP, Request from 6e:a3:42:bd:4b:61, length 300
22:40:54.173797 IP6 :: > ff02::1:ffc2:514f: ICMP6, neighbor solicitation, who has fe80::a40a:e8ff:fec2:514f, length 24
22:40:54.173832 IP6 :: > ff02::1:ffbd:4b61: ICMP6, neighbor solicitation, who has fe80::6ca3:42ff:febd:4b61, length 24
22:40:54.173867 IP6 fe80::4cf:aff:fee5:cf9d > ff02::16: HBH ICMP6, multicast listener report v2, 1 group record(s), length 28
22:40:54.174237 IP6 fe80::4cf:aff:fee5:cf9d > ff02::2: ICMP6, router solicitation, length 16
22:40:54.188154 IP6 fe80::4cf:aff:fee5:cf9d > ff02::16: HBH ICMP6, multicast listener report v2, 1 group record(s), length 28
22:40:54.289033 IP6 :: > ff02::16: HBH ICMP6, multicast listener report v2, 1 group record(s), length 28
22:40:54.289085 IP6 fe80::4cf:aff:fee5:cf9d.5353 > ff02::fb.5353: 0*- [0q] 2/0/0 PTR _workstation._tcp.local., PTR floodlight [06:cf:0a:e5:cf:9d]._workstation._tcp.local. (117)
22:40:54.289134 IP6 fe80::4cf:aff:fee5:cf9d.5353 > ff02::fb.5353: 0 [3q] [5n] ANY (QM)? floodlight [06:cf:0a:e5:cf:9d]._workstation._tcp.local. ANY (QM)? floodlight.local. ANY (QM)? d.9.f.c.5.e.e.f.f.f.a.0.f.c.4.0.0.0.0.0.0.0.0.0.0.0.0.0.0.8.e.f.ip6.arpa. (267)
22:40:54.289181 IP6 :: > ff02::16: HBH ICMP6, multicast listener report v2, 1 group record(s), length 28
22:40:54.290600 IP 0.0.0.0.68 > 255.255.255.255.67: BOOTP/DHCP, Request from d2:1a:a8:b4:a0:aa, length 300
22:40:54.317666 IP6 fe80::ccca:dfff:fed7:9c7c > ff02::16: HBH ICMP6, multicast listener report v2, 2 group record(s), length 48
22:40:54.348319 ARP, Request who-has 10.0.0.6 tell 10.0.0.4, length 28
22:40:54.348354 IP6 fe80::4cf:aff:fee5:cf9d.5353 > ff02::fb.5353: 0 [2q] PTR (QM)? _ipps._tcp.local. PTR (QM)? _ipp._tcp.local. (45)
22:40:54.348737 IP6 fe80::4cf:aff:fee5:cf9d > ff02::16: HBH ICMP6, multicast listener report v2, 1 group record(s), length 28
22:40:54.353808 IP6 fe80::ccca:dfff:fed7:9c7c.5353 > ff02::fb.5353: 0 [3q] [5n] ANY (QM)? floodlight [ce:ca:df:d7:9c:7c]._workstation._tcp.local. ANY (QM)? floodlight.local. ANY (QM)? c.7.c.9.7.d.e.f.f.f.f.d.a.c.c.c.0.0.0.0.0.0.0.0.0.0.0.0.0.8.e.f.ip6.arpa. (267)
22:40:54.532596 IP6 fe80::9423:61ff:fed6:2eac.5353 > ff02::fb.5353: 0 [3q] [5n] ANY (QM)? floodlight [96:23:61:d6:2e:ac]._workstation._tcp.local. ANY (QM)? floodlight.local. ANY (QM)? c.a.e.2.6.d.e.f.f.f.1.6.3.2.4.9.0.0.0.0.0.0.0.0.0.0.0.0.0.8.e.f.ip6.arpa. (267)
22:40:54.533186 IP6 fe80::e41f:e0ff:fe87:3e.5353 > ff02::fb.5353: 0 [3q] [5n] ANY (QM)? floodlight [e6:1f:e0:87:00:3e]._workstation._tcp.local. ANY (QM)? floodlight.local. ANY (QM)? e.3.0.0.7.8.e.f.f.f.0.e.f.1.4.e.0.0.0.0.0.0.0.0.0.0.0.0.0.8.e.f.ip6.arpa. (267)
22:40:54.533463 IP6 fe80::9423:61ff:fed6:2eac.5353 > ff02::fb.5353: 0*- [0q] 5/0/0 (Cache flush) TXT "", (Cache flush) AAAA fe80::9423:61ff:fed6:2eac, (Cache flush) PTR floodlight.local., (Cache flush) HINFO, (Cache flush) SRV floodlight.local.:9 0 0 (249)
22:40:54.597440 IP6 fe80::ccca:dfff:fed7:9c7c.5353 > ff02::fb.5353: 0 [3q] [5n] ANY (QM)? floodlight [ce:ca:df:d7:9c:7c]._workstation._tcp.local. ANY (QM)? floodlight.local. ANY (QM)? c.7.c.9.7.d.e.f.f.f.f.d.a.c.c.c.0.0.0.0.0.0.0.0.0.0.0.0.0.8.e.f.ip6.arpa. (267)
22:40:54.624586 IP6 fe80::e41f:e0ff:fe87:3e.5353 > ff02::fb.5353: 0 [3q] [5n] ANY (QM)? floodlight [e6:1f:e0:87:00:3e]._workstation._tcp.local. ANY (QM)? floodlight.local. ANY (QM)? e.3.0.0.7.8.e.f.f.f.0.e.f.1.4.e.0.0.0.0.0.0.0.0.0.0.0.0.0.8.e.f.ip6.arpa. (267)
22:40:54.797574 IP6 fe80::ccca:dfff:fed7:9c7c.5353 > ff02::fb.5353: 0*- [0q] 5/0/0 (Cache flush) TXT "", (Cache flush) AAAA fe80::ccca:dfff:fed7:9c7c, (Cache flush) PTR floodlight.local., (Cache flush) HINFO, (Cache flush) SRV floodlight.local.:9 0 0 (249)
22:40:54.857495 IP6 fe80::e41f:e0ff:fe87:3e.5353 > ff02::fb.5353: 0*- [0q] 2/0/0 (Cache flush) TXT "", (Cache flush) SRV floodlight.local.:9 0 0 (110)
22:40:54.857650 IP6 fe80::9423:61ff:fed6:2eac.5353 > ff02::fb.5353: 0*- [0q] 2/0/0 PTR _workstation._tcp.local., PTR floodlight [96:23:61:d6:2e:ac]._workstation._tcp.local. (117)
22:40:54.857685 IP6 fe80::e41f:e0ff:fe87:3e.5353 > ff02::fb.5353: 0*- [0q] 3/0/0 (Cache flush) HINFO, (Cache flush) AAAA fe80::e41f:e0ff:fe87:3e, (Cache flush) PTR floodlight.local. (167)
22:40:54.857720 IP6 fe80::9423:61ff:fed6:2eac.5353 > ff02::fb.5353: 0 [2q] PTR (QM)? _ipps._tcp.local. PTR (QM)? _ipp._tcp.local. (45)
