Hosth6
#######################

22:40:09.255801 IP6 fe80::90d8:5fff:fe1c:de3f.5353 > ff02::fb.5353: 0 [2q] PTR (QM)? _ipps._tcp.local. PTR (QM)? _ipp._tcp.local. (45)
22:40:09.625557 IP6 fe80::c86:76ff:fe35:e9b7 > ff02::2: ICMP6, router solicitation, length 16
22:40:09.628299 IP6 fe80::2823:2bff:fe66:ddb8 > ff02::2: ICMP6, router solicitation, length 16
22:40:10.163600 IP6 fe80::90d8:5fff:fe1c:de3f > ff02::2: ICMP6, router solicitation, length 16
22:40:10.300548 IP6 fe80::40b7:f3ff:fe57:e580 > ff02::2: ICMP6, router solicitation, length 16
22:40:10.421866 IP6 fe80::38f0:57ff:fe3e:e67 > ff02::2: ICMP6, router solicitation, length 16
22:40:11.311729 IP 0.0.0.0.68 > 255.255.255.255.67: BOOTP/DHCP, Request from 92:d8:5f:1c:de:3f, length 300
22:40:16.117142 IP6 fe80::d01a:a8ff:feb4:a0aa.5353 > ff02::fb.5353: 0 [2q] PTR (QM)? _ipps._tcp.local. PTR (QM)? _ipp._tcp.local. (45)
22:40:17.255679 IP6 fe80::90d8:5fff:fe1c:de3f.5353 > ff02::fb.5353: 0 [2q] PTR (QM)? _ipps._tcp.local. PTR (QM)? _ipp._tcp.local. (45)
22:40:20.985130 IP 0.0.0.0.68 > 255.255.255.255.67: BOOTP/DHCP, Request from d2:1a:a8:b4:a0:aa, length 300
22:40:21.477691 LLDP, length 47
22:40:21.743805 92:d8:5f:1c:de:3f > ff:ff:ff:ff:ff:ff, ethertype Unknown (0x8942), length 69: 
	0x0000:  2000 0604 0002 0000 0207 0400 0000 0000  ................
	0x0010:  0d04 0302 0003 0602 0078 fe0c 0026 e100  .........x...&..
	0x0020:  0000 0000 0000 000d 1808 0031 3791 7786  ...........17.w.
	0x0030:  1ff2 e601 0100 00                        .......
22:40:22.333874 ARP, Request who-has 10.0.0.7 tell 10.0.0.1, length 28
22:40:22.756808 ARP, Request who-has 10.0.0.8 tell 10.0.0.1, length 28
22:40:28.527129 IP 0.0.0.0.68 > 255.255.255.255.67: BOOTP/DHCP, Request from 96:23:61:d6:2e:ac, length 300
22:40:28.682835 IP 0.0.0.0.68 > 255.255.255.255.67: BOOTP/DHCP, Request from 92:d8:5f:1c:de:3f, length 300
22:40:28.806713 IP 0.0.0.0.68 > 255.255.255.255.67: BOOTP/DHCP, Request from 6e:a3:42:bd:4b:61, length 300
22:40:29.774693 IP6 fe80::9423:61ff:fed6:2eac.5353 > ff02::fb.5353: 0 [2q] PTR (QM)? _ipps._tcp.local. PTR (QM)? _ipp._tcp.local. (45)
22:40:29.962948 IP6 fe80::4ca6:54ff:fed1:d4f0.5353 > ff02::fb.5353: 0 [2q] PTR (QM)? _ipps._tcp.local. PTR (QM)? _ipp._tcp.local. (45)
22:40:30.371048 IP6 fe80::6ca3:42ff:febd:4b61.5353 > ff02::fb.5353: 0 [2q] PTR (QM)? _ipps._tcp.local. PTR (QM)? _ipp._tcp.local. (45)
22:40:31.737721 IP 0.0.0.0.68 > 255.255.255.255.67: BOOTP/DHCP, Request from d2:1a:a8:b4:a0:aa, length 300
22:40:32.113963 IP6 fe80::d01a:a8ff:feb4:a0aa.5353 > ff02::fb.5353: 0 [2q] PTR (QM)? _ipps._tcp.local. PTR (QM)? _ipp._tcp.local. (45)
22:40:33.256456 IP6 fe80::90d8:5fff:fe1c:de3f.5353 > ff02::fb.5353: 0 [2q] PTR (QM)? _ipps._tcp.local. PTR (QM)? _ipp._tcp.local. (45)
22:40:33.396523 ARP, Request who-has 10.0.0.3 tell 10.0.0.2, length 28
22:40:33.826450 ARP, Request who-has 10.0.0.4 tell 10.0.0.2, length 28
22:40:34.282694 ARP, Request who-has 10.0.0.5 tell 10.0.0.2, length 28
22:40:34.720681 ARP, Request who-has 10.0.0.6 tell 10.0.0.2, length 28
22:40:34.721909 ARP, Reply 10.0.0.6 is-at 42:b7:f3:57:e5:80, length 28
22:40:34.776021 IP 10.0.0.2 > 10.0.0.6: ICMP echo request, id 4028, seq 1, length 64
22:40:34.777287 IP 10.0.0.6 > 10.0.0.2: ICMP echo reply, id 4028, seq 1, length 64
22:40:35.146782 ARP, Request who-has 10.0.0.7 tell 10.0.0.2, length 28
22:40:35.362357 IP 0.0.0.0.68 > 255.255.255.255.67: BOOTP/DHCP, Request from 4e:a6:54:d1:d4:f0, length 300
22:40:35.762004 IP 0.0.0.0.68 > 255.255.255.255.67: BOOTP/DHCP, Request from 96:23:61:d6:2e:ac, length 300
22:40:35.803940 IP 0.0.0.0.68 > 255.255.255.255.67: BOOTP/DHCP, Request from 6e:a3:42:bd:4b:61, length 300
22:40:36.514305 LLDP, length 47
22:40:36.577845 ARP, Request who-has 10.0.0.8 tell 10.0.0.2, length 28
22:40:36.796101 92:d8:5f:1c:de:3f > ff:ff:ff:ff:ff:ff, ethertype Unknown (0x8942), length 69: 
	0x0000:  2000 0604 0002 0000 0207 0400 0000 0000  ................
	0x0010:  0d04 0302 0003 0602 0078 fe0c 0026 e100  .........x...&..
	0x0020:  0000 0000 0000 000d 1808 0031 3791 7786  ...........17.w.
	0x0030:  1ff2 e601 0100 00                        .......
22:40:37.744709 ARP, Request who-has 10.0.0.4 tell 10.0.0.3, length 28
22:40:38.172006 ARP, Request who-has 10.0.0.5 tell 10.0.0.3, length 28
22:40:38.578619 ARP, Request who-has 10.0.0.6 tell 10.0.0.3, length 28
22:40:38.580564 ARP, Reply 10.0.0.6 is-at 42:b7:f3:57:e5:80, length 28
22:40:38.634254 IP 10.0.0.3 > 10.0.0.6: ICMP echo request, id 4035, seq 1, length 64
22:40:38.635498 IP 10.0.0.6 > 10.0.0.3: ICMP echo reply, id 4035, seq 1, length 64
22:40:38.983091 ARP, Request who-has 10.0.0.7 tell 10.0.0.3, length 28
22:40:39.251033 IP 0.0.0.0.68 > 255.255.255.255.67: BOOTP/DHCP, Request from d2:1a:a8:b4:a0:aa, length 300
22:40:39.385951 ARP, Request who-has 10.0.0.8 tell 10.0.0.3, length 28
22:40:39.794920 ARP, Request who-has 10.0.0.1 tell 10.0.0.4, length 28
22:40:45.432640 IP 0.0.0.0.68 > 255.255.255.255.67: BOOTP/DHCP, Request from 92:d8:5f:1c:de:3f, length 300
22:40:49.375855 IP6 :: > ff02::16: HBH ICMP6, multicast listener report v2, 2 group record(s), length 48
22:40:49.431688 IP6 :: > ff02::16: HBH ICMP6, multicast listener report v2, 2 group record(s), length 48
22:40:49.454399 IP6 :: > ff02::16: HBH ICMP6, multicast listener report v2, 2 group record(s), length 48
22:40:49.454466 IP6 :: > ff02::16: HBH ICMP6, multicast listener report v2, 2 group record(s), length 48
22:40:49.526077 IP6 :: > ff02::16: HBH ICMP6, multicast listener report v2, 2 group record(s), length 48
22:40:49.554058 IP6 :: > ff02::16: HBH ICMP6, multicast listener report v2, 2 group record(s), length 48
22:40:49.585623 IP6 :: > ff02::16: HBH ICMP6, multicast listener report v2, 2 group record(s), length 48
22:40:49.621386 IP6 :: > ff02::1:ffd6:2eac: ICMP6, neighbor solicitation, who has fe80::9423:61ff:fed6:2eac, length 24
22:40:49.621412 IP6 :: > ff02::1:ffbd:4b61: ICMP6, neighbor solicitation, who has fe80::6ca3:42ff:febd:4b61, length 24
22:40:49.695675 IP6 :: > ff02::1:ff1c:de3f: ICMP6, neighbor solicitation, who has fe80::90d8:5fff:fe1c:de3f, length 24
22:40:49.708859 IP6 :: > ff02::16: HBH ICMP6, multicast listener report v2, 2 group record(s), length 48
22:40:49.941813 IP6 :: > ff02::16: HBH ICMP6, multicast listener report v2, 2 group record(s), length 48
22:40:49.969236 IP6 :: > ff02::1:ffd1:d4f0: ICMP6, neighbor solicitation, who has fe80::4ca6:54ff:fed1:d4f0, length 24
22:40:50.066061 IP6 :: > ff02::16: HBH ICMP6, multicast listener report v2, 1 group record(s), length 28
22:40:50.222026 IP6 :: > ff02::1:ffb4:a0aa: ICMP6, neighbor solicitation, who has fe80::d01a:a8ff:feb4:a0aa, length 24
22:40:50.392955 IP6 fe80::9423:61ff:fed6:2eac > ff02::16: HBH ICMP6, multicast listener report v2, 1 group record(s), length 28
22:40:50.410058 IP6 fe80::9423:61ff:fed6:2eac > ff02::16: HBH ICMP6, multicast listener report v2, 1 group record(s), length 28
22:40:50.438586 IP6 fe80::9423:61ff:fed6:2eac.5353 > ff02::fb.5353: 0*- [0q] 2/0/0 PTR _workstation._tcp.local., PTR floodlight [96:23:61:d6:2e:ac]._workstation._tcp.local. (117)
22:40:50.512628 IP6 fe80::9423:61ff:fed6:2eac.5353 > ff02::fb.5353: 0 [3q] [5n] ANY (QM)? floodlight [96:23:61:d6:2e:ac]._workstation._tcp.local. ANY (QM)? floodlight.local. ANY (QM)? c.a.e.2.6.d.e.f.f.f.1.6.3.2.4.9.0.0.0.0.0.0.0.0.0.0.0.0.0.8.e.f.ip6.arpa. (267)
22:40:50.611003 IP6 fe80::9423:61ff:fed6:2eac.5353 > ff02::fb.5353: 0 [2q] PTR (QM)? _ipps._tcp.local. PTR (QM)? _ipp._tcp.local. (45)
22:40:50.651091 IP6 fe80::6ca3:42ff:febd:4b61 > ff02::16: HBH ICMP6, multicast listener report v2, 1 group record(s), length 28
22:40:50.651116 IP6 fe80::6ca3:42ff:febd:4b61 > ff02::16: HBH ICMP6, multicast listener report v2, 1 group record(s), length 28
22:40:50.655943 IP6 fe80::6ca3:42ff:febd:4b61.5353 > ff02::fb.5353: 0*- [0q] 2/0/0 PTR _workstation._tcp.local., PTR floodlight [6e:a3:42:bd:4b:61]._workstation._tcp.local. (117)
22:40:50.695541 IP6 fe80::90d8:5fff:fe1c:de3f > ff02::16: HBH ICMP6, multicast listener report v2, 1 group record(s), length 28
22:40:50.703666 IP6 fe80::90d8:5fff:fe1c:de3f > ff02::16: HBH ICMP6, multicast listener report v2, 1 group record(s), length 28
22:40:50.725840 IP6 fe80::6ca3:42ff:febd:4b61.5353 > ff02::fb.5353: 0 [3q] [5n] ANY (QM)? floodlight [6e:a3:42:bd:4b:61]._workstation._tcp.local. ANY (QM)? floodlight.local. ANY (QM)? 1.6.b.4.d.b.e.f.f.f.2.4.3.a.c.6.0.0.0.0.0.0.0.0.0.0.0.0.0.8.e.f.ip6.arpa. (267)
22:40:50.761271 IP6 fe80::90d8:5fff:fe1c:de3f.5353 > ff02::fb.5353: 0*- [0q] 2/0/0 PTR _workstation._tcp.local., PTR floodlight [92:d8:5f:1c:de:3f]._workstation._tcp.local. (117)
22:40:50.772970 IP6 fe80::6ca3:42ff:febd:4b61.5353 > ff02::fb.5353: 0 [2q] PTR (QM)? _ipps._tcp.local. PTR (QM)? _ipp._tcp.local. (45)
22:40:50.792458 IP6 fe80::90d8:5fff:fe1c:de3f.5353 > ff02::fb.5353: 0 [3q] [5n] ANY (QM)? floodlight [92:d8:5f:1c:de:3f]._workstation._tcp.local. ANY (QM)? floodlight.local. ANY (QM)? f.3.e.d.c.1.e.f.f.f.f.5.8.d.0.9.0.0.0.0.0.0.0.0.0.0.0.0.0.8.e.f.ip6.arpa. (267)
22:40:50.798516 IP6 fe80::90d8:5fff:fe1c:de3f.5353 > ff02::fb.5353: 0 [2q] PTR (QM)? _ipps._tcp.local. PTR (QM)? _ipp._tcp.local. (45)
22:40:50.939330 IP6 fe80::9423:61ff:fed6:2eac.5353 > ff02::fb.5353: 0 [3q] [5n] ANY (QM)? floodlight [96:23:61:d6:2e:ac]._workstation._tcp.local. ANY (QM)? floodlight.local. ANY (QM)? c.a.e.2.6.d.e.f.f.f.1.6.3.2.4.9.0.0.0.0.0.0.0.0.0.0.0.0.0.8.e.f.ip6.arpa. (267)
22:40:51.039001 IP6 fe80::90d8:5fff:fe1c:de3f.5353 > ff02::fb.5353: 0 [3q] [5n] ANY (QM)? floodlight [92:d8:5f:1c:de:3f]._workstation._tcp.local. ANY (QM)? floodlight.local. ANY (QM)? f.3.e.d.c.1.e.f.f.f.f.5.8.d.0.9.0.0.0.0.0.0.0.0.0.0.0.0.0.8.e.f.ip6.arpa. (267)
22:40:51.117465 IP6 fe80::6ca3:42ff:febd:4b61.5353 > ff02::fb.5353: 0 [3q] [5n] ANY (QM)? floodlight [6e:a3:42:bd:4b:61]._workstation._tcp.local. ANY (QM)? floodlight.local. ANY (QM)? 1.6.b.4.d.b.e.f.f.f.2.4.3.a.c.6.0.0.0.0.0.0.0.0.0.0.0.0.0.8.e.f.ip6.arpa. (267)
22:40:51.117491 IP6 fe80::9423:61ff:fed6:2eac > ff02::16: HBH ICMP6, multicast listener report v2, 1 group record(s), length 28
22:40:51.118077 IP6 fe80::4ca6:54ff:fed1:d4f0 > ff02::16: HBH ICMP6, multicast listener report v2, 1 group record(s), length 28
22:40:51.119071 IP6 fe80::4ca6:54ff:fed1:d4f0 > ff02::16: HBH ICMP6, multicast listener report v2, 1 group record(s), length 28
22:40:51.203643 IP6 fe80::90d8:5fff:fe1c:de3f > ff02::16: HBH ICMP6, multicast listener report v2, 1 group record(s), length 28
22:40:51.304034 IP6 fe80::90d8:5fff:fe1c:de3f.5353 > ff02::fb.5353: 0 [3q] [5n] ANY (QM)? floodlight [92:d8:5f:1c:de:3f]._workstation._tcp.local. ANY (QM)? floodlight.local. ANY (QM)? f.3.e.d.c.1.e.f.f.f.f.5.8.d.0.9.0.0.0.0.0.0.0.0.0.0.0.0.0.8.e.f.ip6.arpa. (267)
22:40:51.443480 IP6 fe80::90d8:5fff:fe1c:de3f > ff02::16: HBH ICMP6, multicast listener report v2, 2 group record(s), length 48
22:40:51.501918 IP6 fe80::90d8:5fff:fe1c:de3f.5353 > ff02::fb.5353: 0*- [0q] 5/0/0 (Cache flush) TXT "", (Cache flush) AAAA fe80::90d8:5fff:fe1c:de3f, (Cache flush) PTR floodlight.local., (Cache flush) HINFO, (Cache flush) SRV floodlight.local.:9 0 0 (249)
22:40:51.538075 IP6 fe80::6ca3:42ff:febd:4b61 > ff02::16: HBH ICMP6, multicast listener report v2, 1 group record(s), length 28
22:40:51.538264 ARP, Request who-has 10.0.0.5 tell 10.0.0.4, length 28
22:40:51.538343 IP6 fe80::4ca6:54ff:fed1:d4f0.5353 > ff02::fb.5353: 0*- [0q] 2/0/0 PTR _workstation._tcp.local., PTR floodlight [4e:a6:54:d1:d4:f0]._workstation._tcp.local. (117)
22:40:51.538369 IP6 fe80::9423:61ff:fed6:2eac.5353 > ff02::fb.5353: 0 [3q] [5n] ANY (QM)? floodlight [96:23:61:d6:2e:ac]._workstation._tcp.local. ANY (QM)? floodlight.local. ANY (QM)? c.a.e.2.6.d.e.f.f.f.1.6.3.2.4.9.0.0.0.0.0.0.0.0.0.0.0.0.0.8.e.f.ip6.arpa. (267)
22:40:51.608044 LLDP, length 47
22:40:51.721318 IP6 fe80::4ca6:54ff:fed1:d4f0.5353 > ff02::fb.5353: 0 [3q] [5n] ANY (QM)? floodlight [4e:a6:54:d1:d4:f0]._workstation._tcp.local. ANY (QM)? floodlight.local. ANY (QM)? 0.f.4.d.1.d.e.f.f.f.4.5.6.a.c.4.0.0.0.0.0.0.0.0.0.0.0.0.0.8.e.f.ip6.arpa. (267)
22:40:51.721346 IP6 fe80::4ca6:54ff:fed1:d4f0.5353 > ff02::fb.5353: 0 [2q] PTR (QM)? _ipps._tcp.local. PTR (QM)? _ipp._tcp.local. (45)
22:40:51.744381 IP6 fe80::6ca3:42ff:febd:4b61.5353 > ff02::fb.5353: 0 [3q] [5n] ANY (QM)? floodlight [6e:a3:42:bd:4b:61]._workstation._tcp.local. ANY (QM)? floodlight.local. ANY (QM)? 1.6.b.4.d.b.e.f.f.f.2.4.3.a.c.6.0.0.0.0.0.0.0.0.0.0.0.0.0.8.e.f.ip6.arpa. (267)
22:40:51.796153 IP6 fe80::90d8:5fff:fe1c:de3f.5353 > ff02::fb.5353: 0*- [0q] 2/0/0 PTR _workstation._tcp.local., PTR floodlight [92:d8:5f:1c:de:3f]._workstation._tcp.local. (117)
22:40:51.817769 IP6 fe80::90d8:5fff:fe1c:de3f.5353 > ff02::fb.5353: 0 [2q] PTR (QM)? _ipps._tcp.local. PTR (QM)? _ipp._tcp.local. (45)
22:40:51.918285 92:d8:5f:1c:de:3f > ff:ff:ff:ff:ff:ff, ethertype Unknown (0x8942), length 69: 
	0x0000:  2000 0604 0002 0000 0207 0400 0000 0000  ................
	0x0010:  0d04 0302 0003 0602 0078 fe0c 0026 e100  .........x...&..
	0x0020:  0000 0000 0000 000d 1808 0031 3791 7786  ...........17.w.
	0x0030:  1ff2 e601 0100 00                        .......
22:40:51.919048 IP6 fe80::6ca3:42ff:febd:4b61 > ff02::16: HBH ICMP6, multicast listener report v2, 2 group record(s), length 48
22:40:51.919074 IP6 fe80::d01a:a8ff:feb4:a0aa > ff02::16: HBH ICMP6, multicast listener report v2, 1 group record(s), length 28
22:40:51.923984 IP6 fe80::d01a:a8ff:feb4:a0aa > ff02::16: HBH ICMP6, multicast listener report v2, 1 group record(s), length 28
22:40:51.924009 IP6 fe80::6ca3:42ff:febd:4b61.5353 > ff02::fb.5353: 0*- [0q] 5/0/0 (Cache flush) TXT "", (Cache flush) AAAA fe80::6ca3:42ff:febd:4b61, (Cache flush) PTR floodlight.local., (Cache flush) HINFO, (Cache flush) SRV floodlight.local.:9 0 0 (249)
22:40:51.924035 IP6 fe80::d01a:a8ff:feb4:a0aa.5353 > ff02::fb.5353: 0*- [0q] 2/0/0 PTR _workstation._tcp.local., PTR floodlight [d2:1a:a8:b4:a0:aa]._workstation._tcp.local. (117)
22:40:51.990637 IP6 fe80::9423:61ff:fed6:2eac.5353 > ff02::fb.5353: 0*- [0q] 5/0/0 (Cache flush) TXT "", (Cache flush) AAAA fe80::9423:61ff:fed6:2eac, (Cache flush) PTR floodlight.local., (Cache flush) HINFO, (Cache flush) SRV floodlight.local.:9 0 0 (249)
22:40:51.990677 IP6 fe80::4ca6:54ff:fed1:d4f0.5353 > ff02::fb.5353: 0 [3q] [5n] ANY (QM)? floodlight [4e:a6:54:d1:d4:f0]._workstation._tcp.local. ANY (QM)? floodlight.local. ANY (QM)? 0.f.4.d.1.d.e.f.f.f.4.5.6.a.c.4.0.0.0.0.0.0.0.0.0.0.0.0.0.8.e.f.ip6.arpa. (267)
22:40:51.990873 IP6 fe80::9423:61ff:fed6:2eac > ff02::16: HBH ICMP6, multicast listener report v2, 2 group record(s), length 48
22:40:51.990900 IP6 fe80::6ca3:42ff:febd:4b61.5353 > ff02::fb.5353: 0*- [0q] 2/0/0 PTR _workstation._tcp.local., PTR floodlight [6e:a3:42:bd:4b:61]._workstation._tcp.local. (117)
22:40:51.991242 IP6 fe80::d01a:a8ff:feb4:a0aa.5353 > ff02::fb.5353: 0 [3q] [5n] ANY (QM)? floodlight [d2:1a:a8:b4:a0:aa]._workstation._tcp.local. ANY (QM)? floodlight.local. ANY (QM)? a.a.0.a.4.b.e.f.f.f.8.a.a.1.0.d.0.0.0.0.0.0.0.0.0.0.0.0.0.8.e.f.ip6.arpa. (267)
22:40:51.991269 IP6 fe80::6ca3:42ff:febd:4b61.5353 > ff02::fb.5353: 0 [2q] PTR (QM)? _ipps._tcp.local. PTR (QM)? _ipp._tcp.local. (45)
22:40:52.528293 IP6 fe80::90d8:5fff:fe1c:de3f.5353 > ff02::fb.5353: 0*- [0q] 5/0/0 (Cache flush) TXT "", (Cache flush) AAAA fe80::90d8:5fff:fe1c:de3f, (Cache flush) PTR floodlight.local., (Cache flush) HINFO, (Cache flush) SRV floodlight.local.:9 0 0 (249)
22:40:52.912154 IP6 fe80::d01a:a8ff:feb4:a0aa > ff02::16: HBH ICMP6, multicast listener report v2, 1 group record(s), length 28
22:40:52.912423 IP6 fe80::d01a:a8ff:feb4:a0aa.5353 > ff02::fb.5353: 0 [2q] PTR (QM)? _ipps._tcp.local. PTR (QM)? _ipp._tcp.local. (45)
22:40:52.912449 IP6 fe80::d01a:a8ff:feb4:a0aa > ff02::16: HBH ICMP6, multicast listener report v2, 2 group record(s), length 48
22:40:52.912475 IP6 fe80::4ca6:54ff:fed1:d4f0 > ff02::16: HBH ICMP6, multicast listener report v2, 2 group record(s), length 48
22:40:52.995363 IP6 fe80::4ca6:54ff:fed1:d4f0 > ff02::16: HBH ICMP6, multicast listener report v2, 1 group record(s), length 28
22:40:53.001394 IP6 fe80::d01a:a8ff:feb4:a0aa.5353 > ff02::fb.5353: 0 [3q] [5n] ANY (QM)? floodlight [d2:1a:a8:b4:a0:aa]._workstation._tcp.local. ANY (QM)? floodlight.local. ANY (QM)? a.a.0.a.4.b.e.f.f.f.8.a.a.1.0.d.0.0.0.0.0.0.0.0.0.0.0.0.0.8.e.f.ip6.arpa. (267)
22:40:53.026706 IP6 fe80::d01a:a8ff:feb4:a0aa.5353 > ff02::fb.5353: 0 [3q] [5n] ANY (QM)? floodlight [d2:1a:a8:b4:a0:aa]._workstation._tcp.local. ANY (QM)? floodlight.local. ANY (QM)? a.a.0.a.4.b.e.f.f.f.8.a.a.1.0.d.0.0.0.0.0.0.0.0.0.0.0.0.0.8.e.f.ip6.arpa. (267)
22:40:53.088219 IP6 fe80::9423:61ff:fed6:2eac.5353 > ff02::fb.5353: 0*- [0q] 2/0/0 PTR _workstation._tcp.local., PTR floodlight [96:23:61:d6:2e:ac]._workstation._tcp.local. (117)
22:40:53.091190 IP6 fe80::9423:61ff:fed6:2eac.5353 > ff02::fb.5353: 0 [2q] PTR (QM)? _ipps._tcp.local. PTR (QM)? _ipp._tcp.local. (45)
22:40:53.100686 IP6 fe80::4ca6:54ff:fed1:d4f0.5353 > ff02::fb.5353: 0 [3q] [5n] ANY (QM)? floodlight [4e:a6:54:d1:d4:f0]._workstation._tcp.local. ANY (QM)? floodlight.local. ANY (QM)? 0.f.4.d.1.d.e.f.f.f.4.5.6.a.c.4.0.0.0.0.0.0.0.0.0.0.0.0.0.8.e.f.ip6.arpa. (267)
22:40:53.463453 IP6 :: > ff02::16: HBH ICMP6, multicast listener report v2, 1 group record(s), length 28
22:40:53.603567 IP6 :: > ff02::1:ff1c:de3f: ICMP6, neighbor solicitation, who has fe80::90d8:5fff:fe1c:de3f, length 24
22:40:53.604314 IP 0.0.0.0.68 > 255.255.255.255.67: BOOTP/DHCP, Request from 92:d8:5f:1c:de:3f, length 300
22:40:53.800545 IP6 fe80::4ca6:54ff:fed1:d4f0.5353 > ff02::fb.5353: 0*- [0q] 2/0/0 (Cache flush) TXT "", (Cache flush) SRV floodlight.local.:9 0 0 (110)
22:40:53.800580 IP6 fe80::4ca6:54ff:fed1:d4f0.5353 > ff02::fb.5353: 0*- [0q] 3/0/0 (Cache flush) HINFO, (Cache flush) AAAA fe80::4ca6:54ff:fed1:d4f0, (Cache flush) PTR floodlight.local. (167)
22:40:53.800615 IP6 fe80::d01a:a8ff:feb4:a0aa.5353 > ff02::fb.5353: 0*- [0q] 5/0/0 (Cache flush) TXT "", (Cache flush) AAAA fe80::d01a:a8ff:feb4:a0aa, (Cache flush) PTR floodlight.local., (Cache flush) HINFO, (Cache flush) SRV floodlight.local.:9 0 0 (249)
22:40:53.800649 IP6 fe80::d01a:a8ff:feb4:a0aa.5353 > ff02::fb.5353: 0 [2q] PTR (QM)? _ipps._tcp.local. PTR (QM)? _ipp._tcp.local. (45)
22:40:53.800684 IP6 fe80::d01a:a8ff:feb4:a0aa.5353 > ff02::fb.5353: 0*- [0q] 2/0/0 PTR _workstation._tcp.local., PTR floodlight [d2:1a:a8:b4:a0:aa]._workstation._tcp.local. (117)
22:40:53.800719 IP6 fe80::6ca3:42ff:febd:4b61.5353 > ff02::fb.5353: 0*- [0q] 5/0/0 (Cache flush) TXT "", (Cache flush) AAAA fe80::6ca3:42ff:febd:4b61, (Cache flush) PTR floodlight.local., (Cache flush) HINFO, (Cache flush) SRV floodlight.local.:9 0 0 (249)
22:40:53.800754 IP6 fe80::4ca6:54ff:fed1:d4f0.5353 > ff02::fb.5353: 0*- [0q] 2/0/0 PTR _workstation._tcp.local., PTR floodlight [4e:a6:54:d1:d4:f0]._workstation._tcp.local. (117)
22:40:53.801446 IP6 fe80::4ca6:54ff:fed1:d4f0.5353 > ff02::fb.5353: 0 [2q] PTR (QM)? _ipps._tcp.local. PTR (QM)? _ipp._tcp.local. (45)
22:40:53.851592 IP6 :: > ff02::16: HBH ICMP6, multicast listener report v2, 1 group record(s), length 28
22:40:54.281227 IP6 :: > ff02::16: HBH ICMP6, multicast listener report v2, 1 group record(s), length 28
22:40:54.328755 IP6 :: > ff02::16: HBH ICMP6, multicast listener report v2, 1 group record(s), length 28
22:40:54.330895 IP 0.0.0.0.68 > 255.255.255.255.67: BOOTP/DHCP, Request from 4e:a6:54:d1:d4:f0, length 300
22:40:54.366854 IP6 fe80::9423:61ff:fed6:2eac.5353 > ff02::fb.5353: 0*- [0q] 5/0/0 (Cache flush) TXT "", (Cache flush) AAAA fe80::9423:61ff:fed6:2eac, (Cache flush) PTR floodlight.local., (Cache flush) HINFO, (Cache flush) SRV floodlight.local.:9 0 0 (249)
22:40:54.372596 IP6 :: > ff02::16: HBH ICMP6, multicast listener report v2, 1 group record(s), length 28
22:40:54.372993 IP 0.0.0.0.68 > 255.255.255.255.67: BOOTP/DHCP, Request from 6e:a3:42:bd:4b:61, length 300
22:40:54.373155 IP6 :: > ff02::16: HBH ICMP6, multicast listener report v2, 1 group record(s), length 28
22:40:54.373191 IP 0.0.0.0.68 > 255.255.255.255.67: BOOTP/DHCP, Request from d2:1a:a8:b4:a0:aa, length 300
22:40:54.373226 IP6 :: > ff02::16: HBH ICMP6, multicast listener report v2, 1 group record(s), length 28
22:40:54.373260 ARP, Request who-has 10.0.0.6 tell 10.0.0.4, length 28
22:40:54.373296 IP6 :: > ff02::1:ffbd:4b61: ICMP6, neighbor solicitation, who has fe80::6ca3:42ff:febd:4b61, length 24
22:40:54.374687 ARP, Reply 10.0.0.6 is-at 42:b7:f3:57:e5:80, length 28
22:40:54.375179 IP6 :: > ff02::16: HBH ICMP6, multicast listener report v2, 2 group record(s), length 48
22:40:54.603638 IP6 fe80::90d8:5fff:fe1c:de3f > ff02::16: HBH ICMP6, multicast listener report v2, 1 group record(s), length 28
22:40:54.603674 IP6 fe80::90d8:5fff:fe1c:de3f > ff02::2: ICMP6, router solicitation, length 16
22:40:54.611577 IP6 fe80::90d8:5fff:fe1c:de3f > ff02::16: HBH ICMP6, multicast listener report v2, 1 group record(s), length 28
22:40:54.668905 IP6 fe80::90d8:5fff:fe1c:de3f.5353 > ff02::fb.5353: 0*- [0q] 2/0/0 PTR _workstation._tcp.local., PTR floodlight [92:d8:5f:1c:de:3f]._workstation._tcp.local. (117)
22:40:54.696759 IP6 fe80::90d8:5fff:fe1c:de3f.5353 > ff02::fb.5353: 0 [3q] [5n] ANY (QM)? floodlight [92:d8:5f:1c:de:3f]._workstation._tcp.local. ANY (QM)? floodlight.local. ANY (QM)? f.3.e.d.c.1.e.f.f.f.f.5.8.d.0.9.0.0.0.0.0.0.0.0.0.0.0.0.0.8.e.f.ip6.arpa. (267)
22:40:54.708389 IP6 fe80::90d8:5fff:fe1c:de3f.5353 > ff02::fb.5353: 0 [2q] PTR (QM)? _ipps._tcp.local. PTR (QM)? _ipp._tcp.local. (45)
22:40:54.907601 IP6 fe80::90d8:5fff:fe1c:de3f > ff02::16: HBH ICMP6, multicast listener report v2, 1 group record(s), length 28
22:40:54.931477 IP6 fe80::90d8:5fff:fe1c:de3f > ff02::16: HBH ICMP6, multicast listener report v2, 2 group record(s), length 48
22:40:54.941039 IP6 fe80::90d8:5fff:fe1c:de3f.5353 > ff02::fb.5353: 0 [3q] [5n] ANY (QM)? floodlight [92:d8:5f:1c:de:3f]._workstation._tcp.local. ANY (QM)? floodlight.local. ANY (QM)? f.3.e.d.c.1.e.f.f.f.f.5.8.d.0.9.0.0.0.0.0.0.0.0.0.0.0.0.0.8.e.f.ip6.arpa. (267)
22:40:55.195959 IP6 fe80::90d8:5fff:fe1c:de3f.5353 > ff02::fb.5353: 0 [3q] [5n] ANY (QM)? floodlight [92:d8:5f:1c:de:3f]._workstation._tcp.local. ANY (QM)? floodlight.local. ANY (QM)? f.3.e.d.c.1.e.f.f.f.f.5.8.d.0.9.0.0.0.0.0.0.0.0.0.0.0.0.0.8.e.f.ip6.arpa. (267)
22:40:55.260487 IP6 :: > ff02::16: HBH ICMP6, multicast listener report v2, 2 group record(s), length 48
22:40:55.276392 IP 0.0.0.0.68 > 255.255.255.255.67: BOOTP/DHCP, Request from 96:23:61:d6:2e:ac, length 300
22:40:55.276427 IP6 :: > ff02::1:ffd6:2eac: ICMP6, neighbor solicitation, who has fe80::9423:61ff:fed6:2eac, length 24
22:40:55.276507 IP6 :: > ff02::16: HBH ICMP6, multicast listener report v2, 1 group record(s), length 28
22:40:55.276555 IP6 :: > ff02::1:ffd1:d4f0: ICMP6, neighbor solicitation, who has fe80::4ca6:54ff:fed1:d4f0, length 24
22:40:55.276591 IP6 :: > ff02::16: HBH ICMP6, multicast listener report v2, 1 group record(s), length 28
22:40:55.276626 ARP, Request who-has 10.0.0.6 tell 10.0.0.4, length 28
22:40:55.277050 IP6 :: > ff02::1:ffb4:a0aa: ICMP6, neighbor solicitation, who has fe80::d01a:a8ff:feb4:a0aa, length 24
22:40:55.277085 IP6 fe80::9423:61ff:fed6:2eac > ff02::16: HBH ICMP6, multicast listener report v2, 1 group record(s), length 28
22:40:55.277120 IP6 fe80::9423:61ff:fed6:2eac > ff02::2: ICMP6, router solicitation, length 16
22:40:55.278230 ARP, Reply 10.0.0.6 is-at 42:b7:f3:57:e5:80, length 28
22:40:55.345052 IP6 fe80::9423:61ff:fed6:2eac > ff02::16: HBH ICMP6, multicast listener report v2, 1 group record(s), length 28
22:40:55.345854 IP6 fe80::9423:61ff:fed6:2eac.5353 > ff02::fb.5353: 0*- [0q] 2/0/0 PTR _workstation._tcp.local., PTR floodlight [96:23:61:d6:2e:ac]._workstation._tcp.local. (117)
22:40:55.345890 IP6 fe80::9423:61ff:fed6:2eac.5353 > ff02::fb.5353: 0 [2q] PTR (QM)? _ipps._tcp.local. PTR (QM)? _ipp._tcp.local. (45)
22:40:55.345925 IP6 fe80::9423:61ff:fed6:2eac > ff02::16: HBH ICMP6, multicast listener report v2, 2 group record(s), length 48
22:40:55.345961 IP6 fe80::9423:61ff:fed6:2eac > ff02::16: HBH ICMP6, multicast listener report v2, 1 group record(s), length 28
22:40:55.396551 IP6 fe80::90d8:5fff:fe1c:de3f.5353 > ff02::fb.5353: 0*- [0q] 5/0/0 (Cache flush) TXT "", (Cache flush) AAAA fe80::90d8:5fff:fe1c:de3f, (Cache flush) PTR floodlight.local., (Cache flush) HINFO, (Cache flush) SRV floodlight.local.:9 0 0 (249)
22:40:55.597163 IP 10.0.0.4 > 10.0.0.6: ICMP echo request, id 4055, seq 1, length 64
22:40:55.598299 IP 10.0.0.6 > 10.0.0.4: ICMP echo reply, id 4055, seq 1, length 64
22:40:55.700438 IP6 fe80::90d8:5fff:fe1c:de3f.5353 > ff02::fb.5353: 0*- [0q] 2/0/0 PTR _workstation._tcp.local., PTR floodlight [92:d8:5f:1c:de:3f]._workstation._tcp.local. (117)
22:40:55.708414 IP6 fe80::90d8:5fff:fe1c:de3f.5353 > ff02::fb.5353: 0 [2q] PTR (QM)? _ipps._tcp.local. PTR (QM)? _ipp._tcp.local. (45)
22:40:55.784922 IP6 fe80::9423:61ff:fed6:2eac.5353 > ff02::fb.5353: 0 [3q] [5n] ANY (QM)? floodlight [96:23:61:d6:2e:ac]._workstation._tcp.local. ANY (QM)? floodlight.local. ANY (QM)? c.a.e.2.6.d.e.f.f.f.1.6.3.2.4.9.0.0.0.0.0.0.0.0.0.0.0.0.0.8.e.f.ip6.arpa. (267)
22:40:55.785350 IP6 fe80::6ca3:42ff:febd:4b61 > ff02::16: HBH ICMP6, multicast listener report v2, 1 group record(s), length 28
22:40:55.785385 IP6 fe80::6ca3:42ff:febd:4b61 > ff02::2: ICMP6, router solicitation, length 16
22:40:55.785420 IP6 fe80::6ca3:42ff:febd:4b61 > ff02::16: HBH ICMP6, multicast listener report v2, 1 group record(s), length 28
22:40:55.785481 IP6 fe80::6ca3:42ff:febd:4b61.5353 > ff02::fb.5353: 0*- [0q] 2/0/0 PTR _workstation._tcp.local., PTR floodlight [6e:a3:42:bd:4b:61]._workstation._tcp.local. (117)
22:40:55.785553 IP6 fe80::6ca3:42ff:febd:4b61.5353 > ff02::fb.5353: 0 [3q] [5n] ANY (QM)? floodlight [6e:a3:42:bd:4b:61]._workstation._tcp.local. ANY (QM)? floodlight.local. ANY (QM)? 1.6.b.4.d.b.e.f.f.f.2.4.3.a.c.6.0.0.0.0.0.0.0.0.0.0.0.0.0.8.e.f.ip6.arpa. (267)
22:40:55.786241 IP6 fe80::6ca3:42ff:febd:4b61.5353 > ff02::fb.5353: 0 [2q] PTR (QM)? _ipps._tcp.local. PTR (QM)? _ipp._tcp.local. (45)
22:40:55.788581 IP6 fe80::d01a:a8ff:feb4:a0aa > ff02::16: HBH ICMP6, multicast listener report v2, 1 group record(s), length 28
22:40:55.788743 IP6 fe80::d01a:a8ff:feb4:a0aa > ff02::2: ICMP6, router solicitation, length 16
22:40:55.788777 IP6 fe80::d01a:a8ff:feb4:a0aa > ff02::16: HBH ICMP6, multicast listener report v2, 1 group record(s), length 28
22:40:55.788936 IP6 fe80::d01a:a8ff:feb4:a0aa.5353 > ff02::fb.5353: 0*- [0q] 2/0/0 PTR _workstation._tcp.local., PTR floodlight [d2:1a:a8:b4:a0:aa]._workstation._tcp.local. (117)
22:40:55.813374 IP6 fe80::d01a:a8ff:feb4:a0aa.5353 > ff02::fb.5353: 0 [3q] [5n] ANY (QM)? floodlight [d2:1a:a8:b4:a0:aa]._workstation._tcp.local. ANY (QM)? floodlight.local. ANY (QM)? a.a.0.a.4.b.e.f.f.f.8.a.a.1.0.d.0.0.0.0.0.0.0.0.0.0.0.0.0.8.e.f.ip6.arpa. (267)
22:40:55.825898 IP6 fe80::6ca3:42ff:febd:4b61.5353 > ff02::fb.5353: 0 [3q] [5n] ANY (QM)? floodlight [6e:a3:42:bd:4b:61]._workstation._tcp.local. ANY (QM)? floodlight.local. ANY (QM)? 1.6.b.4.d.b.e.f.f.f.2.4.3.a.c.6.0.0.0.0.0.0.0.0.0.0.0.0.0.8.e.f.ip6.arpa. (267)
22:40:56.199039 IP6 fe80::4ca6:54ff:fed1:d4f0 > ff02::16: HBH ICMP6, multicast listener report v2, 1 group record(s), length 28
22:40:56.199406 IP6 fe80::4ca6:54ff:fed1:d4f0 > ff02::2: ICMP6, router solicitation, length 16
22:40:56.205486 IP6 fe80::4ca6:54ff:fed1:d4f0 > ff02::16: HBH ICMP6, multicast listener report v2, 1 group record(s), length 28
22:40:56.207177 IP6 fe80::4ca6:54ff:fed1:d4f0.5353 > ff02::fb.5353: 0*- [0q] 2/0/0 PTR _workstation._tcp.local., PTR floodlight [4e:a6:54:d1:d4:f0]._workstation._tcp.local. (117)
22:40:56.207213 IP6 fe80::4ca6:54ff:fed1:d4f0.5353 > ff02::fb.5353: 0 [3q] [5n] ANY (QM)? floodlight [4e:a6:54:d1:d4:f0]._workstation._tcp.local. ANY (QM)? floodlight.local. ANY (QM)? 0.f.4.d.1.d.e.f.f.f.4.5.6.a.c.4.0.0.0.0.0.0.0.0.0.0.0.0.0.8.e.f.ip6.arpa. (267)
22:40:56.207247 IP6 fe80::4ca6:54ff:fed1:d4f0.5353 > ff02::fb.5353: 0 [2q] PTR (QM)? _ipps._tcp.local. PTR (QM)? _ipp._tcp.local. (45)
22:40:56.207498 IP6 fe80::4ca6:54ff:fed1:d4f0 > ff02::16: HBH ICMP6, multicast listener report v2, 2 group record(s), length 48
22:40:56.212170 IP6 fe80::4ca6:54ff:fed1:d4f0.5353 > ff02::fb.5353: 0 [3q] [5n] ANY (QM)? floodlight [4e:a6:54:d1:d4:f0]._workstation._tcp.local. ANY (QM)? floodlight.local. ANY (QM)? 0.f.4.d.1.d.e.f.f.f.4.5.6.a.c.4.0.0.0.0.0.0.0.0.0.0.0.0.0.8.e.f.ip6.arpa. (267)
22:40:56.212205 IP6 fe80::9423:61ff:fed6:2eac.5353 > ff02::fb.5353: 0 [3q] [5n] ANY (QM)? floodlight [96:23:61:d6:2e:ac]._workstation._tcp.local. ANY (QM)? floodlight.local. ANY (QM)? c.a.e.2.6.d.e.f.f.f.1.6.3.2.4.9.0.0.0.0.0.0.0.0.0.0.0.0.0.8.e.f.ip6.arpa. (267)
22:40:56.212240 IP6 fe80::9423:61ff:fed6:2eac.5353 > ff02::fb.5353: 0*- [0q] 5/0/0 (Cache flush) TXT "", (Cache flush) AAAA fe80::9423:61ff:fed6:2eac, (Cache flush) PTR floodlight.local., (Cache flush) HINFO, (Cache flush) SRV floodlight.local.:9 0 0 (249)
22:40:56.227213 IP6 fe80::4ca6:54ff:fed1:d4f0.5353 > ff02::fb.5353: 0 [3q] [5n] ANY (QM)? floodlight [4e:a6:54:d1:d4:f0]._workstation._tcp.local. ANY (QM)? floodlight.local. ANY (QM)? 0.f.4.d.1.d.e.f.f.f.4.5.6.a.c.4.0.0.0.0.0.0.0.0.0.0.0.0.0.8.e.f.ip6.arpa. (267)
22:40:56.244259 IP6 fe80::6ca3:42ff:febd:4b61.5353 > ff02::fb.5353: 0 [3q] [5n] ANY (QM)? floodlight [6e:a3:42:bd:4b:61]._workstation._tcp.local. ANY (QM)? floodlight.local. ANY (QM)? 1.6.b.4.d.b.e.f.f.f.2.4.3.a.c.6.0.0.0.0.0.0.0.0.0.0.0.0.0.8.e.f.ip6.arpa. (267)
22:40:56.244294 IP6 fe80::6ca3:42ff:febd:4b61 > ff02::16: HBH ICMP6, multicast listener report v2, 2 group record(s), length 48
22:40:56.244329 IP6 fe80::d01a:a8ff:feb4:a0aa.5353 > ff02::fb.5353: 0 [2q] PTR (QM)? _ipps._tcp.local. PTR (QM)? _ipp._tcp.local. (45)
22:40:56.244364 ARP, Request who-has 10.0.0.6 tell 10.0.0.4, length 28
22:40:56.244970 IP6 fe80::d01a:a8ff:feb4:a0aa.5353 > ff02::fb.5353: 0 [3q] [5n] ANY (QM)? floodlight [d2:1a:a8:b4:a0:aa]._workstation._tcp.local. ANY (QM)? floodlight.local. ANY (QM)? a.a.0.a.4.b.e.f.f.f.8.a.a.1.0.d.0.0.0.0.0.0.0.0.0.0.0.0.0.8.e.f.ip6.arpa. (267)
22:40:56.245006 IP6 fe80::d01a:a8ff:feb4:a0aa > ff02::16: HBH ICMP6, multicast listener report v2, 2 group record(s), length 48
22:40:56.245041 IP6 fe80::d01a:a8ff:feb4:a0aa.5353 > ff02::fb.5353: 0 [3q] [5n] ANY (QM)? floodlight [d2:1a:a8:b4:a0:aa]._workstation._tcp.local. ANY (QM)? floodlight.local. ANY (QM)? a.a.0.a.4.b.e.f.f.f.8.a.a.1.0.d.0.0.0.0.0.0.0.0.0.0.0.0.0.8.e.f.ip6.arpa. (267)
22:40:56.245076 IP6 fe80::6ca3:42ff:febd:4b61 > ff02::16: HBH ICMP6, multicast listener report v2, 1 group record(s), length 28
22:40:56.245111 IP6 fe80::9423:61ff:fed6:2eac.5353 > ff02::fb.5353: 0*- [0q] 2/0/0 PTR _workstation._tcp.local., PTR floodlight [96:23:61:d6:2e:ac]._workstation._tcp.local. (117)
22:40:56.245643 ARP, Reply 10.0.0.6 is-at 42:b7:f3:57:e5:80, length 28
22:40:56.253376 IP6 fe80::9423:61ff:fed6:2eac.5353 > ff02::fb.5353: 0 [2q] PTR (QM)? _ipps._tcp.local. PTR (QM)? _ipp._tcp.local. (45)
22:40:56.253411 IP6 fe80::4ca6:54ff:fed1:d4f0.5353 > ff02::fb.5353: 0*- [0q] 5/0/0 (Cache flush) TXT "", (Cache flush) AAAA fe80::4ca6:54ff:fed1:d4f0, (Cache flush) PTR floodlight.local., (Cache flush) HINFO, (Cache flush) SRV floodlight.local.:9 0 0 (249)
22:40:56.253446 IP6 fe80::4ca6:54ff:fed1:d4f0 > ff02::16: HBH ICMP6, multicast listener report v2, 1 group record(s), length 28
22:40:56.253481 IP6 fe80::4ca6:54ff:fed1:d4f0.5353 > ff02::fb.5353: 0*- [0q] 2/0/0 PTR _workstation._tcp.local., PTR floodlight [4e:a6:54:d1:d4:f0]._workstation._tcp.local. (117)
22:40:56.253516 IP6 fe80::4ca6:54ff:fed1:d4f0.5353 > ff02::fb.5353: 0 [2q] PTR (QM)? _ipps._tcp.local. PTR (QM)? _ipp._tcp.local. (45)
22:40:56.253551 IP6 fe80::6ca3:42ff:febd:4b61.5353 > ff02::fb.5353: 0*- [0q] 2/0/0 PTR _workstation._tcp.local., PTR floodlight [6e:a3:42:bd:4b:61]._workstation._tcp.local. (117)
22:40:56.337343 IP 0.0.0.0.68 > 255.255.255.255.67: BOOTP/DHCP, Request from 92:d8:5f:1c:de:3f, length 300
22:40:56.426074 IP6 fe80::90d8:5fff:fe1c:de3f.5353 > ff02::fb.5353: 0*- [0q] 5/0/0 (Cache flush) TXT "", (Cache flush) AAAA fe80::90d8:5fff:fe1c:de3f, (Cache flush) PTR floodlight.local., (Cache flush) HINFO, (Cache flush) SRV floodlight.local.:9 0 0 (249)
22:40:56.521210 IP 0.0.0.0.68 > 255.255.255.255.67: BOOTP/DHCP, Request from 4e:a6:54:d1:d4:f0, length 300
22:40:56.542745 IP6 fe80::6ca3:42ff:febd:4b61.5353 > ff02::fb.5353: 0 [2q] PTR (QM)? _ipps._tcp.local. PTR (QM)? _ipp._tcp.local. (45)
22:40:56.548699 IP6 fe80::9423:61ff:fed6:2eac.5353 > ff02::fb.5353: 0*- [0q] 5/0/0 (Cache flush) TXT "", (Cache flush) AAAA fe80::9423:61ff:fed6:2eac, (Cache flush) PTR floodlight.local., (Cache flush) HINFO, (Cache flush) SRV floodlight.local.:9 0 0 (249)
22:40:56.548862 IP6 fe80::d01a:a8ff:feb4:a0aa.5353 > ff02::fb.5353: 0*- [0q] 3/0/0 (Cache flush) TXT "", (Cache flush) HINFO, (Cache flush) SRV floodlight.local.:9 0 0 (135)
22:40:56.548898 IP6 fe80::d01a:a8ff:feb4:a0aa.5353 > ff02::fb.5353: 0*- [0q] 2/0/0 (Cache flush) PTR floodlight.local., (Cache flush) AAAA fe80::d01a:a8ff:feb4:a0aa (142)
22:40:56.548932 IP6 fe80::d01a:a8ff:feb4:a0aa > ff02::16: HBH ICMP6, multicast listener report v2, 1 group record(s), length 28
22:40:56.548967 IP6 fe80::d01a:a8ff:feb4:a0aa.5353 > ff02::fb.5353: 0*- [0q] 2/0/0 PTR _workstation._tcp.local., PTR floodlight [d2:1a:a8:b4:a0:aa]._workstation._tcp.local. (117)
22:40:56.549003 IP6 fe80::d01a:a8ff:feb4:a0aa.5353 > ff02::fb.5353: 0 [2q] PTR (QM)? _ipps._tcp.local. PTR (QM)? _ipp._tcp.local. (45)
22:40:56.549038 IP 0.0.0.0.68 > 255.255.255.255.67: BOOTP/DHCP, Request from 96:23:61:d6:2e:ac, length 300
22:40:56.549504 IP6 fe80::4ca6:54ff:fed1:d4f0.5353 > ff02::fb.5353: 0*- [0q] 5/0/0 (Cache flush) TXT "", (Cache flush) AAAA fe80::4ca6:54ff:fed1:d4f0, (Cache flush) PTR floodlight.local., (Cache flush) HINFO, (Cache flush) SRV floodlight.local.:9 0 0 (249)
22:40:56.637717 IP6 fe80::6ca3:42ff:febd:4b61.5353 > ff02::fb.5353: 0*- [0q] 5/0/0 (Cache flush) TXT "", (Cache flush) AAAA fe80::6ca3:42ff:febd:4b61, (Cache flush) PTR floodlight.local., (Cache flush) HINFO, (Cache flush) SRV floodlight.local.:9 0 0 (249)
22:40:56.660201 ARP, Request who-has 10.0.0.7 tell 10.0.0.4, length 28
22:40:56.879285 IP6 fe80::9423:61ff:fed6:2eac.5353 > ff02::fb.5353: 0 [2q] PTR (QM)? _ipps._tcp.local. PTR (QM)? _ipp._tcp.local. (45)
22:40:56.901159 IP6 fe80::9423:61ff:fed6:2eac.5353 > ff02::fb.5353: 0*- [0q] 5/0/0 PTR _workstation._tcp.local., PTR floodlight [96:23:61:d6:2e:ac]._workstation._tcp.local., (Cache flush) TXT "", (Cache flush) SRV floodlight.local.:9 0 0, (Cache flush) AAAA fe80::9423:61ff:fed6:2eac (189)
22:40:56.924879 IP 0.0.0.0.68 > 255.255.255.255.67: BOOTP/DHCP, Request from 6e:a3:42:bd:4b:61, length 300
22:40:57.202257 ARP, Request who-has 10.0.0.8 tell 10.0.0.4, length 28
22:40:57.311316 IP6 fe80::4ca6:54ff:fed1:d4f0.5353 > ff02::fb.5353: 0 [2q] PTR (QM)? _ipps._tcp.local. PTR (QM)? _ipp._tcp.local. (45)
22:40:57.362318 IP6 fe80::4ca6:54ff:fed1:d4f0.5353 > ff02::fb.5353: 0*- [0q] 5/0/0 PTR _workstation._tcp.local., PTR floodlight [4e:a6:54:d1:d4:f0]._workstation._tcp.local., (Cache flush) TXT "", (Cache flush) SRV floodlight.local.:9 0 0, (Cache flush) AAAA fe80::4ca6:54ff:fed1:d4f0 (189)
22:40:57.561856 IP6 fe80::9423:61ff:fed6:2eac.5353 > ff02::fb.5353: 0*- [0q] 5/0/0 (Cache flush) TXT "", (Cache flush) AAAA fe80::9423:61ff:fed6:2eac, (Cache flush) PTR floodlight.local., (Cache flush) HINFO, (Cache flush) SRV floodlight.local.:9 0 0 (249)
22:40:57.639020 ARP, Request who-has 10.0.0.1 tell 10.0.0.5, length 28
22:40:57.708459 IP6 fe80::90d8:5fff:fe1c:de3f.5353 > ff02::fb.5353: 0 [2q] PTR (QM)? _ipps._tcp.local. PTR (QM)? _ipp._tcp.local. (45)
22:40:57.726513 IP6 fe80::90d8:5fff:fe1c:de3f.5353 > ff02::fb.5353: 0*- [0q] 5/0/0 PTR _workstation._tcp.local., PTR floodlight [92:d8:5f:1c:de:3f]._workstation._tcp.local., (Cache flush) TXT "", (Cache flush) SRV floodlight.local.:9 0 0, (Cache flush) AAAA fe80::90d8:5fff:fe1c:de3f (189)
22:40:57.776894 IP6 fe80::6ca3:42ff:febd:4b61.5353 > ff02::fb.5353: 0 [2q] PTR (QM)? _ipps._tcp.local. PTR (QM)? _ipp._tcp.local. (45)
22:40:57.812927 IP6 fe80::6ca3:42ff:febd:4b61.5353 > ff02::fb.5353: 0*- [0q] 5/0/0 PTR _workstation._tcp.local., PTR floodlight [6e:a3:42:bd:4b:61]._workstation._tcp.local., (Cache flush) TXT "", (Cache flush) SRV floodlight.local.:9 0 0, (Cache flush) AAAA fe80::6ca3:42ff:febd:4b61 (189)
22:40:57.901207 IP6 fe80::d01a:a8ff:feb4:a0aa.5353 > ff02::fb.5353: 0 [2q] PTR (QM)? _ipps._tcp.local. PTR (QM)? _ipp._tcp.local. (45)
22:40:57.921951 IP6 fe80::d01a:a8ff:feb4:a0aa.5353 > ff02::fb.5353: 0*- [0q] 5/0/0 PTR _workstation._tcp.local., PTR floodlight [d2:1a:a8:b4:a0:aa]._workstation._tcp.local., (Cache flush) TXT "", (Cache flush) SRV floodlight.local.:9 0 0, (Cache flush) AAAA fe80::d01a:a8ff:feb4:a0aa (189)
22:40:58.025032 IP6 fe80::4ca6:54ff:fed1:d4f0.5353 > ff02::fb.5353: 0*- [0q] 5/0/0 (Cache flush) TXT "", (Cache flush) AAAA fe80::4ca6:54ff:fed1:d4f0, (Cache flush) PTR floodlight.local., (Cache flush) HINFO, (Cache flush) SRV floodlight.local.:9 0 0 (249)
22:40:58.178798 IP6 fe80::4ca6:54ff:fed1:d4f0 > ff02::2: ICMP6, router solicitation, length 16
22:40:58.455271 IP6 fe80::90d8:5fff:fe1c:de3f.5353 > ff02::fb.5353: 0*- [0q] 5/0/0 (Cache flush) TXT "", (Cache flush) AAAA fe80::90d8:5fff:fe1c:de3f, (Cache flush) PTR floodlight.local., (Cache flush) HINFO, (Cache flush) SRV floodlight.local.:9 0 0 (249)
22:40:58.532462 IP6 fe80::6ca3:42ff:febd:4b61.5353 > ff02::fb.5353: 0*- [0q] 5/0/0 (Cache flush) TXT "", (Cache flush) AAAA fe80::6ca3:42ff:febd:4b61, (Cache flush) PTR floodlight.local., (Cache flush) HINFO, (Cache flush) SRV floodlight.local.:9 0 0 (249)
22:40:58.611537 IP6 fe80::90d8:5fff:fe1c:de3f > ff02::2: ICMP6, router solicitation, length 16
22:40:58.634049 ARP, Request who-has 10.0.0.1 tell 10.0.0.5, length 28
22:40:58.646571 IP6 fe80::d01a:a8ff:feb4:a0aa.5353 > ff02::fb.5353: 0*- [0q] 5/0/0 (Cache flush) TXT "", (Cache flush) AAAA fe80::d01a:a8ff:feb4:a0aa, (Cache flush) PTR floodlight.local., (Cache flush) HINFO, (Cache flush) SRV floodlight.local.:9 0 0 (249)
22:40:58.727872 IP6 fe80::6ca3:42ff:febd:4b61 > ff02::2: ICMP6, router solicitation, length 16
22:40:58.796146 IP6 fe80::d01a:a8ff:feb4:a0aa > ff02::2: ICMP6, router solicitation, length 16
22:40:59.482318 IP 0.0.0.0.68 > 255.255.255.255.67: BOOTP/DHCP, Request from 4e:a6:54:d1:d4:f0, length 300
22:41:00.136853 ARP, Request who-has 10.0.0.6 tell 10.0.0.5, length 28
22:41:00.138169 ARP, Reply 10.0.0.6 is-at 42:b7:f3:57:e5:80, length 28
22:41:00.182873 IP 10.0.0.5 > 10.0.0.6: ICMP echo request, id 4123, seq 1, length 64
22:41:00.184103 IP 10.0.0.6 > 10.0.0.5: ICMP echo reply, id 4123, seq 1, length 64
22:41:00.410531 IP 0.0.0.0.68 > 255.255.255.255.67: BOOTP/DHCP, Request from d2:1a:a8:b4:a0:aa, length 300
22:41:00.529538 ARP, Request who-has 10.0.0.7 tell 10.0.0.5, length 28
22:41:00.811048 IP6 fe80::9423:61ff:fed6:2eac.5353 > ff02::fb.5353: 0 [2q] PTR (QM)? _ipps._tcp.local. PTR (QM)? _ipp._tcp.local. (45)
22:41:01.272004 IP6 fe80::4ca6:54ff:fed1:d4f0.5353 > ff02::fb.5353: 0 [2q] PTR (QM)? _ipps._tcp.local. PTR (QM)? _ipp._tcp.local. (45)
22:41:01.711258 IP6 fe80::90d8:5fff:fe1c:de3f.5353 > ff02::fb.5353: 0 [2q] PTR (QM)? _ipps._tcp.local. PTR (QM)? _ipp._tcp.local. (45)
22:41:01.733300 IP6 fe80::9423:61ff:fed6:2eac > ff02::2: ICMP6, router solicitation, length 16
22:41:01.776315 IP6 fe80::6ca3:42ff:febd:4b61.5353 > ff02::fb.5353: 0 [2q] PTR (QM)? _ipps._tcp.local. PTR (QM)? _ipp._tcp.local. (45)
22:41:01.892842 IP6 fe80::d01a:a8ff:feb4:a0aa.5353 > ff02::fb.5353: 0 [2q] PTR (QM)? _ipps._tcp.local. PTR (QM)? _ipp._tcp.local. (45)
22:41:02.186018 IP6 fe80::4ca6:54ff:fed1:d4f0 > ff02::2: ICMP6, router solicitation, length 16
22:41:02.619498 IP6 fe80::90d8:5fff:fe1c:de3f > ff02::2: ICMP6, router solicitation, length 16
22:41:02.687763 IP6 fe80::6ca3:42ff:febd:4b61 > ff02::2: ICMP6, router solicitation, length 16
