Hosth7
#######################

22:40:09.595553 IP6 fe80::2823:2bff:fe66:ddb8 > ff02::2: ICMP6, router solicitation, length 16
22:40:09.679302 IP6 fe80::c86:76ff:fe35:e9b7 > ff02::2: ICMP6, router solicitation, length 16
22:40:09.771714 IP6 fe80::c86f:e5ff:fe5d:9fc5 > ff02::2: ICMP6, router solicitation, length 16
22:40:10.311645 IP6 fe80::40b7:f3ff:fe57:e580 > ff02::2: ICMP6, router solicitation, length 16
22:40:10.418435 IP6 fe80::38f0:57ff:fe3e:e67 > ff02::2: ICMP6, router solicitation, length 16
22:40:12.134504 IP 0.0.0.0.68 > 255.255.255.255.67: BOOTP/DHCP, Request from ca:6f:e5:5d:9f:c5, length 300
22:40:16.120666 IP6 fe80::d01a:a8ff:feb4:a0aa.5353 > ff02::fb.5353: 0 [2q] PTR (QM)? _ipps._tcp.local. PTR (QM)? _ipp._tcp.local. (45)
22:40:16.865909 IP6 fe80::c86f:e5ff:fe5d:9fc5.5353 > ff02::fb.5353: 0 [2q] PTR (QM)? _ipps._tcp.local. PTR (QM)? _ipp._tcp.local. (45)
22:40:20.991186 IP 0.0.0.0.68 > 255.255.255.255.67: BOOTP/DHCP, Request from d2:1a:a8:b4:a0:aa, length 300
22:40:21.474759 LLDP, length 47
22:40:21.632519 ca:6f:e5:5d:9f:c5 > ff:ff:ff:ff:ff:ff, ethertype Unknown (0x8942), length 69: 
	0x0000:  2000 0604 0002 0000 0207 0400 0000 0000  ................
	0x0010:  0e04 0302 0002 0602 0078 fe0c 0026 e100  .........x...&..
	0x0020:  0000 0000 0000 000e 1808 0031 3791 7786  ...........17.w.
	0x0030:  1ff2 e601 0100 00                        .......
22:40:22.337224 ARP, Request who-has 10.0.0.7 tell 10.0.0.1, length 28
22:40:22.338698 ARP, Reply 10.0.0.7 is-at 2a:23:2b:66:dd:b8, length 28
22:40:22.385897 IP 10.0.0.1 > 10.0.0.7: ICMP echo request, id 4022, seq 1, length 64
22:40:22.387131 IP 10.0.0.7 > 10.0.0.1: ICMP echo reply, id 4022, seq 1, length 64
22:40:22.763880 ARP, Request who-has 10.0.0.8 tell 10.0.0.1, length 28
22:40:27.858245 IP 0.0.0.0.68 > 255.255.255.255.67: BOOTP/DHCP, Request from ca:6f:e5:5d:9f:c5, length 300
22:40:28.529537 IP 0.0.0.0.68 > 255.255.255.255.67: BOOTP/DHCP, Request from 96:23:61:d6:2e:ac, length 300
22:40:28.812172 IP 0.0.0.0.68 > 255.255.255.255.67: BOOTP/DHCP, Request from 6e:a3:42:bd:4b:61, length 300
22:40:29.778217 IP6 fe80::9423:61ff:fed6:2eac.5353 > ff02::fb.5353: 0 [2q] PTR (QM)? _ipps._tcp.local. PTR (QM)? _ipp._tcp.local. (45)
22:40:29.966319 IP6 fe80::4ca6:54ff:fed1:d4f0.5353 > ff02::fb.5353: 0 [2q] PTR (QM)? _ipps._tcp.local. PTR (QM)? _ipp._tcp.local. (45)
22:40:30.376104 IP6 fe80::6ca3:42ff:febd:4b61.5353 > ff02::fb.5353: 0 [2q] PTR (QM)? _ipps._tcp.local. PTR (QM)? _ipp._tcp.local. (45)
22:40:31.745850 IP 0.0.0.0.68 > 255.255.255.255.67: BOOTP/DHCP, Request from d2:1a:a8:b4:a0:aa, length 300
22:40:32.118721 IP6 fe80::d01a:a8ff:feb4:a0aa.5353 > ff02::fb.5353: 0 [2q] PTR (QM)? _ipps._tcp.local. PTR (QM)? _ipp._tcp.local. (45)
22:40:32.867189 IP6 fe80::c86f:e5ff:fe5d:9fc5.5353 > ff02::fb.5353: 0 [2q] PTR (QM)? _ipps._tcp.local. PTR (QM)? _ipp._tcp.local. (45)
22:40:33.419157 ARP, Request who-has 10.0.0.3 tell 10.0.0.2, length 28
22:40:33.831376 ARP, Request who-has 10.0.0.4 tell 10.0.0.2, length 28
22:40:34.292614 ARP, Request who-has 10.0.0.5 tell 10.0.0.2, length 28
22:40:35.150679 ARP, Request who-has 10.0.0.7 tell 10.0.0.2, length 28
22:40:35.151937 ARP, Reply 10.0.0.7 is-at 2a:23:2b:66:dd:b8, length 28
22:40:35.214940 IP 10.0.0.2 > 10.0.0.7: ICMP echo request, id 4029, seq 1, length 64
22:40:35.217210 IP 10.0.0.7 > 10.0.0.2: ICMP echo reply, id 4029, seq 1, length 64
22:40:35.369897 IP 0.0.0.0.68 > 255.255.255.255.67: BOOTP/DHCP, Request from 4e:a6:54:d1:d4:f0, length 300
22:40:35.764519 IP 0.0.0.0.68 > 255.255.255.255.67: BOOTP/DHCP, Request from 96:23:61:d6:2e:ac, length 300
22:40:35.813338 IP 0.0.0.0.68 > 255.255.255.255.67: BOOTP/DHCP, Request from 6e:a3:42:bd:4b:61, length 300
22:40:36.531347 LLDP, length 47
22:40:36.598920 ARP, Request who-has 10.0.0.8 tell 10.0.0.2, length 28
22:40:36.702450 ca:6f:e5:5d:9f:c5 > ff:ff:ff:ff:ff:ff, ethertype Unknown (0x8942), length 69: 
	0x0000:  2000 0604 0002 0000 0207 0400 0000 0000  ................
	0x0010:  0e04 0302 0002 0602 0078 fe0c 0026 e100  .........x...&..
	0x0020:  0000 0000 0000 000e 1808 0031 3791 7786  ...........17.w.
	0x0030:  1ff2 e601 0100 00                        .......
22:40:37.766299 ARP, Request who-has 10.0.0.4 tell 10.0.0.3, length 28
22:40:38.174852 ARP, Request who-has 10.0.0.5 tell 10.0.0.3, length 28
22:40:38.588126 ARP, Request who-has 10.0.0.6 tell 10.0.0.3, length 28
22:40:38.987940 ARP, Request who-has 10.0.0.7 tell 10.0.0.3, length 28
22:40:38.989206 ARP, Reply 10.0.0.7 is-at 2a:23:2b:66:dd:b8, length 28
22:40:39.043525 IP 10.0.0.3 > 10.0.0.7: ICMP echo request, id 4036, seq 1, length 64
22:40:39.044770 IP 10.0.0.7 > 10.0.0.3: ICMP echo reply, id 4036, seq 1, length 64
22:40:39.254317 IP 0.0.0.0.68 > 255.255.255.255.67: BOOTP/DHCP, Request from d2:1a:a8:b4:a0:aa, length 300
22:40:39.394568 ARP, Request who-has 10.0.0.8 tell 10.0.0.3, length 28
22:40:39.799023 ARP, Request who-has 10.0.0.1 tell 10.0.0.4, length 28
22:40:42.266546 IP 0.0.0.0.68 > 255.255.255.255.67: BOOTP/DHCP, Request from ca:6f:e5:5d:9f:c5, length 300
22:40:49.359602 IP6 :: > ff02::16: HBH ICMP6, multicast listener report v2, 2 group record(s), length 48
22:40:49.584390 IP6 :: > ff02::16: HBH ICMP6, multicast listener report v2, 2 group record(s), length 48
22:40:49.584416 IP6 :: > ff02::16: HBH ICMP6, multicast listener report v2, 2 group record(s), length 48
22:40:49.584442 IP6 :: > ff02::16: HBH ICMP6, multicast listener report v2, 2 group record(s), length 48
22:40:49.585545 IP6 :: > ff02::16: HBH ICMP6, multicast listener report v2, 2 group record(s), length 48
22:40:49.585571 IP6 :: > ff02::16: HBH ICMP6, multicast listener report v2, 2 group record(s), length 48
22:40:49.660372 IP6 :: > ff02::16: HBH ICMP6, multicast listener report v2, 2 group record(s), length 48
22:40:49.660398 IP6 :: > ff02::1:ffd6:2eac: ICMP6, neighbor solicitation, who has fe80::9423:61ff:fed6:2eac, length 24
22:40:49.660424 IP6 :: > ff02::1:ffbd:4b61: ICMP6, neighbor solicitation, who has fe80::6ca3:42ff:febd:4b61, length 24
22:40:49.720397 IP6 :: > ff02::16: HBH ICMP6, multicast listener report v2, 2 group record(s), length 48
22:40:49.952281 IP6 :: > ff02::16: HBH ICMP6, multicast listener report v2, 2 group record(s), length 48
22:40:49.976306 IP6 :: > ff02::1:ffd1:d4f0: ICMP6, neighbor solicitation, who has fe80::4ca6:54ff:fed1:d4f0, length 24
22:40:50.070262 IP6 :: > ff02::16: HBH ICMP6, multicast listener report v2, 1 group record(s), length 28
22:40:50.119687 IP6 :: > ff02::16: HBH ICMP6, multicast listener report v2, 2 group record(s), length 48
22:40:50.227025 IP6 :: > ff02::1:ffb4:a0aa: ICMP6, neighbor solicitation, who has fe80::d01a:a8ff:feb4:a0aa, length 24
22:40:50.279591 IP6 :: > ff02::1:ff5d:9fc5: ICMP6, neighbor solicitation, who has fe80::c86f:e5ff:fe5d:9fc5, length 24
22:40:50.404146 IP6 fe80::9423:61ff:fed6:2eac > ff02::16: HBH ICMP6, multicast listener report v2, 1 group record(s), length 28
22:40:50.414037 IP6 fe80::9423:61ff:fed6:2eac > ff02::16: HBH ICMP6, multicast listener report v2, 1 group record(s), length 28
22:40:50.441959 IP6 fe80::9423:61ff:fed6:2eac.5353 > ff02::fb.5353: 0*- [0q] 2/0/0 PTR _workstation._tcp.local., PTR floodlight [96:23:61:d6:2e:ac]._workstation._tcp.local. (117)
22:40:50.536097 IP6 fe80::9423:61ff:fed6:2eac.5353 > ff02::fb.5353: 0 [3q] [5n] ANY (QM)? floodlight [96:23:61:d6:2e:ac]._workstation._tcp.local. ANY (QM)? floodlight.local. ANY (QM)? c.a.e.2.6.d.e.f.f.f.1.6.3.2.4.9.0.0.0.0.0.0.0.0.0.0.0.0.0.8.e.f.ip6.arpa. (267)
22:40:50.642480 IP6 fe80::9423:61ff:fed6:2eac.5353 > ff02::fb.5353: 0 [2q] PTR (QM)? _ipps._tcp.local. PTR (QM)? _ipp._tcp.local. (45)
22:40:50.666245 IP6 fe80::6ca3:42ff:febd:4b61 > ff02::16: HBH ICMP6, multicast listener report v2, 1 group record(s), length 28
22:40:50.666778 IP6 fe80::6ca3:42ff:febd:4b61 > ff02::16: HBH ICMP6, multicast listener report v2, 1 group record(s), length 28
22:40:50.666819 IP6 fe80::6ca3:42ff:febd:4b61.5353 > ff02::fb.5353: 0*- [0q] 2/0/0 PTR _workstation._tcp.local., PTR floodlight [6e:a3:42:bd:4b:61]._workstation._tcp.local. (117)
22:40:50.742054 IP6 fe80::6ca3:42ff:febd:4b61.5353 > ff02::fb.5353: 0 [3q] [5n] ANY (QM)? floodlight [6e:a3:42:bd:4b:61]._workstation._tcp.local. ANY (QM)? floodlight.local. ANY (QM)? 1.6.b.4.d.b.e.f.f.f.2.4.3.a.c.6.0.0.0.0.0.0.0.0.0.0.0.0.0.8.e.f.ip6.arpa. (267)
22:40:50.785511 IP6 fe80::6ca3:42ff:febd:4b61.5353 > ff02::fb.5353: 0 [2q] PTR (QM)? _ipps._tcp.local. PTR (QM)? _ipp._tcp.local. (45)
22:40:51.000578 IP6 fe80::9423:61ff:fed6:2eac.5353 > ff02::fb.5353: 0 [3q] [5n] ANY (QM)? floodlight [96:23:61:d6:2e:ac]._workstation._tcp.local. ANY (QM)? floodlight.local. ANY (QM)? c.a.e.2.6.d.e.f.f.f.1.6.3.2.4.9.0.0.0.0.0.0.0.0.0.0.0.0.0.8.e.f.ip6.arpa. (267)
22:40:51.206728 IP6 fe80::6ca3:42ff:febd:4b61.5353 > ff02::fb.5353: 0 [3q] [5n] ANY (QM)? floodlight [6e:a3:42:bd:4b:61]._workstation._tcp.local. ANY (QM)? floodlight.local. ANY (QM)? 1.6.b.4.d.b.e.f.f.f.2.4.3.a.c.6.0.0.0.0.0.0.0.0.0.0.0.0.0.8.e.f.ip6.arpa. (267)
22:40:51.206796 IP6 fe80::9423:61ff:fed6:2eac > ff02::16: HBH ICMP6, multicast listener report v2, 1 group record(s), length 28
22:40:51.206821 IP6 fe80::4ca6:54ff:fed1:d4f0 > ff02::16: HBH ICMP6, multicast listener report v2, 1 group record(s), length 28
22:40:51.237446 IP6 fe80::4ca6:54ff:fed1:d4f0 > ff02::16: HBH ICMP6, multicast listener report v2, 1 group record(s), length 28
22:40:51.279586 IP6 fe80::c86f:e5ff:fe5d:9fc5 > ff02::16: HBH ICMP6, multicast listener report v2, 1 group record(s), length 28
22:40:51.307508 IP6 fe80::c86f:e5ff:fe5d:9fc5 > ff02::16: HBH ICMP6, multicast listener report v2, 1 group record(s), length 28
22:40:51.374448 IP6 fe80::c86f:e5ff:fe5d:9fc5.5353 > ff02::fb.5353: 0*- [0q] 2/0/0 PTR _workstation._tcp.local., PTR floodlight [ca:6f:e5:5d:9f:c5]._workstation._tcp.local. (117)
22:40:51.390968 IP6 fe80::c86f:e5ff:fe5d:9fc5.5353 > ff02::fb.5353: 0 [3q] [5n] ANY (QM)? floodlight [ca:6f:e5:5d:9f:c5]._workstation._tcp.local. ANY (QM)? floodlight.local. ANY (QM)? 5.c.f.9.d.5.e.f.f.f.5.e.f.6.8.c.0.0.0.0.0.0.0.0.0.0.0.0.0.8.e.f.ip6.arpa. (267)
22:40:51.401767 IP6 fe80::c86f:e5ff:fe5d:9fc5.5353 > ff02::fb.5353: 0 [2q] PTR (QM)? _ipps._tcp.local. PTR (QM)? _ipp._tcp.local. (45)
22:40:51.552613 LLDP, length 47
22:40:51.560580 IP6 fe80::6ca3:42ff:febd:4b61 > ff02::16: HBH ICMP6, multicast listener report v2, 1 group record(s), length 28
22:40:51.560605 ARP, Request who-has 10.0.0.5 tell 10.0.0.4, length 28
22:40:51.560631 IP6 fe80::4ca6:54ff:fed1:d4f0.5353 > ff02::fb.5353: 0*- [0q] 2/0/0 PTR _workstation._tcp.local., PTR floodlight [4e:a6:54:d1:d4:f0]._workstation._tcp.local. (117)
22:40:51.560657 IP6 fe80::9423:61ff:fed6:2eac.5353 > ff02::fb.5353: 0 [3q] [5n] ANY (QM)? floodlight [96:23:61:d6:2e:ac]._workstation._tcp.local. ANY (QM)? floodlight.local. ANY (QM)? c.a.e.2.6.d.e.f.f.f.1.6.3.2.4.9.0.0.0.0.0.0.0.0.0.0.0.0.0.8.e.f.ip6.arpa. (267)
22:40:51.656325 IP6 fe80::c86f:e5ff:fe5d:9fc5.5353 > ff02::fb.5353: 0 [3q] [5n] ANY (QM)? floodlight [ca:6f:e5:5d:9f:c5]._workstation._tcp.local. ANY (QM)? floodlight.local. ANY (QM)? 5.c.f.9.d.5.e.f.f.f.5.e.f.6.8.c.0.0.0.0.0.0.0.0.0.0.0.0.0.8.e.f.ip6.arpa. (267)
22:40:51.700067 ca:6f:e5:5d:9f:c5 > ff:ff:ff:ff:ff:ff, ethertype Unknown (0x8942), length 69: 
	0x0000:  2000 0604 0002 0000 0207 0400 0000 0000  ................
	0x0010:  0e04 0302 0002 0602 0078 fe0c 0026 e100  .........x...&..
	0x0020:  0000 0000 0000 000e 1808 0031 3791 7786  ...........17.w.
	0x0030:  1ff2 e601 0100 00                        .......
22:40:51.758774 IP6 fe80::4ca6:54ff:fed1:d4f0.5353 > ff02::fb.5353: 0 [3q] [5n] ANY (QM)? floodlight [4e:a6:54:d1:d4:f0]._workstation._tcp.local. ANY (QM)? floodlight.local. ANY (QM)? 0.f.4.d.1.d.e.f.f.f.4.5.6.a.c.4.0.0.0.0.0.0.0.0.0.0.0.0.0.8.e.f.ip6.arpa. (267)
22:40:51.758800 IP6 fe80::4ca6:54ff:fed1:d4f0.5353 > ff02::fb.5353: 0 [2q] PTR (QM)? _ipps._tcp.local. PTR (QM)? _ipp._tcp.local. (45)
22:40:51.758826 IP6 fe80::6ca3:42ff:febd:4b61.5353 > ff02::fb.5353: 0 [3q] [5n] ANY (QM)? floodlight [6e:a3:42:bd:4b:61]._workstation._tcp.local. ANY (QM)? floodlight.local. ANY (QM)? 1.6.b.4.d.b.e.f.f.f.2.4.3.a.c.6.0.0.0.0.0.0.0.0.0.0.0.0.0.8.e.f.ip6.arpa. (267)
22:40:51.900821 IP6 fe80::c86f:e5ff:fe5d:9fc5.5353 > ff02::fb.5353: 0 [3q] [5n] ANY (QM)? floodlight [ca:6f:e5:5d:9f:c5]._workstation._tcp.local. ANY (QM)? floodlight.local. ANY (QM)? 5.c.f.9.d.5.e.f.f.f.5.e.f.6.8.c.0.0.0.0.0.0.0.0.0.0.0.0.0.8.e.f.ip6.arpa. (267)
22:40:51.919502 IP6 fe80::c86f:e5ff:fe5d:9fc5 > ff02::16: HBH ICMP6, multicast listener report v2, 1 group record(s), length 28
22:40:51.940605 IP6 fe80::6ca3:42ff:febd:4b61 > ff02::16: HBH ICMP6, multicast listener report v2, 2 group record(s), length 48
22:40:51.940631 IP6 fe80::d01a:a8ff:feb4:a0aa > ff02::16: HBH ICMP6, multicast listener report v2, 1 group record(s), length 28
22:40:51.940840 IP6 fe80::d01a:a8ff:feb4:a0aa > ff02::16: HBH ICMP6, multicast listener report v2, 1 group record(s), length 28
22:40:51.940866 IP6 fe80::6ca3:42ff:febd:4b61.5353 > ff02::fb.5353: 0*- [0q] 5/0/0 (Cache flush) TXT "", (Cache flush) AAAA fe80::6ca3:42ff:febd:4b61, (Cache flush) PTR floodlight.local., (Cache flush) HINFO, (Cache flush) SRV floodlight.local.:9 0 0 (249)
22:40:51.940892 IP6 fe80::d01a:a8ff:feb4:a0aa.5353 > ff02::fb.5353: 0*- [0q] 2/0/0 PTR _workstation._tcp.local., PTR floodlight [d2:1a:a8:b4:a0:aa]._workstation._tcp.local. (117)
22:40:52.094060 IP6 fe80::c86f:e5ff:fe5d:9fc5.5353 > ff02::fb.5353: 0*- [0q] 5/0/0 (Cache flush) TXT "", (Cache flush) AAAA fe80::c86f:e5ff:fe5d:9fc5, (Cache flush) PTR floodlight.local., (Cache flush) HINFO, (Cache flush) SRV floodlight.local.:9 0 0 (249)
22:40:52.115458 IP6 fe80::c86f:e5ff:fe5d:9fc5 > ff02::16: HBH ICMP6, multicast listener report v2, 2 group record(s), length 48
22:40:52.192731 IP6 fe80::9423:61ff:fed6:2eac.5353 > ff02::fb.5353: 0*- [0q] 5/0/0 (Cache flush) TXT "", (Cache flush) AAAA fe80::9423:61ff:fed6:2eac, (Cache flush) PTR floodlight.local., (Cache flush) HINFO, (Cache flush) SRV floodlight.local.:9 0 0 (249)
22:40:52.250898 IP6 fe80::4ca6:54ff:fed1:d4f0.5353 > ff02::fb.5353: 0 [3q] [5n] ANY (QM)? floodlight [4e:a6:54:d1:d4:f0]._workstation._tcp.local. ANY (QM)? floodlight.local. ANY (QM)? 0.f.4.d.1.d.e.f.f.f.4.5.6.a.c.4.0.0.0.0.0.0.0.0.0.0.0.0.0.8.e.f.ip6.arpa. (267)
22:40:52.256610 IP6 fe80::9423:61ff:fed6:2eac > ff02::16: HBH ICMP6, multicast listener report v2, 2 group record(s), length 48
22:40:52.256974 IP6 fe80::6ca3:42ff:febd:4b61.5353 > ff02::fb.5353: 0*- [0q] 2/0/0 PTR _workstation._tcp.local., PTR floodlight [6e:a3:42:bd:4b:61]._workstation._tcp.local. (117)
22:40:52.257000 IP6 fe80::d01a:a8ff:feb4:a0aa.5353 > ff02::fb.5353: 0 [3q] [5n] ANY (QM)? floodlight [d2:1a:a8:b4:a0:aa]._workstation._tcp.local. ANY (QM)? floodlight.local. ANY (QM)? a.a.0.a.4.b.e.f.f.f.8.a.a.1.0.d.0.0.0.0.0.0.0.0.0.0.0.0.0.8.e.f.ip6.arpa. (267)
22:40:52.257026 IP6 fe80::6ca3:42ff:febd:4b61.5353 > ff02::fb.5353: 0 [2q] PTR (QM)? _ipps._tcp.local. PTR (QM)? _ipp._tcp.local. (45)
22:40:52.408408 IP6 fe80::c86f:e5ff:fe5d:9fc5.5353 > ff02::fb.5353: 0*- [0q] 2/0/0 PTR _workstation._tcp.local., PTR floodlight [ca:6f:e5:5d:9f:c5]._workstation._tcp.local. (117)
22:40:52.416924 IP6 fe80::c86f:e5ff:fe5d:9fc5.5353 > ff02::fb.5353: 0 [2q] PTR (QM)? _ipps._tcp.local. PTR (QM)? _ipp._tcp.local. (45)
22:40:53.122797 IP6 fe80::c86f:e5ff:fe5d:9fc5.5353 > ff02::fb.5353: 0*- [0q] 5/0/0 (Cache flush) TXT "", (Cache flush) AAAA fe80::c86f:e5ff:fe5d:9fc5, (Cache flush) PTR floodlight.local., (Cache flush) HINFO, (Cache flush) SRV floodlight.local.:9 0 0 (249)
22:40:53.203508 IP6 fe80::d01a:a8ff:feb4:a0aa > ff02::16: HBH ICMP6, multicast listener report v2, 1 group record(s), length 28
22:40:53.217206 IP6 fe80::d01a:a8ff:feb4:a0aa.5353 > ff02::fb.5353: 0 [2q] PTR (QM)? _ipps._tcp.local. PTR (QM)? _ipp._tcp.local. (45)
22:40:53.217232 IP6 fe80::d01a:a8ff:feb4:a0aa > ff02::16: HBH ICMP6, multicast listener report v2, 2 group record(s), length 48
22:40:53.217430 IP6 fe80::4ca6:54ff:fed1:d4f0 > ff02::16: HBH ICMP6, multicast listener report v2, 2 group record(s), length 48
22:40:53.258507 IP6 fe80::4ca6:54ff:fed1:d4f0 > ff02::16: HBH ICMP6, multicast listener report v2, 1 group record(s), length 28
22:40:53.262037 IP6 fe80::d01a:a8ff:feb4:a0aa.5353 > ff02::fb.5353: 0 [3q] [5n] ANY (QM)? floodlight [d2:1a:a8:b4:a0:aa]._workstation._tcp.local. ANY (QM)? floodlight.local. ANY (QM)? a.a.0.a.4.b.e.f.f.f.8.a.a.1.0.d.0.0.0.0.0.0.0.0.0.0.0.0.0.8.e.f.ip6.arpa. (267)
22:40:53.264454 IP6 fe80::d01a:a8ff:feb4:a0aa.5353 > ff02::fb.5353: 0 [3q] [5n] ANY (QM)? floodlight [d2:1a:a8:b4:a0:aa]._workstation._tcp.local. ANY (QM)? floodlight.local. ANY (QM)? a.a.0.a.4.b.e.f.f.f.8.a.a.1.0.d.0.0.0.0.0.0.0.0.0.0.0.0.0.8.e.f.ip6.arpa. (267)
22:40:53.265864 IP6 fe80::9423:61ff:fed6:2eac.5353 > ff02::fb.5353: 0*- [0q] 2/0/0 PTR _workstation._tcp.local., PTR floodlight [96:23:61:d6:2e:ac]._workstation._tcp.local. (117)
22:40:53.267276 IP6 fe80::9423:61ff:fed6:2eac.5353 > ff02::fb.5353: 0 [2q] PTR (QM)? _ipps._tcp.local. PTR (QM)? _ipp._tcp.local. (45)
22:40:53.283920 IP6 fe80::4ca6:54ff:fed1:d4f0.5353 > ff02::fb.5353: 0 [3q] [5n] ANY (QM)? floodlight [4e:a6:54:d1:d4:f0]._workstation._tcp.local. ANY (QM)? floodlight.local. ANY (QM)? 0.f.4.d.1.d.e.f.f.f.4.5.6.a.c.4.0.0.0.0.0.0.0.0.0.0.0.0.0.8.e.f.ip6.arpa. (267)
22:40:53.363598 IP6 :: > ff02::16: HBH ICMP6, multicast listener report v2, 2 group record(s), length 48
22:40:53.387669 IP6 :: > ff02::16: HBH ICMP6, multicast listener report v2, 2 group record(s), length 48
22:40:53.491666 IP 0.0.0.0.68 > 255.255.255.255.67: BOOTP/DHCP, Request from ca:6f:e5:5d:9f:c5, length 300
22:40:53.759491 IP6 :: > ff02::16: HBH ICMP6, multicast listener report v2, 1 group record(s), length 28
22:40:53.867955 IP6 fe80::4ca6:54ff:fed1:d4f0.5353 > ff02::fb.5353: 0*- [0q] 2/0/0 (Cache flush) TXT "", (Cache flush) SRV floodlight.local.:9 0 0 (110)
22:40:53.867990 IP6 fe80::4ca6:54ff:fed1:d4f0.5353 > ff02::fb.5353: 0*- [0q] 3/0/0 (Cache flush) HINFO, (Cache flush) AAAA fe80::4ca6:54ff:fed1:d4f0, (Cache flush) PTR floodlight.local. (167)
22:40:53.868401 IP6 fe80::d01a:a8ff:feb4:a0aa.5353 > ff02::fb.5353: 0*- [0q] 5/0/0 (Cache flush) TXT "", (Cache flush) AAAA fe80::d01a:a8ff:feb4:a0aa, (Cache flush) PTR floodlight.local., (Cache flush) HINFO, (Cache flush) SRV floodlight.local.:9 0 0 (249)
22:40:53.868436 IP6 fe80::d01a:a8ff:feb4:a0aa.5353 > ff02::fb.5353: 0 [2q] PTR (QM)? _ipps._tcp.local. PTR (QM)? _ipp._tcp.local. (45)
22:40:53.868472 IP6 fe80::d01a:a8ff:feb4:a0aa.5353 > ff02::fb.5353: 0*- [0q] 2/0/0 PTR _workstation._tcp.local., PTR floodlight [d2:1a:a8:b4:a0:aa]._workstation._tcp.local. (117)
22:40:53.868507 IP6 fe80::6ca3:42ff:febd:4b61.5353 > ff02::fb.5353: 0*- [0q] 5/0/0 (Cache flush) TXT "", (Cache flush) AAAA fe80::6ca3:42ff:febd:4b61, (Cache flush) PTR floodlight.local., (Cache flush) HINFO, (Cache flush) SRV floodlight.local.:9 0 0 (249)
22:40:53.868542 IP6 fe80::4ca6:54ff:fed1:d4f0.5353 > ff02::fb.5353: 0*- [0q] 2/0/0 PTR _workstation._tcp.local., PTR floodlight [4e:a6:54:d1:d4:f0]._workstation._tcp.local. (117)
22:40:53.868577 IP6 fe80::4ca6:54ff:fed1:d4f0.5353 > ff02::fb.5353: 0 [2q] PTR (QM)? _ipps._tcp.local. PTR (QM)? _ipp._tcp.local. (45)
22:40:54.287701 IP6 :: > ff02::1:ff5d:9fc5: ICMP6, neighbor solicitation, who has fe80::c86f:e5ff:fe5d:9fc5, length 24
22:40:54.381336 IP6 :: > ff02::16: HBH ICMP6, multicast listener report v2, 1 group record(s), length 28
22:40:54.381376 IP6 :: > ff02::16: HBH ICMP6, multicast listener report v2, 1 group record(s), length 28
22:40:54.381426 IP 0.0.0.0.68 > 255.255.255.255.67: BOOTP/DHCP, Request from 4e:a6:54:d1:d4:f0, length 300
22:40:54.533569 IP6 fe80::9423:61ff:fed6:2eac.5353 > ff02::fb.5353: 0*- [0q] 5/0/0 (Cache flush) TXT "", (Cache flush) AAAA fe80::9423:61ff:fed6:2eac, (Cache flush) PTR floodlight.local., (Cache flush) HINFO, (Cache flush) SRV floodlight.local.:9 0 0 (249)
22:40:54.533605 IP6 :: > ff02::16: HBH ICMP6, multicast listener report v2, 1 group record(s), length 28
22:40:54.547719 IP 0.0.0.0.68 > 255.255.255.255.67: BOOTP/DHCP, Request from 6e:a3:42:bd:4b:61, length 300
22:40:54.547754 IP6 :: > ff02::16: HBH ICMP6, multicast listener report v2, 1 group record(s), length 28
22:40:54.547789 IP 0.0.0.0.68 > 255.255.255.255.67: BOOTP/DHCP, Request from d2:1a:a8:b4:a0:aa, length 300
22:40:54.569055 IP6 :: > ff02::16: HBH ICMP6, multicast listener report v2, 1 group record(s), length 28
22:40:54.570557 ARP, Request who-has 10.0.0.6 tell 10.0.0.4, length 28
22:40:54.595196 IP6 :: > ff02::1:ffbd:4b61: ICMP6, neighbor solicitation, who has fe80::6ca3:42ff:febd:4b61, length 24
22:40:54.602537 IP6 :: > ff02::16: HBH ICMP6, multicast listener report v2, 2 group record(s), length 48
22:40:55.287490 IP6 fe80::c86f:e5ff:fe5d:9fc5 > ff02::16: HBH ICMP6, multicast listener report v2, 1 group record(s), length 28
22:40:55.287545 IP6 fe80::c86f:e5ff:fe5d:9fc5 > ff02::2: ICMP6, router solicitation, length 16
22:40:55.295660 IP6 fe80::c86f:e5ff:fe5d:9fc5 > ff02::16: HBH ICMP6, multicast listener report v2, 1 group record(s), length 28
22:40:55.350320 IP6 fe80::c86f:e5ff:fe5d:9fc5.5353 > ff02::fb.5353: 0*- [0q] 2/0/0 PTR _workstation._tcp.local., PTR floodlight [ca:6f:e5:5d:9f:c5]._workstation._tcp.local. (117)
22:40:55.372402 IP6 fe80::c86f:e5ff:fe5d:9fc5.5353 > ff02::fb.5353: 0 [3q] [5n] ANY (QM)? floodlight [ca:6f:e5:5d:9f:c5]._workstation._tcp.local. ANY (QM)? floodlight.local. ANY (QM)? 5.c.f.9.d.5.e.f.f.f.5.e.f.6.8.c.0.0.0.0.0.0.0.0.0.0.0.0.0.8.e.f.ip6.arpa. (267)
22:40:55.389954 IP6 fe80::c86f:e5ff:fe5d:9fc5.5353 > ff02::fb.5353: 0 [2q] PTR (QM)? _ipps._tcp.local. PTR (QM)? _ipp._tcp.local. (45)
22:40:55.391773 IP6 :: > ff02::16: HBH ICMP6, multicast listener report v2, 2 group record(s), length 48
22:40:55.391808 IP 0.0.0.0.68 > 255.255.255.255.67: BOOTP/DHCP, Request from 96:23:61:d6:2e:ac, length 300
22:40:55.391843 IP6 :: > ff02::1:ffd6:2eac: ICMP6, neighbor solicitation, who has fe80::9423:61ff:fed6:2eac, length 24
22:40:55.392491 IP6 :: > ff02::16: HBH ICMP6, multicast listener report v2, 1 group record(s), length 28
22:40:55.392526 IP6 :: > ff02::1:ffd1:d4f0: ICMP6, neighbor solicitation, who has fe80::4ca6:54ff:fed1:d4f0, length 24
22:40:55.392561 IP6 :: > ff02::16: HBH ICMP6, multicast listener report v2, 1 group record(s), length 28
22:40:55.392596 ARP, Request who-has 10.0.0.6 tell 10.0.0.4, length 28
22:40:55.392630 IP6 :: > ff02::1:ffb4:a0aa: ICMP6, neighbor solicitation, who has fe80::d01a:a8ff:feb4:a0aa, length 24
22:40:55.392665 IP6 fe80::9423:61ff:fed6:2eac > ff02::16: HBH ICMP6, multicast listener report v2, 1 group record(s), length 28
22:40:55.392885 IP6 fe80::9423:61ff:fed6:2eac > ff02::2: ICMP6, router solicitation, length 16
22:40:55.423976 IP6 fe80::9423:61ff:fed6:2eac > ff02::16: HBH ICMP6, multicast listener report v2, 1 group record(s), length 28
22:40:55.424012 IP6 fe80::9423:61ff:fed6:2eac.5353 > ff02::fb.5353: 0*- [0q] 2/0/0 PTR _workstation._tcp.local., PTR floodlight [96:23:61:d6:2e:ac]._workstation._tcp.local. (117)
22:40:55.424480 IP6 fe80::9423:61ff:fed6:2eac.5353 > ff02::fb.5353: 0 [2q] PTR (QM)? _ipps._tcp.local. PTR (QM)? _ipp._tcp.local. (45)
22:40:55.424541 IP6 fe80::9423:61ff:fed6:2eac > ff02::16: HBH ICMP6, multicast listener report v2, 2 group record(s), length 48
22:40:55.424590 IP6 fe80::9423:61ff:fed6:2eac > ff02::16: HBH ICMP6, multicast listener report v2, 1 group record(s), length 28
22:40:55.563806 IP6 fe80::c86f:e5ff:fe5d:9fc5 > ff02::16: HBH ICMP6, multicast listener report v2, 1 group record(s), length 28
22:40:55.623802 IP6 fe80::c86f:e5ff:fe5d:9fc5.5353 > ff02::fb.5353: 0 [3q] [5n] ANY (QM)? floodlight [ca:6f:e5:5d:9f:c5]._workstation._tcp.local. ANY (QM)? floodlight.local. ANY (QM)? 5.c.f.9.d.5.e.f.f.f.5.e.f.6.8.c.0.0.0.0.0.0.0.0.0.0.0.0.0.8.e.f.ip6.arpa. (267)
22:40:55.800694 IP6 fe80::c86f:e5ff:fe5d:9fc5 > ff02::16: HBH ICMP6, multicast listener report v2, 2 group record(s), length 48
22:40:55.857431 IP6 fe80::9423:61ff:fed6:2eac.5353 > ff02::fb.5353: 0 [3q] [5n] ANY (QM)? floodlight [96:23:61:d6:2e:ac]._workstation._tcp.local. ANY (QM)? floodlight.local. ANY (QM)? c.a.e.2.6.d.e.f.f.f.1.6.3.2.4.9.0.0.0.0.0.0.0.0.0.0.0.0.0.8.e.f.ip6.arpa. (267)
22:40:55.857482 IP6 fe80::6ca3:42ff:febd:4b61 > ff02::16: HBH ICMP6, multicast listener report v2, 1 group record(s), length 28
22:40:55.870756 IP6 fe80::c86f:e5ff:fe5d:9fc5.5353 > ff02::fb.5353: 0 [3q] [5n] ANY (QM)? floodlight [ca:6f:e5:5d:9f:c5]._workstation._tcp.local. ANY (QM)? floodlight.local. ANY (QM)? 5.c.f.9.d.5.e.f.f.f.5.e.f.6.8.c.0.0.0.0.0.0.0.0.0.0.0.0.0.8.e.f.ip6.arpa. (267)
22:40:55.895967 IP6 fe80::6ca3:42ff:febd:4b61 > ff02::2: ICMP6, router solicitation, length 16
22:40:55.896044 IP6 fe80::6ca3:42ff:febd:4b61 > ff02::16: HBH ICMP6, multicast listener report v2, 1 group record(s), length 28
22:40:55.896079 IP6 fe80::6ca3:42ff:febd:4b61.5353 > ff02::fb.5353: 0*- [0q] 2/0/0 PTR _workstation._tcp.local., PTR floodlight [6e:a3:42:bd:4b:61]._workstation._tcp.local. (117)
22:40:55.896114 IP6 fe80::6ca3:42ff:febd:4b61.5353 > ff02::fb.5353: 0 [3q] [5n] ANY (QM)? floodlight [6e:a3:42:bd:4b:61]._workstation._tcp.local. ANY (QM)? floodlight.local. ANY (QM)? 1.6.b.4.d.b.e.f.f.f.2.4.3.a.c.6.0.0.0.0.0.0.0.0.0.0.0.0.0.8.e.f.ip6.arpa. (267)
22:40:55.896764 IP6 fe80::6ca3:42ff:febd:4b61.5353 > ff02::fb.5353: 0 [2q] PTR (QM)? _ipps._tcp.local. PTR (QM)? _ipp._tcp.local. (45)
22:40:55.896799 IP6 fe80::d01a:a8ff:feb4:a0aa > ff02::16: HBH ICMP6, multicast listener report v2, 1 group record(s), length 28
22:40:55.896834 IP6 fe80::d01a:a8ff:feb4:a0aa > ff02::2: ICMP6, router solicitation, length 16
22:40:55.896869 IP6 fe80::d01a:a8ff:feb4:a0aa > ff02::16: HBH ICMP6, multicast listener report v2, 1 group record(s), length 28
22:40:55.896904 IP6 fe80::d01a:a8ff:feb4:a0aa.5353 > ff02::fb.5353: 0*- [0q] 2/0/0 PTR _workstation._tcp.local., PTR floodlight [d2:1a:a8:b4:a0:aa]._workstation._tcp.local. (117)
22:40:55.896940 IP6 fe80::d01a:a8ff:feb4:a0aa.5353 > ff02::fb.5353: 0 [3q] [5n] ANY (QM)? floodlight [d2:1a:a8:b4:a0:aa]._workstation._tcp.local. ANY (QM)? floodlight.local. ANY (QM)? a.a.0.a.4.b.e.f.f.f.8.a.a.1.0.d.0.0.0.0.0.0.0.0.0.0.0.0.0.8.e.f.ip6.arpa. (267)
22:40:55.898608 IP6 fe80::6ca3:42ff:febd:4b61.5353 > ff02::fb.5353: 0 [3q] [5n] ANY (QM)? floodlight [6e:a3:42:bd:4b:61]._workstation._tcp.local. ANY (QM)? floodlight.local. ANY (QM)? 1.6.b.4.d.b.e.f.f.f.2.4.3.a.c.6.0.0.0.0.0.0.0.0.0.0.0.0.0.8.e.f.ip6.arpa. (267)
22:40:56.018257 IP 0.0.0.0.68 > 255.255.255.255.67: BOOTP/DHCP, Request from ca:6f:e5:5d:9f:c5, length 300
22:40:56.075895 IP6 fe80::c86f:e5ff:fe5d:9fc5.5353 > ff02::fb.5353: 0*- [0q] 5/0/0 (Cache flush) TXT "", (Cache flush) AAAA fe80::c86f:e5ff:fe5d:9fc5, (Cache flush) PTR floodlight.local., (Cache flush) HINFO, (Cache flush) SRV floodlight.local.:9 0 0 (249)
22:40:56.214983 IP6 fe80::4ca6:54ff:fed1:d4f0 > ff02::2: ICMP6, router solicitation, length 16
22:40:56.220676 IP6 fe80::4ca6:54ff:fed1:d4f0 > ff02::16: HBH ICMP6, multicast listener report v2, 1 group record(s), length 28
22:40:56.220711 IP6 fe80::4ca6:54ff:fed1:d4f0.5353 > ff02::fb.5353: 0*- [0q] 2/0/0 PTR _workstation._tcp.local., PTR floodlight [4e:a6:54:d1:d4:f0]._workstation._tcp.local. (117)
22:40:56.220747 IP6 fe80::4ca6:54ff:fed1:d4f0.5353 > ff02::fb.5353: 0 [3q] [5n] ANY (QM)? floodlight [4e:a6:54:d1:d4:f0]._workstation._tcp.local. ANY (QM)? floodlight.local. ANY (QM)? 0.f.4.d.1.d.e.f.f.f.4.5.6.a.c.4.0.0.0.0.0.0.0.0.0.0.0.0.0.8.e.f.ip6.arpa. (267)
22:40:56.220782 IP6 fe80::4ca6:54ff:fed1:d4f0.5353 > ff02::fb.5353: 0 [2q] PTR (QM)? _ipps._tcp.local. PTR (QM)? _ipp._tcp.local. (45)
22:40:56.221628 IP6 fe80::4ca6:54ff:fed1:d4f0 > ff02::16: HBH ICMP6, multicast listener report v2, 2 group record(s), length 48
22:40:56.221663 IP6 fe80::4ca6:54ff:fed1:d4f0.5353 > ff02::fb.5353: 0 [3q] [5n] ANY (QM)? floodlight [4e:a6:54:d1:d4:f0]._workstation._tcp.local. ANY (QM)? floodlight.local. ANY (QM)? 0.f.4.d.1.d.e.f.f.f.4.5.6.a.c.4.0.0.0.0.0.0.0.0.0.0.0.0.0.8.e.f.ip6.arpa. (267)
22:40:56.252756 IP6 fe80::9423:61ff:fed6:2eac.5353 > ff02::fb.5353: 0 [3q] [5n] ANY (QM)? floodlight [96:23:61:d6:2e:ac]._workstation._tcp.local. ANY (QM)? floodlight.local. ANY (QM)? c.a.e.2.6.d.e.f.f.f.1.6.3.2.4.9.0.0.0.0.0.0.0.0.0.0.0.0.0.8.e.f.ip6.arpa. (267)
22:40:56.252795 IP6 fe80::9423:61ff:fed6:2eac.5353 > ff02::fb.5353: 0*- [0q] 5/0/0 (Cache flush) TXT "", (Cache flush) AAAA fe80::9423:61ff:fed6:2eac, (Cache flush) PTR floodlight.local., (Cache flush) HINFO, (Cache flush) SRV floodlight.local.:9 0 0 (249)
22:40:56.276410 IP6 fe80::4ca6:54ff:fed1:d4f0.5353 > ff02::fb.5353: 0 [3q] [5n] ANY (QM)? floodlight [4e:a6:54:d1:d4:f0]._workstation._tcp.local. ANY (QM)? floodlight.local. ANY (QM)? 0.f.4.d.1.d.e.f.f.f.4.5.6.a.c.4.0.0.0.0.0.0.0.0.0.0.0.0.0.8.e.f.ip6.arpa. (267)
22:40:56.280830 IP6 fe80::6ca3:42ff:febd:4b61.5353 > ff02::fb.5353: 0 [3q] [5n] ANY (QM)? floodlight [6e:a3:42:bd:4b:61]._workstation._tcp.local. ANY (QM)? floodlight.local. ANY (QM)? 1.6.b.4.d.b.e.f.f.f.2.4.3.a.c.6.0.0.0.0.0.0.0.0.0.0.0.0.0.8.e.f.ip6.arpa. (267)
22:40:56.282438 IP6 fe80::6ca3:42ff:febd:4b61 > ff02::16: HBH ICMP6, multicast listener report v2, 2 group record(s), length 48
22:40:56.284777 IP6 fe80::d01a:a8ff:feb4:a0aa.5353 > ff02::fb.5353: 0 [2q] PTR (QM)? _ipps._tcp.local. PTR (QM)? _ipp._tcp.local. (45)
22:40:56.286744 ARP, Request who-has 10.0.0.6 tell 10.0.0.4, length 28
22:40:56.296271 IP6 fe80::d01a:a8ff:feb4:a0aa.5353 > ff02::fb.5353: 0 [3q] [5n] ANY (QM)? floodlight [d2:1a:a8:b4:a0:aa]._workstation._tcp.local. ANY (QM)? floodlight.local. ANY (QM)? a.a.0.a.4.b.e.f.f.f.8.a.a.1.0.d.0.0.0.0.0.0.0.0.0.0.0.0.0.8.e.f.ip6.arpa. (267)
22:40:56.296307 IP6 fe80::d01a:a8ff:feb4:a0aa > ff02::16: HBH ICMP6, multicast listener report v2, 2 group record(s), length 48
22:40:56.296341 IP6 fe80::d01a:a8ff:feb4:a0aa.5353 > ff02::fb.5353: 0 [3q] [5n] ANY (QM)? floodlight [d2:1a:a8:b4:a0:aa]._workstation._tcp.local. ANY (QM)? floodlight.local. ANY (QM)? a.a.0.a.4.b.e.f.f.f.8.a.a.1.0.d.0.0.0.0.0.0.0.0.0.0.0.0.0.8.e.f.ip6.arpa. (267)
22:40:56.296729 IP6 fe80::6ca3:42ff:febd:4b61 > ff02::16: HBH ICMP6, multicast listener report v2, 1 group record(s), length 28
22:40:56.296764 IP6 fe80::9423:61ff:fed6:2eac.5353 > ff02::fb.5353: 0*- [0q] 2/0/0 PTR _workstation._tcp.local., PTR floodlight [96:23:61:d6:2e:ac]._workstation._tcp.local. (117)
22:40:56.308637 IP6 fe80::9423:61ff:fed6:2eac.5353 > ff02::fb.5353: 0 [2q] PTR (QM)? _ipps._tcp.local. PTR (QM)? _ipp._tcp.local. (45)
22:40:56.308672 IP6 fe80::4ca6:54ff:fed1:d4f0.5353 > ff02::fb.5353: 0*- [0q] 5/0/0 (Cache flush) TXT "", (Cache flush) AAAA fe80::4ca6:54ff:fed1:d4f0, (Cache flush) PTR floodlight.local., (Cache flush) HINFO, (Cache flush) SRV floodlight.local.:9 0 0 (249)
22:40:56.309082 IP6 fe80::4ca6:54ff:fed1:d4f0 > ff02::16: HBH ICMP6, multicast listener report v2, 1 group record(s), length 28
22:40:56.309118 IP6 fe80::4ca6:54ff:fed1:d4f0.5353 > ff02::fb.5353: 0*- [0q] 2/0/0 PTR _workstation._tcp.local., PTR floodlight [4e:a6:54:d1:d4:f0]._workstation._tcp.local. (117)
22:40:56.309153 IP6 fe80::4ca6:54ff:fed1:d4f0.5353 > ff02::fb.5353: 0 [2q] PTR (QM)? _ipps._tcp.local. PTR (QM)? _ipp._tcp.local. (45)
22:40:56.309188 IP6 fe80::6ca3:42ff:febd:4b61.5353 > ff02::fb.5353: 0*- [0q] 2/0/0 PTR _workstation._tcp.local., PTR floodlight [6e:a3:42:bd:4b:61]._workstation._tcp.local. (117)
22:40:56.380881 IP6 fe80::c86f:e5ff:fe5d:9fc5.5353 > ff02::fb.5353: 0*- [0q] 2/0/0 PTR _workstation._tcp.local., PTR floodlight [ca:6f:e5:5d:9f:c5]._workstation._tcp.local. (117)
22:40:56.390791 IP6 fe80::c86f:e5ff:fe5d:9fc5.5353 > ff02::fb.5353: 0 [2q] PTR (QM)? _ipps._tcp.local. PTR (QM)? _ipp._tcp.local. (45)
22:40:56.533322 IP 0.0.0.0.68 > 255.255.255.255.67: BOOTP/DHCP, Request from 4e:a6:54:d1:d4:f0, length 300
22:40:56.557142 IP6 fe80::6ca3:42ff:febd:4b61.5353 > ff02::fb.5353: 0 [2q] PTR (QM)? _ipps._tcp.local. PTR (QM)? _ipp._tcp.local. (45)
22:40:56.564174 IP6 fe80::9423:61ff:fed6:2eac.5353 > ff02::fb.5353: 0*- [0q] 5/0/0 (Cache flush) TXT "", (Cache flush) AAAA fe80::9423:61ff:fed6:2eac, (Cache flush) PTR floodlight.local., (Cache flush) HINFO, (Cache flush) SRV floodlight.local.:9 0 0 (249)
22:40:56.564210 IP6 fe80::d01a:a8ff:feb4:a0aa.5353 > ff02::fb.5353: 0*- [0q] 3/0/0 (Cache flush) TXT "", (Cache flush) HINFO, (Cache flush) SRV floodlight.local.:9 0 0 (135)
22:40:56.564264 IP6 fe80::d01a:a8ff:feb4:a0aa.5353 > ff02::fb.5353: 0*- [0q] 2/0/0 (Cache flush) PTR floodlight.local., (Cache flush) AAAA fe80::d01a:a8ff:feb4:a0aa (142)
22:40:56.564898 IP6 fe80::d01a:a8ff:feb4:a0aa > ff02::16: HBH ICMP6, multicast listener report v2, 1 group record(s), length 28
22:40:56.564934 IP6 fe80::d01a:a8ff:feb4:a0aa.5353 > ff02::fb.5353: 0*- [0q] 2/0/0 PTR _workstation._tcp.local., PTR floodlight [d2:1a:a8:b4:a0:aa]._workstation._tcp.local. (117)
22:40:56.564969 IP6 fe80::d01a:a8ff:feb4:a0aa.5353 > ff02::fb.5353: 0 [2q] PTR (QM)? _ipps._tcp.local. PTR (QM)? _ipp._tcp.local. (45)
22:40:56.565004 IP 0.0.0.0.68 > 255.255.255.255.67: BOOTP/DHCP, Request from 96:23:61:d6:2e:ac, length 300
22:40:56.565039 IP6 fe80::4ca6:54ff:fed1:d4f0.5353 > ff02::fb.5353: 0*- [0q] 5/0/0 (Cache flush) TXT "", (Cache flush) AAAA fe80::4ca6:54ff:fed1:d4f0, (Cache flush) PTR floodlight.local., (Cache flush) HINFO, (Cache flush) SRV floodlight.local.:9 0 0 (249)
22:40:56.656814 IP 0.0.0.0.68 > 255.255.255.255.67: BOOTP/DHCP, Request from d2:1a:a8:b4:a0:aa, length 300
22:40:56.656849 IP6 fe80::6ca3:42ff:febd:4b61.5353 > ff02::fb.5353: 0*- [0q] 5/0/0 (Cache flush) TXT "", (Cache flush) AAAA fe80::6ca3:42ff:febd:4b61, (Cache flush) PTR floodlight.local., (Cache flush) HINFO, (Cache flush) SRV floodlight.local.:9 0 0 (249)
22:40:56.693028 ARP, Request who-has 10.0.0.7 tell 10.0.0.4, length 28
22:40:56.693662 IP6 fe80::d01a:a8ff:feb4:a0aa.5353 > ff02::fb.5353: 0*- [0q] 5/0/0 (Cache flush) TXT "", (Cache flush) AAAA fe80::d01a:a8ff:feb4:a0aa, (Cache flush) PTR floodlight.local., (Cache flush) HINFO, (Cache flush) SRV floodlight.local.:9 0 0 (249)
22:40:56.694317 ARP, Reply 10.0.0.7 is-at 2a:23:2b:66:dd:b8, length 28
22:40:56.809208 IP 10.0.0.4 > 10.0.0.7: ICMP echo request, id 4117, seq 1, length 64
22:40:56.810490 IP 10.0.0.7 > 10.0.0.4: ICMP echo reply, id 4117, seq 1, length 64
22:40:56.888399 IP6 fe80::9423:61ff:fed6:2eac.5353 > ff02::fb.5353: 0 [2q] PTR (QM)? _ipps._tcp.local. PTR (QM)? _ipp._tcp.local. (45)
22:40:56.913081 IP6 fe80::9423:61ff:fed6:2eac.5353 > ff02::fb.5353: 0*- [0q] 5/0/0 PTR _workstation._tcp.local., PTR floodlight [96:23:61:d6:2e:ac]._workstation._tcp.local., (Cache flush) TXT "", (Cache flush) SRV floodlight.local.:9 0 0, (Cache flush) AAAA fe80::9423:61ff:fed6:2eac (189)
22:40:56.946173 IP 0.0.0.0.68 > 255.255.255.255.67: BOOTP/DHCP, Request from 6e:a3:42:bd:4b:61, length 300
22:40:57.101578 IP6 fe80::c86f:e5ff:fe5d:9fc5.5353 > ff02::fb.5353: 0*- [0q] 5/0/0 (Cache flush) TXT "", (Cache flush) AAAA fe80::c86f:e5ff:fe5d:9fc5, (Cache flush) PTR floodlight.local., (Cache flush) HINFO, (Cache flush) SRV floodlight.local.:9 0 0 (249)
22:40:57.214263 ARP, Request who-has 10.0.0.8 tell 10.0.0.4, length 28
22:40:57.347281 IP6 fe80::4ca6:54ff:fed1:d4f0.5353 > ff02::fb.5353: 0 [2q] PTR (QM)? _ipps._tcp.local. PTR (QM)? _ipp._tcp.local. (45)
22:40:57.367104 IP6 fe80::4ca6:54ff:fed1:d4f0.5353 > ff02::fb.5353: 0*- [0q] 5/0/0 PTR _workstation._tcp.local., PTR floodlight [4e:a6:54:d1:d4:f0]._workstation._tcp.local., (Cache flush) TXT "", (Cache flush) SRV floodlight.local.:9 0 0, (Cache flush) AAAA fe80::4ca6:54ff:fed1:d4f0 (189)
22:40:57.565744 IP6 fe80::9423:61ff:fed6:2eac.5353 > ff02::fb.5353: 0*- [0q] 5/0/0 (Cache flush) TXT "", (Cache flush) AAAA fe80::9423:61ff:fed6:2eac, (Cache flush) PTR floodlight.local., (Cache flush) HINFO, (Cache flush) SRV floodlight.local.:9 0 0 (249)
22:40:57.642961 ARP, Request who-has 10.0.0.1 tell 10.0.0.5, length 28
22:40:57.779290 IP6 fe80::6ca3:42ff:febd:4b61.5353 > ff02::fb.5353: 0 [2q] PTR (QM)? _ipps._tcp.local. PTR (QM)? _ipp._tcp.local. (45)
22:40:57.817207 IP6 fe80::6ca3:42ff:febd:4b61.5353 > ff02::fb.5353: 0*- [0q] 5/0/0 PTR _workstation._tcp.local., PTR floodlight [6e:a3:42:bd:4b:61]._workstation._tcp.local., (Cache flush) TXT "", (Cache flush) SRV floodlight.local.:9 0 0, (Cache flush) AAAA fe80::6ca3:42ff:febd:4b61 (189)
22:40:57.905545 IP6 fe80::d01a:a8ff:feb4:a0aa.5353 > ff02::fb.5353: 0 [2q] PTR (QM)? _ipps._tcp.local. PTR (QM)? _ipp._tcp.local. (45)
22:40:57.929626 IP6 fe80::d01a:a8ff:feb4:a0aa.5353 > ff02::fb.5353: 0*- [0q] 5/0/0 PTR _workstation._tcp.local., PTR floodlight [d2:1a:a8:b4:a0:aa]._workstation._tcp.local., (Cache flush) TXT "", (Cache flush) SRV floodlight.local.:9 0 0, (Cache flush) AAAA fe80::d01a:a8ff:feb4:a0aa (189)
22:40:58.026976 IP6 fe80::4ca6:54ff:fed1:d4f0.5353 > ff02::fb.5353: 0*- [0q] 5/0/0 (Cache flush) TXT "", (Cache flush) AAAA fe80::4ca6:54ff:fed1:d4f0, (Cache flush) PTR floodlight.local., (Cache flush) HINFO, (Cache flush) SRV floodlight.local.:9 0 0 (249)
22:40:58.182454 IP6 fe80::4ca6:54ff:fed1:d4f0 > ff02::2: ICMP6, router solicitation, length 16
22:40:58.391866 IP6 fe80::c86f:e5ff:fe5d:9fc5.5353 > ff02::fb.5353: 0 [2q] PTR (QM)? _ipps._tcp.local. PTR (QM)? _ipp._tcp.local. (45)
22:40:58.409216 IP6 fe80::c86f:e5ff:fe5d:9fc5.5353 > ff02::fb.5353: 0*- [0q] 5/0/0 PTR _workstation._tcp.local., PTR floodlight [ca:6f:e5:5d:9f:c5]._workstation._tcp.local., (Cache flush) TXT "", (Cache flush) SRV floodlight.local.:9 0 0, (Cache flush) AAAA fe80::c86f:e5ff:fe5d:9fc5 (189)
22:40:58.539083 IP6 fe80::6ca3:42ff:febd:4b61.5353 > ff02::fb.5353: 0*- [0q] 5/0/0 (Cache flush) TXT "", (Cache flush) AAAA fe80::6ca3:42ff:febd:4b61, (Cache flush) PTR floodlight.local., (Cache flush) HINFO, (Cache flush) SRV floodlight.local.:9 0 0 (249)
22:40:58.648764 ARP, Request who-has 10.0.0.1 tell 10.0.0.5, length 28
22:40:58.660383 IP6 fe80::d01a:a8ff:feb4:a0aa.5353 > ff02::fb.5353: 0*- [0q] 5/0/0 (Cache flush) TXT "", (Cache flush) AAAA fe80::d01a:a8ff:feb4:a0aa, (Cache flush) PTR floodlight.local., (Cache flush) HINFO, (Cache flush) SRV floodlight.local.:9 0 0 (249)
22:40:58.732281 IP6 fe80::6ca3:42ff:febd:4b61 > ff02::2: ICMP6, router solicitation, length 16
22:40:58.806232 IP6 fe80::d01a:a8ff:feb4:a0aa > ff02::2: ICMP6, router solicitation, length 16
22:40:59.130245 IP6 fe80::c86f:e5ff:fe5d:9fc5.5353 > ff02::fb.5353: 0*- [0q] 5/0/0 (Cache flush) TXT "", (Cache flush) PTR floodlight.local., (Cache flush) HINFO, (Cache flush) SRV floodlight.local.:9 0 0, (Cache flush) AAAA fe80::c86f:e5ff:fe5d:9fc5 (249)
22:40:59.299721 IP6 fe80::c86f:e5ff:fe5d:9fc5 > ff02::2: ICMP6, router solicitation, length 16
22:40:59.486242 IP 0.0.0.0.68 > 255.255.255.255.67: BOOTP/DHCP, Request from 4e:a6:54:d1:d4:f0, length 300
22:41:00.141587 ARP, Request who-has 10.0.0.6 tell 10.0.0.5, length 28
22:41:00.413654 IP 0.0.0.0.68 > 255.255.255.255.67: BOOTP/DHCP, Request from d2:1a:a8:b4:a0:aa, length 300
22:41:00.532577 ARP, Request who-has 10.0.0.7 tell 10.0.0.5, length 28
22:41:00.533815 ARP, Reply 10.0.0.7 is-at 2a:23:2b:66:dd:b8, length 28
22:41:00.814241 IP6 fe80::9423:61ff:fed6:2eac.5353 > ff02::fb.5353: 0 [2q] PTR (QM)? _ipps._tcp.local. PTR (QM)? _ipp._tcp.local. (45)
22:41:01.276185 IP6 fe80::4ca6:54ff:fed1:d4f0.5353 > ff02::fb.5353: 0 [2q] PTR (QM)? _ipps._tcp.local. PTR (QM)? _ipp._tcp.local. (45)
22:41:01.745608 IP6 fe80::9423:61ff:fed6:2eac > ff02::2: ICMP6, router solicitation, length 16
22:41:01.781716 IP6 fe80::6ca3:42ff:febd:4b61.5353 > ff02::fb.5353: 0 [2q] PTR (QM)? _ipps._tcp.local. PTR (QM)? _ipp._tcp.local. (45)
22:41:01.896172 IP6 fe80::d01a:a8ff:feb4:a0aa.5353 > ff02::fb.5353: 0 [2q] PTR (QM)? _ipps._tcp.local. PTR (QM)? _ipp._tcp.local. (45)
22:41:02.188701 IP6 fe80::4ca6:54ff:fed1:d4f0 > ff02::2: ICMP6, router solicitation, length 16
22:41:02.393284 IP6 fe80::c86f:e5ff:fe5d:9fc5.5353 > ff02::fb.5353: 0 [2q] PTR (QM)? _ipps._tcp.local. PTR (QM)? _ipp._tcp.local. (45)
