Hosth3
#######################

22:40:09.619954 IP 0.0.0.0.68 > 255.255.255.255.67: BOOTP/DHCP, Request from 4e:a6:54:d1:d4:f0, length 300
22:40:10.032760 ARP, Request who-has 10.0.0.3 tell 10.0.0.1, length 28
22:40:10.033996 ARP, Reply 10.0.0.3 is-at 62:52:cd:31:e2:b5, length 28
22:40:10.063822 IP 10.0.0.1 > 10.0.0.3: ICMP echo request, id 4008, seq 1, length 64
22:40:10.065053 IP 10.0.0.3 > 10.0.0.1: ICMP echo reply, id 4008, seq 1, length 64
22:40:11.400488 ARP, Request who-has 10.0.0.4 tell 10.0.0.1, length 28
22:40:12.403693 ARP, Request who-has 10.0.0.4 tell 10.0.0.1, length 28
22:40:13.702424 IP 0.0.0.0.68 > 255.255.255.255.67: BOOTP/DHCP, Request from 96:23:61:d6:2e:ac, length 300
22:40:13.736924 ARP, Request who-has 10.0.0.5 tell 10.0.0.1, length 28
22:40:13.760600 IP6 fe80::9423:61ff:fed6:2eac.5353 > ff02::fb.5353: 0 [2q] PTR (QM)? _ipps._tcp.local. PTR (QM)? _ipp._tcp.local. (45)
22:40:13.958043 IP6 fe80::4ca6:54ff:fed1:d4f0.5353 > ff02::fb.5353: 0 [2q] PTR (QM)? _ipps._tcp.local. PTR (QM)? _ipp._tcp.local. (45)
22:40:14.565624 IP6 fe80::285f:63ff:fe81:3c5d.5353 > ff02::fb.5353: 0 [2q] PTR (QM)? _ipps._tcp.local. PTR (QM)? _ipp._tcp.local. (45)
22:40:14.722203 ARP, Request who-has 10.0.0.5 tell 10.0.0.1, length 28
22:40:14.858292 IP 0.0.0.0.68 > 255.255.255.255.67: BOOTP/DHCP, Request from 4e:a6:54:d1:d4:f0, length 300
22:40:15.720870 ARP, Request who-has 10.0.0.5 tell 10.0.0.1, length 28
22:40:18.022745 ARP, Request who-has 10.0.0.6 tell 10.0.0.1, length 28
22:40:19.024352 ARP, Request who-has 10.0.0.6 tell 10.0.0.1, length 28
22:40:20.290007 IP 0.0.0.0.68 > 255.255.255.255.67: BOOTP/DHCP, Request from 4e:a6:54:d1:d4:f0, length 300
22:40:20.330597 ARP, Request who-has 10.0.0.7 tell 10.0.0.1, length 28
22:40:21.326982 ARP, Request who-has 10.0.0.7 tell 10.0.0.1, length 28
22:40:21.478034 LLDP, length 47
22:40:21.524951 IP 0.0.0.0.68 > 255.255.255.255.67: BOOTP/DHCP, Request from 2a:5f:63:81:3c:5d, length 300
22:40:22.323739 ARP, Request who-has 10.0.0.7 tell 10.0.0.1, length 28
22:40:22.728298 ARP, Request who-has 10.0.0.8 tell 10.0.0.1, length 28
22:40:25.787001 IP 0.0.0.0.68 > 255.255.255.255.67: BOOTP/DHCP, Request from a6:0a:e8:c2:51:4f, length 300
22:40:28.520715 IP 0.0.0.0.68 > 255.255.255.255.67: BOOTP/DHCP, Request from 96:23:61:d6:2e:ac, length 300
22:40:29.763218 IP6 fe80::9423:61ff:fed6:2eac.5353 > ff02::fb.5353: 0 [2q] PTR (QM)? _ipps._tcp.local. PTR (QM)? _ipp._tcp.local. (45)
22:40:29.956856 IP6 fe80::4ca6:54ff:fed1:d4f0.5353 > ff02::fb.5353: 0 [2q] PTR (QM)? _ipps._tcp.local. PTR (QM)? _ipp._tcp.local. (45)
22:40:30.565669 IP6 fe80::285f:63ff:fe81:3c5d.5353 > ff02::fb.5353: 0 [2q] PTR (QM)? _ipps._tcp.local. PTR (QM)? _ipp._tcp.local. (45)
22:40:31.671794 IP6 fe80::a40a:e8ff:fec2:514f.5353 > ff02::fb.5353: 0 [2q] PTR (QM)? _ipps._tcp.local. PTR (QM)? _ipp._tcp.local. (45)
22:40:31.743046 IP 0.0.0.0.68 > 255.255.255.255.67: BOOTP/DHCP, Request from d2:1a:a8:b4:a0:aa, length 300
22:40:32.117041 IP6 fe80::d01a:a8ff:feb4:a0aa.5353 > ff02::fb.5353: 0 [2q] PTR (QM)? _ipps._tcp.local. PTR (QM)? _ipp._tcp.local. (45)
22:40:32.551817 IP 0.0.0.0.68 > 255.255.255.255.67: BOOTP/DHCP, Request from 2a:5f:63:81:3c:5d, length 300
22:40:33.386864 ARP, Request who-has 10.0.0.3 tell 10.0.0.2, length 28
22:40:33.388164 ARP, Reply 10.0.0.3 is-at 62:52:cd:31:e2:b5, length 28
22:40:33.458628 IP 10.0.0.2 > 10.0.0.3: ICMP echo request, id 4025, seq 1, length 64
22:40:33.459877 IP 10.0.0.3 > 10.0.0.2: ICMP echo reply, id 4025, seq 1, length 64
22:40:33.807289 ARP, Request who-has 10.0.0.4 tell 10.0.0.2, length 28
22:40:34.278634 ARP, Request who-has 10.0.0.5 tell 10.0.0.2, length 28
22:40:34.707893 ARP, Request who-has 10.0.0.6 tell 10.0.0.2, length 28
22:40:35.360262 IP 0.0.0.0.68 > 255.255.255.255.67: BOOTP/DHCP, Request from 4e:a6:54:d1:d4:f0, length 300
22:40:35.584763 ARP, Request who-has 10.0.0.8 tell 10.0.0.2, length 28
22:40:35.753144 IP 0.0.0.0.68 > 255.255.255.255.67: BOOTP/DHCP, Request from 96:23:61:d6:2e:ac, length 300
22:40:36.533631 LLDP, length 47
22:40:36.573088 ARP, Request who-has 10.0.0.8 tell 10.0.0.2, length 28
22:40:36.896625 2a:5f:63:81:3c:5d > ff:ff:ff:ff:ff:ff, ethertype Unknown (0x8942), length 69: 
	0x0000:  2000 0604 0002 0000 0207 0400 0000 0000  ................
	0x0010:  0804 0302 0002 0602 0078 fe0c 0026 e100  .........x...&..
	0x0020:  0000 0000 0000 0008 1808 0031 3791 7786  ...........17.w.
	0x0030:  1ff2 e601 0100 00                        .......
22:40:36.998832 IP 10.0.0.3 > 10.0.0.1: ICMP echo request, id 4031, seq 1, length 64
22:40:37.054877 IP 10.0.0.1 > 10.0.0.3: ICMP echo reply, id 4031, seq 1, length 64
22:40:37.359205 IP 10.0.0.3 > 10.0.0.2: ICMP echo request, id 4032, seq 1, length 64
22:40:37.378104 IP 10.0.0.2 > 10.0.0.3: ICMP echo reply, id 4032, seq 1, length 64
22:40:37.684208 ARP, Request who-has 10.0.0.4 tell 10.0.0.3, length 28
22:40:37.771787 ARP, Reply 10.0.0.4 is-at 0e:86:76:35:e9:b7, length 28
22:40:37.774006 IP 10.0.0.3 > 10.0.0.4: ICMP echo request, id 4033, seq 1, length 64
22:40:37.847950 IP 10.0.0.4 > 10.0.0.3: ICMP echo reply, id 4033, seq 1, length 64
22:40:38.153034 ARP, Request who-has 10.0.0.5 tell 10.0.0.3, length 28
22:40:38.195751 ARP, Reply 10.0.0.5 is-at 9e:70:ab:3e:15:eb, length 28
22:40:38.196974 IP 10.0.0.3 > 10.0.0.5: ICMP echo request, id 4034, seq 1, length 64
22:40:38.241160 IP 10.0.0.5 > 10.0.0.3: ICMP echo reply, id 4034, seq 1, length 64
22:40:38.392897 IP 0.0.0.0.68 > 255.255.255.255.67: BOOTP/DHCP, Request from a6:0a:e8:c2:51:4f, length 300
22:40:38.547808 ARP, Request who-has 10.0.0.6 tell 10.0.0.3, length 28
22:40:38.604624 ARP, Reply 10.0.0.6 is-at 42:b7:f3:57:e5:80, length 28
22:40:38.605820 IP 10.0.0.3 > 10.0.0.6: ICMP echo request, id 4035, seq 1, length 64
22:40:38.653188 IP 10.0.0.6 > 10.0.0.3: ICMP echo reply, id 4035, seq 1, length 64
22:40:38.959536 ARP, Request who-has 10.0.0.7 tell 10.0.0.3, length 28
22:40:39.011732 ARP, Reply 10.0.0.7 is-at 2a:23:2b:66:dd:b8, length 28
22:40:39.012957 IP 10.0.0.3 > 10.0.0.7: ICMP echo request, id 4036, seq 1, length 64
22:40:39.055668 IP 10.0.0.7 > 10.0.0.3: ICMP echo reply, id 4036, seq 1, length 64
22:40:39.255174 IP 0.0.0.0.68 > 255.255.255.255.67: BOOTP/DHCP, Request from d2:1a:a8:b4:a0:aa, length 300
22:40:39.360921 ARP, Request who-has 10.0.0.8 tell 10.0.0.3, length 28
22:40:39.417138 ARP, Reply 10.0.0.8 is-at 3a:f0:57:3e:0e:67, length 28
22:40:39.418525 IP 10.0.0.3 > 10.0.0.8: ICMP echo request, id 4037, seq 1, length 64
22:40:39.470271 IP 10.0.0.8 > 10.0.0.3: ICMP echo reply, id 4037, seq 1, length 64
22:40:39.799096 ARP, Request who-has 10.0.0.1 tell 10.0.0.4, length 28
22:40:42.003532 ARP, Request who-has 10.0.0.1 tell 10.0.0.3, length 28
22:40:42.041230 ARP, Reply 10.0.0.1 is-at c2:72:34:72:f2:5b, length 28
22:40:42.372087 ARP, Request who-has 10.0.0.2 tell 10.0.0.3, length 28
22:40:42.421561 ARP, Reply 10.0.0.2 is-at 22:ae:0f:90:01:17, length 28
22:40:44.463942 ARP, Request who-has 10.0.0.3 tell 10.0.0.8, length 28
22:40:44.465166 ARP, Reply 10.0.0.3 is-at 62:52:cd:31:e2:b5, length 28
22:40:49.284348 IP6 :: > ff02::16: HBH ICMP6, multicast listener report v2, 2 group record(s), length 48
22:40:49.475481 IP6 :: > ff02::1:ff81:3c5d: ICMP6, neighbor solicitation, who has fe80::285f:63ff:fe81:3c5d, length 24
22:40:49.585649 IP6 :: > ff02::16: HBH ICMP6, multicast listener report v2, 2 group record(s), length 48
22:40:49.587202 IP6 :: > ff02::16: HBH ICMP6, multicast listener report v2, 2 group record(s), length 48
22:40:49.587465 IP6 :: > ff02::16: HBH ICMP6, multicast listener report v2, 2 group record(s), length 48
22:40:49.591623 IP6 :: > ff02::16: HBH ICMP6, multicast listener report v2, 2 group record(s), length 48
22:40:49.591649 IP6 :: > ff02::16: HBH ICMP6, multicast listener report v2, 2 group record(s), length 48
22:40:49.653338 IP6 :: > ff02::16: HBH ICMP6, multicast listener report v2, 2 group record(s), length 48
22:40:49.660853 IP6 :: > ff02::1:ffd6:2eac: ICMP6, neighbor solicitation, who has fe80::9423:61ff:fed6:2eac, length 24
22:40:49.703578 IP6 :: > ff02::16: HBH ICMP6, multicast listener report v2, 2 group record(s), length 48
22:40:49.720734 IP6 :: > ff02::16: HBH ICMP6, multicast listener report v2, 2 group record(s), length 48
22:40:49.791979 IP6 :: > ff02::16: HBH ICMP6, multicast listener report v2, 2 group record(s), length 48
22:40:49.960338 IP6 :: > ff02::1:ffd1:d4f0: ICMP6, neighbor solicitation, who has fe80::4ca6:54ff:fed1:d4f0, length 24
22:40:50.062650 IP6 :: > ff02::16: HBH ICMP6, multicast listener report v2, 1 group record(s), length 28
22:40:50.193563 IP6 :: > ff02::1:ffc2:514f: ICMP6, neighbor solicitation, who has fe80::a40a:e8ff:fec2:514f, length 24
22:40:50.225270 IP6 :: > ff02::1:ffb4:a0aa: ICMP6, neighbor solicitation, who has fe80::d01a:a8ff:feb4:a0aa, length 24
22:40:50.385971 IP6 fe80::9423:61ff:fed6:2eac > ff02::16: HBH ICMP6, multicast listener report v2, 1 group record(s), length 28
22:40:50.393632 IP6 fe80::9423:61ff:fed6:2eac > ff02::16: HBH ICMP6, multicast listener report v2, 1 group record(s), length 28
22:40:50.435016 IP6 fe80::9423:61ff:fed6:2eac.5353 > ff02::fb.5353: 0*- [0q] 2/0/0 PTR _workstation._tcp.local., PTR floodlight [96:23:61:d6:2e:ac]._workstation._tcp.local. (117)
22:40:50.475547 IP6 fe80::285f:63ff:fe81:3c5d > ff02::16: HBH ICMP6, multicast listener report v2, 1 group record(s), length 28
22:40:50.480458 IP6 fe80::9423:61ff:fed6:2eac.5353 > ff02::fb.5353: 0 [3q] [5n] ANY (QM)? floodlight [96:23:61:d6:2e:ac]._workstation._tcp.local. ANY (QM)? floodlight.local. ANY (QM)? c.a.e.2.6.d.e.f.f.f.1.6.3.2.4.9.0.0.0.0.0.0.0.0.0.0.0.0.0.8.e.f.ip6.arpa. (267)
22:40:50.483788 IP6 fe80::285f:63ff:fe81:3c5d > ff02::16: HBH ICMP6, multicast listener report v2, 1 group record(s), length 28
22:40:50.533159 IP 10.0.0.4 > 10.0.0.3: ICMP echo request, id 4044, seq 1, length 64
22:40:50.534373 IP 10.0.0.3 > 10.0.0.4: ICMP echo reply, id 4044, seq 1, length 64
22:40:50.537459 IP6 fe80::285f:63ff:fe81:3c5d.5353 > ff02::fb.5353: 0*- [0q] 2/0/0 PTR _workstation._tcp.local., PTR floodlight [2a:5f:63:81:3c:5d]._workstation._tcp.local. (117)
22:40:50.551547 IP6 fe80::285f:63ff:fe81:3c5d > ff02::16: HBH ICMP6, multicast listener report v2, 1 group record(s), length 28
22:40:50.556326 IP6 fe80::285f:63ff:fe81:3c5d.5353 > ff02::fb.5353: 0 [3q] [5n] ANY (QM)? floodlight [2a:5f:63:81:3c:5d]._workstation._tcp.local. ANY (QM)? floodlight.local. ANY (QM)? d.5.c.3.1.8.e.f.f.f.3.6.f.5.8.2.0.0.0.0.0.0.0.0.0.0.0.0.0.8.e.f.ip6.arpa. (267)
22:40:50.557734 IP6 fe80::9423:61ff:fed6:2eac.5353 > ff02::fb.5353: 0 [2q] PTR (QM)? _ipps._tcp.local. PTR (QM)? _ipp._tcp.local. (45)
22:40:50.576989 IP6 fe80::285f:63ff:fe81:3c5d.5353 > ff02::fb.5353: 0 [2q] PTR (QM)? _ipps._tcp.local. PTR (QM)? _ipp._tcp.local. (45)
22:40:50.750906 IP6 fe80::9423:61ff:fed6:2eac.5353 > ff02::fb.5353: 0 [3q] [5n] ANY (QM)? floodlight [96:23:61:d6:2e:ac]._workstation._tcp.local. ANY (QM)? floodlight.local. ANY (QM)? c.a.e.2.6.d.e.f.f.f.1.6.3.2.4.9.0.0.0.0.0.0.0.0.0.0.0.0.0.8.e.f.ip6.arpa. (267)
22:40:50.809655 IP6 fe80::285f:63ff:fe81:3c5d.5353 > ff02::fb.5353: 0 [3q] [5n] ANY (QM)? floodlight [2a:5f:63:81:3c:5d]._workstation._tcp.local. ANY (QM)? floodlight.local. ANY (QM)? d.5.c.3.1.8.e.f.f.f.3.6.f.5.8.2.0.0.0.0.0.0.0.0.0.0.0.0.0.8.e.f.ip6.arpa. (267)
22:40:51.030062 IP6 fe80::9423:61ff:fed6:2eac > ff02::16: HBH ICMP6, multicast listener report v2, 1 group record(s), length 28
22:40:51.056161 IP6 fe80::285f:63ff:fe81:3c5d > ff02::16: HBH ICMP6, multicast listener report v2, 2 group record(s), length 48
22:40:51.059678 IP6 fe80::285f:63ff:fe81:3c5d.5353 > ff02::fb.5353: 0 [3q] [5n] ANY (QM)? floodlight [2a:5f:63:81:3c:5d]._workstation._tcp.local. ANY (QM)? floodlight.local. ANY (QM)? d.5.c.3.1.8.e.f.f.f.3.6.f.5.8.2.0.0.0.0.0.0.0.0.0.0.0.0.0.8.e.f.ip6.arpa. (267)
22:40:51.128222 IP6 fe80::4ca6:54ff:fed1:d4f0 > ff02::16: HBH ICMP6, multicast listener report v2, 1 group record(s), length 28
22:40:51.128248 IP6 fe80::4ca6:54ff:fed1:d4f0 > ff02::16: HBH ICMP6, multicast listener report v2, 1 group record(s), length 28
22:40:51.207147 IP6 fe80::4ca6:54ff:fed1:d4f0.5353 > ff02::fb.5353: 0*- [0q] 2/0/0 PTR _workstation._tcp.local., PTR floodlight [4e:a6:54:d1:d4:f0]._workstation._tcp.local. (117)
22:40:51.267072 IP6 fe80::285f:63ff:fe81:3c5d.5353 > ff02::fb.5353: 0*- [0q] 5/0/0 (Cache flush) TXT "", (Cache flush) AAAA fe80::285f:63ff:fe81:3c5d, (Cache flush) PTR floodlight.local., (Cache flush) HINFO, (Cache flush) SRV floodlight.local.:9 0 0 (249)
22:40:51.272608 IP6 fe80::9423:61ff:fed6:2eac.5353 > ff02::fb.5353: 0 [3q] [5n] ANY (QM)? floodlight [96:23:61:d6:2e:ac]._workstation._tcp.local. ANY (QM)? floodlight.local. ANY (QM)? c.a.e.2.6.d.e.f.f.f.1.6.3.2.4.9.0.0.0.0.0.0.0.0.0.0.0.0.0.8.e.f.ip6.arpa. (267)
22:40:51.272634 IP6 fe80::4ca6:54ff:fed1:d4f0.5353 > ff02::fb.5353: 0 [3q] [5n] ANY (QM)? floodlight [4e:a6:54:d1:d4:f0]._workstation._tcp.local. ANY (QM)? floodlight.local. ANY (QM)? 0.f.4.d.1.d.e.f.f.f.4.5.6.a.c.4.0.0.0.0.0.0.0.0.0.0.0.0.0.8.e.f.ip6.arpa. (267)
22:40:51.272659 IP6 fe80::4ca6:54ff:fed1:d4f0.5353 > ff02::fb.5353: 0 [2q] PTR (QM)? _ipps._tcp.local. PTR (QM)? _ipp._tcp.local. (45)
22:40:51.384409 IP6 fe80::a40a:e8ff:fec2:514f > ff02::16: HBH ICMP6, multicast listener report v2, 1 group record(s), length 28
22:40:51.384435 IP6 fe80::a40a:e8ff:fec2:514f > ff02::16: HBH ICMP6, multicast listener report v2, 1 group record(s), length 28
22:40:51.384461 ARP, Request who-has 10.0.0.5 tell 10.0.0.4, length 28
22:40:51.384696 IP6 fe80::a40a:e8ff:fec2:514f.5353 > ff02::fb.5353: 0*- [0q] 2/0/0 PTR _workstation._tcp.local., PTR floodlight [a6:0a:e8:c2:51:4f]._workstation._tcp.local. (117)
22:40:51.428894 IP6 fe80::a40a:e8ff:fec2:514f.5353 > ff02::fb.5353: 0 [3q] [5n] ANY (QM)? floodlight [a6:0a:e8:c2:51:4f]._workstation._tcp.local. ANY (QM)? floodlight.local. ANY (QM)? f.4.1.5.2.c.e.f.f.f.8.e.a.0.4.a.0.0.0.0.0.0.0.0.0.0.0.0.0.8.e.f.ip6.arpa. (267)
22:40:51.428921 IP6 fe80::a40a:e8ff:fec2:514f.5353 > ff02::fb.5353: 0 [2q] PTR (QM)? _ipps._tcp.local. PTR (QM)? _ipp._tcp.local. (45)
22:40:51.538704 IP6 fe80::9423:61ff:fed6:2eac.5353 > ff02::fb.5353: 0*- [0q] 5/0/0 (Cache flush) TXT "", (Cache flush) AAAA fe80::9423:61ff:fed6:2eac, (Cache flush) PTR floodlight.local., (Cache flush) HINFO, (Cache flush) SRV floodlight.local.:9 0 0 (249)
22:40:51.538730 IP6 fe80::4ca6:54ff:fed1:d4f0.5353 > ff02::fb.5353: 0 [3q] [5n] ANY (QM)? floodlight [4e:a6:54:d1:d4:f0]._workstation._tcp.local. ANY (QM)? floodlight.local. ANY (QM)? 0.f.4.d.1.d.e.f.f.f.4.5.6.a.c.4.0.0.0.0.0.0.0.0.0.0.0.0.0.8.e.f.ip6.arpa. (267)
22:40:51.538792 IP6 fe80::9423:61ff:fed6:2eac > ff02::16: HBH ICMP6, multicast listener report v2, 2 group record(s), length 48
22:40:51.561062 LLDP, length 47
22:40:51.567871 IP6 fe80::285f:63ff:fe81:3c5d.5353 > ff02::fb.5353: 0*- [0q] 2/0/0 PTR _workstation._tcp.local., PTR floodlight [2a:5f:63:81:3c:5d]._workstation._tcp.local. (117)
22:40:51.584572 IP6 fe80::285f:63ff:fe81:3c5d.5353 > ff02::fb.5353: 0 [2q] PTR (QM)? _ipps._tcp.local. PTR (QM)? _ipp._tcp.local. (45)
22:40:51.597848 IP6 fe80::a40a:e8ff:fec2:514f.5353 > ff02::fb.5353: 0 [3q] [5n] ANY (QM)? floodlight [a6:0a:e8:c2:51:4f]._workstation._tcp.local. ANY (QM)? floodlight.local. ANY (QM)? f.4.1.5.2.c.e.f.f.f.8.e.a.0.4.a.0.0.0.0.0.0.0.0.0.0.0.0.0.8.e.f.ip6.arpa. (267)
22:40:51.759153 IP6 fe80::4ca6:54ff:fed1:d4f0 > ff02::16: HBH ICMP6, multicast listener report v2, 2 group record(s), length 48
22:40:51.762818 IP6 fe80::4ca6:54ff:fed1:d4f0 > ff02::16: HBH ICMP6, multicast listener report v2, 1 group record(s), length 28
22:40:51.810904 IP6 fe80::d01a:a8ff:feb4:a0aa > ff02::16: HBH ICMP6, multicast listener report v2, 1 group record(s), length 28
22:40:51.816464 IP6 fe80::d01a:a8ff:feb4:a0aa > ff02::16: HBH ICMP6, multicast listener report v2, 1 group record(s), length 28
22:40:51.816490 IP6 fe80::d01a:a8ff:feb4:a0aa.5353 > ff02::fb.5353: 0*- [0q] 2/0/0 PTR _workstation._tcp.local., PTR floodlight [d2:1a:a8:b4:a0:aa]._workstation._tcp.local. (117)
22:40:51.924557 2a:5f:63:81:3c:5d > ff:ff:ff:ff:ff:ff, ethertype Unknown (0x8942), length 69: 
	0x0000:  2000 0604 0002 0000 0207 0400 0000 0000  ................
	0x0010:  0804 0302 0002 0602 0078 fe0c 0026 e100  .........x...&..
	0x0020:  0000 0000 0000 0008 1808 0031 3791 7786  ...........17.w.
	0x0030:  1ff2 e601 0100 00                        .......
22:40:51.933206 IP6 fe80::9423:61ff:fed6:2eac.5353 > ff02::fb.5353: 0*- [0q] 2/0/0 PTR _workstation._tcp.local., PTR floodlight [96:23:61:d6:2e:ac]._workstation._tcp.local. (117)
22:40:51.933232 IP6 fe80::9423:61ff:fed6:2eac.5353 > ff02::fb.5353: 0 [2q] PTR (QM)? _ipps._tcp.local. PTR (QM)? _ipp._tcp.local. (45)
22:40:51.933258 IP6 fe80::4ca6:54ff:fed1:d4f0.5353 > ff02::fb.5353: 0 [3q] [5n] ANY (QM)? floodlight [4e:a6:54:d1:d4:f0]._workstation._tcp.local. ANY (QM)? floodlight.local. ANY (QM)? 0.f.4.d.1.d.e.f.f.f.4.5.6.a.c.4.0.0.0.0.0.0.0.0.0.0.0.0.0.8.e.f.ip6.arpa. (267)
22:40:51.970552 IP6 fe80::a40a:e8ff:fec2:514f > ff02::16: HBH ICMP6, multicast listener report v2, 1 group record(s), length 28
22:40:52.316879 IP6 fe80::285f:63ff:fe81:3c5d.5353 > ff02::fb.5353: 0*- [0q] 5/0/0 (Cache flush) TXT "", (Cache flush) AAAA fe80::285f:63ff:fe81:3c5d, (Cache flush) PTR floodlight.local., (Cache flush) HINFO, (Cache flush) SRV floodlight.local.:9 0 0 (249)
22:40:52.480948 IP6 fe80::d01a:a8ff:feb4:a0aa.5353 > ff02::fb.5353: 0 [3q] [5n] ANY (QM)? floodlight [d2:1a:a8:b4:a0:aa]._workstation._tcp.local. ANY (QM)? floodlight.local. ANY (QM)? a.a.0.a.4.b.e.f.f.f.8.a.a.1.0.d.0.0.0.0.0.0.0.0.0.0.0.0.0.8.e.f.ip6.arpa. (267)
22:40:52.480974 IP6 fe80::a40a:e8ff:fec2:514f.5353 > ff02::fb.5353: 0*- [0q] 2/0/0 (Cache flush) TXT "", (Cache flush) SRV floodlight.local.:9 0 0 (110)
22:40:52.481000 IP6 fe80::4ca6:54ff:fed1:d4f0.5353 > ff02::fb.5353: 0*- [0q] 2/0/0 (Cache flush) TXT "", (Cache flush) SRV floodlight.local.:9 0 0 (110)
22:40:52.602869 IP6 fe80::a40a:e8ff:fec2:514f.5353 > ff02::fb.5353: 0*- [0q] 3/0/0 (Cache flush) HINFO, (Cache flush) AAAA fe80::a40a:e8ff:fec2:514f, (Cache flush) PTR floodlight.local. (167)
22:40:52.608787 IP6 fe80::4ca6:54ff:fed1:d4f0.5353 > ff02::fb.5353: 0*- [0q] 3/0/0 (Cache flush) HINFO, (Cache flush) AAAA fe80::4ca6:54ff:fed1:d4f0, (Cache flush) PTR floodlight.local. (167)
22:40:52.608832 IP6 fe80::d01a:a8ff:feb4:a0aa > ff02::16: HBH ICMP6, multicast listener report v2, 1 group record(s), length 28
22:40:52.608917 IP6 fe80::d01a:a8ff:feb4:a0aa.5353 > ff02::fb.5353: 0 [2q] PTR (QM)? _ipps._tcp.local. PTR (QM)? _ipp._tcp.local. (45)
22:40:52.700314 IP6 fe80::d01a:a8ff:feb4:a0aa > ff02::16: HBH ICMP6, multicast listener report v2, 2 group record(s), length 48
22:40:52.700340 IP6 fe80::d01a:a8ff:feb4:a0aa.5353 > ff02::fb.5353: 0 [3q] [5n] ANY (QM)? floodlight [d2:1a:a8:b4:a0:aa]._workstation._tcp.local. ANY (QM)? floodlight.local. ANY (QM)? a.a.0.a.4.b.e.f.f.f.8.a.a.1.0.d.0.0.0.0.0.0.0.0.0.0.0.0.0.8.e.f.ip6.arpa. (267)
22:40:52.797084 IP6 fe80::d01a:a8ff:feb4:a0aa.5353 > ff02::fb.5353: 0 [3q] [5n] ANY (QM)? floodlight [d2:1a:a8:b4:a0:aa]._workstation._tcp.local. ANY (QM)? floodlight.local. ANY (QM)? a.a.0.a.4.b.e.f.f.f.8.a.a.1.0.d.0.0.0.0.0.0.0.0.0.0.0.0.0.8.e.f.ip6.arpa. (267)
22:40:52.797118 IP6 fe80::a40a:e8ff:fec2:514f > ff02::16: HBH ICMP6, multicast listener report v2, 2 group record(s), length 48
22:40:52.855715 IP6 :: > ff02::16: HBH ICMP6, multicast listener report v2, 1 group record(s), length 28
22:40:52.896664 IP6 fe80::a40a:e8ff:fec2:514f.5353 > ff02::fb.5353: 0*- [0q] 2/0/0 PTR _workstation._tcp.local., PTR floodlight [a6:0a:e8:c2:51:4f]._workstation._tcp.local. (117)
22:40:52.924380 IP6 fe80::a40a:e8ff:fec2:514f.5353 > ff02::fb.5353: 0 [2q] PTR (QM)? _ipps._tcp.local. PTR (QM)? _ipp._tcp.local. (45)
22:40:52.924406 IP6 fe80::4ca6:54ff:fed1:d4f0.5353 > ff02::fb.5353: 0*- [0q] 2/0/0 PTR _workstation._tcp.local., PTR floodlight [4e:a6:54:d1:d4:f0]._workstation._tcp.local. (117)
22:40:52.924938 IP6 fe80::4ca6:54ff:fed1:d4f0.5353 > ff02::fb.5353: 0 [2q] PTR (QM)? _ipps._tcp.local. PTR (QM)? _ipp._tcp.local. (45)
22:40:53.033708 IP 0.0.0.0.68 > 255.255.255.255.67: BOOTP/DHCP, Request from 2a:5f:63:81:3c:5d, length 300
22:40:53.156365 IP6 :: > ff02::16: HBH ICMP6, multicast listener report v2, 1 group record(s), length 28
22:40:53.217836 IP 0.0.0.0.68 > 255.255.255.255.67: BOOTP/DHCP, Request from a6:0a:e8:c2:51:4f, length 300
22:40:53.217871 IP6 :: > ff02::16: HBH ICMP6, multicast listener report v2, 1 group record(s), length 28
22:40:53.217906 IP 0.0.0.0.68 > 255.255.255.255.67: BOOTP/DHCP, Request from 4e:a6:54:d1:d4:f0, length 300
22:40:53.217941 IP6 fe80::9423:61ff:fed6:2eac.5353 > ff02::fb.5353: 0*- [0q] 5/0/0 (Cache flush) TXT "", (Cache flush) AAAA fe80::9423:61ff:fed6:2eac, (Cache flush) PTR floodlight.local., (Cache flush) HINFO, (Cache flush) SRV floodlight.local.:9 0 0 (249)
22:40:53.284221 IP6 :: > ff02::16: HBH ICMP6, multicast listener report v2, 2 group record(s), length 48
22:40:53.284256 IP6 :: > ff02::16: HBH ICMP6, multicast listener report v2, 2 group record(s), length 48
22:40:53.350328 IP6 fe80::d01a:a8ff:feb4:a0aa.5353 > ff02::fb.5353: 0*- [0q] 5/0/0 (Cache flush) TXT "", (Cache flush) AAAA fe80::d01a:a8ff:feb4:a0aa, (Cache flush) PTR floodlight.local., (Cache flush) HINFO, (Cache flush) SRV floodlight.local.:9 0 0 (249)
22:40:53.364798 IP6 fe80::d01a:a8ff:feb4:a0aa.5353 > ff02::fb.5353: 0 [2q] PTR (QM)? _ipps._tcp.local. PTR (QM)? _ipp._tcp.local. (45)
22:40:53.364833 IP6 fe80::d01a:a8ff:feb4:a0aa.5353 > ff02::fb.5353: 0*- [0q] 2/0/0 PTR _workstation._tcp.local., PTR floodlight [d2:1a:a8:b4:a0:aa]._workstation._tcp.local. (117)
22:40:53.575725 IP6 :: > ff02::1:ff81:3c5d: ICMP6, neighbor solicitation, who has fe80::285f:63ff:fe81:3c5d, length 24
22:40:53.654067 IP6 :: > ff02::1:ffc2:514f: ICMP6, neighbor solicitation, who has fe80::a40a:e8ff:fec2:514f, length 24
22:40:53.774386 IP6 :: > ff02::16: HBH ICMP6, multicast listener report v2, 2 group record(s), length 48
22:40:53.774436 IP6 :: > ff02::16: HBH ICMP6, multicast listener report v2, 2 group record(s), length 48
22:40:53.774471 IP 0.0.0.0.68 > 255.255.255.255.67: BOOTP/DHCP, Request from 96:23:61:d6:2e:ac, length 300
22:40:53.822025 IP6 :: > ff02::1:ffd6:2eac: ICMP6, neighbor solicitation, who has fe80::9423:61ff:fed6:2eac, length 24
22:40:53.918339 IP6 :: > ff02::16: HBH ICMP6, multicast listener report v2, 1 group record(s), length 28
22:40:53.918390 IP6 :: > ff02::16: HBH ICMP6, multicast listener report v2, 1 group record(s), length 28
22:40:53.918425 IP6 :: > ff02::1:ffd1:d4f0: ICMP6, neighbor solicitation, who has fe80::4ca6:54ff:fed1:d4f0, length 24
22:40:53.956627 IP6 :: > ff02::16: HBH ICMP6, multicast listener report v2, 1 group record(s), length 28
22:40:53.976630 IP6 :: > ff02::16: HBH ICMP6, multicast listener report v2, 1 group record(s), length 28
22:40:53.978350 IP 0.0.0.0.68 > 255.255.255.255.67: BOOTP/DHCP, Request from d2:1a:a8:b4:a0:aa, length 300
22:40:54.005317 IP6 :: > ff02::16: HBH ICMP6, multicast listener report v2, 1 group record(s), length 28
22:40:54.005672 ARP, Request who-has 10.0.0.6 tell 10.0.0.4, length 28
22:40:54.291033 IP6 fe80::9423:61ff:fed6:2eac > ff02::16: HBH ICMP6, multicast listener report v2, 1 group record(s), length 28
22:40:54.291068 IP6 fe80::9423:61ff:fed6:2eac > ff02::2: ICMP6, router solicitation, length 16
22:40:54.291103 IP6 fe80::9423:61ff:fed6:2eac > ff02::16: HBH ICMP6, multicast listener report v2, 1 group record(s), length 28
22:40:54.292576 IP6 fe80::9423:61ff:fed6:2eac.5353 > ff02::fb.5353: 0*- [0q] 2/0/0 PTR _workstation._tcp.local., PTR floodlight [96:23:61:d6:2e:ac]._workstation._tcp.local. (117)
22:40:54.292612 IP6 fe80::9423:61ff:fed6:2eac.5353 > ff02::fb.5353: 0 [2q] PTR (QM)? _ipps._tcp.local. PTR (QM)? _ipp._tcp.local. (45)
22:40:54.520202 IP6 fe80::9423:61ff:fed6:2eac > ff02::16: HBH ICMP6, multicast listener report v2, 2 group record(s), length 48
22:40:54.521876 IP6 fe80::9423:61ff:fed6:2eac > ff02::16: HBH ICMP6, multicast listener report v2, 1 group record(s), length 28
22:40:54.527345 IP6 fe80::9423:61ff:fed6:2eac.5353 > ff02::fb.5353: 0 [3q] [5n] ANY (QM)? floodlight [96:23:61:d6:2e:ac]._workstation._tcp.local. ANY (QM)? floodlight.local. ANY (QM)? c.a.e.2.6.d.e.f.f.f.1.6.3.2.4.9.0.0.0.0.0.0.0.0.0.0.0.0.0.8.e.f.ip6.arpa. (267)
22:40:54.575494 IP6 fe80::285f:63ff:fe81:3c5d > ff02::16: HBH ICMP6, multicast listener report v2, 1 group record(s), length 28
22:40:54.575530 IP6 fe80::285f:63ff:fe81:3c5d > ff02::2: ICMP6, router solicitation, length 16
22:40:54.583686 IP6 fe80::285f:63ff:fe81:3c5d > ff02::16: HBH ICMP6, multicast listener report v2, 1 group record(s), length 28
22:40:54.638025 IP6 fe80::285f:63ff:fe81:3c5d.5353 > ff02::fb.5353: 0*- [0q] 2/0/0 PTR _workstation._tcp.local., PTR floodlight [2a:5f:63:81:3c:5d]._workstation._tcp.local. (117)
22:40:54.656380 IP6 fe80::285f:63ff:fe81:3c5d.5353 > ff02::fb.5353: 0 [3q] [5n] ANY (QM)? floodlight [2a:5f:63:81:3c:5d]._workstation._tcp.local. ANY (QM)? floodlight.local. ANY (QM)? d.5.c.3.1.8.e.f.f.f.3.6.f.5.8.2.0.0.0.0.0.0.0.0.0.0.0.0.0.8.e.f.ip6.arpa. (267)
22:40:54.659343 ARP, Request who-has 10.0.0.6 tell 10.0.0.4, length 28
22:40:54.665477 IP6 :: > ff02::1:ffb4:a0aa: ICMP6, neighbor solicitation, who has fe80::d01a:a8ff:feb4:a0aa, length 24
22:40:54.665513 IP6 fe80::a40a:e8ff:fec2:514f > ff02::16: HBH ICMP6, multicast listener report v2, 1 group record(s), length 28
22:40:54.665548 IP6 fe80::a40a:e8ff:fec2:514f > ff02::2: ICMP6, router solicitation, length 16
22:40:54.665583 IP6 fe80::a40a:e8ff:fec2:514f > ff02::16: HBH ICMP6, multicast listener report v2, 1 group record(s), length 28
22:40:54.683564 IP6 fe80::285f:63ff:fe81:3c5d.5353 > ff02::fb.5353: 0 [2q] PTR (QM)? _ipps._tcp.local. PTR (QM)? _ipp._tcp.local. (45)
22:40:54.805321 IP6 fe80::a40a:e8ff:fec2:514f.5353 > ff02::fb.5353: 0*- [0q] 2/0/0 PTR _workstation._tcp.local., PTR floodlight [a6:0a:e8:c2:51:4f]._workstation._tcp.local. (117)
22:40:54.858216 IP6 fe80::a40a:e8ff:fec2:514f.5353 > ff02::fb.5353: 0 [3q] [5n] ANY (QM)? floodlight [a6:0a:e8:c2:51:4f]._workstation._tcp.local. ANY (QM)? floodlight.local. ANY (QM)? f.4.1.5.2.c.e.f.f.f.8.e.a.0.4.a.0.0.0.0.0.0.0.0.0.0.0.0.0.8.e.f.ip6.arpa. (267)
22:40:54.858525 IP6 fe80::a40a:e8ff:fec2:514f.5353 > ff02::fb.5353: 0 [2q] PTR (QM)? _ipps._tcp.local. PTR (QM)? _ipp._tcp.local. (45)
22:40:54.908258 IP6 fe80::285f:63ff:fe81:3c5d.5353 > ff02::fb.5353: 0 [3q] [5n] ANY (QM)? floodlight [2a:5f:63:81:3c:5d]._workstation._tcp.local. ANY (QM)? floodlight.local. ANY (QM)? d.5.c.3.1.8.e.f.f.f.3.6.f.5.8.2.0.0.0.0.0.0.0.0.0.0.0.0.0.8.e.f.ip6.arpa. (267)
22:40:55.028722 IP6 fe80::a40a:e8ff:fec2:514f.5353 > ff02::fb.5353: 0 [3q] [5n] ANY (QM)? floodlight [a6:0a:e8:c2:51:4f]._workstation._tcp.local. ANY (QM)? floodlight.local. ANY (QM)? f.4.1.5.2.c.e.f.f.f.8.e.a.0.4.a.0.0.0.0.0.0.0.0.0.0.0.0.0.8.e.f.ip6.arpa. (267)
22:40:55.050976 IP6 fe80::a40a:e8ff:fec2:514f > ff02::16: HBH ICMP6, multicast listener report v2, 2 group record(s), length 48
22:40:55.152524 IP6 fe80::4ca6:54ff:fed1:d4f0 > ff02::16: HBH ICMP6, multicast listener report v2, 1 group record(s), length 28
22:40:55.157469 IP6 fe80::285f:63ff:fe81:3c5d.5353 > ff02::fb.5353: 0 [3q] [5n] ANY (QM)? floodlight [2a:5f:63:81:3c:5d]._workstation._tcp.local. ANY (QM)? floodlight.local. ANY (QM)? d.5.c.3.1.8.e.f.f.f.3.6.f.5.8.2.0.0.0.0.0.0.0.0.0.0.0.0.0.8.e.f.ip6.arpa. (267)
22:40:55.179707 IP 0.0.0.0.68 > 255.255.255.255.67: BOOTP/DHCP, Request from 2a:5f:63:81:3c:5d, length 300
22:40:55.226296 IP6 fe80::4ca6:54ff:fed1:d4f0 > ff02::2: ICMP6, router solicitation, length 16
22:40:55.226361 IP6 fe80::4ca6:54ff:fed1:d4f0 > ff02::16: HBH ICMP6, multicast listener report v2, 1 group record(s), length 28
22:40:55.226396 IP6 fe80::4ca6:54ff:fed1:d4f0.5353 > ff02::fb.5353: 0*- [0q] 2/0/0 PTR _workstation._tcp.local., PTR floodlight [4e:a6:54:d1:d4:f0]._workstation._tcp.local. (117)
22:40:55.226431 IP6 fe80::4ca6:54ff:fed1:d4f0.5353 > ff02::fb.5353: 0 [3q] [5n] ANY (QM)? floodlight [4e:a6:54:d1:d4:f0]._workstation._tcp.local. ANY (QM)? floodlight.local. ANY (QM)? 0.f.4.d.1.d.e.f.f.f.4.5.6.a.c.4.0.0.0.0.0.0.0.0.0.0.0.0.0.8.e.f.ip6.arpa. (267)
22:40:55.226466 IP6 fe80::4ca6:54ff:fed1:d4f0.5353 > ff02::fb.5353: 0 [2q] PTR (QM)? _ipps._tcp.local. PTR (QM)? _ipp._tcp.local. (45)
22:40:55.226501 IP6 fe80::4ca6:54ff:fed1:d4f0 > ff02::16: HBH ICMP6, multicast listener report v2, 2 group record(s), length 48
22:40:55.227959 IP6 fe80::4ca6:54ff:fed1:d4f0.5353 > ff02::fb.5353: 0 [3q] [5n] ANY (QM)? floodlight [4e:a6:54:d1:d4:f0]._workstation._tcp.local. ANY (QM)? floodlight.local. ANY (QM)? 0.f.4.d.1.d.e.f.f.f.4.5.6.a.c.4.0.0.0.0.0.0.0.0.0.0.0.0.0.8.e.f.ip6.arpa. (267)
22:40:55.227994 IP6 fe80::9423:61ff:fed6:2eac.5353 > ff02::fb.5353: 0 [3q] [5n] ANY (QM)? floodlight [96:23:61:d6:2e:ac]._workstation._tcp.local. ANY (QM)? floodlight.local. ANY (QM)? c.a.e.2.6.d.e.f.f.f.1.6.3.2.4.9.0.0.0.0.0.0.0.0.0.0.0.0.0.8.e.f.ip6.arpa. (267)
22:40:55.228029 IP6 fe80::9423:61ff:fed6:2eac.5353 > ff02::fb.5353: 0*- [0q] 5/0/0 (Cache flush) TXT "", (Cache flush) AAAA fe80::9423:61ff:fed6:2eac, (Cache flush) PTR floodlight.local., (Cache flush) HINFO, (Cache flush) SRV floodlight.local.:9 0 0 (249)
22:40:55.267563 IP6 fe80::285f:63ff:fe81:3c5d > ff02::16: HBH ICMP6, multicast listener report v2, 2 group record(s), length 48
22:40:55.356180 IP6 fe80::4ca6:54ff:fed1:d4f0.5353 > ff02::fb.5353: 0 [3q] [5n] ANY (QM)? floodlight [4e:a6:54:d1:d4:f0]._workstation._tcp.local. ANY (QM)? floodlight.local. ANY (QM)? 0.f.4.d.1.d.e.f.f.f.4.5.6.a.c.4.0.0.0.0.0.0.0.0.0.0.0.0.0.8.e.f.ip6.arpa. (267)
22:40:55.356215 IP6 fe80::a40a:e8ff:fec2:514f.5353 > ff02::fb.5353: 0 [3q] [5n] ANY (QM)? floodlight [a6:0a:e8:c2:51:4f]._workstation._tcp.local. ANY (QM)? floodlight.local. ANY (QM)? f.4.1.5.2.c.e.f.f.f.8.e.a.0.4.a.0.0.0.0.0.0.0.0.0.0.0.0.0.8.e.f.ip6.arpa. (267)
22:40:55.356250 IP 0.0.0.0.68 > 255.255.255.255.67: BOOTP/DHCP, Request from a6:0a:e8:c2:51:4f, length 300
22:40:55.362204 IP6 fe80::285f:63ff:fe81:3c5d.5353 > ff02::fb.5353: 0*- [0q] 5/0/0 (Cache flush) TXT "", (Cache flush) AAAA fe80::285f:63ff:fe81:3c5d, (Cache flush) PTR floodlight.local., (Cache flush) HINFO, (Cache flush) SRV floodlight.local.:9 0 0 (249)
22:40:55.440241 IP6 fe80::d01a:a8ff:feb4:a0aa > ff02::16: HBH ICMP6, multicast listener report v2, 1 group record(s), length 28
22:40:55.440276 IP6 fe80::d01a:a8ff:feb4:a0aa > ff02::2: ICMP6, router solicitation, length 16
22:40:55.440312 IP6 fe80::d01a:a8ff:feb4:a0aa > ff02::16: HBH ICMP6, multicast listener report v2, 1 group record(s), length 28
22:40:55.440346 IP6 fe80::d01a:a8ff:feb4:a0aa.5353 > ff02::fb.5353: 0*- [0q] 2/0/0 PTR _workstation._tcp.local., PTR floodlight [d2:1a:a8:b4:a0:aa]._workstation._tcp.local. (117)
22:40:55.440608 IP6 fe80::d01a:a8ff:feb4:a0aa.5353 > ff02::fb.5353: 0 [3q] [5n] ANY (QM)? floodlight [d2:1a:a8:b4:a0:aa]._workstation._tcp.local. ANY (QM)? floodlight.local. ANY (QM)? a.a.0.a.4.b.e.f.f.f.8.a.a.1.0.d.0.0.0.0.0.0.0.0.0.0.0.0.0.8.e.f.ip6.arpa. (267)
22:40:55.440644 IP6 fe80::a40a:e8ff:fec2:514f.5353 > ff02::fb.5353: 0*- [0q] 5/0/0 (Cache flush) TXT "", (Cache flush) AAAA fe80::a40a:e8ff:fec2:514f, (Cache flush) PTR floodlight.local., (Cache flush) HINFO, (Cache flush) SRV floodlight.local.:9 0 0 (249)
22:40:55.555702 IP6 fe80::285f:63ff:fe81:3c5d > ff02::16: HBH ICMP6, multicast listener report v2, 1 group record(s), length 28
22:40:55.653214 ARP, Request who-has 10.0.0.3 tell 10.0.0.4, length 28
22:40:55.654542 ARP, Reply 10.0.0.3 is-at 62:52:cd:31:e2:b5, length 28
22:40:55.666742 IP6 fe80::285f:63ff:fe81:3c5d.5353 > ff02::fb.5353: 0*- [0q] 2/0/0 PTR _workstation._tcp.local., PTR floodlight [2a:5f:63:81:3c:5d]._workstation._tcp.local. (117)
22:40:55.677833 IP6 fe80::285f:63ff:fe81:3c5d.5353 > ff02::fb.5353: 0 [2q] PTR (QM)? _ipps._tcp.local. PTR (QM)? _ipp._tcp.local. (45)
22:40:55.753496 IP6 fe80::a40a:e8ff:fec2:514f.5353 > ff02::fb.5353: 0*- [0q] 2/0/0 PTR _workstation._tcp.local., PTR floodlight [a6:0a:e8:c2:51:4f]._workstation._tcp.local. (117)
22:40:55.753531 IP6 fe80::a40a:e8ff:fec2:514f.5353 > ff02::fb.5353: 0 [2q] PTR (QM)? _ipps._tcp.local. PTR (QM)? _ipp._tcp.local. (45)
22:40:55.788707 IP6 fe80::9423:61ff:fed6:2eac.5353 > ff02::fb.5353: 0*- [0q] 2/0/0 PTR _workstation._tcp.local., PTR floodlight [96:23:61:d6:2e:ac]._workstation._tcp.local. (117)
22:40:55.868122 IP6 fe80::4ca6:54ff:fed1:d4f0.5353 > ff02::fb.5353: 0*- [0q] 5/0/0 (Cache flush) TXT "", (Cache flush) AAAA fe80::4ca6:54ff:fed1:d4f0, (Cache flush) PTR floodlight.local., (Cache flush) HINFO, (Cache flush) SRV floodlight.local.:9 0 0 (249)
22:40:55.868158 IP6 fe80::4ca6:54ff:fed1:d4f0 > ff02::16: HBH ICMP6, multicast listener report v2, 1 group record(s), length 28
22:40:55.868193 IP6 fe80::4ca6:54ff:fed1:d4f0.5353 > ff02::fb.5353: 0*- [0q] 2/0/0 PTR _workstation._tcp.local., PTR floodlight [4e:a6:54:d1:d4:f0]._workstation._tcp.local. (117)
22:40:55.868228 IP6 fe80::4ca6:54ff:fed1:d4f0.5353 > ff02::fb.5353: 0 [2q] PTR (QM)? _ipps._tcp.local. PTR (QM)? _ipp._tcp.local. (45)
22:40:55.868459 IP 0.0.0.0.68 > 255.255.255.255.67: BOOTP/DHCP, Request from 4e:a6:54:d1:d4:f0, length 300
22:40:55.917537 IP6 fe80::9423:61ff:fed6:2eac.5353 > ff02::fb.5353: 0*- [0q] 5/0/0 (Cache flush) TXT "", (Cache flush) AAAA fe80::9423:61ff:fed6:2eac, (Cache flush) PTR floodlight.local., (Cache flush) HINFO, (Cache flush) SRV floodlight.local.:9 0 0 (249)
22:40:55.922820 IP6 fe80::d01a:a8ff:feb4:a0aa.5353 > ff02::fb.5353: 0 [2q] PTR (QM)? _ipps._tcp.local. PTR (QM)? _ipp._tcp.local. (45)
22:40:55.934424 ARP, Request who-has 10.0.0.6 tell 10.0.0.4, length 28
22:40:55.939672 IP6 fe80::d01a:a8ff:feb4:a0aa.5353 > ff02::fb.5353: 0 [3q] [5n] ANY (QM)? floodlight [d2:1a:a8:b4:a0:aa]._workstation._tcp.local. ANY (QM)? floodlight.local. ANY (QM)? a.a.0.a.4.b.e.f.f.f.8.a.a.1.0.d.0.0.0.0.0.0.0.0.0.0.0.0.0.8.e.f.ip6.arpa. (267)
22:40:55.939707 IP6 fe80::d01a:a8ff:feb4:a0aa > ff02::16: HBH ICMP6, multicast listener report v2, 2 group record(s), length 48
22:40:55.939742 IP6 fe80::d01a:a8ff:feb4:a0aa.5353 > ff02::fb.5353: 0 [3q] [5n] ANY (QM)? floodlight [d2:1a:a8:b4:a0:aa]._workstation._tcp.local. ANY (QM)? floodlight.local. ANY (QM)? a.a.0.a.4.b.e.f.f.f.8.a.a.1.0.d.0.0.0.0.0.0.0.0.0.0.0.0.0.8.e.f.ip6.arpa. (267)
22:40:56.221698 IP 0.0.0.0.68 > 255.255.255.255.67: BOOTP/DHCP, Request from 96:23:61:d6:2e:ac, length 300
22:40:56.361659 IP6 fe80::d01a:a8ff:feb4:a0aa.5353 > ff02::fb.5353: 0*- [0q] 3/0/0 (Cache flush) TXT "", (Cache flush) HINFO, (Cache flush) SRV floodlight.local.:9 0 0 (135)
22:40:56.361694 IP6 fe80::d01a:a8ff:feb4:a0aa.5353 > ff02::fb.5353: 0*- [0q] 2/0/0 (Cache flush) PTR floodlight.local., (Cache flush) AAAA fe80::d01a:a8ff:feb4:a0aa (142)
22:40:56.361729 IP6 fe80::d01a:a8ff:feb4:a0aa > ff02::16: HBH ICMP6, multicast listener report v2, 1 group record(s), length 28
22:40:56.361764 IP6 fe80::d01a:a8ff:feb4:a0aa.5353 > ff02::fb.5353: 0*- [0q] 2/0/0 PTR _workstation._tcp.local., PTR floodlight [d2:1a:a8:b4:a0:aa]._workstation._tcp.local. (117)
22:40:56.369175 IP6 fe80::d01a:a8ff:feb4:a0aa.5353 > ff02::fb.5353: 0 [2q] PTR (QM)? _ipps._tcp.local. PTR (QM)? _ipp._tcp.local. (45)
22:40:56.400106 IP6 fe80::285f:63ff:fe81:3c5d.5353 > ff02::fb.5353: 0*- [0q] 5/0/0 (Cache flush) TXT "", (Cache flush) AAAA fe80::285f:63ff:fe81:3c5d, (Cache flush) PTR floodlight.local., (Cache flush) HINFO, (Cache flush) SRV floodlight.local.:9 0 0 (249)
22:40:56.462620 IP6 fe80::a40a:e8ff:fec2:514f.5353 > ff02::fb.5353: 0*- [0q] 5/0/0 (Cache flush) TXT "", (Cache flush) AAAA fe80::a40a:e8ff:fec2:514f, (Cache flush) PTR floodlight.local., (Cache flush) HINFO, (Cache flush) SRV floodlight.local.:9 0 0 (249)
22:40:56.582280 IP 0.0.0.0.68 > 255.255.255.255.67: BOOTP/DHCP, Request from d2:1a:a8:b4:a0:aa, length 300
22:40:56.699219 ARP, Request who-has 10.0.0.7 tell 10.0.0.4, length 28
22:40:56.699255 IP6 fe80::d01a:a8ff:feb4:a0aa.5353 > ff02::fb.5353: 0*- [0q] 5/0/0 (Cache flush) TXT "", (Cache flush) AAAA fe80::d01a:a8ff:feb4:a0aa, (Cache flush) PTR floodlight.local., (Cache flush) HINFO, (Cache flush) SRV floodlight.local.:9 0 0 (249)
22:40:56.856276 IP6 fe80::9423:61ff:fed6:2eac.5353 > ff02::fb.5353: 0 [2q] PTR (QM)? _ipps._tcp.local. PTR (QM)? _ipp._tcp.local. (45)
22:40:56.879322 IP6 fe80::9423:61ff:fed6:2eac.5353 > ff02::fb.5353: 0*- [0q] 5/0/0 PTR _workstation._tcp.local., PTR floodlight [96:23:61:d6:2e:ac]._workstation._tcp.local., (Cache flush) TXT "", (Cache flush) SRV floodlight.local.:9 0 0, (Cache flush) AAAA fe80::9423:61ff:fed6:2eac (189)
22:40:57.218379 ARP, Request who-has 10.0.0.8 tell 10.0.0.4, length 28
22:40:57.302355 IP6 fe80::4ca6:54ff:fed1:d4f0.5353 > ff02::fb.5353: 0 [2q] PTR (QM)? _ipps._tcp.local. PTR (QM)? _ipp._tcp.local. (45)
22:40:57.348726 IP6 fe80::4ca6:54ff:fed1:d4f0.5353 > ff02::fb.5353: 0*- [0q] 5/0/0 PTR _workstation._tcp.local., PTR floodlight [4e:a6:54:d1:d4:f0]._workstation._tcp.local., (Cache flush) TXT "", (Cache flush) SRV floodlight.local.:9 0 0, (Cache flush) AAAA fe80::4ca6:54ff:fed1:d4f0 (189)
22:40:57.552287 IP6 fe80::9423:61ff:fed6:2eac.5353 > ff02::fb.5353: 0*- [0q] 5/0/0 (Cache flush) TXT "", (Cache flush) AAAA fe80::9423:61ff:fed6:2eac, (Cache flush) PTR floodlight.local., (Cache flush) HINFO, (Cache flush) SRV floodlight.local.:9 0 0 (249)
22:40:57.647117 ARP, Request who-has 10.0.0.1 tell 10.0.0.5, length 28
22:40:57.680178 IP6 fe80::285f:63ff:fe81:3c5d.5353 > ff02::fb.5353: 0 [2q] PTR (QM)? _ipps._tcp.local. PTR (QM)? _ipp._tcp.local. (45)
22:40:57.696072 IP6 fe80::285f:63ff:fe81:3c5d.5353 > ff02::fb.5353: 0*- [0q] 5/0/0 PTR _workstation._tcp.local., PTR floodlight [2a:5f:63:81:3c:5d]._workstation._tcp.local., (Cache flush) TXT "", (Cache flush) SRV floodlight.local.:9 0 0, (Cache flush) AAAA fe80::285f:63ff:fe81:3c5d (189)
22:40:57.718080 IP6 fe80::a40a:e8ff:fec2:514f.5353 > ff02::fb.5353: 0 [2q] PTR (QM)? _ipps._tcp.local. PTR (QM)? _ipp._tcp.local. (45)
22:40:57.745169 IP6 fe80::9423:61ff:fed6:2eac > ff02::2: ICMP6, router solicitation, length 16
22:40:57.745204 IP6 fe80::a40a:e8ff:fec2:514f.5353 > ff02::fb.5353: 0*- [0q] 5/0/0 PTR _workstation._tcp.local., PTR floodlight [a6:0a:e8:c2:51:4f]._workstation._tcp.local., (Cache flush) TXT "", (Cache flush) SRV floodlight.local.:9 0 0, (Cache flush) AAAA fe80::a40a:e8ff:fec2:514f (189)
22:40:57.901801 IP6 fe80::d01a:a8ff:feb4:a0aa.5353 > ff02::fb.5353: 0 [2q] PTR (QM)? _ipps._tcp.local. PTR (QM)? _ipp._tcp.local. (45)
22:40:57.930027 IP6 fe80::d01a:a8ff:feb4:a0aa.5353 > ff02::fb.5353: 0*- [0q] 5/0/0 PTR _workstation._tcp.local., PTR floodlight [d2:1a:a8:b4:a0:aa]._workstation._tcp.local., (Cache flush) TXT "", (Cache flush) SRV floodlight.local.:9 0 0, (Cache flush) AAAA fe80::d01a:a8ff:feb4:a0aa (189)
22:40:58.021293 IP6 fe80::4ca6:54ff:fed1:d4f0.5353 > ff02::fb.5353: 0*- [0q] 5/0/0 (Cache flush) TXT "", (Cache flush) AAAA fe80::4ca6:54ff:fed1:d4f0, (Cache flush) PTR floodlight.local., (Cache flush) HINFO, (Cache flush) SRV floodlight.local.:9 0 0 (249)
22:40:58.168714 IP6 fe80::4ca6:54ff:fed1:d4f0 > ff02::2: ICMP6, router solicitation, length 16
22:40:58.421327 IP6 fe80::285f:63ff:fe81:3c5d.5353 > ff02::fb.5353: 0*- [0q] 5/0/0 (Cache flush) TXT "", (Cache flush) AAAA fe80::285f:63ff:fe81:3c5d, (Cache flush) PTR floodlight.local., (Cache flush) HINFO, (Cache flush) SRV floodlight.local.:9 0 0 (249)
22:40:58.447754 IP6 fe80::a40a:e8ff:fec2:514f.5353 > ff02::fb.5353: 0*- [0q] 5/0/0 (Cache flush) TXT "", (Cache flush) AAAA fe80::a40a:e8ff:fec2:514f, (Cache flush) PTR floodlight.local., (Cache flush) HINFO, (Cache flush) SRV floodlight.local.:9 0 0 (249)
22:40:58.579608 IP6 fe80::285f:63ff:fe81:3c5d > ff02::2: ICMP6, router solicitation, length 16
22:40:58.609997 IP6 fe80::a40a:e8ff:fec2:514f > ff02::2: ICMP6, router solicitation, length 16
22:40:58.646606 ARP, Request who-has 10.0.0.1 tell 10.0.0.5, length 28
