Hosth5
#######################

22:40:09.612310 IP6 fe80::c86:76ff:fe35:e9b7 > ff02::2: ICMP6, router solicitation, length 16
22:40:09.640225 IP6 fe80::2823:2bff:fe66:ddb8 > ff02::2: ICMP6, router solicitation, length 16
22:40:10.317060 IP6 fe80::40b7:f3ff:fe57:e580 > ff02::2: ICMP6, router solicitation, length 16
22:40:10.430998 IP6 fe80::38f0:57ff:fe3e:e67 > ff02::2: ICMP6, router solicitation, length 16
22:40:10.988386 IP 0.0.0.0.68 > 255.255.255.255.67: BOOTP/DHCP, Request from 2a:0d:34:b7:2c:12, length 300
22:40:15.198711 IP6 fe80::5cd4:88ff:fef3:5ac.5353 > ff02::fb.5353: 0 [2q] PTR (QM)? _ipps._tcp.local. PTR (QM)? _ipp._tcp.local. (45)
22:40:15.993052 IP6 fe80::280d:34ff:feb7:2c12.5353 > ff02::fb.5353: 0 [2q] PTR (QM)? _ipps._tcp.local. PTR (QM)? _ipp._tcp.local. (45)
22:40:16.103103 IP6 fe80::d01a:a8ff:feb4:a0aa.5353 > ff02::fb.5353: 0 [2q] PTR (QM)? _ipps._tcp.local. PTR (QM)? _ipp._tcp.local. (45)
22:40:19.380308 IP 0.0.0.0.68 > 255.255.255.255.67: BOOTP/DHCP, Request from 2a:0d:34:b7:2c:12, length 300
22:40:20.298673 IP 0.0.0.0.68 > 255.255.255.255.67: BOOTP/DHCP, Request from 5e:d4:88:f3:05:ac, length 300
22:40:20.973666 IP 0.0.0.0.68 > 255.255.255.255.67: BOOTP/DHCP, Request from d2:1a:a8:b4:a0:aa, length 300
22:40:21.475427 LLDP, length 47
22:40:21.526457 2a:0d:34:b7:2c:12 > ff:ff:ff:ff:ff:ff, ethertype Unknown (0x8942), length 69: 
	0x0000:  2000 0604 0002 0000 0207 0400 0000 0000  ................
	0x0010:  0a04 0302 0003 0602 0078 fe0c 0026 e100  .........x...&..
	0x0020:  0000 0000 0000 000a 1808 0031 3791 7786  ...........17.w.
	0x0030:  1ff2 e601 0100 00                        .......
22:40:22.333092 ARP, Request who-has 10.0.0.7 tell 10.0.0.1, length 28
22:40:22.750786 ARP, Request who-has 10.0.0.8 tell 10.0.0.1, length 28
22:40:28.525628 IP 0.0.0.0.68 > 255.255.255.255.67: BOOTP/DHCP, Request from 96:23:61:d6:2e:ac, length 300
22:40:28.820086 IP 0.0.0.0.68 > 255.255.255.255.67: BOOTP/DHCP, Request from 6e:a3:42:bd:4b:61, length 300
22:40:29.770316 IP6 fe80::9423:61ff:fed6:2eac.5353 > ff02::fb.5353: 0 [2q] PTR (QM)? _ipps._tcp.local. PTR (QM)? _ipp._tcp.local. (45)
22:40:29.940090 IP 0.0.0.0.68 > 255.255.255.255.67: BOOTP/DHCP, Request from 2a:0d:34:b7:2c:12, length 300
22:40:29.960728 IP6 fe80::4ca6:54ff:fed1:d4f0.5353 > ff02::fb.5353: 0 [2q] PTR (QM)? _ipps._tcp.local. PTR (QM)? _ipp._tcp.local. (45)
22:40:30.370867 IP6 fe80::6ca3:42ff:febd:4b61.5353 > ff02::fb.5353: 0 [2q] PTR (QM)? _ipps._tcp.local. PTR (QM)? _ipp._tcp.local. (45)
22:40:30.396000 IP 0.0.0.0.68 > 255.255.255.255.67: BOOTP/DHCP, Request from 5e:d4:88:f3:05:ac, length 300
22:40:31.196173 IP6 fe80::5cd4:88ff:fef3:5ac.5353 > ff02::fb.5353: 0 [2q] PTR (QM)? _ipps._tcp.local. PTR (QM)? _ipp._tcp.local. (45)
22:40:31.728998 IP 0.0.0.0.68 > 255.255.255.255.67: BOOTP/DHCP, Request from d2:1a:a8:b4:a0:aa, length 300
22:40:31.993892 IP6 fe80::280d:34ff:feb7:2c12.5353 > ff02::fb.5353: 0 [2q] PTR (QM)? _ipps._tcp.local. PTR (QM)? _ipp._tcp.local. (45)
22:40:32.105067 IP6 fe80::d01a:a8ff:feb4:a0aa.5353 > ff02::fb.5353: 0 [2q] PTR (QM)? _ipps._tcp.local. PTR (QM)? _ipp._tcp.local. (45)
22:40:33.396301 ARP, Request who-has 10.0.0.3 tell 10.0.0.2, length 28
22:40:33.822295 ARP, Request who-has 10.0.0.4 tell 10.0.0.2, length 28
22:40:34.282608 ARP, Request who-has 10.0.0.5 tell 10.0.0.2, length 28
22:40:34.284047 ARP, Reply 10.0.0.5 is-at 9e:70:ab:3e:15:eb, length 28
22:40:34.350316 IP 10.0.0.2 > 10.0.0.5: ICMP echo request, id 4027, seq 1, length 64
22:40:34.351574 IP 10.0.0.5 > 10.0.0.2: ICMP echo reply, id 4027, seq 1, length 64
22:40:34.717710 ARP, Request who-has 10.0.0.6 tell 10.0.0.2, length 28
22:40:35.146320 ARP, Request who-has 10.0.0.7 tell 10.0.0.2, length 28
22:40:35.360009 IP 0.0.0.0.68 > 255.255.255.255.67: BOOTP/DHCP, Request from 4e:a6:54:d1:d4:f0, length 300
22:40:35.595890 ARP, Request who-has 10.0.0.8 tell 10.0.0.2, length 28
22:40:35.759002 IP 0.0.0.0.68 > 255.255.255.255.67: BOOTP/DHCP, Request from 96:23:61:d6:2e:ac, length 300
22:40:35.803261 IP 0.0.0.0.68 > 255.255.255.255.67: BOOTP/DHCP, Request from 6e:a3:42:bd:4b:61, length 300
22:40:36.513878 LLDP, length 47
22:40:36.576995 ARP, Request who-has 10.0.0.8 tell 10.0.0.2, length 28
22:40:36.599024 2a:0d:34:b7:2c:12 > ff:ff:ff:ff:ff:ff, ethertype Unknown (0x8942), length 69: 
	0x0000:  2000 0604 0002 0000 0207 0400 0000 0000  ................
	0x0010:  0a04 0302 0003 0602 0078 fe0c 0026 e100  .........x...&..
	0x0020:  0000 0000 0000 000a 1808 0031 3791 7786  ...........17.w.
	0x0030:  1ff2 e601 0100 00                        .......
22:40:37.015885 IP 0.0.0.0.68 > 255.255.255.255.67: BOOTP/DHCP, Request from 2a:0d:34:b7:2c:12, length 300
22:40:37.699161 ARP, Request who-has 10.0.0.4 tell 10.0.0.3, length 28
22:40:38.171341 ARP, Request who-has 10.0.0.5 tell 10.0.0.3, length 28
22:40:38.172602 ARP, Reply 10.0.0.5 is-at 9e:70:ab:3e:15:eb, length 28
22:40:38.220884 IP 10.0.0.3 > 10.0.0.5: ICMP echo request, id 4034, seq 1, length 64
22:40:38.222216 IP 10.0.0.5 > 10.0.0.3: ICMP echo reply, id 4034, seq 1, length 64
22:40:38.562878 ARP, Request who-has 10.0.0.6 tell 10.0.0.3, length 28
22:40:38.982985 ARP, Request who-has 10.0.0.7 tell 10.0.0.3, length 28
22:40:39.244427 IP 0.0.0.0.68 > 255.255.255.255.67: BOOTP/DHCP, Request from d2:1a:a8:b4:a0:aa, length 300
22:40:39.396082 ARP, Request who-has 10.0.0.8 tell 10.0.0.3, length 28
22:40:39.783806 ARP, Request who-has 10.0.0.1 tell 10.0.0.4, length 28
22:40:45.421449 IP 0.0.0.0.68 > 255.255.255.255.67: BOOTP/DHCP, Request from 2a:0d:34:b7:2c:12, length 300
22:40:49.342538 IP6 :: > ff02::16: HBH ICMP6, multicast listener report v2, 2 group record(s), length 48
22:40:49.400755 IP6 :: > ff02::16: HBH ICMP6, multicast listener report v2, 2 group record(s), length 48
22:40:49.400780 IP6 :: > ff02::16: HBH ICMP6, multicast listener report v2, 2 group record(s), length 48
22:40:49.454319 IP6 :: > ff02::16: HBH ICMP6, multicast listener report v2, 2 group record(s), length 48
22:40:49.495900 IP6 :: > ff02::16: HBH ICMP6, multicast listener report v2, 2 group record(s), length 48
22:40:49.525799 IP6 :: > ff02::16: HBH ICMP6, multicast listener report v2, 2 group record(s), length 48
22:40:49.525825 IP6 :: > ff02::16: HBH ICMP6, multicast listener report v2, 2 group record(s), length 48
22:40:49.567492 IP6 :: > ff02::1:ffb7:2c12: ICMP6, neighbor solicitation, who has fe80::280d:34ff:feb7:2c12, length 24
22:40:49.574432 IP6 :: > ff02::16: HBH ICMP6, multicast listener report v2, 2 group record(s), length 48
22:40:49.621283 IP6 :: > ff02::1:ffbd:4b61: ICMP6, neighbor solicitation, who has fe80::6ca3:42ff:febd:4b61, length 24
22:40:49.691622 IP6 :: > ff02::16: HBH ICMP6, multicast listener report v2, 2 group record(s), length 48
22:40:49.851679 IP6 :: > ff02::16: HBH ICMP6, multicast listener report v2, 2 group record(s), length 48
22:40:49.941530 IP6 :: > ff02::16: HBH ICMP6, multicast listener report v2, 2 group record(s), length 48
22:40:49.968984 IP6 :: > ff02::1:ffd1:d4f0: ICMP6, neighbor solicitation, who has fe80::4ca6:54ff:fed1:d4f0, length 24
22:40:49.976509 IP6 :: > ff02::16: HBH ICMP6, multicast listener report v2, 2 group record(s), length 48
22:40:50.065819 IP6 :: > ff02::16: HBH ICMP6, multicast listener report v2, 1 group record(s), length 28
22:40:50.148022 IP6 :: > ff02::1:fff3:5ac: ICMP6, neighbor solicitation, who has fe80::5cd4:88ff:fef3:5ac, length 24
22:40:50.205618 IP6 :: > ff02::1:ffb4:a0aa: ICMP6, neighbor solicitation, who has fe80::d01a:a8ff:feb4:a0aa, length 24
22:40:50.391198 IP6 fe80::9423:61ff:fed6:2eac > ff02::16: HBH ICMP6, multicast listener report v2, 1 group record(s), length 28
22:40:50.409134 IP6 fe80::9423:61ff:fed6:2eac > ff02::16: HBH ICMP6, multicast listener report v2, 1 group record(s), length 28
22:40:50.437650 IP6 fe80::9423:61ff:fed6:2eac.5353 > ff02::fb.5353: 0*- [0q] 2/0/0 PTR _workstation._tcp.local., PTR floodlight [96:23:61:d6:2e:ac]._workstation._tcp.local. (117)
22:40:50.507379 IP6 fe80::9423:61ff:fed6:2eac.5353 > ff02::fb.5353: 0 [3q] [5n] ANY (QM)? floodlight [96:23:61:d6:2e:ac]._workstation._tcp.local. ANY (QM)? floodlight.local. ANY (QM)? c.a.e.2.6.d.e.f.f.f.1.6.3.2.4.9.0.0.0.0.0.0.0.0.0.0.0.0.0.8.e.f.ip6.arpa. (267)
22:40:50.567654 IP6 fe80::280d:34ff:feb7:2c12 > ff02::16: HBH ICMP6, multicast listener report v2, 1 group record(s), length 28
22:40:50.575481 IP6 fe80::280d:34ff:feb7:2c12 > ff02::16: HBH ICMP6, multicast listener report v2, 1 group record(s), length 28
22:40:50.600394 IP6 fe80::9423:61ff:fed6:2eac.5353 > ff02::fb.5353: 0 [2q] PTR (QM)? _ipps._tcp.local. PTR (QM)? _ipp._tcp.local. (45)
22:40:50.626069 IP6 fe80::6ca3:42ff:febd:4b61 > ff02::16: HBH ICMP6, multicast listener report v2, 1 group record(s), length 28
22:40:50.626411 IP6 fe80::6ca3:42ff:febd:4b61 > ff02::16: HBH ICMP6, multicast listener report v2, 1 group record(s), length 28
22:40:50.626506 IP6 fe80::6ca3:42ff:febd:4b61.5353 > ff02::fb.5353: 0*- [0q] 2/0/0 PTR _workstation._tcp.local., PTR floodlight [6e:a3:42:bd:4b:61]._workstation._tcp.local. (117)
22:40:50.633839 IP6 fe80::280d:34ff:feb7:2c12.5353 > ff02::fb.5353: 0*- [0q] 2/0/0 PTR _workstation._tcp.local., PTR floodlight [2a:0d:34:b7:2c:12]._workstation._tcp.local. (117)
22:40:50.649404 IP6 fe80::280d:34ff:feb7:2c12.5353 > ff02::fb.5353: 0 [3q] [5n] ANY (QM)? floodlight [2a:0d:34:b7:2c:12]._workstation._tcp.local. ANY (QM)? floodlight.local. ANY (QM)? 2.1.c.2.7.b.e.f.f.f.4.3.d.0.8.2.0.0.0.0.0.0.0.0.0.0.0.0.0.8.e.f.ip6.arpa. (267)
22:40:50.669839 IP6 fe80::280d:34ff:feb7:2c12.5353 > ff02::fb.5353: 0 [2q] PTR (QM)? _ipps._tcp.local. PTR (QM)? _ipp._tcp.local. (45)
22:40:50.677182 IP6 fe80::6ca3:42ff:febd:4b61.5353 > ff02::fb.5353: 0 [3q] [5n] ANY (QM)? floodlight [6e:a3:42:bd:4b:61]._workstation._tcp.local. ANY (QM)? floodlight.local. ANY (QM)? 1.6.b.4.d.b.e.f.f.f.2.4.3.a.c.6.0.0.0.0.0.0.0.0.0.0.0.0.0.8.e.f.ip6.arpa. (267)
22:40:50.767486 IP6 fe80::280d:34ff:feb7:2c12 > ff02::16: HBH ICMP6, multicast listener report v2, 1 group record(s), length 28
22:40:50.902548 IP6 fe80::280d:34ff:feb7:2c12.5353 > ff02::fb.5353: 0 [3q] [5n] ANY (QM)? floodlight [2a:0d:34:b7:2c:12]._workstation._tcp.local. ANY (QM)? floodlight.local. ANY (QM)? 2.1.c.2.7.b.e.f.f.f.4.3.d.0.8.2.0.0.0.0.0.0.0.0.0.0.0.0.0.8.e.f.ip6.arpa. (267)
22:40:50.964197 IP6 fe80::9423:61ff:fed6:2eac.5353 > ff02::fb.5353: 0 [3q] [5n] ANY (QM)? floodlight [96:23:61:d6:2e:ac]._workstation._tcp.local. ANY (QM)? floodlight.local. ANY (QM)? c.a.e.2.6.d.e.f.f.f.1.6.3.2.4.9.0.0.0.0.0.0.0.0.0.0.0.0.0.8.e.f.ip6.arpa. (267)
22:40:51.091118 IP6 fe80::6ca3:42ff:febd:4b61.5353 > ff02::fb.5353: 0 [3q] [5n] ANY (QM)? floodlight [6e:a3:42:bd:4b:61]._workstation._tcp.local. ANY (QM)? floodlight.local. ANY (QM)? 1.6.b.4.d.b.e.f.f.f.2.4.3.a.c.6.0.0.0.0.0.0.0.0.0.0.0.0.0.8.e.f.ip6.arpa. (267)
22:40:51.116512 IP6 fe80::9423:61ff:fed6:2eac > ff02::16: HBH ICMP6, multicast listener report v2, 1 group record(s), length 28
22:40:51.117101 ARP, Request who-has 10.0.0.5 tell 10.0.0.4, length 28
22:40:51.118291 ARP, Reply 10.0.0.5 is-at 9e:70:ab:3e:15:eb, length 28
22:40:51.154663 IP6 fe80::280d:34ff:feb7:2c12.5353 > ff02::fb.5353: 0 [3q] [5n] ANY (QM)? floodlight [2a:0d:34:b7:2c:12]._workstation._tcp.local. ANY (QM)? floodlight.local. ANY (QM)? 2.1.c.2.7.b.e.f.f.f.4.3.d.0.8.2.0.0.0.0.0.0.0.0.0.0.0.0.0.8.e.f.ip6.arpa. (267)
22:40:51.167548 IP6 fe80::280d:34ff:feb7:2c12 > ff02::16: HBH ICMP6, multicast listener report v2, 2 group record(s), length 48
22:40:51.184953 IP6 fe80::4ca6:54ff:fed1:d4f0 > ff02::16: HBH ICMP6, multicast listener report v2, 1 group record(s), length 28
22:40:51.184979 IP6 fe80::4ca6:54ff:fed1:d4f0 > ff02::16: HBH ICMP6, multicast listener report v2, 1 group record(s), length 28
22:40:51.357947 IP6 fe80::5cd4:88ff:fef3:5ac > ff02::16: HBH ICMP6, multicast listener report v2, 1 group record(s), length 28
22:40:51.357973 IP6 fe80::5cd4:88ff:fef3:5ac > ff02::16: HBH ICMP6, multicast listener report v2, 1 group record(s), length 28
22:40:51.358162 IP6 fe80::d01a:a8ff:feb4:a0aa > ff02::16: HBH ICMP6, multicast listener report v2, 1 group record(s), length 28
22:40:51.358544 IP6 fe80::5cd4:88ff:fef3:5ac.5353 > ff02::fb.5353: 0*- [0q] 2/0/0 PTR _workstation._tcp.local., PTR floodlight [5e:d4:88:f3:05:ac]._workstation._tcp.local. (117)
22:40:51.358570 IP6 fe80::6ca3:42ff:febd:4b61 > ff02::16: HBH ICMP6, multicast listener report v2, 1 group record(s), length 28
22:40:51.374705 IP6 fe80::280d:34ff:feb7:2c12.5353 > ff02::fb.5353: 0*- [0q] 5/0/0 (Cache flush) TXT "", (Cache flush) AAAA fe80::280d:34ff:feb7:2c12, (Cache flush) PTR floodlight.local., (Cache flush) HINFO, (Cache flush) SRV floodlight.local.:9 0 0 (249)
22:40:51.416946 IP6 fe80::4ca6:54ff:fed1:d4f0.5353 > ff02::fb.5353: 0*- [0q] 2/0/0 PTR _workstation._tcp.local., PTR floodlight [4e:a6:54:d1:d4:f0]._workstation._tcp.local. (117)
22:40:51.417245 IP6 fe80::d01a:a8ff:feb4:a0aa > ff02::16: HBH ICMP6, multicast listener report v2, 1 group record(s), length 28
22:40:51.441217 IP6 fe80::5cd4:88ff:fef3:5ac.5353 > ff02::fb.5353: 0 [3q] [5n] ANY (QM)? floodlight [5e:d4:88:f3:05:ac]._workstation._tcp.local. ANY (QM)? floodlight.local. ANY (QM)? c.a.5.0.3.f.e.f.f.f.8.8.4.d.c.5.0.0.0.0.0.0.0.0.0.0.0.0.0.8.e.f.ip6.arpa. (267)
22:40:51.441370 IP6 fe80::5cd4:88ff:fef3:5ac.5353 > ff02::fb.5353: 0 [2q] PTR (QM)? _ipps._tcp.local. PTR (QM)? _ipp._tcp.local. (45)
22:40:51.441396 IP6 fe80::d01a:a8ff:feb4:a0aa.5353 > ff02::fb.5353: 0*- [0q] 2/0/0 PTR _workstation._tcp.local., PTR floodlight [d2:1a:a8:b4:a0:aa]._workstation._tcp.local. (117)
22:40:51.616323 LLDP, length 47
22:40:51.616350 2a:0d:34:b7:2c:12 > ff:ff:ff:ff:ff:ff, ethertype Unknown (0x8942), length 69: 
	0x0000:  2000 0604 0002 0000 0207 0400 0000 0000  ................
	0x0010:  0a04 0302 0003 0602 0078 fe0c 0026 e100  .........x...&..
	0x0020:  0000 0000 0000 000a 1808 0031 3791 7786  ...........17.w.
	0x0030:  1ff2 e601 0100 00                        .......
22:40:51.661003 IP6 fe80::d01a:a8ff:feb4:a0aa.5353 > ff02::fb.5353: 0 [3q] [5n] ANY (QM)? floodlight [d2:1a:a8:b4:a0:aa]._workstation._tcp.local. ANY (QM)? floodlight.local. ANY (QM)? a.a.0.a.4.b.e.f.f.f.8.a.a.1.0.d.0.0.0.0.0.0.0.0.0.0.0.0.0.8.e.f.ip6.arpa. (267)
22:40:51.661217 IP6 fe80::9423:61ff:fed6:2eac.5353 > ff02::fb.5353: 0 [3q] [5n] ANY (QM)? floodlight [96:23:61:d6:2e:ac]._workstation._tcp.local. ANY (QM)? floodlight.local. ANY (QM)? c.a.e.2.6.d.e.f.f.f.1.6.3.2.4.9.0.0.0.0.0.0.0.0.0.0.0.0.0.8.e.f.ip6.arpa. (267)
22:40:51.670896 IP6 fe80::280d:34ff:feb7:2c12.5353 > ff02::fb.5353: 0 [2q] PTR (QM)? _ipps._tcp.local. PTR (QM)? _ipp._tcp.local. (45)
22:40:51.671671 IP 10.0.0.4 > 10.0.0.5: ICMP echo request, id 4045, seq 1, length 64
22:40:51.672926 IP 10.0.0.5 > 10.0.0.4: ICMP echo reply, id 4045, seq 1, length 64
22:40:51.674319 IP6 fe80::280d:34ff:feb7:2c12.5353 > ff02::fb.5353: 0*- [0q] 2/0/0 PTR _workstation._tcp.local., PTR floodlight [2a:0d:34:b7:2c:12]._workstation._tcp.local. (117)
22:40:51.679989 IP6 fe80::d01a:a8ff:feb4:a0aa > ff02::16: HBH ICMP6, multicast listener report v2, 1 group record(s), length 28
22:40:51.680137 IP6 fe80::d01a:a8ff:feb4:a0aa.5353 > ff02::fb.5353: 0 [2q] PTR (QM)? _ipps._tcp.local. PTR (QM)? _ipp._tcp.local. (45)
22:40:51.680163 IP6 fe80::5cd4:88ff:fef3:5ac.5353 > ff02::fb.5353: 0 [3q] [5n] ANY (QM)? floodlight [5e:d4:88:f3:05:ac]._workstation._tcp.local. ANY (QM)? floodlight.local. ANY (QM)? c.a.5.0.3.f.e.f.f.f.8.8.4.d.c.5.0.0.0.0.0.0.0.0.0.0.0.0.0.8.e.f.ip6.arpa. (267)
22:40:51.680189 IP6 fe80::d01a:a8ff:feb4:a0aa > ff02::16: HBH ICMP6, multicast listener report v2, 2 group record(s), length 48
22:40:51.680214 IP6 fe80::4ca6:54ff:fed1:d4f0.5353 > ff02::fb.5353: 0 [3q] [5n] ANY (QM)? floodlight [4e:a6:54:d1:d4:f0]._workstation._tcp.local. ANY (QM)? floodlight.local. ANY (QM)? 0.f.4.d.1.d.e.f.f.f.4.5.6.a.c.4.0.0.0.0.0.0.0.0.0.0.0.0.0.8.e.f.ip6.arpa. (267)
22:40:51.680543 IP6 fe80::4ca6:54ff:fed1:d4f0.5353 > ff02::fb.5353: 0 [2q] PTR (QM)? _ipps._tcp.local. PTR (QM)? _ipp._tcp.local. (45)
22:40:51.848088 IP6 fe80::d01a:a8ff:feb4:a0aa.5353 > ff02::fb.5353: 0 [3q] [5n] ANY (QM)? floodlight [d2:1a:a8:b4:a0:aa]._workstation._tcp.local. ANY (QM)? floodlight.local. ANY (QM)? a.a.0.a.4.b.e.f.f.f.8.a.a.1.0.d.0.0.0.0.0.0.0.0.0.0.0.0.0.8.e.f.ip6.arpa. (267)
22:40:51.848114 IP6 fe80::6ca3:42ff:febd:4b61.5353 > ff02::fb.5353: 0 [3q] [5n] ANY (QM)? floodlight [6e:a3:42:bd:4b:61]._workstation._tcp.local. ANY (QM)? floodlight.local. ANY (QM)? 1.6.b.4.d.b.e.f.f.f.2.4.3.a.c.6.0.0.0.0.0.0.0.0.0.0.0.0.0.8.e.f.ip6.arpa. (267)
22:40:51.876775 IP6 fe80::5cd4:88ff:fef3:5ac > ff02::16: HBH ICMP6, multicast listener report v2, 2 group record(s), length 48
22:40:51.876801 IP6 fe80::5cd4:88ff:fef3:5ac.5353 > ff02::fb.5353: 0 [3q] [5n] ANY (QM)? floodlight [5e:d4:88:f3:05:ac]._workstation._tcp.local. ANY (QM)? floodlight.local. ANY (QM)? c.a.5.0.3.f.e.f.f.f.8.8.4.d.c.5.0.0.0.0.0.0.0.0.0.0.0.0.0.8.e.f.ip6.arpa. (267)
22:40:51.876827 IP6 fe80::6ca3:42ff:febd:4b61 > ff02::16: HBH ICMP6, multicast listener report v2, 2 group record(s), length 48
22:40:51.876853 IP6 fe80::6ca3:42ff:febd:4b61.5353 > ff02::fb.5353: 0*- [0q] 5/0/0 (Cache flush) TXT "", (Cache flush) AAAA fe80::6ca3:42ff:febd:4b61, (Cache flush) PTR floodlight.local., (Cache flush) HINFO, (Cache flush) SRV floodlight.local.:9 0 0 (249)
22:40:51.879104 IP6 fe80::d01a:a8ff:feb4:a0aa.5353 > ff02::fb.5353: 0 [3q] [5n] ANY (QM)? floodlight [d2:1a:a8:b4:a0:aa]._workstation._tcp.local. ANY (QM)? floodlight.local. ANY (QM)? a.a.0.a.4.b.e.f.f.f.8.a.a.1.0.d.0.0.0.0.0.0.0.0.0.0.0.0.0.8.e.f.ip6.arpa. (267)
22:40:51.988529 IP6 fe80::5cd4:88ff:fef3:5ac > ff02::16: HBH ICMP6, multicast listener report v2, 1 group record(s), length 28
22:40:51.988554 IP6 fe80::9423:61ff:fed6:2eac.5353 > ff02::fb.5353: 0*- [0q] 5/0/0 (Cache flush) TXT "", (Cache flush) AAAA fe80::9423:61ff:fed6:2eac, (Cache flush) PTR floodlight.local., (Cache flush) HINFO, (Cache flush) SRV floodlight.local.:9 0 0 (249)
22:40:51.988580 IP6 fe80::4ca6:54ff:fed1:d4f0.5353 > ff02::fb.5353: 0 [3q] [5n] ANY (QM)? floodlight [4e:a6:54:d1:d4:f0]._workstation._tcp.local. ANY (QM)? floodlight.local. ANY (QM)? 0.f.4.d.1.d.e.f.f.f.4.5.6.a.c.4.0.0.0.0.0.0.0.0.0.0.0.0.0.8.e.f.ip6.arpa. (267)
22:40:51.988606 IP6 fe80::9423:61ff:fed6:2eac > ff02::16: HBH ICMP6, multicast listener report v2, 2 group record(s), length 48
22:40:51.988631 IP6 fe80::6ca3:42ff:febd:4b61.5353 > ff02::fb.5353: 0*- [0q] 2/0/0 PTR _workstation._tcp.local., PTR floodlight [6e:a3:42:bd:4b:61]._workstation._tcp.local. (117)
22:40:51.988657 IP6 fe80::6ca3:42ff:febd:4b61.5353 > ff02::fb.5353: 0 [2q] PTR (QM)? _ipps._tcp.local. PTR (QM)? _ipp._tcp.local. (45)
22:40:51.989149 IP6 fe80::5cd4:88ff:fef3:5ac.5353 > ff02::fb.5353: 0*- [0q] 3/0/0 (Cache flush) TXT "", (Cache flush) HINFO, (Cache flush) SRV floodlight.local.:9 0 0 (135)
22:40:51.989725 IP6 fe80::5cd4:88ff:fef3:5ac.5353 > ff02::fb.5353: 0*- [0q] 2/0/0 (Cache flush) PTR floodlight.local., (Cache flush) AAAA fe80::5cd4:88ff:fef3:5ac (142)
22:40:52.409013 IP6 fe80::280d:34ff:feb7:2c12.5353 > ff02::fb.5353: 0*- [0q] 5/0/0 (Cache flush) TXT "", (Cache flush) AAAA fe80::280d:34ff:feb7:2c12, (Cache flush) PTR floodlight.local., (Cache flush) HINFO, (Cache flush) SRV floodlight.local.:9 0 0 (249)
22:40:52.480341 IP6 fe80::d01a:a8ff:feb4:a0aa.5353 > ff02::fb.5353: 0*- [0q] 5/0/0 (Cache flush) TXT "", (Cache flush) AAAA fe80::d01a:a8ff:feb4:a0aa, (Cache flush) PTR floodlight.local., (Cache flush) HINFO, (Cache flush) SRV floodlight.local.:9 0 0 (249)
22:40:52.480367 IP6 fe80::4ca6:54ff:fed1:d4f0 > ff02::16: HBH ICMP6, multicast listener report v2, 2 group record(s), length 48
22:40:52.480393 IP6 fe80::4ca6:54ff:fed1:d4f0 > ff02::16: HBH ICMP6, multicast listener report v2, 1 group record(s), length 28
22:40:52.480418 IP6 fe80::9423:61ff:fed6:2eac.5353 > ff02::fb.5353: 0*- [0q] 2/0/0 PTR _workstation._tcp.local., PTR floodlight [96:23:61:d6:2e:ac]._workstation._tcp.local. (117)
22:40:52.480720 IP6 fe80::9423:61ff:fed6:2eac.5353 > ff02::fb.5353: 0 [2q] PTR (QM)? _ipps._tcp.local. PTR (QM)? _ipp._tcp.local. (45)
22:40:52.543549 IP6 fe80::4ca6:54ff:fed1:d4f0.5353 > ff02::fb.5353: 0 [3q] [5n] ANY (QM)? floodlight [4e:a6:54:d1:d4:f0]._workstation._tcp.local. ANY (QM)? floodlight.local. ANY (QM)? 0.f.4.d.1.d.e.f.f.f.4.5.6.a.c.4.0.0.0.0.0.0.0.0.0.0.0.0.0.8.e.f.ip6.arpa. (267)
22:40:52.550488 IP6 fe80::5cd4:88ff:fef3:5ac.5353 > ff02::fb.5353: 0*- [0q] 2/0/0 PTR _workstation._tcp.local., PTR floodlight [5e:d4:88:f3:05:ac]._workstation._tcp.local. (117)
22:40:52.550651 IP6 fe80::5cd4:88ff:fef3:5ac.5353 > ff02::fb.5353: 0 [2q] PTR (QM)? _ipps._tcp.local. PTR (QM)? _ipp._tcp.local. (45)
22:40:52.550676 IP6 fe80::d01a:a8ff:feb4:a0aa.5353 > ff02::fb.5353: 0 [2q] PTR (QM)? _ipps._tcp.local. PTR (QM)? _ipp._tcp.local. (45)
22:40:52.550700 IP6 fe80::d01a:a8ff:feb4:a0aa.5353 > ff02::fb.5353: 0*- [0q] 2/0/0 PTR _workstation._tcp.local., PTR floodlight [d2:1a:a8:b4:a0:aa]._workstation._tcp.local. (117)
22:40:53.151546 IP6 :: > ff02::16: HBH ICMP6, multicast listener report v2, 2 group record(s), length 48
22:40:53.156392 IP6 :: > ff02::1:ffb7:2c12: ICMP6, neighbor solicitation, who has fe80::280d:34ff:feb7:2c12, length 24
22:40:53.168677 IP 0.0.0.0.68 > 255.255.255.255.67: BOOTP/DHCP, Request from 2a:0d:34:b7:2c:12, length 300
22:40:53.588017 IP6 fe80::5cd4:88ff:fef3:5ac.5353 > ff02::fb.5353: 0*- [0q] 4/0/0 (Cache flush) TXT "", (Cache flush) HINFO, (Cache flush) SRV floodlight.local.:9 0 0, (Cache flush) AAAA fe80::5cd4:88ff:fef3:5ac (163)
22:40:53.588068 IP6 :: > ff02::16: HBH ICMP6, multicast listener report v2, 2 group record(s), length 48
22:40:53.588536 IP6 :: > ff02::16: HBH ICMP6, multicast listener report v2, 1 group record(s), length 28
22:40:53.588571 IP6 fe80::4ca6:54ff:fed1:d4f0.5353 > ff02::fb.5353: 0*- [0q] 2/0/0 (Cache flush) TXT "", (Cache flush) SRV floodlight.local.:9 0 0 (110)
22:40:53.588606 IP6 fe80::4ca6:54ff:fed1:d4f0.5353 > ff02::fb.5353: 0*- [0q] 3/0/0 (Cache flush) HINFO, (Cache flush) AAAA fe80::4ca6:54ff:fed1:d4f0, (Cache flush) PTR floodlight.local. (167)
22:40:53.588641 IP6 fe80::6ca3:42ff:febd:4b61.5353 > ff02::fb.5353: 0*- [0q] 5/0/0 (Cache flush) TXT "", (Cache flush) AAAA fe80::6ca3:42ff:febd:4b61, (Cache flush) PTR floodlight.local., (Cache flush) HINFO, (Cache flush) SRV floodlight.local.:9 0 0 (249)
22:40:53.588676 IP6 fe80::4ca6:54ff:fed1:d4f0.5353 > ff02::fb.5353: 0*- [0q] 2/0/0 PTR _workstation._tcp.local., PTR floodlight [4e:a6:54:d1:d4:f0]._workstation._tcp.local. (117)
22:40:53.588710 IP6 fe80::4ca6:54ff:fed1:d4f0.5353 > ff02::fb.5353: 0 [2q] PTR (QM)? _ipps._tcp.local. PTR (QM)? _ipp._tcp.local. (45)
22:40:53.589189 IP 0.0.0.0.68 > 255.255.255.255.67: BOOTP/DHCP, Request from d2:1a:a8:b4:a0:aa, length 300
22:40:53.590992 IP 0.0.0.0.68 > 255.255.255.255.67: BOOTP/DHCP, Request from 5e:d4:88:f3:05:ac, length 300
22:40:53.636712 IP6 :: > ff02::16: HBH ICMP6, multicast listener report v2, 1 group record(s), length 28
22:40:53.638552 ARP, Request who-has 10.0.0.6 tell 10.0.0.4, length 28
22:40:53.639625 IP6 :: > ff02::16: HBH ICMP6, multicast listener report v2, 2 group record(s), length 48
22:40:53.691258 IP6 :: > ff02::16: HBH ICMP6, multicast listener report v2, 2 group record(s), length 48
22:40:54.058309 ARP, Request who-has 10.0.0.6 tell 10.0.0.4, length 28
22:40:54.060919 IP6 :: > ff02::1:fff3:5ac: ICMP6, neighbor solicitation, who has fe80::5cd4:88ff:fef3:5ac, length 24
22:40:54.097265 IP6 :: > ff02::1:ffb4:a0aa: ICMP6, neighbor solicitation, who has fe80::d01a:a8ff:feb4:a0aa, length 24
22:40:54.104765 IP6 :: > ff02::16: HBH ICMP6, multicast listener report v2, 1 group record(s), length 28
22:40:54.104801 IP6 :: > ff02::16: HBH ICMP6, multicast listener report v2, 1 group record(s), length 28
22:40:54.104836 IP 0.0.0.0.68 > 255.255.255.255.67: BOOTP/DHCP, Request from 4e:a6:54:d1:d4:f0, length 300
22:40:54.104871 IP6 fe80::9423:61ff:fed6:2eac.5353 > ff02::fb.5353: 0*- [0q] 5/0/0 (Cache flush) TXT "", (Cache flush) AAAA fe80::9423:61ff:fed6:2eac, (Cache flush) PTR floodlight.local., (Cache flush) HINFO, (Cache flush) SRV floodlight.local.:9 0 0 (249)
22:40:54.113061 IP6 :: > ff02::16: HBH ICMP6, multicast listener report v2, 1 group record(s), length 28
22:40:54.113097 IP 0.0.0.0.68 > 255.255.255.255.67: BOOTP/DHCP, Request from 6e:a3:42:bd:4b:61, length 300
22:40:54.113257 IP6 :: > ff02::1:ffbd:4b61: ICMP6, neighbor solicitation, who has fe80::6ca3:42ff:febd:4b61, length 24
22:40:54.113293 IP6 :: > ff02::16: HBH ICMP6, multicast listener report v2, 2 group record(s), length 48
22:40:54.155752 IP6 fe80::280d:34ff:feb7:2c12 > ff02::16: HBH ICMP6, multicast listener report v2, 1 group record(s), length 28
22:40:54.155789 IP6 fe80::280d:34ff:feb7:2c12 > ff02::2: ICMP6, router solicitation, length 16
22:40:54.175377 IP6 fe80::280d:34ff:feb7:2c12 > ff02::16: HBH ICMP6, multicast listener report v2, 1 group record(s), length 28
22:40:54.234344 IP6 fe80::280d:34ff:feb7:2c12.5353 > ff02::fb.5353: 0*- [0q] 2/0/0 PTR _workstation._tcp.local., PTR floodlight [2a:0d:34:b7:2c:12]._workstation._tcp.local. (117)
22:40:54.255310 IP6 fe80::280d:34ff:feb7:2c12.5353 > ff02::fb.5353: 0 [3q] [5n] ANY (QM)? floodlight [2a:0d:34:b7:2c:12]._workstation._tcp.local. ANY (QM)? floodlight.local. ANY (QM)? 2.1.c.2.7.b.e.f.f.f.4.3.d.0.8.2.0.0.0.0.0.0.0.0.0.0.0.0.0.8.e.f.ip6.arpa. (267)
22:40:54.269125 IP6 fe80::280d:34ff:feb7:2c12.5353 > ff02::fb.5353: 0 [2q] PTR (QM)? _ipps._tcp.local. PTR (QM)? _ipp._tcp.local. (45)
22:40:54.307579 IP6 fe80::280d:34ff:feb7:2c12 > ff02::16: HBH ICMP6, multicast listener report v2, 2 group record(s), length 48
22:40:54.440323 IP6 fe80::280d:34ff:feb7:2c12 > ff02::16: HBH ICMP6, multicast listener report v2, 1 group record(s), length 28
22:40:54.503886 IP6 fe80::280d:34ff:feb7:2c12.5353 > ff02::fb.5353: 0 [3q] [5n] ANY (QM)? floodlight [2a:0d:34:b7:2c:12]._workstation._tcp.local. ANY (QM)? floodlight.local. ANY (QM)? 2.1.c.2.7.b.e.f.f.f.4.3.d.0.8.2.0.0.0.0.0.0.0.0.0.0.0.0.0.8.e.f.ip6.arpa. (267)
22:40:54.758669 IP6 fe80::280d:34ff:feb7:2c12.5353 > ff02::fb.5353: 0 [3q] [5n] ANY (QM)? floodlight [2a:0d:34:b7:2c:12]._workstation._tcp.local. ANY (QM)? floodlight.local. ANY (QM)? 2.1.c.2.7.b.e.f.f.f.4.3.d.0.8.2.0.0.0.0.0.0.0.0.0.0.0.0.0.8.e.f.ip6.arpa. (267)
22:40:54.886006 IP6 :: > ff02::16: HBH ICMP6, multicast listener report v2, 2 group record(s), length 48
22:40:54.905508 IP 0.0.0.0.68 > 255.255.255.255.67: BOOTP/DHCP, Request from 96:23:61:d6:2e:ac, length 300
22:40:54.921121 IP6 :: > ff02::1:ffd6:2eac: ICMP6, neighbor solicitation, who has fe80::9423:61ff:fed6:2eac, length 24
22:40:54.921157 IP6 :: > ff02::16: HBH ICMP6, multicast listener report v2, 1 group record(s), length 28
22:40:54.921192 IP6 :: > ff02::1:ffd1:d4f0: ICMP6, neighbor solicitation, who has fe80::4ca6:54ff:fed1:d4f0, length 24
22:40:54.921226 IP6 :: > ff02::16: HBH ICMP6, multicast listener report v2, 1 group record(s), length 28
22:40:54.921262 IP6 fe80::9423:61ff:fed6:2eac > ff02::16: HBH ICMP6, multicast listener report v2, 1 group record(s), length 28
22:40:54.921297 IP6 fe80::9423:61ff:fed6:2eac > ff02::2: ICMP6, router solicitation, length 16
22:40:54.921379 IP6 fe80::9423:61ff:fed6:2eac > ff02::16: HBH ICMP6, multicast listener report v2, 1 group record(s), length 28
22:40:54.921444 IP6 fe80::9423:61ff:fed6:2eac.5353 > ff02::fb.5353: 0*- [0q] 2/0/0 PTR _workstation._tcp.local., PTR floodlight [96:23:61:d6:2e:ac]._workstation._tcp.local. (117)
22:40:54.921939 IP6 fe80::9423:61ff:fed6:2eac.5353 > ff02::fb.5353: 0 [2q] PTR (QM)? _ipps._tcp.local. PTR (QM)? _ipp._tcp.local. (45)
22:40:54.921974 IP6 fe80::9423:61ff:fed6:2eac > ff02::16: HBH ICMP6, multicast listener report v2, 2 group record(s), length 48
22:40:54.922009 IP6 fe80::9423:61ff:fed6:2eac > ff02::16: HBH ICMP6, multicast listener report v2, 1 group record(s), length 28
22:40:54.925289 IP6 fe80::5cd4:88ff:fef3:5ac > ff02::16: HBH ICMP6, multicast listener report v2, 1 group record(s), length 28
22:40:54.925323 IP6 fe80::5cd4:88ff:fef3:5ac > ff02::2: ICMP6, router solicitation, length 16
22:40:54.925358 IP6 fe80::5cd4:88ff:fef3:5ac > ff02::16: HBH ICMP6, multicast listener report v2, 1 group record(s), length 28
22:40:54.942882 IP6 fe80::d01a:a8ff:feb4:a0aa > ff02::16: HBH ICMP6, multicast listener report v2, 1 group record(s), length 28
22:40:54.942917 IP6 fe80::d01a:a8ff:feb4:a0aa > ff02::2: ICMP6, router solicitation, length 16
22:40:54.942952 IP6 fe80::d01a:a8ff:feb4:a0aa > ff02::16: HBH ICMP6, multicast listener report v2, 1 group record(s), length 28
22:40:54.942987 IP6 fe80::5cd4:88ff:fef3:5ac.5353 > ff02::fb.5353: 0*- [0q] 2/0/0 PTR _workstation._tcp.local., PTR floodlight [5e:d4:88:f3:05:ac]._workstation._tcp.local. (117)
22:40:54.943022 IP6 fe80::5cd4:88ff:fef3:5ac.5353 > ff02::fb.5353: 0 [3q] [5n] ANY (QM)? floodlight [5e:d4:88:f3:05:ac]._workstation._tcp.local. ANY (QM)? floodlight.local. ANY (QM)? c.a.5.0.3.f.e.f.f.f.8.8.4.d.c.5.0.0.0.0.0.0.0.0.0.0.0.0.0.8.e.f.ip6.arpa. (267)
22:40:54.943403 IP6 fe80::5cd4:88ff:fef3:5ac.5353 > ff02::fb.5353: 0 [2q] PTR (QM)? _ipps._tcp.local. PTR (QM)? _ipp._tcp.local. (45)
22:40:54.952590 IP6 fe80::d01a:a8ff:feb4:a0aa.5353 > ff02::fb.5353: 0*- [0q] 2/0/0 PTR _workstation._tcp.local., PTR floodlight [d2:1a:a8:b4:a0:aa]._workstation._tcp.local. (117)
22:40:54.952682 IP6 fe80::d01a:a8ff:feb4:a0aa.5353 > ff02::fb.5353: 0 [3q] [5n] ANY (QM)? floodlight [d2:1a:a8:b4:a0:aa]._workstation._tcp.local. ANY (QM)? floodlight.local. ANY (QM)? a.a.0.a.4.b.e.f.f.f.8.a.a.1.0.d.0.0.0.0.0.0.0.0.0.0.0.0.0.8.e.f.ip6.arpa. (267)
22:40:54.959831 IP6 fe80::280d:34ff:feb7:2c12.5353 > ff02::fb.5353: 0*- [0q] 5/0/0 (Cache flush) TXT "", (Cache flush) AAAA fe80::280d:34ff:feb7:2c12, (Cache flush) PTR floodlight.local., (Cache flush) HINFO, (Cache flush) SRV floodlight.local.:9 0 0 (249)
22:40:55.263723 IP6 fe80::280d:34ff:feb7:2c12.5353 > ff02::fb.5353: 0*- [0q] 2/0/0 PTR _workstation._tcp.local., PTR floodlight [2a:0d:34:b7:2c:12]._workstation._tcp.local. (117)
22:40:55.278645 IP6 fe80::280d:34ff:feb7:2c12.5353 > ff02::fb.5353: 0 [2q] PTR (QM)? _ipps._tcp.local. PTR (QM)? _ipp._tcp.local. (45)
22:40:55.616659 IP6 fe80::d01a:a8ff:feb4:a0aa.5353 > ff02::fb.5353: 0 [2q] PTR (QM)? _ipps._tcp.local. PTR (QM)? _ipp._tcp.local. (45)
22:40:55.616720 ARP, Request who-has 10.0.0.6 tell 10.0.0.4, length 28
22:40:55.616772 IP6 fe80::5cd4:88ff:fef3:5ac > ff02::16: HBH ICMP6, multicast listener report v2, 1 group record(s), length 28
22:40:55.616930 IP6 fe80::5cd4:88ff:fef3:5ac.5353 > ff02::fb.5353: 0 [3q] [5n] ANY (QM)? floodlight [5e:d4:88:f3:05:ac]._workstation._tcp.local. ANY (QM)? floodlight.local. ANY (QM)? c.a.5.0.3.f.e.f.f.f.8.8.4.d.c.5.0.0.0.0.0.0.0.0.0.0.0.0.0.8.e.f.ip6.arpa. (267)
22:40:55.616965 IP6 fe80::d01a:a8ff:feb4:a0aa.5353 > ff02::fb.5353: 0 [3q] [5n] ANY (QM)? floodlight [d2:1a:a8:b4:a0:aa]._workstation._tcp.local. ANY (QM)? floodlight.local. ANY (QM)? a.a.0.a.4.b.e.f.f.f.8.a.a.1.0.d.0.0.0.0.0.0.0.0.0.0.0.0.0.8.e.f.ip6.arpa. (267)
22:40:55.617000 IP6 fe80::5cd4:88ff:fef3:5ac > ff02::16: HBH ICMP6, multicast listener report v2, 2 group record(s), length 48
22:40:55.617035 IP6 fe80::d01a:a8ff:feb4:a0aa > ff02::16: HBH ICMP6, multicast listener report v2, 2 group record(s), length 48
22:40:55.617531 IP6 fe80::5cd4:88ff:fef3:5ac.5353 > ff02::fb.5353: 0 [3q] [5n] ANY (QM)? floodlight [5e:d4:88:f3:05:ac]._workstation._tcp.local. ANY (QM)? floodlight.local. ANY (QM)? c.a.5.0.3.f.e.f.f.f.8.8.4.d.c.5.0.0.0.0.0.0.0.0.0.0.0.0.0.8.e.f.ip6.arpa. (267)
22:40:55.617566 IP6 fe80::d01a:a8ff:feb4:a0aa.5353 > ff02::fb.5353: 0 [3q] [5n] ANY (QM)? floodlight [d2:1a:a8:b4:a0:aa]._workstation._tcp.local. ANY (QM)? floodlight.local. ANY (QM)? a.a.0.a.4.b.e.f.f.f.8.a.a.1.0.d.0.0.0.0.0.0.0.0.0.0.0.0.0.8.e.f.ip6.arpa. (267)
22:40:55.618904 IP6 fe80::9423:61ff:fed6:2eac.5353 > ff02::fb.5353: 0 [3q] [5n] ANY (QM)? floodlight [96:23:61:d6:2e:ac]._workstation._tcp.local. ANY (QM)? floodlight.local. ANY (QM)? c.a.e.2.6.d.e.f.f.f.1.6.3.2.4.9.0.0.0.0.0.0.0.0.0.0.0.0.0.8.e.f.ip6.arpa. (267)
22:40:55.619217 IP6 fe80::6ca3:42ff:febd:4b61 > ff02::16: HBH ICMP6, multicast listener report v2, 1 group record(s), length 28
22:40:55.619826 IP6 fe80::6ca3:42ff:febd:4b61 > ff02::2: ICMP6, router solicitation, length 16
22:40:55.620051 IP6 fe80::6ca3:42ff:febd:4b61 > ff02::16: HBH ICMP6, multicast listener report v2, 1 group record(s), length 28
22:40:55.620649 IP6 fe80::6ca3:42ff:febd:4b61.5353 > ff02::fb.5353: 0*- [0q] 2/0/0 PTR _workstation._tcp.local., PTR floodlight [6e:a3:42:bd:4b:61]._workstation._tcp.local. (117)
22:40:55.620685 IP6 fe80::6ca3:42ff:febd:4b61.5353 > ff02::fb.5353: 0 [3q] [5n] ANY (QM)? floodlight [6e:a3:42:bd:4b:61]._workstation._tcp.local. ANY (QM)? floodlight.local. ANY (QM)? 1.6.b.4.d.b.e.f.f.f.2.4.3.a.c.6.0.0.0.0.0.0.0.0.0.0.0.0.0.8.e.f.ip6.arpa. (267)
22:40:55.673017 IP6 fe80::6ca3:42ff:febd:4b61.5353 > ff02::fb.5353: 0 [2q] PTR (QM)? _ipps._tcp.local. PTR (QM)? _ipp._tcp.local. (45)
22:40:55.673083 IP6 fe80::6ca3:42ff:febd:4b61.5353 > ff02::fb.5353: 0 [3q] [5n] ANY (QM)? floodlight [6e:a3:42:bd:4b:61]._workstation._tcp.local. ANY (QM)? floodlight.local. ANY (QM)? 1.6.b.4.d.b.e.f.f.f.2.4.3.a.c.6.0.0.0.0.0.0.0.0.0.0.0.0.0.8.e.f.ip6.arpa. (267)
22:40:55.673404 IP6 fe80::5cd4:88ff:fef3:5ac.5353 > ff02::fb.5353: 0*- [0q] 5/0/0 (Cache flush) TXT "", (Cache flush) AAAA fe80::5cd4:88ff:fef3:5ac, (Cache flush) PTR floodlight.local., (Cache flush) HINFO, (Cache flush) SRV floodlight.local.:9 0 0 (249)
22:40:55.989026 IP6 fe80::280d:34ff:feb7:2c12.5353 > ff02::fb.5353: 0*- [0q] 5/0/0 (Cache flush) TXT "", (Cache flush) AAAA fe80::280d:34ff:feb7:2c12, (Cache flush) PTR floodlight.local., (Cache flush) HINFO, (Cache flush) SRV floodlight.local.:9 0 0 (249)
22:40:56.029718 IP6 fe80::d01a:a8ff:feb4:a0aa.5353 > ff02::fb.5353: 0*- [0q] 3/0/0 (Cache flush) TXT "", (Cache flush) HINFO, (Cache flush) SRV floodlight.local.:9 0 0 (135)
22:40:56.040180 IP6 fe80::d01a:a8ff:feb4:a0aa.5353 > ff02::fb.5353: 0*- [0q] 2/0/0 (Cache flush) PTR floodlight.local., (Cache flush) AAAA fe80::d01a:a8ff:feb4:a0aa (142)
22:40:56.040215 IP6 fe80::d01a:a8ff:feb4:a0aa > ff02::16: HBH ICMP6, multicast listener report v2, 1 group record(s), length 28
22:40:56.040635 IP6 fe80::4ca6:54ff:fed1:d4f0 > ff02::16: HBH ICMP6, multicast listener report v2, 1 group record(s), length 28
22:40:56.040670 IP6 fe80::5cd4:88ff:fef3:5ac.5353 > ff02::fb.5353: 0*- [0q] 2/0/0 PTR _workstation._tcp.local., PTR floodlight [5e:d4:88:f3:05:ac]._workstation._tcp.local. (117)
22:40:56.040705 IP6 fe80::5cd4:88ff:fef3:5ac.5353 > ff02::fb.5353: 0 [2q] PTR (QM)? _ipps._tcp.local. PTR (QM)? _ipp._tcp.local. (45)
22:40:56.040740 IP6 fe80::4ca6:54ff:fed1:d4f0 > ff02::2: ICMP6, router solicitation, length 16
22:40:56.040775 IP6 fe80::4ca6:54ff:fed1:d4f0 > ff02::16: HBH ICMP6, multicast listener report v2, 1 group record(s), length 28
22:40:56.040810 IP6 fe80::4ca6:54ff:fed1:d4f0.5353 > ff02::fb.5353: 0*- [0q] 2/0/0 PTR _workstation._tcp.local., PTR floodlight [4e:a6:54:d1:d4:f0]._workstation._tcp.local. (117)
22:40:56.041343 IP6 fe80::4ca6:54ff:fed1:d4f0.5353 > ff02::fb.5353: 0 [3q] [5n] ANY (QM)? floodlight [4e:a6:54:d1:d4:f0]._workstation._tcp.local. ANY (QM)? floodlight.local. ANY (QM)? 0.f.4.d.1.d.e.f.f.f.4.5.6.a.c.4.0.0.0.0.0.0.0.0.0.0.0.0.0.8.e.f.ip6.arpa. (267)
22:40:56.041378 IP6 fe80::4ca6:54ff:fed1:d4f0.5353 > ff02::fb.5353: 0 [2q] PTR (QM)? _ipps._tcp.local. PTR (QM)? _ipp._tcp.local. (45)
22:40:56.041432 IP6 fe80::4ca6:54ff:fed1:d4f0 > ff02::16: HBH ICMP6, multicast listener report v2, 2 group record(s), length 48
22:40:56.047905 IP6 fe80::4ca6:54ff:fed1:d4f0.5353 > ff02::fb.5353: 0 [3q] [5n] ANY (QM)? floodlight [4e:a6:54:d1:d4:f0]._workstation._tcp.local. ANY (QM)? floodlight.local. ANY (QM)? 0.f.4.d.1.d.e.f.f.f.4.5.6.a.c.4.0.0.0.0.0.0.0.0.0.0.0.0.0.8.e.f.ip6.arpa. (267)
22:40:56.048106 IP6 fe80::9423:61ff:fed6:2eac.5353 > ff02::fb.5353: 0 [3q] [5n] ANY (QM)? floodlight [96:23:61:d6:2e:ac]._workstation._tcp.local. ANY (QM)? floodlight.local. ANY (QM)? c.a.e.2.6.d.e.f.f.f.1.6.3.2.4.9.0.0.0.0.0.0.0.0.0.0.0.0.0.8.e.f.ip6.arpa. (267)
22:40:56.048300 IP6 fe80::9423:61ff:fed6:2eac.5353 > ff02::fb.5353: 0*- [0q] 5/0/0 (Cache flush) TXT "", (Cache flush) AAAA fe80::9423:61ff:fed6:2eac, (Cache flush) PTR floodlight.local., (Cache flush) HINFO, (Cache flush) SRV floodlight.local.:9 0 0 (249)
22:40:56.048335 IP6 fe80::4ca6:54ff:fed1:d4f0.5353 > ff02::fb.5353: 0 [3q] [5n] ANY (QM)? floodlight [4e:a6:54:d1:d4:f0]._workstation._tcp.local. ANY (QM)? floodlight.local. ANY (QM)? 0.f.4.d.1.d.e.f.f.f.4.5.6.a.c.4.0.0.0.0.0.0.0.0.0.0.0.0.0.8.e.f.ip6.arpa. (267)
22:40:56.048370 IP6 fe80::6ca3:42ff:febd:4b61.5353 > ff02::fb.5353: 0 [3q] [5n] ANY (QM)? floodlight [6e:a3:42:bd:4b:61]._workstation._tcp.local. ANY (QM)? floodlight.local. ANY (QM)? 1.6.b.4.d.b.e.f.f.f.2.4.3.a.c.6.0.0.0.0.0.0.0.0.0.0.0.0.0.8.e.f.ip6.arpa. (267)
22:40:56.048538 IP6 fe80::6ca3:42ff:febd:4b61 > ff02::16: HBH ICMP6, multicast listener report v2, 2 group record(s), length 48
22:40:56.048573 IP6 fe80::d01a:a8ff:feb4:a0aa.5353 > ff02::fb.5353: 0*- [0q] 2/0/0 PTR _workstation._tcp.local., PTR floodlight [d2:1a:a8:b4:a0:aa]._workstation._tcp.local. (117)
22:40:56.048608 IP6 fe80::d01a:a8ff:feb4:a0aa.5353 > ff02::fb.5353: 0 [2q] PTR (QM)? _ipps._tcp.local. PTR (QM)? _ipp._tcp.local. (45)
22:40:56.048642 IP6 fe80::6ca3:42ff:febd:4b61 > ff02::16: HBH ICMP6, multicast listener report v2, 1 group record(s), length 28
22:40:56.048677 IP6 fe80::9423:61ff:fed6:2eac.5353 > ff02::fb.5353: 0*- [0q] 2/0/0 PTR _workstation._tcp.local., PTR floodlight [96:23:61:d6:2e:ac]._workstation._tcp.local. (117)
22:40:56.077911 IP6 fe80::9423:61ff:fed6:2eac.5353 > ff02::fb.5353: 0 [2q] PTR (QM)? _ipps._tcp.local. PTR (QM)? _ipp._tcp.local. (45)
22:40:56.078261 IP6 fe80::4ca6:54ff:fed1:d4f0.5353 > ff02::fb.5353: 0*- [0q] 5/0/0 (Cache flush) TXT "", (Cache flush) AAAA fe80::4ca6:54ff:fed1:d4f0, (Cache flush) PTR floodlight.local., (Cache flush) HINFO, (Cache flush) SRV floodlight.local.:9 0 0 (249)
22:40:56.078596 IP6 fe80::4ca6:54ff:fed1:d4f0 > ff02::16: HBH ICMP6, multicast listener report v2, 1 group record(s), length 28
22:40:56.078632 IP6 fe80::4ca6:54ff:fed1:d4f0.5353 > ff02::fb.5353: 0*- [0q] 2/0/0 PTR _workstation._tcp.local., PTR floodlight [4e:a6:54:d1:d4:f0]._workstation._tcp.local. (117)
22:40:56.078667 IP6 fe80::4ca6:54ff:fed1:d4f0.5353 > ff02::fb.5353: 0 [2q] PTR (QM)? _ipps._tcp.local. PTR (QM)? _ipp._tcp.local. (45)
22:40:56.078702 IP6 fe80::6ca3:42ff:febd:4b61.5353 > ff02::fb.5353: 0*- [0q] 2/0/0 PTR _workstation._tcp.local., PTR floodlight [6e:a3:42:bd:4b:61]._workstation._tcp.local. (117)
22:40:56.442992 IP 0.0.0.0.68 > 255.255.255.255.67: BOOTP/DHCP, Request from d2:1a:a8:b4:a0:aa, length 300
22:40:56.443027 IP 0.0.0.0.68 > 255.255.255.255.67: BOOTP/DHCP, Request from 4e:a6:54:d1:d4:f0, length 300
22:40:56.484812 IP6 fe80::6ca3:42ff:febd:4b61.5353 > ff02::fb.5353: 0 [2q] PTR (QM)? _ipps._tcp.local. PTR (QM)? _ipp._tcp.local. (45)
22:40:56.484971 IP6 fe80::9423:61ff:fed6:2eac.5353 > ff02::fb.5353: 0*- [0q] 5/0/0 (Cache flush) TXT "", (Cache flush) AAAA fe80::9423:61ff:fed6:2eac, (Cache flush) PTR floodlight.local., (Cache flush) HINFO, (Cache flush) SRV floodlight.local.:9 0 0 (249)
22:40:56.485007 IP 0.0.0.0.68 > 255.255.255.255.67: BOOTP/DHCP, Request from 96:23:61:d6:2e:ac, length 300
22:40:56.486070 IP6 fe80::4ca6:54ff:fed1:d4f0.5353 > ff02::fb.5353: 0*- [0q] 5/0/0 (Cache flush) TXT "", (Cache flush) AAAA fe80::4ca6:54ff:fed1:d4f0, (Cache flush) PTR floodlight.local., (Cache flush) HINFO, (Cache flush) SRV floodlight.local.:9 0 0 (249)
22:40:56.490216 IP 0.0.0.0.68 > 255.255.255.255.67: BOOTP/DHCP, Request from 2a:0d:34:b7:2c:12, length 300
22:40:56.616612 ARP, Request who-has 10.0.0.7 tell 10.0.0.4, length 28
