Hosth4
#######################

22:40:09.491527 IP6 fe80::c86:76ff:fe35:e9b7 > ff02::2: ICMP6, router solicitation, length 16
22:40:09.684404 IP6 fe80::2823:2bff:fe66:ddb8 > ff02::2: ICMP6, router solicitation, length 16
22:40:10.332383 IP6 fe80::40b7:f3ff:fe57:e580 > ff02::2: ICMP6, router solicitation, length 16
22:40:10.442074 IP6 fe80::38f0:57ff:fe3e:e67 > ff02::2: ICMP6, router solicitation, length 16
22:40:10.510795 IP 0.0.0.0.68 > 255.255.255.255.67: BOOTP/DHCP, Request from f6:bf:db:75:92:6a, length 300
22:40:15.206236 IP6 fe80::5cd4:88ff:fef3:5ac.5353 > ff02::fb.5353: 0 [2q] PTR (QM)? _ipps._tcp.local. PTR (QM)? _ipp._tcp.local. (45)
22:40:15.765992 IP6 fe80::f4bf:dbff:fe75:926a.5353 > ff02::fb.5353: 0 [2q] PTR (QM)? _ipps._tcp.local. PTR (QM)? _ipp._tcp.local. (45)
22:40:15.868923 IP6 fe80::d8ce:abff:fe9e:bac.5353 > ff02::fb.5353: 0 [2q] PTR (QM)? _ipps._tcp.local. PTR (QM)? _ipp._tcp.local. (45)
22:40:17.754532 IP 0.0.0.0.68 > 255.255.255.255.67: BOOTP/DHCP, Request from da:ce:ab:9e:0b:ac, length 300
22:40:20.305177 IP 0.0.0.0.68 > 255.255.255.255.67: BOOTP/DHCP, Request from 5e:d4:88:f3:05:ac, length 300
22:40:21.485362 LLDP, length 47
22:40:21.738469 da:ce:ab:9e:0b:ac > ff:ff:ff:ff:ff:ff, ethertype Unknown (0x8942), length 69: 
	0x0000:  2000 0604 0002 0000 0207 0400 0000 0000  ................
	0x0010:  0c04 0302 0002 0602 0078 fe0c 0026 e100  .........x...&..
	0x0020:  0000 0000 0000 000c 1808 0031 3791 7786  ...........17.w.
	0x0030:  1ff2 e601 0100 00                        .......
22:40:22.357577 ARP, Request who-has 10.0.0.7 tell 10.0.0.1, length 28
22:40:22.763100 ARP, Request who-has 10.0.0.8 tell 10.0.0.1, length 28
22:40:25.374201 IP 0.0.0.0.68 > 255.255.255.255.67: BOOTP/DHCP, Request from f6:bf:db:75:92:6a, length 300
22:40:28.533225 IP 0.0.0.0.68 > 255.255.255.255.67: BOOTP/DHCP, Request from 96:23:61:d6:2e:ac, length 300
22:40:28.825555 IP 0.0.0.0.68 > 255.255.255.255.67: BOOTP/DHCP, Request from 6e:a3:42:bd:4b:61, length 300
22:40:29.778758 IP6 fe80::9423:61ff:fed6:2eac.5353 > ff02::fb.5353: 0 [2q] PTR (QM)? _ipps._tcp.local. PTR (QM)? _ipp._tcp.local. (45)
22:40:29.971554 IP6 fe80::4ca6:54ff:fed1:d4f0.5353 > ff02::fb.5353: 0 [2q] PTR (QM)? _ipps._tcp.local. PTR (QM)? _ipp._tcp.local. (45)
22:40:30.380495 IP6 fe80::6ca3:42ff:febd:4b61.5353 > ff02::fb.5353: 0 [2q] PTR (QM)? _ipps._tcp.local. PTR (QM)? _ipp._tcp.local. (45)
22:40:30.405575 IP 0.0.0.0.68 > 255.255.255.255.67: BOOTP/DHCP, Request from 5e:d4:88:f3:05:ac, length 300
22:40:31.202633 IP6 fe80::5cd4:88ff:fef3:5ac.5353 > ff02::fb.5353: 0 [2q] PTR (QM)? _ipps._tcp.local. PTR (QM)? _ipp._tcp.local. (45)
22:40:31.767098 IP6 fe80::f4bf:dbff:fe75:926a.5353 > ff02::fb.5353: 0 [2q] PTR (QM)? _ipps._tcp.local. PTR (QM)? _ipp._tcp.local. (45)
22:40:31.871032 IP6 fe80::d8ce:abff:fe9e:bac.5353 > ff02::fb.5353: 0 [2q] PTR (QM)? _ipps._tcp.local. PTR (QM)? _ipp._tcp.local. (45)
22:40:32.450724 IP 0.0.0.0.68 > 255.255.255.255.67: BOOTP/DHCP, Request from da:ce:ab:9e:0b:ac, length 300
22:40:33.432260 ARP, Request who-has 10.0.0.3 tell 10.0.0.2, length 28
22:40:33.838384 ARP, Request who-has 10.0.0.4 tell 10.0.0.2, length 28
22:40:33.839631 ARP, Reply 10.0.0.4 is-at 0e:86:76:35:e9:b7, length 28
22:40:33.909728 IP 10.0.0.2 > 10.0.0.4: ICMP echo request, id 4026, seq 1, length 64
22:40:33.911112 IP 10.0.0.4 > 10.0.0.2: ICMP echo reply, id 4026, seq 1, length 64
22:40:34.313118 ARP, Request who-has 10.0.0.5 tell 10.0.0.2, length 28
22:40:34.730398 ARP, Request who-has 10.0.0.6 tell 10.0.0.2, length 28
22:40:35.173253 ARP, Request who-has 10.0.0.7 tell 10.0.0.2, length 28
22:40:35.376519 IP 0.0.0.0.68 > 255.255.255.255.67: BOOTP/DHCP, Request from 4e:a6:54:d1:d4:f0, length 300
22:40:35.601796 ARP, Request who-has 10.0.0.8 tell 10.0.0.2, length 28
22:40:35.767302 IP 0.0.0.0.68 > 255.255.255.255.67: BOOTP/DHCP, Request from 96:23:61:d6:2e:ac, length 300
22:40:35.816356 IP 0.0.0.0.68 > 255.255.255.255.67: BOOTP/DHCP, Request from 6e:a3:42:bd:4b:61, length 300
22:40:36.524872 LLDP, length 47
22:40:36.602459 ARP, Request who-has 10.0.0.8 tell 10.0.0.2, length 28
22:40:36.796433 da:ce:ab:9e:0b:ac > ff:ff:ff:ff:ff:ff, ethertype Unknown (0x8942), length 69: 
	0x0000:  2000 0604 0002 0000 0207 0400 0000 0000  ................
	0x0010:  0c04 0302 0002 0602 0078 fe0c 0026 e100  .........x...&..
	0x0020:  0000 0000 0000 000c 1808 0031 3791 7786  ...........17.w.
	0x0030:  1ff2 e601 0100 00                        .......
22:40:37.708617 ARP, Request who-has 10.0.0.4 tell 10.0.0.3, length 28
22:40:37.709844 ARP, Reply 10.0.0.4 is-at 0e:86:76:35:e9:b7, length 28
22:40:37.809088 IP 10.0.0.3 > 10.0.0.4: ICMP echo request, id 4033, seq 1, length 64
22:40:37.810390 IP 10.0.0.4 > 10.0.0.3: ICMP echo reply, id 4033, seq 1, length 64
22:40:38.210940 ARP, Request who-has 10.0.0.5 tell 10.0.0.3, length 28
22:40:38.588722 ARP, Request who-has 10.0.0.6 tell 10.0.0.3, length 28
22:40:39.027044 ARP, Request who-has 10.0.0.7 tell 10.0.0.3, length 28
22:40:39.415006 ARP, Request who-has 10.0.0.8 tell 10.0.0.3, length 28
22:40:39.775706 ARP, Request who-has 10.0.0.1 tell 10.0.0.4, length 28
22:40:39.834177 ARP, Reply 10.0.0.1 is-at c2:72:34:72:f2:5b, length 28
22:40:39.835430 IP 10.0.0.4 > 10.0.0.1: ICMP echo request, id 4038, seq 1, length 64
22:40:40.981762 IP 0.0.0.0.68 > 255.255.255.255.67: BOOTP/DHCP, Request from da:ce:ab:9e:0b:ac, length 300
22:40:44.910728 IP 0.0.0.0.68 > 255.255.255.255.67: BOOTP/DHCP, Request from f6:bf:db:75:92:6a, length 300
22:40:49.327865 IP6 :: > ff02::16: HBH ICMP6, multicast listener report v2, 2 group record(s), length 48
22:40:49.510205 IP6 :: > ff02::16: HBH ICMP6, multicast listener report v2, 2 group record(s), length 48
22:40:49.510246 IP6 :: > ff02::16: HBH ICMP6, multicast listener report v2, 2 group record(s), length 48
22:40:49.510272 IP6 :: > ff02::16: HBH ICMP6, multicast listener report v2, 2 group record(s), length 48
22:40:49.633979 IP6 :: > ff02::16: HBH ICMP6, multicast listener report v2, 2 group record(s), length 48
22:40:49.644738 IP6 :: > ff02::16: HBH ICMP6, multicast listener report v2, 2 group record(s), length 48
22:40:49.653704 IP6 :: > ff02::16: HBH ICMP6, multicast listener report v2, 2 group record(s), length 48
22:40:49.661813 IP6 :: > ff02::16: HBH ICMP6, multicast listener report v2, 2 group record(s), length 48
22:40:49.661839 IP6 :: > ff02::1:ffd6:2eac: ICMP6, neighbor solicitation, who has fe80::9423:61ff:fed6:2eac, length 24
22:40:49.662159 IP6 :: > ff02::1:ffbd:4b61: ICMP6, neighbor solicitation, who has fe80::6ca3:42ff:febd:4b61, length 24
22:40:49.804962 IP6 :: > ff02::1:ff75:926a: ICMP6, neighbor solicitation, who has fe80::f4bf:dbff:fe75:926a, length 24
22:40:49.807478 IP6 :: > ff02::16: HBH ICMP6, multicast listener report v2, 2 group record(s), length 48
22:40:49.903597 IP6 :: > ff02::1:ff9e:bac: ICMP6, neighbor solicitation, who has fe80::d8ce:abff:fe9e:bac, length 24
22:40:49.960851 IP6 :: > ff02::16: HBH ICMP6, multicast listener report v2, 2 group record(s), length 48
22:40:49.980784 IP6 :: > ff02::1:ffd1:d4f0: ICMP6, neighbor solicitation, who has fe80::4ca6:54ff:fed1:d4f0, length 24
22:40:49.984538 IP6 :: > ff02::16: HBH ICMP6, multicast listener report v2, 2 group record(s), length 48
22:40:50.002040 IP6 :: > ff02::16: HBH ICMP6, multicast listener report v2, 2 group record(s), length 48
22:40:50.073209 IP6 :: > ff02::16: HBH ICMP6, multicast listener report v2, 1 group record(s), length 28
22:40:50.084568 IP 10.0.0.4 > 10.0.0.2: ICMP echo request, id 4042, seq 1, length 64
22:40:50.155973 IP 10.0.0.2 > 10.0.0.4: ICMP echo reply, id 4042, seq 1, length 64
22:40:50.156214 IP6 :: > ff02::1:fff3:5ac: ICMP6, neighbor solicitation, who has fe80::5cd4:88ff:fef3:5ac, length 24
22:40:50.402432 IP6 fe80::9423:61ff:fed6:2eac > ff02::16: HBH ICMP6, multicast listener report v2, 1 group record(s), length 28
22:40:50.415028 IP6 fe80::9423:61ff:fed6:2eac > ff02::16: HBH ICMP6, multicast listener report v2, 1 group record(s), length 28
22:40:50.446645 IP6 fe80::9423:61ff:fed6:2eac.5353 > ff02::fb.5353: 0*- [0q] 2/0/0 PTR _workstation._tcp.local., PTR floodlight [96:23:61:d6:2e:ac]._workstation._tcp.local. (117)
22:40:50.469475 IP 10.0.0.4 > 10.0.0.3: ICMP echo request, id 4044, seq 1, length 64
22:40:50.581355 IP6 fe80::9423:61ff:fed6:2eac.5353 > ff02::fb.5353: 0 [3q] [5n] ANY (QM)? floodlight [96:23:61:d6:2e:ac]._workstation._tcp.local. ANY (QM)? floodlight.local. ANY (QM)? c.a.e.2.6.d.e.f.f.f.1.6.3.2.4.9.0.0.0.0.0.0.0.0.0.0.0.0.0.8.e.f.ip6.arpa. (267)
22:40:50.590816 IP 10.0.0.3 > 10.0.0.4: ICMP echo reply, id 4044, seq 1, length 64
22:40:50.634733 IP6 fe80::9423:61ff:fed6:2eac.5353 > ff02::fb.5353: 0 [2q] PTR (QM)? _ipps._tcp.local. PTR (QM)? _ipp._tcp.local. (45)
22:40:50.665136 IP6 fe80::6ca3:42ff:febd:4b61 > ff02::16: HBH ICMP6, multicast listener report v2, 1 group record(s), length 28
22:40:50.665162 IP6 fe80::6ca3:42ff:febd:4b61 > ff02::16: HBH ICMP6, multicast listener report v2, 1 group record(s), length 28
22:40:50.665367 IP6 fe80::6ca3:42ff:febd:4b61.5353 > ff02::fb.5353: 0*- [0q] 2/0/0 PTR _workstation._tcp.local., PTR floodlight [6e:a3:42:bd:4b:61]._workstation._tcp.local. (117)
22:40:50.756682 IP6 fe80::6ca3:42ff:febd:4b61.5353 > ff02::fb.5353: 0 [3q] [5n] ANY (QM)? floodlight [6e:a3:42:bd:4b:61]._workstation._tcp.local. ANY (QM)? floodlight.local. ANY (QM)? 1.6.b.4.d.b.e.f.f.f.2.4.3.a.c.6.0.0.0.0.0.0.0.0.0.0.0.0.0.8.e.f.ip6.arpa. (267)
22:40:50.872346 IP6 fe80::6ca3:42ff:febd:4b61.5353 > ff02::fb.5353: 0 [2q] PTR (QM)? _ipps._tcp.local. PTR (QM)? _ipp._tcp.local. (45)
22:40:50.872372 IP6 fe80::f4bf:dbff:fe75:926a > ff02::16: HBH ICMP6, multicast listener report v2, 1 group record(s), length 28
22:40:50.872398 IP6 fe80::f4bf:dbff:fe75:926a > ff02::16: HBH ICMP6, multicast listener report v2, 1 group record(s), length 28
22:40:50.903543 IP6 fe80::d8ce:abff:fe9e:bac > ff02::16: HBH ICMP6, multicast listener report v2, 1 group record(s), length 28
22:40:50.915650 IP6 fe80::d8ce:abff:fe9e:bac > ff02::16: HBH ICMP6, multicast listener report v2, 1 group record(s), length 28
22:40:50.948578 ARP, Request who-has 10.0.0.5 tell 10.0.0.4, length 28
22:40:50.970077 IP6 fe80::d8ce:abff:fe9e:bac.5353 > ff02::fb.5353: 0*- [0q] 2/0/0 PTR _workstation._tcp.local., PTR floodlight [da:ce:ab:9e:0b:ac]._workstation._tcp.local. (117)
22:40:50.990276 IP6 fe80::d8ce:abff:fe9e:bac.5353 > ff02::fb.5353: 0 [3q] [5n] ANY (QM)? floodlight [da:ce:ab:9e:0b:ac]._workstation._tcp.local. ANY (QM)? floodlight.local. ANY (QM)? c.a.b.0.e.9.e.f.f.f.b.a.e.c.8.d.0.0.0.0.0.0.0.0.0.0.0.0.0.8.e.f.ip6.arpa. (267)
22:40:51.002042 IP6 fe80::f4bf:dbff:fe75:926a.5353 > ff02::fb.5353: 0*- [0q] 2/0/0 PTR _workstation._tcp.local., PTR floodlight [f6:bf:db:75:92:6a]._workstation._tcp.local. (117)
22:40:51.002068 IP6 fe80::f4bf:dbff:fe75:926a.5353 > ff02::fb.5353: 0 [3q] [5n] ANY (QM)? floodlight [f6:bf:db:75:92:6a]._workstation._tcp.local. ANY (QM)? floodlight.local. ANY (QM)? a.6.2.9.5.7.e.f.f.f.b.d.f.b.4.f.0.0.0.0.0.0.0.0.0.0.0.0.0.8.e.f.ip6.arpa. (267)
22:40:51.002252 IP6 fe80::f4bf:dbff:fe75:926a.5353 > ff02::fb.5353: 0 [2q] PTR (QM)? _ipps._tcp.local. PTR (QM)? _ipp._tcp.local. (45)
22:40:51.008600 IP6 fe80::d8ce:abff:fe9e:bac.5353 > ff02::fb.5353: 0 [2q] PTR (QM)? _ipps._tcp.local. PTR (QM)? _ipp._tcp.local. (45)
22:40:51.027691 IP6 fe80::d8ce:abff:fe9e:bac > ff02::16: HBH ICMP6, multicast listener report v2, 2 group record(s), length 48
22:40:51.169298 IP6 fe80::9423:61ff:fed6:2eac.5353 > ff02::fb.5353: 0 [3q] [5n] ANY (QM)? floodlight [96:23:61:d6:2e:ac]._workstation._tcp.local. ANY (QM)? floodlight.local. ANY (QM)? c.a.e.2.6.d.e.f.f.f.1.6.3.2.4.9.0.0.0.0.0.0.0.0.0.0.0.0.0.8.e.f.ip6.arpa. (267)
22:40:51.250241 IP6 fe80::d8ce:abff:fe9e:bac.5353 > ff02::fb.5353: 0 [3q] [5n] ANY (QM)? floodlight [da:ce:ab:9e:0b:ac]._workstation._tcp.local. ANY (QM)? floodlight.local. ANY (QM)? c.a.b.0.e.9.e.f.f.f.b.a.e.c.8.d.0.0.0.0.0.0.0.0.0.0.0.0.0.8.e.f.ip6.arpa. (267)
22:40:51.430932 IP6 fe80::6ca3:42ff:febd:4b61.5353 > ff02::fb.5353: 0 [3q] [5n] ANY (QM)? floodlight [6e:a3:42:bd:4b:61]._workstation._tcp.local. ANY (QM)? floodlight.local. ANY (QM)? 1.6.b.4.d.b.e.f.f.f.2.4.3.a.c.6.0.0.0.0.0.0.0.0.0.0.0.0.0.8.e.f.ip6.arpa. (267)
22:40:51.430958 IP6 fe80::9423:61ff:fed6:2eac > ff02::16: HBH ICMP6, multicast listener report v2, 1 group record(s), length 28
22:40:51.453777 IP6 fe80::f4bf:dbff:fe75:926a.5353 > ff02::fb.5353: 0 [3q] [5n] ANY (QM)? floodlight [f6:bf:db:75:92:6a]._workstation._tcp.local. ANY (QM)? floodlight.local. ANY (QM)? a.6.2.9.5.7.e.f.f.f.b.d.f.b.4.f.0.0.0.0.0.0.0.0.0.0.0.0.0.8.e.f.ip6.arpa. (267)
22:40:51.454274 IP6 fe80::4ca6:54ff:fed1:d4f0 > ff02::16: HBH ICMP6, multicast listener report v2, 1 group record(s), length 28
22:40:51.466046 IP6 fe80::4ca6:54ff:fed1:d4f0 > ff02::16: HBH ICMP6, multicast listener report v2, 1 group record(s), length 28
22:40:51.497256 IP6 fe80::d8ce:abff:fe9e:bac.5353 > ff02::fb.5353: 0 [3q] [5n] ANY (QM)? floodlight [da:ce:ab:9e:0b:ac]._workstation._tcp.local. ANY (QM)? floodlight.local. ANY (QM)? c.a.b.0.e.9.e.f.f.f.b.a.e.c.8.d.0.0.0.0.0.0.0.0.0.0.0.0.0.8.e.f.ip6.arpa. (267)
22:40:51.562656 LLDP, length 47
22:40:51.643695 ARP, Reply 10.0.0.5 is-at 9e:70:ab:3e:15:eb, length 28
22:40:51.644920 IP 10.0.0.4 > 10.0.0.5: ICMP echo request, id 4045, seq 1, length 64
22:40:51.683783 IP6 fe80::5cd4:88ff:fef3:5ac > ff02::16: HBH ICMP6, multicast listener report v2, 1 group record(s), length 28
22:40:51.683814 IP6 fe80::5cd4:88ff:fef3:5ac > ff02::16: HBH ICMP6, multicast listener report v2, 1 group record(s), length 28
22:40:51.689726 IP6 fe80::5cd4:88ff:fef3:5ac.5353 > ff02::fb.5353: 0*- [0q] 2/0/0 PTR _workstation._tcp.local., PTR floodlight [5e:d4:88:f3:05:ac]._workstation._tcp.local. (117)
22:40:51.689757 IP6 fe80::6ca3:42ff:febd:4b61 > ff02::16: HBH ICMP6, multicast listener report v2, 1 group record(s), length 28
22:40:51.689783 IP6 fe80::f4bf:dbff:fe75:926a.5353 > ff02::fb.5353: 0 [3q] [5n] ANY (QM)? floodlight [f6:bf:db:75:92:6a]._workstation._tcp.local. ANY (QM)? floodlight.local. ANY (QM)? a.6.2.9.5.7.e.f.f.f.b.d.f.b.4.f.0.0.0.0.0.0.0.0.0.0.0.0.0.8.e.f.ip6.arpa. (267)
22:40:51.689808 IP6 fe80::f4bf:dbff:fe75:926a > ff02::16: HBH ICMP6, multicast listener report v2, 2 group record(s), length 48
22:40:51.690063 IP6 fe80::4ca6:54ff:fed1:d4f0.5353 > ff02::fb.5353: 0*- [0q] 2/0/0 PTR _workstation._tcp.local., PTR floodlight [4e:a6:54:d1:d4:f0]._workstation._tcp.local. (117)
22:40:51.696451 IP6 fe80::d8ce:abff:fe9e:bac.5353 > ff02::fb.5353: 0*- [0q] 5/0/0 (Cache flush) TXT "", (Cache flush) AAAA fe80::d8ce:abff:fe9e:bac, (Cache flush) PTR floodlight.local., (Cache flush) HINFO, (Cache flush) SRV floodlight.local.:9 0 0 (249)
22:40:51.805962 IP6 fe80::d8ce:abff:fe9e:bac > ff02::16: HBH ICMP6, multicast listener report v2, 1 group record(s), length 28
22:40:51.817124 da:ce:ab:9e:0b:ac > ff:ff:ff:ff:ff:ff, ethertype Unknown (0x8942), length 69: 
	0x0000:  2000 0604 0002 0000 0207 0400 0000 0000  ................
	0x0010:  0c04 0302 0002 0602 0078 fe0c 0026 e100  .........x...&..
	0x0020:  0000 0000 0000 000c 1808 0031 3791 7786  ...........17.w.
	0x0030:  1ff2 e601 0100 00                        .......
22:40:51.844025 IP6 fe80::5cd4:88ff:fef3:5ac.5353 > ff02::fb.5353: 0 [3q] [5n] ANY (QM)? floodlight [5e:d4:88:f3:05:ac]._workstation._tcp.local. ANY (QM)? floodlight.local. ANY (QM)? c.a.5.0.3.f.e.f.f.f.8.8.4.d.c.5.0.0.0.0.0.0.0.0.0.0.0.0.0.8.e.f.ip6.arpa. (267)
22:40:51.844051 IP6 fe80::5cd4:88ff:fef3:5ac.5353 > ff02::fb.5353: 0 [2q] PTR (QM)? _ipps._tcp.local. PTR (QM)? _ipp._tcp.local. (45)
22:40:51.844370 IP6 fe80::f4bf:dbff:fe75:926a.5353 > ff02::fb.5353: 0*- [0q] 2/0/0 (Cache flush) TXT "", (Cache flush) SRV floodlight.local.:9 0 0 (110)
22:40:51.844399 IP6 fe80::f4bf:dbff:fe75:926a.5353 > ff02::fb.5353: 0*- [0q] 3/0/0 (Cache flush) HINFO, (Cache flush) AAAA fe80::f4bf:dbff:fe75:926a, (Cache flush) PTR floodlight.local. (167)
22:40:51.844424 IP6 fe80::9423:61ff:fed6:2eac.5353 > ff02::fb.5353: 0 [3q] [5n] ANY (QM)? floodlight [96:23:61:d6:2e:ac]._workstation._tcp.local. ANY (QM)? floodlight.local. ANY (QM)? c.a.e.2.6.d.e.f.f.f.1.6.3.2.4.9.0.0.0.0.0.0.0.0.0.0.0.0.0.8.e.f.ip6.arpa. (267)
22:40:51.851920 IP6 fe80::f4bf:dbff:fe75:926a > ff02::16: HBH ICMP6, multicast listener report v2, 1 group record(s), length 28
22:40:51.853437 IP6 fe80::5cd4:88ff:fef3:5ac.5353 > ff02::fb.5353: 0 [3q] [5n] ANY (QM)? floodlight [5e:d4:88:f3:05:ac]._workstation._tcp.local. ANY (QM)? floodlight.local. ANY (QM)? c.a.5.0.3.f.e.f.f.f.8.8.4.d.c.5.0.0.0.0.0.0.0.0.0.0.0.0.0.8.e.f.ip6.arpa. (267)
22:40:51.888117 IP6 fe80::4ca6:54ff:fed1:d4f0.5353 > ff02::fb.5353: 0 [3q] [5n] ANY (QM)? floodlight [4e:a6:54:d1:d4:f0]._workstation._tcp.local. ANY (QM)? floodlight.local. ANY (QM)? 0.f.4.d.1.d.e.f.f.f.4.5.6.a.c.4.0.0.0.0.0.0.0.0.0.0.0.0.0.8.e.f.ip6.arpa. (267)
22:40:51.888143 IP6 fe80::4ca6:54ff:fed1:d4f0.5353 > ff02::fb.5353: 0 [2q] PTR (QM)? _ipps._tcp.local. PTR (QM)? _ipp._tcp.local. (45)
22:40:51.998616 IP6 fe80::d8ce:abff:fe9e:bac.5353 > ff02::fb.5353: 0*- [0q] 2/0/0 PTR _workstation._tcp.local., PTR floodlight [da:ce:ab:9e:0b:ac]._workstation._tcp.local. (117)
22:40:52.012266 IP6 fe80::d8ce:abff:fe9e:bac.5353 > ff02::fb.5353: 0 [2q] PTR (QM)? _ipps._tcp.local. PTR (QM)? _ipp._tcp.local. (45)
22:40:52.024551 IP 10.0.0.5 > 10.0.0.4: ICMP echo reply, id 4045, seq 1, length 64
22:40:52.377865 ARP, Request who-has 10.0.0.6 tell 10.0.0.4, length 28
22:40:52.406872 IP6 fe80::6ca3:42ff:febd:4b61.5353 > ff02::fb.5353: 0 [3q] [5n] ANY (QM)? floodlight [6e:a3:42:bd:4b:61]._workstation._tcp.local. ANY (QM)? floodlight.local. ANY (QM)? 1.6.b.4.d.b.e.f.f.f.2.4.3.a.c.6.0.0.0.0.0.0.0.0.0.0.0.0.0.8.e.f.ip6.arpa. (267)
22:40:52.406940 IP6 fe80::5cd4:88ff:fef3:5ac > ff02::16: HBH ICMP6, multicast listener report v2, 2 group record(s), length 48
22:40:52.407013 IP6 fe80::5cd4:88ff:fef3:5ac.5353 > ff02::fb.5353: 0 [3q] [5n] ANY (QM)? floodlight [5e:d4:88:f3:05:ac]._workstation._tcp.local. ANY (QM)? floodlight.local. ANY (QM)? c.a.5.0.3.f.e.f.f.f.8.8.4.d.c.5.0.0.0.0.0.0.0.0.0.0.0.0.0.8.e.f.ip6.arpa. (267)
22:40:52.407074 IP6 fe80::6ca3:42ff:febd:4b61 > ff02::16: HBH ICMP6, multicast listener report v2, 2 group record(s), length 48
22:40:52.407541 IP6 fe80::6ca3:42ff:febd:4b61.5353 > ff02::fb.5353: 0*- [0q] 5/0/0 (Cache flush) TXT "", (Cache flush) AAAA fe80::6ca3:42ff:febd:4b61, (Cache flush) PTR floodlight.local., (Cache flush) HINFO, (Cache flush) SRV floodlight.local.:9 0 0 (249)
22:40:52.701692 IP6 fe80::f4bf:dbff:fe75:926a.5353 > ff02::fb.5353: 0*- [0q] 2/0/0 PTR _workstation._tcp.local., PTR floodlight [f6:bf:db:75:92:6a]._workstation._tcp.local. (117)
22:40:52.701718 IP6 fe80::f4bf:dbff:fe75:926a.5353 > ff02::fb.5353: 0 [2q] PTR (QM)? _ipps._tcp.local. PTR (QM)? _ipp._tcp.local. (45)
22:40:52.716085 IP6 fe80::5cd4:88ff:fef3:5ac > ff02::16: HBH ICMP6, multicast listener report v2, 1 group record(s), length 28
22:40:52.716112 IP6 fe80::9423:61ff:fed6:2eac.5353 > ff02::fb.5353: 0*- [0q] 5/0/0 (Cache flush) TXT "", (Cache flush) AAAA fe80::9423:61ff:fed6:2eac, (Cache flush) PTR floodlight.local., (Cache flush) HINFO, (Cache flush) SRV floodlight.local.:9 0 0 (249)
22:40:52.716379 IP6 fe80::4ca6:54ff:fed1:d4f0.5353 > ff02::fb.5353: 0 [3q] [5n] ANY (QM)? floodlight [4e:a6:54:d1:d4:f0]._workstation._tcp.local. ANY (QM)? floodlight.local. ANY (QM)? 0.f.4.d.1.d.e.f.f.f.4.5.6.a.c.4.0.0.0.0.0.0.0.0.0.0.0.0.0.8.e.f.ip6.arpa. (267)
22:40:52.716405 IP6 fe80::9423:61ff:fed6:2eac > ff02::16: HBH ICMP6, multicast listener report v2, 2 group record(s), length 48
22:40:52.716700 IP6 fe80::6ca3:42ff:febd:4b61.5353 > ff02::fb.5353: 0*- [0q] 2/0/0 PTR _workstation._tcp.local., PTR floodlight [6e:a3:42:bd:4b:61]._workstation._tcp.local. (117)
22:40:52.716726 IP6 fe80::6ca3:42ff:febd:4b61.5353 > ff02::fb.5353: 0 [2q] PTR (QM)? _ipps._tcp.local. PTR (QM)? _ipp._tcp.local. (45)
22:40:52.726014 IP6 fe80::d8ce:abff:fe9e:bac.5353 > ff02::fb.5353: 0*- [0q] 5/0/0 (Cache flush) TXT "", (Cache flush) AAAA fe80::d8ce:abff:fe9e:bac, (Cache flush) PTR floodlight.local., (Cache flush) HINFO, (Cache flush) SRV floodlight.local.:9 0 0 (249)
22:40:52.786940 IP6 fe80::5cd4:88ff:fef3:5ac.5353 > ff02::fb.5353: 0*- [0q] 3/0/0 (Cache flush) TXT "", (Cache flush) HINFO, (Cache flush) SRV floodlight.local.:9 0 0 (135)
22:40:52.786967 IP6 fe80::5cd4:88ff:fef3:5ac.5353 > ff02::fb.5353: 0*- [0q] 2/0/0 (Cache flush) PTR floodlight.local., (Cache flush) AAAA fe80::5cd4:88ff:fef3:5ac (142)
22:40:53.135643 IP6 :: > ff02::16: HBH ICMP6, multicast listener report v2, 2 group record(s), length 48
22:40:53.147690 IP6 :: > ff02::16: HBH ICMP6, multicast listener report v2, 2 group record(s), length 48
22:40:53.195535 IP6 :: > ff02::1:ff9e:bac: ICMP6, neighbor solicitation, who has fe80::d8ce:abff:fe9e:bac, length 24
22:40:53.209541 IP 0.0.0.0.68 > 255.255.255.255.67: BOOTP/DHCP, Request from da:ce:ab:9e:0b:ac, length 300
22:40:53.375680 ARP, Request who-has 10.0.0.6 tell 10.0.0.4, length 28
22:40:53.444932 IP6 fe80::4ca6:54ff:fed1:d4f0 > ff02::16: HBH ICMP6, multicast listener report v2, 2 group record(s), length 48
22:40:53.446289 IP6 fe80::4ca6:54ff:fed1:d4f0 > ff02::16: HBH ICMP6, multicast listener report v2, 1 group record(s), length 28
22:40:53.452740 IP6 fe80::9423:61ff:fed6:2eac.5353 > ff02::fb.5353: 0*- [0q] 2/0/0 PTR _workstation._tcp.local., PTR floodlight [96:23:61:d6:2e:ac]._workstation._tcp.local. (117)
22:40:53.452776 IP6 fe80::9423:61ff:fed6:2eac.5353 > ff02::fb.5353: 0 [2q] PTR (QM)? _ipps._tcp.local. PTR (QM)? _ipp._tcp.local. (45)
22:40:53.452811 IP6 fe80::4ca6:54ff:fed1:d4f0.5353 > ff02::fb.5353: 0 [3q] [5n] ANY (QM)? floodlight [4e:a6:54:d1:d4:f0]._workstation._tcp.local. ANY (QM)? floodlight.local. ANY (QM)? 0.f.4.d.1.d.e.f.f.f.4.5.6.a.c.4.0.0.0.0.0.0.0.0.0.0.0.0.0.8.e.f.ip6.arpa. (267)
22:40:53.452846 IP6 fe80::5cd4:88ff:fef3:5ac.5353 > ff02::fb.5353: 0*- [0q] 2/0/0 PTR _workstation._tcp.local., PTR floodlight [5e:d4:88:f3:05:ac]._workstation._tcp.local. (117)
22:40:53.452881 IP6 fe80::5cd4:88ff:fef3:5ac.5353 > ff02::fb.5353: 0 [2q] PTR (QM)? _ipps._tcp.local. PTR (QM)? _ipp._tcp.local. (45)
22:40:53.453485 IP6 fe80::f4bf:dbff:fe75:926a.5353 > ff02::fb.5353: 0*- [0q] 2/0/0 (Cache flush) HINFO, (Cache flush) PTR floodlight.local. (139)
22:40:53.603530 IP6 :: > ff02::16: HBH ICMP6, multicast listener report v2, 1 group record(s), length 28
22:40:53.616955 IP6 :: > ff02::16: HBH ICMP6, multicast listener report v2, 1 group record(s), length 28
22:40:53.616991 IP 0.0.0.0.68 > 255.255.255.255.67: BOOTP/DHCP, Request from f6:bf:db:75:92:6a, length 300
22:40:54.068923 IP6 fe80::5cd4:88ff:fef3:5ac.5353 > ff02::fb.5353: 0*- [0q] 4/0/0 (Cache flush) TXT "", (Cache flush) HINFO, (Cache flush) SRV floodlight.local.:9 0 0, (Cache flush) AAAA fe80::5cd4:88ff:fef3:5ac (163)
22:40:54.069414 IP6 :: > ff02::16: HBH ICMP6, multicast listener report v2, 2 group record(s), length 48
22:40:54.069449 IP6 fe80::4ca6:54ff:fed1:d4f0.5353 > ff02::fb.5353: 0*- [0q] 2/0/0 (Cache flush) TXT "", (Cache flush) SRV floodlight.local.:9 0 0 (110)
22:40:54.069484 IP6 fe80::4ca6:54ff:fed1:d4f0.5353 > ff02::fb.5353: 0*- [0q] 3/0/0 (Cache flush) HINFO, (Cache flush) AAAA fe80::4ca6:54ff:fed1:d4f0, (Cache flush) PTR floodlight.local. (167)
22:40:54.069519 IP6 fe80::6ca3:42ff:febd:4b61.5353 > ff02::fb.5353: 0*- [0q] 5/0/0 (Cache flush) TXT "", (Cache flush) AAAA fe80::6ca3:42ff:febd:4b61, (Cache flush) PTR floodlight.local., (Cache flush) HINFO, (Cache flush) SRV floodlight.local.:9 0 0 (249)
22:40:54.069554 IP6 fe80::4ca6:54ff:fed1:d4f0.5353 > ff02::fb.5353: 0*- [0q] 2/0/0 PTR _workstation._tcp.local., PTR floodlight [4e:a6:54:d1:d4:f0]._workstation._tcp.local. (117)
22:40:54.069781 IP6 fe80::4ca6:54ff:fed1:d4f0.5353 > ff02::fb.5353: 0 [2q] PTR (QM)? _ipps._tcp.local. PTR (QM)? _ipp._tcp.local. (45)
22:40:54.080129 IP 0.0.0.0.68 > 255.255.255.255.67: BOOTP/DHCP, Request from 5e:d4:88:f3:05:ac, length 300
22:40:54.080179 IP6 :: > ff02::16: HBH ICMP6, multicast listener report v2, 1 group record(s), length 28
22:40:54.080214 IP6 :: > ff02::16: HBH ICMP6, multicast listener report v2, 2 group record(s), length 48
22:40:54.080250 IP6 :: > ff02::1:ff75:926a: ICMP6, neighbor solicitation, who has fe80::f4bf:dbff:fe75:926a, length 24
22:40:54.195562 IP6 fe80::d8ce:abff:fe9e:bac > ff02::16: HBH ICMP6, multicast listener report v2, 1 group record(s), length 28
22:40:54.195600 IP6 fe80::d8ce:abff:fe9e:bac > ff02::2: ICMP6, router solicitation, length 16
22:40:54.203575 IP6 fe80::d8ce:abff:fe9e:bac > ff02::16: HBH ICMP6, multicast listener report v2, 1 group record(s), length 28
22:40:54.261489 IP6 fe80::d8ce:abff:fe9e:bac.5353 > ff02::fb.5353: 0*- [0q] 2/0/0 PTR _workstation._tcp.local., PTR floodlight [da:ce:ab:9e:0b:ac]._workstation._tcp.local. (117)
22:40:54.278047 IP6 fe80::d8ce:abff:fe9e:bac.5353 > ff02::fb.5353: 0 [3q] [5n] ANY (QM)? floodlight [da:ce:ab:9e:0b:ac]._workstation._tcp.local. ANY (QM)? floodlight.local. ANY (QM)? c.a.b.0.e.9.e.f.f.f.b.a.e.c.8.d.0.0.0.0.0.0.0.0.0.0.0.0.0.8.e.f.ip6.arpa. (267)
22:40:54.296546 IP6 fe80::d8ce:abff:fe9e:bac.5353 > ff02::fb.5353: 0 [2q] PTR (QM)? _ipps._tcp.local. PTR (QM)? _ipp._tcp.local. (45)
22:40:54.344065 IP6 fe80::d8ce:abff:fe9e:bac > ff02::16: HBH ICMP6, multicast listener report v2, 1 group record(s), length 28
22:40:54.375458 ARP, Request who-has 10.0.0.6 tell 10.0.0.4, length 28
22:40:54.537165 IP6 fe80::d8ce:abff:fe9e:bac.5353 > ff02::fb.5353: 0 [3q] [5n] ANY (QM)? floodlight [da:ce:ab:9e:0b:ac]._workstation._tcp.local. ANY (QM)? floodlight.local. ANY (QM)? c.a.b.0.e.9.e.f.f.f.b.a.e.c.8.d.0.0.0.0.0.0.0.0.0.0.0.0.0.8.e.f.ip6.arpa. (267)
22:40:54.780737 IP6 fe80::d8ce:abff:fe9e:bac.5353 > ff02::fb.5353: 0 [3q] [5n] ANY (QM)? floodlight [da:ce:ab:9e:0b:ac]._workstation._tcp.local. ANY (QM)? floodlight.local. ANY (QM)? c.a.b.0.e.9.e.f.f.f.b.a.e.c.8.d.0.0.0.0.0.0.0.0.0.0.0.0.0.8.e.f.ip6.arpa. (267)
22:40:54.890271 IP6 :: > ff02::1:fff3:5ac: ICMP6, neighbor solicitation, who has fe80::5cd4:88ff:fef3:5ac, length 24
22:40:54.896122 IP6 :: > ff02::16: HBH ICMP6, multicast listener report v2, 1 group record(s), length 28
22:40:54.896157 IP6 :: > ff02::16: HBH ICMP6, multicast listener report v2, 1 group record(s), length 28
22:40:54.896193 IP 0.0.0.0.68 > 255.255.255.255.67: BOOTP/DHCP, Request from 4e:a6:54:d1:d4:f0, length 300
22:40:54.896227 IP6 fe80::9423:61ff:fed6:2eac.5353 > ff02::fb.5353: 0*- [0q] 5/0/0 (Cache flush) TXT "", (Cache flush) AAAA fe80::9423:61ff:fed6:2eac, (Cache flush) PTR floodlight.local., (Cache flush) HINFO, (Cache flush) SRV floodlight.local.:9 0 0 (249)
22:40:54.896443 IP6 :: > ff02::16: HBH ICMP6, multicast listener report v2, 1 group record(s), length 28
22:40:54.896479 IP 0.0.0.0.68 > 255.255.255.255.67: BOOTP/DHCP, Request from 6e:a3:42:bd:4b:61, length 300
22:40:54.954028 IP6 :: > ff02::1:ffbd:4b61: ICMP6, neighbor solicitation, who has fe80::6ca3:42ff:febd:4b61, length 24
22:40:54.954341 IP6 :: > ff02::16: HBH ICMP6, multicast listener report v2, 2 group record(s), length 48
22:40:54.984527 IP6 fe80::d8ce:abff:fe9e:bac > ff02::16: HBH ICMP6, multicast listener report v2, 2 group record(s), length 48
22:40:54.992361 IP6 fe80::d8ce:abff:fe9e:bac.5353 > ff02::fb.5353: 0*- [0q] 5/0/0 (Cache flush) TXT "", (Cache flush) AAAA fe80::d8ce:abff:fe9e:bac, (Cache flush) PTR floodlight.local., (Cache flush) HINFO, (Cache flush) SRV floodlight.local.:9 0 0 (249)
22:40:55.091387 ARP, Request who-has 10.0.0.2 tell 10.0.0.4, length 28
22:40:55.288213 IP6 fe80::d8ce:abff:fe9e:bac.5353 > ff02::fb.5353: 0*- [0q] 2/0/0 PTR _workstation._tcp.local., PTR floodlight [da:ce:ab:9e:0b:ac]._workstation._tcp.local. (117)
22:40:55.298674 IP6 fe80::d8ce:abff:fe9e:bac.5353 > ff02::fb.5353: 0 [2q] PTR (QM)? _ipps._tcp.local. PTR (QM)? _ipp._tcp.local. (45)
22:40:55.317352 ARP, Reply 10.0.0.6 is-at 42:b7:f3:57:e5:80, length 28
22:40:55.318547 IP 10.0.0.4 > 10.0.0.6: ICMP echo request, id 4055, seq 1, length 64
22:40:55.416296 ARP, Reply 10.0.0.6 is-at 42:b7:f3:57:e5:80, length 28
22:40:55.475454 ARP, Request who-has 10.0.0.3 tell 10.0.0.4, length 28
22:40:55.597519 IP6 :: > ff02::16: HBH ICMP6, multicast listener report v2, 2 group record(s), length 48
22:40:55.597555 IP 0.0.0.0.68 > 255.255.255.255.67: BOOTP/DHCP, Request from 96:23:61:d6:2e:ac, length 300
22:40:55.597590 IP6 fe80::f4bf:dbff:fe75:926a > ff02::16: HBH ICMP6, multicast listener report v2, 1 group record(s), length 28
22:40:55.597625 IP6 fe80::f4bf:dbff:fe75:926a > ff02::2: ICMP6, router solicitation, length 16
22:40:55.597900 IP6 fe80::f4bf:dbff:fe75:926a > ff02::16: HBH ICMP6, multicast listener report v2, 1 group record(s), length 28
22:40:55.597935 IP6 :: > ff02::1:ffd6:2eac: ICMP6, neighbor solicitation, who has fe80::9423:61ff:fed6:2eac, length 24
22:40:55.603898 IP6 :: > ff02::16: HBH ICMP6, multicast listener report v2, 1 group record(s), length 28
22:40:55.603938 IP6 :: > ff02::1:ffd1:d4f0: ICMP6, neighbor solicitation, who has fe80::4ca6:54ff:fed1:d4f0, length 24
22:40:55.603973 IP6 :: > ff02::16: HBH ICMP6, multicast listener report v2, 1 group record(s), length 28
22:40:55.604008 IP6 fe80::9423:61ff:fed6:2eac > ff02::16: HBH ICMP6, multicast listener report v2, 1 group record(s), length 28
22:40:55.604334 IP6 fe80::9423:61ff:fed6:2eac > ff02::2: ICMP6, router solicitation, length 16
22:40:55.634990 IP6 fe80::9423:61ff:fed6:2eac > ff02::16: HBH ICMP6, multicast listener report v2, 1 group record(s), length 28
22:40:55.648356 IP6 fe80::9423:61ff:fed6:2eac.5353 > ff02::fb.5353: 0*- [0q] 2/0/0 PTR _workstation._tcp.local., PTR floodlight [96:23:61:d6:2e:ac]._workstation._tcp.local. (117)
22:40:55.648391 IP6 fe80::9423:61ff:fed6:2eac.5353 > ff02::fb.5353: 0 [2q] PTR (QM)? _ipps._tcp.local. PTR (QM)? _ipp._tcp.local. (45)
22:40:55.648426 IP6 fe80::9423:61ff:fed6:2eac > ff02::16: HBH ICMP6, multicast listener report v2, 2 group record(s), length 48
22:40:55.648461 IP6 fe80::9423:61ff:fed6:2eac > ff02::16: HBH ICMP6, multicast listener report v2, 1 group record(s), length 28
22:40:55.648695 IP6 fe80::5cd4:88ff:fef3:5ac > ff02::16: HBH ICMP6, multicast listener report v2, 1 group record(s), length 28
22:40:55.648731 IP6 fe80::5cd4:88ff:fef3:5ac > ff02::2: ICMP6, router solicitation, length 16
22:40:55.648765 IP6 fe80::5cd4:88ff:fef3:5ac > ff02::16: HBH ICMP6, multicast listener report v2, 1 group record(s), length 28
22:40:55.648800 IP6 fe80::5cd4:88ff:fef3:5ac.5353 > ff02::fb.5353: 0*- [0q] 2/0/0 PTR _workstation._tcp.local., PTR floodlight [5e:d4:88:f3:05:ac]._workstation._tcp.local. (117)
22:40:55.650507 IP6 fe80::5cd4:88ff:fef3:5ac.5353 > ff02::fb.5353: 0 [3q] [5n] ANY (QM)? floodlight [5e:d4:88:f3:05:ac]._workstation._tcp.local. ANY (QM)? floodlight.local. ANY (QM)? c.a.5.0.3.f.e.f.f.f.8.8.4.d.c.5.0.0.0.0.0.0.0.0.0.0.0.0.0.8.e.f.ip6.arpa. (267)
22:40:55.650543 IP6 fe80::5cd4:88ff:fef3:5ac.5353 > ff02::fb.5353: 0 [2q] PTR (QM)? _ipps._tcp.local. PTR (QM)? _ipp._tcp.local. (45)
22:40:55.650578 IP6 fe80::f4bf:dbff:fe75:926a.5353 > ff02::fb.5353: 0*- [0q] 2/0/0 PTR _workstation._tcp.local., PTR floodlight [f6:bf:db:75:92:6a]._workstation._tcp.local. (117)
22:40:55.650613 IP6 fe80::f4bf:dbff:fe75:926a.5353 > ff02::fb.5353: 0 [3q] [5n] ANY (QM)? floodlight [f6:bf:db:75:92:6a]._workstation._tcp.local. ANY (QM)? floodlight.local. ANY (QM)? a.6.2.9.5.7.e.f.f.f.b.d.f.b.4.f.0.0.0.0.0.0.0.0.0.0.0.0.0.8.e.f.ip6.arpa. (267)
22:40:55.650648 IP6 fe80::f4bf:dbff:fe75:926a > ff02::16: HBH ICMP6, multicast listener report v2, 1 group record(s), length 28
22:40:55.650937 IP6 fe80::f4bf:dbff:fe75:926a.5353 > ff02::fb.5353: 0 [2q] PTR (QM)? _ipps._tcp.local. PTR (QM)? _ipp._tcp.local. (45)
22:40:55.650972 IP6 fe80::f4bf:dbff:fe75:926a.5353 > ff02::fb.5353: 0 [3q] [5n] ANY (QM)? floodlight [f6:bf:db:75:92:6a]._workstation._tcp.local. ANY (QM)? floodlight.local. ANY (QM)? a.6.2.9.5.7.e.f.f.f.b.d.f.b.4.f.0.0.0.0.0.0.0.0.0.0.0.0.0.8.e.f.ip6.arpa. (267)
22:40:55.651007 IP6 fe80::f4bf:dbff:fe75:926a > ff02::16: HBH ICMP6, multicast listener report v2, 2 group record(s), length 48
22:40:55.684867 IP6 fe80::f4bf:dbff:fe75:926a.5353 > ff02::fb.5353: 0 [3q] [5n] ANY (QM)? floodlight [f6:bf:db:75:92:6a]._workstation._tcp.local. ANY (QM)? floodlight.local. ANY (QM)? a.6.2.9.5.7.e.f.f.f.b.d.f.b.4.f.0.0.0.0.0.0.0.0.0.0.0.0.0.8.e.f.ip6.arpa. (267)
22:40:55.911537 IP 10.0.0.6 > 10.0.0.4: ICMP echo reply, id 4055, seq 1, length 64
22:40:55.915852 ARP, Reply 10.0.0.3 is-at 62:52:cd:31:e2:b5, length 28
22:40:56.000234 IP6 fe80::5cd4:88ff:fef3:5ac > ff02::16: HBH ICMP6, multicast listener report v2, 1 group record(s), length 28
22:40:56.017210 IP6 fe80::d8ce:abff:fe9e:bac.5353 > ff02::fb.5353: 0*- [0q] 1/0/0 (Cache flush) TXT "" (79)
22:40:56.021227 IP6 fe80::d8ce:abff:fe9e:bac.5353 > ff02::fb.5353: 0*- [0q] 4/0/0 (Cache flush) SRV floodlight.local.:9 0 0, (Cache flush) AAAA fe80::d8ce:abff:fe9e:bac, (Cache flush) PTR floodlight.local., (Cache flush) HINFO (236)
22:40:56.051185 IP6 fe80::5cd4:88ff:fef3:5ac.5353 > ff02::fb.5353: 0 [3q] [5n] ANY (QM)? floodlight [5e:d4:88:f3:05:ac]._workstation._tcp.local. ANY (QM)? floodlight.local. ANY (QM)? c.a.5.0.3.f.e.f.f.f.8.8.4.d.c.5.0.0.0.0.0.0.0.0.0.0.0.0.0.8.e.f.ip6.arpa. (267)
22:40:56.051221 IP6 fe80::5cd4:88ff:fef3:5ac > ff02::16: HBH ICMP6, multicast listener report v2, 2 group record(s), length 48
22:40:56.052511 IP6 fe80::5cd4:88ff:fef3:5ac.5353 > ff02::fb.5353: 0 [3q] [5n] ANY (QM)? floodlight [5e:d4:88:f3:05:ac]._workstation._tcp.local. ANY (QM)? floodlight.local. ANY (QM)? c.a.5.0.3.f.e.f.f.f.8.8.4.d.c.5.0.0.0.0.0.0.0.0.0.0.0.0.0.8.e.f.ip6.arpa. (267)
22:40:56.052547 IP6 fe80::9423:61ff:fed6:2eac.5353 > ff02::fb.5353: 0 [3q] [5n] ANY (QM)? floodlight [96:23:61:d6:2e:ac]._workstation._tcp.local. ANY (QM)? floodlight.local. ANY (QM)? c.a.e.2.6.d.e.f.f.f.1.6.3.2.4.9.0.0.0.0.0.0.0.0.0.0.0.0.0.8.e.f.ip6.arpa. (267)
22:40:56.052582 IP6 fe80::6ca3:42ff:febd:4b61 > ff02::16: HBH ICMP6, multicast listener report v2, 1 group record(s), length 28
22:40:56.052617 IP6 fe80::6ca3:42ff:febd:4b61 > ff02::2: ICMP6, router solicitation, length 16
22:40:56.076834 IP6 fe80::6ca3:42ff:febd:4b61 > ff02::16: HBH ICMP6, multicast listener report v2, 1 group record(s), length 28
22:40:56.076870 IP6 fe80::6ca3:42ff:febd:4b61.5353 > ff02::fb.5353: 0*- [0q] 2/0/0 PTR _workstation._tcp.local., PTR floodlight [6e:a3:42:bd:4b:61]._workstation._tcp.local. (117)
22:40:56.084791 IP6 fe80::6ca3:42ff:febd:4b61.5353 > ff02::fb.5353: 0 [3q] [5n] ANY (QM)? floodlight [6e:a3:42:bd:4b:61]._workstation._tcp.local. ANY (QM)? floodlight.local. ANY (QM)? 1.6.b.4.d.b.e.f.f.f.2.4.3.a.c.6.0.0.0.0.0.0.0.0.0.0.0.0.0.8.e.f.ip6.arpa. (267)
22:40:56.084827 IP6 fe80::6ca3:42ff:febd:4b61.5353 > ff02::fb.5353: 0 [2q] PTR (QM)? _ipps._tcp.local. PTR (QM)? _ipp._tcp.local. (45)
22:40:56.084862 IP6 fe80::6ca3:42ff:febd:4b61.5353 > ff02::fb.5353: 0 [3q] [5n] ANY (QM)? floodlight [6e:a3:42:bd:4b:61]._workstation._tcp.local. ANY (QM)? floodlight.local. ANY (QM)? 1.6.b.4.d.b.e.f.f.f.2.4.3.a.c.6.0.0.0.0.0.0.0.0.0.0.0.0.0.8.e.f.ip6.arpa. (267)
22:40:56.084898 IP6 fe80::5cd4:88ff:fef3:5ac.5353 > ff02::fb.5353: 0*- [0q] 5/0/0 (Cache flush) TXT "", (Cache flush) AAAA fe80::5cd4:88ff:fef3:5ac, (Cache flush) PTR floodlight.local., (Cache flush) HINFO, (Cache flush) SRV floodlight.local.:9 0 0 (249)
22:40:56.091617 ARP, Request who-has 10.0.0.2 tell 10.0.0.4, length 28
22:40:56.096936 IP6 fe80::f4bf:dbff:fe75:926a.5353 > ff02::fb.5353: 0*- [0q] 5/0/0 (Cache flush) TXT "", (Cache flush) AAAA fe80::f4bf:dbff:fe75:926a, (Cache flush) PTR floodlight.local., (Cache flush) HINFO, (Cache flush) SRV floodlight.local.:9 0 0 (249)
22:40:56.107670 IP 0.0.0.0.68 > 255.255.255.255.67: BOOTP/DHCP, Request from da:ce:ab:9e:0b:ac, length 300
22:40:56.146746 ARP, Reply 10.0.0.2 is-at 22:ae:0f:90:01:17, length 28
22:40:56.242602 ARP, Request who-has 10.0.0.7 tell 10.0.0.4, length 28
22:40:56.432463 IP6 fe80::f4bf:dbff:fe75:926a.5353 > ff02::fb.5353: 0*- [0q] 2/0/0 PTR _workstation._tcp.local., PTR floodlight [f6:bf:db:75:92:6a]._workstation._tcp.local. (117)
22:40:56.432498 IP6 fe80::f4bf:dbff:fe75:926a.5353 > ff02::fb.5353: 0 [2q] PTR (QM)? _ipps._tcp.local. PTR (QM)? _ipp._tcp.local. (45)
22:40:56.432533 IP6 fe80::4ca6:54ff:fed1:d4f0 > ff02::16: HBH ICMP6, multicast listener report v2, 1 group record(s), length 28
22:40:56.432746 IP6 fe80::5cd4:88ff:fef3:5ac.5353 > ff02::fb.5353: 0*- [0q] 2/0/0 PTR _workstation._tcp.local., PTR floodlight [5e:d4:88:f3:05:ac]._workstation._tcp.local. (117)
22:40:56.432781 IP6 fe80::5cd4:88ff:fef3:5ac.5353 > ff02::fb.5353: 0 [2q] PTR (QM)? _ipps._tcp.local. PTR (QM)? _ipp._tcp.local. (45)
22:40:56.432817 IP6 fe80::4ca6:54ff:fed1:d4f0 > ff02::2: ICMP6, router solicitation, length 16
22:40:56.454015 IP6 fe80::4ca6:54ff:fed1:d4f0 > ff02::16: HBH ICMP6, multicast listener report v2, 1 group record(s), length 28
22:40:56.454056 IP6 fe80::4ca6:54ff:fed1:d4f0.5353 > ff02::fb.5353: 0*- [0q] 2/0/0 PTR _workstation._tcp.local., PTR floodlight [4e:a6:54:d1:d4:f0]._workstation._tcp.local. (117)
22:40:56.454328 IP6 fe80::4ca6:54ff:fed1:d4f0.5353 > ff02::fb.5353: 0 [3q] [5n] ANY (QM)? floodlight [4e:a6:54:d1:d4:f0]._workstation._tcp.local. ANY (QM)? floodlight.local. ANY (QM)? 0.f.4.d.1.d.e.f.f.f.4.5.6.a.c.4.0.0.0.0.0.0.0.0.0.0.0.0.0.8.e.f.ip6.arpa. (267)
22:40:56.454389 IP6 fe80::4ca6:54ff:fed1:d4f0.5353 > ff02::fb.5353: 0 [2q] PTR (QM)? _ipps._tcp.local. PTR (QM)? _ipp._tcp.local. (45)
22:40:56.454449 IP6 fe80::4ca6:54ff:fed1:d4f0 > ff02::16: HBH ICMP6, multicast listener report v2, 2 group record(s), length 48
22:40:56.454484 IP6 fe80::4ca6:54ff:fed1:d4f0.5353 > ff02::fb.5353: 0 [3q] [5n] ANY (QM)? floodlight [4e:a6:54:d1:d4:f0]._workstation._tcp.local. ANY (QM)? floodlight.local. ANY (QM)? 0.f.4.d.1.d.e.f.f.f.4.5.6.a.c.4.0.0.0.0.0.0.0.0.0.0.0.0.0.8.e.f.ip6.arpa. (267)
22:40:56.454519 IP6 fe80::9423:61ff:fed6:2eac.5353 > ff02::fb.5353: 0 [3q] [5n] ANY (QM)? floodlight [96:23:61:d6:2e:ac]._workstation._tcp.local. ANY (QM)? floodlight.local. ANY (QM)? c.a.e.2.6.d.e.f.f.f.1.6.3.2.4.9.0.0.0.0.0.0.0.0.0.0.0.0.0.8.e.f.ip6.arpa. (267)
22:40:56.454554 IP6 fe80::9423:61ff:fed6:2eac.5353 > ff02::fb.5353: 0*- [0q] 5/0/0 (Cache flush) TXT "", (Cache flush) AAAA fe80::9423:61ff:fed6:2eac, (Cache flush) PTR floodlight.local., (Cache flush) HINFO, (Cache flush) SRV floodlight.local.:9 0 0 (249)
22:40:56.454589 IP6 fe80::4ca6:54ff:fed1:d4f0.5353 > ff02::fb.5353: 0 [3q] [5n] ANY (QM)? floodlight [4e:a6:54:d1:d4:f0]._workstation._tcp.local. ANY (QM)? floodlight.local. ANY (QM)? 0.f.4.d.1.d.e.f.f.f.4.5.6.a.c.4.0.0.0.0.0.0.0.0.0.0.0.0.0.8.e.f.ip6.arpa. (267)
22:40:56.454624 IP6 fe80::6ca3:42ff:febd:4b61.5353 > ff02::fb.5353: 0 [3q] [5n] ANY (QM)? floodlight [6e:a3:42:bd:4b:61]._workstation._tcp.local. ANY (QM)? floodlight.local. ANY (QM)? 1.6.b.4.d.b.e.f.f.f.2.4.3.a.c.6.0.0.0.0.0.0.0.0.0.0.0.0.0.8.e.f.ip6.arpa. (267)
22:40:56.454659 IP6 fe80::6ca3:42ff:febd:4b61 > ff02::16: HBH ICMP6, multicast listener report v2, 2 group record(s), length 48
22:40:56.460889 IP6 fe80::6ca3:42ff:febd:4b61 > ff02::16: HBH ICMP6, multicast listener report v2, 1 group record(s), length 28
22:40:56.465220 IP6 fe80::9423:61ff:fed6:2eac.5353 > ff02::fb.5353: 0*- [0q] 2/0/0 PTR _workstation._tcp.local., PTR floodlight [96:23:61:d6:2e:ac]._workstation._tcp.local. (117)
22:40:56.469058 IP6 fe80::9423:61ff:fed6:2eac.5353 > ff02::fb.5353: 0 [2q] PTR (QM)? _ipps._tcp.local. PTR (QM)? _ipp._tcp.local. (45)
22:40:56.470774 IP6 fe80::4ca6:54ff:fed1:d4f0.5353 > ff02::fb.5353: 0*- [0q] 5/0/0 (Cache flush) TXT "", (Cache flush) AAAA fe80::4ca6:54ff:fed1:d4f0, (Cache flush) PTR floodlight.local., (Cache flush) HINFO, (Cache flush) SRV floodlight.local.:9 0 0 (249)
22:40:56.495219 ARP, Reply 10.0.0.2 is-at 22:ae:0f:90:01:17, length 28
22:40:56.496374 IP6 fe80::4ca6:54ff:fed1:d4f0 > ff02::16: HBH ICMP6, multicast listener report v2, 1 group record(s), length 28
